name,value,date,Unnamed: 3
高考准考证少写一个还有分吗,1156962.0,2024-06-11 00:03,
刘亦菲的亲热戏把我老公看急眼了,798314.0,2024-06-11 00:03,
这个端午110000000人次出游,142278.0,2024-06-11 00:03,
弟弟去世了二十天我高考完才知道,1831452.0,2024-06-11 00:03,
Jennie走秀,517287.0,2024-06-11 00:03,
张桂梅患带状疱疹仍坚持陪考,506257.0,2024-06-11 00:03,
张颂文晒108元重量级粽子王,516543.0,2024-06-11 00:03,
今年西瓜为什么便宜了,462222.0,2024-06-11 00:03,
墨雨云间这段刘亦菲10年前就意识到了,439767.0,2024-06-11 00:03,
姨妈40度高温抱大白兔陪考,59314.0,2024-06-11 00:03,
96年28岁其实挺小的,503310.0,2024-06-11 00:03,
肖战上海,350245.0,2024-06-11 00:03,
发现一直玩手机真的很恐怖,316427.0,2024-06-11 00:03,
刘亦菲新剧口碑逆跌,319071.0,2024-06-11 00:03,
这周只上4天班,210299.0,2024-06-11 00:03,
彭冠英下线林更新上线,264526.0,2024-06-11 00:03,
三亚考生建议不要出课本没教过知识,196893.0,2024-06-11 00:03,
万茜好帅,252595.0,2024-06-11 00:03,
韩国罕见展出500年前王室印玺,163864.0,2024-06-11 00:03,
近视手术并不是一劳永逸,123150.0,2024-06-11 00:03,
李承铉给离婚的爸妈订同一间房,529231.0,2024-06-11 00:03,
才知道焯水不是简单的煮一下,316097.0,2024-06-11 00:03,
双方都对这个吻感到恶心,277968.0,2024-06-11 00:03,
因为熬夜长了带状疱疹,253389.0,2024-06-11 00:03,
突然发现了求婚的意义,185092.0,2024-06-11 00:03,
庄国栋强吻,159670.0,2024-06-11 00:03,
你俩能不能莫名其妙亲一个,156053.0,2024-06-11 00:03,
Angelababy汉服少女,155795.0,2024-06-11 00:03,
研究生面试和公考面试的区别,144001.0,2024-06-11 00:03,
皇马官宣将参加新版世俱杯,105209.0,2024-06-11 00:03,
肖战放饭,142346.0,2024-06-11 00:03,
张艺兴一口气发了12首新歌试听,135994.0,2024-06-11 00:03,
岛屿少年总导演回应陈雨浓孙丞潇吵架,132950.0,2024-06-11 00:03,
周深打不过就加入,124861.0,2024-06-11 00:03,
SM将追究EXOCBX法律责任,112573.0,2024-06-11 00:03,
Cube回应解约,111686.0,2024-06-11 00:03,
张颂文 咸粽第一,111650.0,2024-06-11 00:03,
分手一年多了前任一直在用亲情卡,107823.0,2024-06-11 00:03,
陈瑶无框眼镜,106721.0,2024-06-11 00:03,
高考47年来裸分最高的考生是谁,90162.0,2024-06-11 00:03,
张凌赫回复陈都灵,100793.0,2024-06-11 00:03,
宋亚轩刘耀文一起逛街,96368.0,2024-06-11 00:03,
在曼彻斯特边吐槽边Citywalk,94986.0,2024-06-11 00:03,
墨雨云间硬控台湾网友,94225.0,2024-06-11 00:03,
黑神话,93900.0,2024-06-11 00:03,
人生中最爽的三个月,91377.0,2024-06-11 00:03,
U19国足vs韩国U19,90161.0,2024-06-11 00:03,
杨紫李现国色芳华没有停拍,89252.0,2024-06-11 00:03,
林更新丁宁互关了,85130.0,2024-06-11 00:03,
生孩子是最大的开盲盒,82055.0,2024-06-11 00:03,
