name,value,date,Unnamed: 3
冯提莫腰线,716341.0,2024-03-28 00:12,
8万的预算能在深圳玩三天吗,658372.0,2024-03-28 00:12,
春天的花花接二连三开,58016.0,2024-03-28 00:12,
王嘉尔普吉岛,608616.0,2024-03-28 00:12,
大熊猫青糍死亡,511434.0,2024-03-28 00:12,
南通,1482291.0,2024-03-28 00:12,
王诗龄晒与李湘在英国的日常,372123.0,2024-03-28 00:12,
离异3年内不得京内购房被废止,352712.0,2024-03-28 00:12,
极限挑战,348275.0,2024-03-28 00:12,
王一博听到并立于雪山之巅笑了,282644.0,2024-03-28 00:12,
知情人士回应腾讯大规模裁员,371662.0,2024-03-28 00:12,
Scout说不会韩语,291276.0,2024-03-28 00:12,
老邪吐槽追风者 翻车,267749.0,2024-03-28 00:12,
蔡文静什么都赖地磁暴,259329.0,2024-03-28 00:12,
刚出生就1米85的帅宝宝来了,240775.0,2024-03-28 00:12,
魏大勋说不清了,211810.0,2024-03-28 00:12,
小米SU7续航700公里起步,208551.0,2024-03-28 00:12,
全国研究生招生6年增幅超6成,197792.0,2024-03-28 00:12,
禁售殡葬用品后南通12345接大量电话,181238.0,2024-03-28 00:12,
白鹿一口气发了28张照片,172309.0,2024-03-28 00:12,
男方准备10万彩礼女方要30万,334434.0,2024-03-28 00:12,
经常喝牛奶或增加这两种癌症风险,332270.0,2024-03-28 00:12,
韩国高中生向女老师保温杯注入精液,248119.0,2024-03-28 00:12,
导致胃部癌变的6大因素,241442.0,2024-03-28 00:12,
幼儿园老师背名牌包被投诉,218588.0,2024-03-28 00:12,
张慧雯回应演何悯鸿后面相变了,198410.0,2024-03-28 00:12,
金牛座的焦虑来自于匮乏感,186934.0,2024-03-28 00:12,
去喜欢一个对你有空的人,158750.0,2024-03-28 00:12,
王者荣耀版沈璃上线,154099.0,2024-03-28 00:12,
手足口病感染高峰,64678.0,2024-03-28 00:12,
与凤行 送子婚姻,147416.0,2024-03-28 00:12,
广州10块一碗猪脚面,118776.0,2024-03-28 00:12,
终于学会删除空白页了,117749.0,2024-03-28 00:12,
林俊杰生日照,106036.0,2024-03-28 00:12,
黄景瑜我妈要百度你的电话,101146.0,2024-03-28 00:12,
臀腿这下真能重获新生了,98569.0,2024-03-28 00:12,
王一博素颜,95275.0,2024-03-28 00:12,
曝刘亦菲加盟梁朝伟新片,93307.0,2024-03-28 00:12,
真的有人陷入爱里走不出来,90432.0,2024-03-28 00:12,
专家称A股跌破3000点别太当回事,89353.0,2024-03-28 00:12,
看到成毅的胸肌了,83398.0,2024-03-28 00:12,
任嘉伦回应烈焰造型台词争议,82757.0,2024-03-28 00:12,
JDG 放假,77903.0,2024-03-28 00:12,
一觉醒来夏东海和锅姨在一起了,76217.0,2024-03-28 00:12,
甘肃宴西北菜,73446.0,2024-03-28 00:12,
美的2023年净利润337.2亿元,70216.0,2024-03-28 00:12,
追风者直播,70083.0,2024-03-28 00:12,
张艺兴黄渤 没头脑和不高兴,65725.0,2024-03-28 00:12,
going seventeen,63961.0,2024-03-28 00:12,
专家称不要把IPO当作套现百亿的致富路,63088.0,2024-03-28 00:12,
