name,value,date,Unnamed: 3
韩国警告俄罗斯,869935.0,2024-06-24 00:13,
iPhone16全系尺寸曝光,726861.0,2024-06-24 00:13,
千年运河从历史流向未来,36741.0,2024-06-24 00:13,
海蓝之谜柜姐被顾客泼水羞辱,596613.0,2024-06-24 00:13,
女儿零点查分竟和妈妈梦的一模一样,521105.0,2024-06-24 00:13,
青岛大学 奢香夫人,469264.0,2024-06-24 00:13,
汪苏泷回应上歌手碎了,450178.0,2024-06-24 00:13,
首个高考成绩被屏蔽的人出现了,445396.0,2024-06-24 00:13,
庆余年 晕墨,420432.0,2024-06-24 00:13,
李一桐 将门毒后,420081.0,2024-06-24 00:13,
高考后他们3小时进帐上亿,806450.0,2024-06-24 00:13,
林允发际线,411250.0,2024-06-24 00:13,
白日提灯 平番,342766.0,2024-06-24 00:13,
魏无羡 AG,316666.0,2024-06-24 00:13,
妈妈捧着一束肉串接中考儿子回家,28678.0,2024-06-24 00:13,
梁实第28次高考成绩出炉,1144399.0,2024-06-24 00:13,
张艺兴朴灿烈合照,303866.0,2024-06-24 00:13,
将门毒后 男主,292805.0,2024-06-24 00:13,
陈洁仪 心动,252035.0,2024-06-24 00:13,
杭州灵隐寺发大水,224930.0,2024-06-24 00:13,
男子带96岁母亲酒店养老遭集体拉黑,474354.0,2024-06-24 00:13,
2点睡觉10点起床算熬夜吗,433783.0,2024-06-24 00:13,
女子等红绿灯被撞飞后遭碾压当场身亡,277308.0,2024-06-24 00:13,
猪身上这三个部位很脏尽量少吃,225766.0,2024-06-24 00:13,
霍建华朱珠演情侣,214501.0,2024-06-24 00:13,
王源听到结婚的反应,189417.0,2024-06-24 00:13,
意大利女排3比1日本女排,176839.0,2024-06-24 00:13,
汪苏泷综艺爆曲八连唱,169040.0,2024-06-24 00:13,
一份没有985211的宝藏大学名单,167080.0,2024-06-24 00:13,
鹿晗演唱会背影图,164212.0,2024-06-24 00:13,
青春有你北京面试,159773.0,2024-06-24 00:13,
年轻人为什么爱上德训鞋,155677.0,2024-06-24 00:13,
林俊杰我的刘海还好吗,152558.0,2024-06-24 00:13,
高考成绩被亲戚擅自发到家人群,144419.0,2024-06-24 00:13,
Wei不打了,142140.0,2024-06-24 00:13,
大奉打更人预告repo,135039.0,2024-06-24 00:13,
四喜丸子围坐狂炫生日餐仪式感满满,52333.0,2024-06-24 00:13,
减肥误食了6个蛋挞,120717.0,2024-06-24 00:13,
汪苏泷用徐志胜声音打碟,109942.0,2024-06-24 00:13,
王源演唱会嘉宾 容祖儿,109697.0,2024-06-24 00:13,
李宇春 苏打绿嘉宾,109113.0,2024-06-24 00:13,
陈瑶白晓荷有姐感了,106570.0,2024-06-24 00:13,
宋雨琦去SuperJunior演唱会,99425.0,2024-06-24 00:13,
赵兆 不署名,98784.0,2024-06-24 00:13,
高考失意不是失败,97813.0,2024-06-24 00:13,
章若楠深V白T恤,94680.0,2024-06-24 00:13,
妈妈有钱和爸爸有钱的区别,94061.0,2024-06-24 00:13,
阿汤哥女儿去掉父亲姓氏,91947.0,2024-06-24 00:13,
日本人冒充中国人在巴基斯坦骗吃骗喝,87004.0,2024-06-24 00:13,
说多喝水可能真不是在敷衍你,84840.0,2024-06-24 00:13,
