name,value,date,Unnamed: 3
金价,655105.0,2024-03-06 00:10,
建议彩票个人单项奖金最高额度不超过500万,421568.0,2024-03-06 00:10,
细节中读懂两会的精微要义,53815.0,2024-03-06 00:10,
代表建议毕业生不要只把眼光放在一线城市,309735.0,2024-03-06 00:10,
建议消除简历第一学历概念,283571.0,2024-03-06 00:10,
射雕英雄传侠之大者计划全球发行,279063.0,2024-03-06 00:10,
朱一龙志愿军2将于国庆档上映,179045.0,2024-03-06 00:10,
建议中小学生每天都有一节体育课,164192.0,2024-03-06 00:10,
唐探2时间线连上了,139978.0,2024-03-06 00:10,
感染HPV后还能打疫苗吗,101594.0,2024-03-06 00:10,
140万买的230平房子,1182657.0,2024-03-06 00:10,
农夫山泉,621397.0,2024-03-06 00:10,
白敬亭退出乐本文化,562950.0,2024-03-06 00:10,
遭多人强暴的西班牙网红收到印度政府赔偿,552407.0,2024-03-06 00:10,
朱丹听到sorry变脸,539388.0,2024-03-06 00:10,
易梦玲宋智雅合照,496455.0,2024-03-06 00:10,
周处除三害 抄袭,443919.0,2024-03-06 00:10,
已经生娃可能还会检测出已怀孕,334407.0,2024-03-06 00:10,
张元英miumiu巴黎时装周,314406.0,2024-03-06 00:10,
Jennie仪态,286264.0,2024-03-06 00:10,
相亲当晚女生发来开销账单,341212.0,2024-03-06 00:10,
越来越多年轻人确诊淡淡综合症,261843.0,2024-03-06 00:10,
邓为工作室的审美,261106.0,2024-03-06 00:10,
真没必要为三五年后的前途担忧,241098.0,2024-03-06 00:10,
杨幂谈私服风格,225821.0,2024-03-06 00:10,
我在银行买金镯子又大又便宜,224043.0,2024-03-06 00:10,
许凯 别刷那个汉堡了,203169.0,2024-03-06 00:10,
男朋友谈过一段很长的恋爱,199299.0,2024-03-06 00:10,
王一博白色运动服造型,192985.0,2024-03-06 00:10,
分手后最体面的星座,189837.0,2024-03-06 00:10,
继承者们 抄袭,187162.0,2024-03-06 00:10,
周杰伦录制说唱梦工厂,180385.0,2024-03-06 00:10,
哈兰德认为梅西是历史最佳球员,176449.0,2024-03-06 00:10,
阿姨被辞退后发信息轰炸我,175328.0,2024-03-06 00:10,
蔚来现金储备达573亿元,175228.0,2024-03-06 00:10,
Minnie MiuMiu秀场中文问候,142231.0,2024-03-06 00:10,
姐弟恋 精神年龄契合,131514.0,2024-03-06 00:10,
豪士面包 种地吧,128781.0,2024-03-06 00:10,
王一博世趋排名,127570.0,2024-03-06 00:10,
别再让黄金店割智商税了,96171.0,2024-03-06 00:10,
这只猫真的非养不可吗,117313.0,2024-03-06 00:10,
男生第一次约会的至暗时刻,107013.0,2024-03-06 00:10,
00后都在做什么工作,101419.0,2024-03-06 00:10,
身体出现3个异常警惕癌症信号,99837.0,2024-03-06 00:10,
刘家祎的青春感,98834.0,2024-03-06 00:10,
霍启刚回应建议完善带薪年假制度,84074.0,2024-03-06 00:10,
檀健次看网友翻拍吵架名场面,79896.0,2024-03-06 00:10,
双向奔赴的病情,78455.0,2024-03-06 00:10,
MiuMiu大秀,78210.0,2024-03-06 00:10,
墨尔本偶遇周杰伦GAI,71909.0,2024-03-06 00:10,
