name,value,date,Unnamed: 3
好消息1月工资年前发,775871.0,2024-01-28 00:08,
包上恩,915771.0,2024-01-28 00:08,
何以中国向海泉州,8704.0,2024-01-28 00:08,
00后四美,546978.0,2024-01-28 00:08,
迪丽热巴高定首穿,543851.0,2024-01-28 00:08,
昆明动物园为什么三发通报才救猫,523050.0,2024-01-28 00:08,
主播称董宇辉被叫老板恨不得翻脸,437244.0,2024-01-28 00:08,
这跟易烊千玺谈了有什么区别,435724.0,2024-01-28 00:08,
央视曝回流医保药洗白过程,346714.0,2024-01-28 00:08,
迪丽热巴一个月四套高定,527425.0,2024-01-28 00:08,
人均37元的早餐为何没人买单了,766879.0,2024-01-28 00:08,
北京野生动物园就昆明动物园事件发声,633654.0,2024-01-28 00:08,
林俊杰多少有点见外了,335323.0,2024-01-28 00:08,
苦了陈楚生不能苦了我,333351.0,2024-01-28 00:08,
阿拉斯加自己走丢在大街上大哭,302169.0,2024-01-28 00:08,
金鹤龙晒迪丽热巴,421923.0,2024-01-28 00:08,
初中妹妹8科成绩总分66,245399.0,2024-01-28 00:08,
文韬齐思钧去看了唐九洲巡演,197961.0,2024-01-28 00:08,
梦天拍热巴,197649.0,2024-01-28 00:08,
人要一寸一寸的拯救自己,188511.0,2024-01-28 00:08,
没结婚用不用给外甥女压岁钱,287000.0,2024-01-28 00:08,
范丞丞不想跳科目三,197454.0,2024-01-28 00:08,
00后四帅,182246.0,2024-01-28 00:08,
沈梦辰腰椎骨头断裂,180452.0,2024-01-28 00:08,
新加坡免签一不小心就变穷光蛋,170617.0,2024-01-28 00:08,
陈奕迅演唱会,179644.0,2024-01-28 00:08,
吴磊赵今麦好配,174943.0,2024-01-28 00:08,
宝妈用小馒头吸收药物喂宝宝吃,162157.0,2024-01-28 00:08,
昆明动物园,142632.0,2024-01-28 00:08,
湖北省政府向中国网协和郑钦文致贺电,137205.0,2024-01-28 00:08,
迪丽热巴爱琴海,171502.0,2024-01-28 00:08,
白敬亭裤子上挂玩偶,158152.0,2024-01-28 00:08,
电竞小子蒲熠星,142511.0,2024-01-28 00:08,
小动物保护协会称两只猫暂未被找到,125926.0,2024-01-28 00:08,
你早上刷牙还是晚上刷牙,123831.0,2024-01-28 00:08,
情绪压抑的人更易长结节,121107.0,2024-01-28 00:08,
第一次见猫猫泡脚,117071.0,2024-01-28 00:08,
青山说灰原喜欢柯南,112640.0,2024-01-28 00:08,
刘宇魏无羡造型,111414.0,2024-01-28 00:08,
武汉女生备考3个月被剑桥录取,97142.0,2024-01-28 00:08,
金晨全套新中式,111407.0,2024-01-28 00:08,
迪丽热巴新妆,110595.0,2024-01-28 00:08,
宋慧乔红丝袜,102153.0,2024-01-28 00:08,
留住金鹤龙,101911.0,2024-01-28 00:08,
TES拿到首胜,98579.0,2024-01-28 00:08,
郑钦文父亲说澳网亚军只是新起点,96402.0,2024-01-28 00:08,
金晨舞蹈致敬200年前清代女科学家,95780.0,2024-01-28 00:08,
大鹏拥抱戴王一博面具新浪员工,90992.0,2024-01-28 00:08,
在暴雪时分,89321.0,2024-01-28 00:08,
郑钦文赛后发布会落泪,85286.0,2024-01-28 00:08,
