name,value,date,Unnamed: 3
为什么睡得越多反而越累,1457231.0,2024-01-30 00:01,
卡米拉禁赛四年,1092467.0,2024-01-30 00:01,
何以中国向海泉州,5712.0,2024-01-30 00:01,
宋祖儿,794272.0,2024-01-30 00:01,
花少节目组超重费花了20多万,582462.0,2024-01-30 00:01,
多位明星参加中国影协第十一次全国代表大会,500148.0,2024-01-30 00:01,
官方辟谣上海松江发生爆炸,491231.0,2024-01-30 00:01,
易烊千玺新闻联播镜头,477933.0,2024-01-30 00:01,
韩庚曾曝被SM公司区别对待,429090.0,2024-01-30 00:01,
K宝冬奥会金牌被裁无效,419045.0,2024-01-30 00:01,
恶心穿搭,752916.0,2024-01-30 00:01,
请和我的老公结婚,399647.0,2024-01-30 00:01,
英国男子爬29楼跳伞伞没打开当场身亡,354609.0,2024-01-30 00:01,
多地限制教师非正常流动,353281.0,2024-01-30 00:01,
美国流浪猫每年杀死几十亿哺乳动物,330344.0,2024-01-30 00:01,
浙江父亲想用AI复活儿子,300004.0,2024-01-30 00:01,
订婚强奸案,284750.0,2024-01-30 00:01,
00后女大学生保研后开珠宝店月入过万,274874.0,2024-01-30 00:01,
网红宝妈因感冒五天未就医去世,260491.0,2024-01-30 00:01,
于正发卢昱晓原始帧,237016.0,2024-01-30 00:01,
6种症状提醒你该查血脂了,248266.0,2024-01-30 00:01,
女子遭男友骗光6套房还被小三,243360.0,2024-01-30 00:01,
恋与制作人你疯啦,222859.0,2024-01-30 00:01,
肖战红西装大背头,221130.0,2024-01-30 00:01,
万达电影新任董事长陈祉希,202991.0,2024-01-30 00:01,
2024最走狗屎运的星座,198486.0,2024-01-30 00:01,
香港偶遇宋轶文咏珊逛街,197485.0,2024-01-30 00:01,
6岁娃羡慕美甲体验2天后崩溃大哭,197079.0,2024-01-30 00:01,
恋与制作人,178068.0,2024-01-30 00:01,
小动协讲述2只猫身体状况细节,116612.0,2024-01-30 00:01,
美邦创始人回应衣服丑价格贵,172175.0,2024-01-30 00:01,
美国队递补获得一枚北京冬奥金牌,152971.0,2024-01-30 00:01,
虞书欣痛失真名,148144.0,2024-01-30 00:01,
恩静消失术,143945.0,2024-01-30 00:01,
婆婆用儿媳盖头给将出世宝宝做包被,137202.0,2024-01-30 00:01,
金莎cos18岁的蓝菲琳,124458.0,2024-01-30 00:01,
赵露思毛绒手机壳,119531.0,2024-01-30 00:01,
张镇麟脱球衣离场,116319.0,2024-01-30 00:01,
中国恒大市值仅剩22亿港元,112125.0,2024-01-30 00:01,
广东人洁癖不洗澡不上床,110090.0,2024-01-30 00:01,
你的快递可能是两岁小孩哥打包的,104703.0,2024-01-30 00:01,
一次性蛋糕盘可以折起来用,99340.0,2024-01-30 00:01,
昆明动物园2只猫最大的问题是心理,97810.0,2024-01-30 00:01,
董宇辉新号准备校招,96678.0,2024-01-30 00:01,
广东人过年最怕的环节来了,95801.0,2024-01-30 00:01,
王小军被撤销全国政协委员资格,93777.0,2024-01-30 00:01,
张予曦红衣龙女,89482.0,2024-01-30 00:01,
宋祖儿张新成新剧过审,89053.0,2024-01-30 00:01,
创造营亚洲首支预告,88114.0,2024-01-30 00:01,
吴京梦女,80608.0,2024-01-30 00:01,
