name,value,date,Unnamed: 3
陈泽直播间被封,894070.0,2024-07-05 00:20,
不停道歉的东方甄选怎么了,804375.0,2024-07-05 00:20,
风清气正的网络环境是中国的名片,71938.0,2024-07-05 00:20,
电竞世界杯BLG对战T1,462477.0,2024-07-05 00:20,
谁家老公做成这勾栏模样,321073.0,2024-07-05 00:20,
韩语专业生就业方向,287871.0,2024-07-05 00:20,
妈妈回应儿子出生6个月长到22斤,286237.0,2024-07-05 00:20,
养父母未办领养手续养子失去继承权,250484.0,2024-07-05 00:20,
吉祥航空通报不开空调致旅客中暑,225330.0,2024-07-05 00:20,
萌兰出演MV男主角,23688.0,2024-07-05 00:20,
菲律宾,522093.0,2024-07-05 00:20,
张馨予胖五斤了,323114.0,2024-07-05 00:20,
孙颖莎被金球砸到,213950.0,2024-07-05 00:20,
北大考古女孩正参加敦煌研究院招聘,203805.0,2024-07-05 00:20,
哈萨克斯坦姑娘16岁没来月经来杭求医,192400.0,2024-07-05 00:20,
保时捷发霉车主自嘲不想要了,187783.0,2024-07-05 00:20,
巴黎奥运会允许代表团自费安空调,187779.0,2024-07-05 00:20,
那英 如果你也听说,186831.0,2024-07-05 00:20,
郭晓婷晒与迪丽热巴合照,185462.0,2024-07-05 00:20,
王心凌玫瑰嫁纱重达十公斤,171937.0,2024-07-05 00:20,
被撕票中企高管最后语音曝光,1096537.0,2024-07-05 00:20,
男性睡觉掉色是全国统一的吗,331058.0,2024-07-05 00:20,
小水小九分手,208284.0,2024-07-05 00:20,
广州地铁18号线沙溪站停止对外服务,160143.0,2024-07-05 00:20,
绝区零 美术,138739.0,2024-07-05 00:20,
女子醉卧马路被轧身亡送人者认定无责,132387.0,2024-07-05 00:20,
长相思第二季变更为23集,129289.0,2024-07-05 00:20,
感觉谭松韵真在公司上过班,128853.0,2024-07-05 00:20,
一天一个西瓜瘦了1.5斤,121460.0,2024-07-05 00:20,
消防员洪水中温柔看向怀中婴儿,40719.0,2024-07-05 00:20,
姜爷爷,121327.0,2024-07-05 00:20,
用两只虾做三个菜,119748.0,2024-07-05 00:20,
警方通报6旬男子持刀伤人致3死1伤,117889.0,2024-07-05 00:20,
复读生已经上了五天课了,105543.0,2024-07-05 00:20,
肖战深V亮钻西装,103952.0,2024-07-05 00:20,
老师我们家Henry怎么了,101756.0,2024-07-05 00:20,
林一晚安大小姐 国标味,95590.0,2024-07-05 00:20,
林俊杰卡地亚现场,94542.0,2024-07-05 00:20,
王楚钦孙颖莎身披龙服,93457.0,2024-07-05 00:20,
白敬亭染粉发掉色了,91072.0,2024-07-05 00:20,
秦岚也吵不过的女人,89802.0,2024-07-05 00:20,
沈阳铁西,89784.0,2024-07-05 00:20,
孙艺珍红毯状态,88918.0,2024-07-05 00:20,
默杀彩蛋,78326.0,2024-07-05 00:20,
王嘉尔蒙面舞台,75078.0,2024-07-05 00:20,
女子高铁上拒绝查票飙英文骂哭乘务员,71623.0,2024-07-05 00:20,
吴谨言下一部剧妆造,66941.0,2024-07-05 00:20,
白敬亭跟唐嫣学上海话,58737.0,2024-07-05 00:20,
东镇多惠宣布复合,58234.0,2024-07-05 00:20,
王嘉尔活动生图,63906.0,2024-07-05 00:20,
