name,value,date,Unnamed: 3
以色列,708978.0,2024-04-25 00:16,
唐家三少宣布停更,666390.0,2024-04-25 00:16,
万千气象看山西,9899.0,2024-04-25 00:16,
花少第一站破碎的是张翰,606303.0,2024-04-25 00:16,
大麦网已退票退款,458354.0,2024-04-25 00:16,
玲花 维权是你们的权利,443113.0,2024-04-25 00:16,
摩羯座最需要是自我认可,349068.0,2024-04-25 00:16,
金价下跌有人卖了一百多万金条,340748.0,2024-04-25 00:16,
菠菜一定焯水后吃否则或引发肾损伤,277568.0,2024-04-25 00:16,
手机里存了3个月的照片终于删了,142115.0,2024-04-25 00:16,
拼多多涉不正当竞争被判赔500万,615025.0,2024-04-25 00:16,
章子怡 我的职业生涯不必在意,289508.0,2024-04-25 00:16,
Angelababy狼尾超短发,288985.0,2024-04-25 00:16,
被评最美公务员干部被曝曾殴打残疾人,249490.0,2024-04-25 00:16,
秦海璐霸总小说书单,242350.0,2024-04-25 00:16,
玲花 换位思考,234735.0,2024-04-25 00:16,
可以这样亲我吗李现,224461.0,2024-04-25 00:16,
陆虎直播,224342.0,2024-04-25 00:16,
深圳暴雨,191810.0,2024-04-25 00:16,
买长乘短是一种不折不扣的双输,187275.0,2024-04-25 00:16,
田馥甄发微博,899152.0,2024-04-25 00:16,
男子多次性侵前女友11岁女儿获刑16年,753426.0,2024-04-25 00:16,
微信区分单删互删,502917.0,2024-04-25 00:16,
读研就是在筛选过于较真的人,194015.0,2024-04-25 00:16,
身份证号码中包含X该如何买票,166882.0,2024-04-25 00:16,
冠军赛叶诗文200蛙夺冠,134197.0,2024-04-25 00:16,
养7年狗被偷找到时只剩20斤残肢,163917.0,2024-04-25 00:16,
卢昱晓冷艳千金妆,155688.0,2024-04-25 00:16,
男孩骑车失误刹车把手插进大腿里,141738.0,2024-04-25 00:16,
女公交司机驾车过3个鸡蛋完好无损,40492.0,2024-04-25 00:16,
承欢记大结局,143409.0,2024-04-25 00:16,
老舅是张若昀的开关,143250.0,2024-04-25 00:16,
ive预告,135167.0,2024-04-25 00:16,
春色寄情人 多机位吻戏,129163.0,2024-04-25 00:16,
让腿丝滑变直的小技巧,119977.0,2024-04-25 00:16,
中传教授说杨幂新片有惊喜,114091.0,2024-04-25 00:16,
春色寄情人,106950.0,2024-04-25 00:16,
长期吃铝包子或引发肝肾损伤,106297.0,2024-04-25 00:16,
福宝已开始在外场采食,102102.0,2024-04-25 00:16,
这些人工合成水果又出来骗人了,94791.0,2024-04-25 00:16,
我们仨,93094.0,2024-04-25 00:16,
花少好友记冷场,91495.0,2024-04-25 00:16,
22岁的我不舍得吃20块的外卖,90971.0,2024-04-25 00:16,
韩维辰镜头,90043.0,2024-04-25 00:16,
小米汽车回应玻璃镀银影响信号,82238.0,2024-04-25 00:16,
赵丽颖林更新缘分开始的地方,78499.0,2024-04-25 00:16,
日本地震,78151.0,2024-04-25 00:16,
郑恺 当跑男都需要干什么,76461.0,2024-04-25 00:16,
周鸿祎问贾跃亭啥时候回国,68908.0,2024-04-25 00:16,
普拉多价格,65814.0,2024-04-25 00:16,
