name,value,date,Unnamed: 3
尚雯婕冠军,1232062.0,2024-06-25 00:08,
到底啥是city不city啊,815880.0,2024-06-25 00:08,
收下这份暴雨天避险自救指南,33249.0,2024-06-25 00:08,
杜江霍思燕收养实验犬,1335355.0,2024-06-25 00:08,
酒桌上发出5.2万红包后悔了能要回吗,321630.0,2024-06-25 00:08,
韩国起火电池厂员工多来自东北朝鲜族,310011.0,2024-06-25 00:08,
辉子失误,670636.0,2024-06-25 00:08,
林一回应和刘亦菲合作,500911.0,2024-06-25 00:08,
A股大跌,303210.0,2024-06-25 00:08,
女生复读1年高考涨133分激动爆哭,41872.0,2024-06-25 00:08,
女子与男友发生关系后诬告对方强奸,745355.0,2024-06-25 00:08,
韩方通报遇难中国公民增至19人,578894.0,2024-06-25 00:08,
刘亦菲喝了黄玫瑰拿铁,483584.0,2024-06-25 00:08,
韩雪 难听,365497.0,2024-06-25 00:08,
靳梦佳救场,303016.0,2024-06-25 00:08,
韩方向中方表示哀悼,301863.0,2024-06-25 00:08,
唐尚珺高考成绩,284198.0,2024-06-25 00:08,
长沙1小时下了54个西湖,261123.0,2024-06-25 00:08,
唐治平疑似精神失常,254801.0,2024-06-25 00:08,
江苏高考689分及以上107人,204274.0,2024-06-25 00:08,
轻断食五天瘦了11斤,247876.0,2024-06-25 00:08,
王星越一把抱起了前夫哥,240198.0,2024-06-25 00:08,
痛经越来越疼要小心巧克力囊肿,219045.0,2024-06-25 00:08,
发现导师朋友圈只屏蔽了我,216837.0,2024-06-25 00:08,
山东卫视发了肖战,196902.0,2024-06-25 00:08,
月薪四千开始从孩子身上降本增效,182747.0,2024-06-25 00:08,
陈昊宇发言,180853.0,2024-06-25 00:08,
新说唱,175241.0,2024-06-25 00:08,
终于有了一部全女主的剧,162104.0,2024-06-25 00:08,
向佐发16个问号问黄子韬,161933.0,2024-06-25 00:08,
EXO成员去了张艺兴演唱会,159674.0,2024-06-25 00:08,
陈丽君 投票,154925.0,2024-06-25 00:08,
易猝死的人有4个共同点,150231.0,2024-06-25 00:08,
金智秀巴黎大秀造型,149850.0,2024-06-25 00:08,
外国博主打卡北京带火city不city,142998.0,2024-06-25 00:08,
网传荣梓杉高考成绩417分,142922.0,2024-06-25 00:08,
某韩国男星性侵18岁女学生,138468.0,2024-06-25 00:08,
榴莲的叶酸含量是苹果的30倍,135810.0,2024-06-25 00:08,
长相思2定档,135161.0,2024-06-25 00:08,
保时捷降价了,107931.0,2024-06-25 00:08,
何洁听尚雯婕哭了,128458.0,2024-06-25 00:08,
大奉打更人,127375.0,2024-06-25 00:08,
白夜追凶2过审了,119907.0,2024-06-25 00:08,
沈泉锐直播,110270.0,2024-06-25 00:08,
李晋晔哽咽回应歌手争议,106086.0,2024-06-25 00:08,
女性一生中月经的次数变化,101829.0,2024-06-25 00:08,
桐岛爱,93865.0,2024-06-25 00:08,
大四女生退学后复读5个月考641分,91361.0,2024-06-25 00:08,
中方对波兰公民实施15日单方面免签,85707.0,2024-06-25 00:08,
为何前列腺癌一发现就是晚期,83277.0,2024-06-25 00:08,
