name,value,date,Unnamed: 3
729声明,1159599.0,2024-07-10 00:00,
涂山璟 此身从此分明了,987893.0,2024-07-10 00:00,
新时代全面深化改革的宝贵经验,17477.0,2024-07-10 00:00,
跌200万后女子要卖掉能看西湖的房子,853008.0,2024-07-10 00:00,
黄晓明再次感谢虞书欣,667277.0,2024-07-10 00:00,
国务院食安办回应油罐车事件,598666.0,2024-07-10 00:00,
长相思戏还没播完番外先出了,495481.0,2024-07-10 00:00,
巴黎奥运会韩国代表团制服,417849.0,2024-07-10 00:00,
防风邶下线,451426.0,2024-07-10 00:00,
4岁小孩被卡门缝消防3分钟救出,17535.0,2024-07-10 00:00,
金龙鱼再回应油罐车事件,506855.0,2024-07-10 00:00,
清华大学博士情侣毕业奔赴祖国中部,440959.0,2024-07-10 00:00,
Jennie方承认吸烟并道歉,440329.0,2024-07-10 00:00,
为什么现在电视剧都是1女N男,426805.0,2024-07-10 00:00,
鲁花回应油罐车事件,403483.0,2024-07-10 00:00,
会吵架真的能省很多事,396616.0,2024-07-10 00:00,
中储粮油厂门口油罐车司机称没活干,380427.0,2024-07-10 00:00,
小夭的难堪众人的狂欢,354182.0,2024-07-10 00:00,
鹿晗工作室是在暗示四巡地点吗,251880.0,2024-07-10 00:00,
廊坊市监局回应化工油食用油混装事件,244244.0,2024-07-10 00:00,
不想结节癌变千万避开这3种蔬菜,687234.0,2024-07-10 00:00,
体制内对怀孕女性的态度,548033.0,2024-07-10 00:00,
才25岁就要被介绍40岁的男孩,291032.0,2024-07-10 00:00,
人死之前为什么会回光返照,252885.0,2024-07-10 00:00,
研究发现月经用品中含有毒金属,235191.0,2024-07-10 00:00,
体制内到办公室的第一件事,233816.0,2024-07-10 00:00,
西班牙vs法国,216462.0,2024-07-10 00:00,
iPhone16系列或将支持40W快充,206693.0,2024-07-10 00:00,
相柳 ooc,193658.0,2024-07-10 00:00,
失踪22年美国登山者遗体被找到,176627.0,2024-07-10 00:00,
金牛座为什么难以亲近,172608.0,2024-07-10 00:00,
中国人民解放军92950部队记一等功,168491.0,2024-07-10 00:00,
荷兰男子捐精生下1000个娃,137815.0,2024-07-10 00:00,
卢昱晓父母都是医生,134516.0,2024-07-10 00:00,
欧洲杯半决赛,123590.0,2024-07-10 00:00,
徐志胜 本来上班就烦,115836.0,2024-07-10 00:00,
金龙鱼声明,107813.0,2024-07-10 00:00,
张凌赫和裴文宣合照,104193.0,2024-07-10 00:00,
两个账号同一航班价格相差1300,104176.0,2024-07-10 00:00,
油罐车司机称客户有要求才会洗,101657.0,2024-07-10 00:00,
重生之我是江浙沪独女,95071.0,2024-07-10 00:00,
傅园慧要去浙大当老师了,92069.0,2024-07-10 00:00,
白敬亭P了两个白敬亭,90115.0,2024-07-10 00:00,
胡姬花,89331.0,2024-07-10 00:00,
张拿铁带着爸爸干吃播,88902.0,2024-07-10 00:00,
欧洲杯最壕的一场比赛来了,84651.0,2024-07-10 00:00,
张贤胜公开退团原因,83437.0,2024-07-10 00:00,
章若楠白敬亭营业了,84089.0,2024-07-10 00:00,
吴谨言短发白裙,79741.0,2024-07-10 00:00,
母亲背罕见病儿子14年累断足骨,73049.0,2024-07-10 00:00,
