name,value,date,Unnamed: 3
刘亦菲头像,759638.0,2024-06-10 00:20,
不接陌生电话但是要去微信搜,510001.0,2024-06-10 00:20,
一批诋毁企业形象账号被处置,92574.0,2024-06-10 00:20,
女子注射400支玻尿酸丰臀致臀部感染,1037624.0,2024-06-10 00:20,
早田希娜女单冠军,309696.0,2024-06-10 00:20,
刘亦菲5集换了32套造型,667553.0,2024-06-10 00:20,
高考下一章 墨雨云间,375663.0,2024-06-10 00:20,
潮牌Champion为什么不火了,305047.0,2024-06-10 00:20,
彭冠英嘻嘻徐海乔不嘻嘻,277614.0,2024-06-10 00:20,
定格在郑州落日下的浪漫,18323.0,2024-06-10 00:20,
女子厕所装百叶窗走光3年浑然不知,836459.0,2024-06-10 00:20,
新女团成员上节目被开黄腔,506914.0,2024-06-10 00:20,
我爸以为有教资就能去学校当老师,255424.0,2024-06-10 00:20,
刘亦菲彭冠英踮脚吻,353418.0,2024-06-10 00:20,
陈雨浓孙程潇吵架,208387.0,2024-06-10 00:20,
中国零食饮料逐渐征服外国人,198680.0,2024-06-10 00:20,
用李现照片当成相亲对象发给老爸,191655.0,2024-06-10 00:20,
白桃星座,189852.0,2024-06-10 00:20,
以色列,158435.0,2024-06-10 00:20,
高考再见,129084.0,2024-06-10 00:20,
经常吃水煮蛋是养肝还是伤肝,432973.0,2024-06-10 00:20,
高铁上拒绝了宝妈的换座要求,302819.0,2024-06-10 00:20,
为什么离职的都去新疆了,266254.0,2024-06-10 00:20,
小警犬因太友好而被开除,214112.0,2024-06-10 00:20,
老破小二手房突然火了,181665.0,2024-06-10 00:20,
3个洗碗坏习惯或增加患癌风险,171541.0,2024-06-10 00:20,
真的和纸片人结婚了,161791.0,2024-06-10 00:20,
佟大为演技,157366.0,2024-06-10 00:20,
张翰当伴郎,145405.0,2024-06-10 00:20,
法网,108310.0,2024-06-10 00:20,
墨雨云间,140401.0,2024-06-10 00:20,
朴灿烈唱StayWithMe,140121.0,2024-06-10 00:20,
墨雨云间让大学生神金合理了,133996.0,2024-06-10 00:20,
他做饭他被骂他委屈巴巴,125386.0,2024-06-10 00:20,
于正审美,123535.0,2024-06-10 00:20,
植物大战僵尸杂交版,113277.0,2024-06-10 00:20,
老师最不看好你 可你偏偏最争气,112947.0,2024-06-10 00:20,
高考生催更墨雨云间,109214.0,2024-06-10 00:20,
金价大跌消费者还想再等等,102110.0,2024-06-10 00:20,
荣梓杉是今年中戏北电双第一,101334.0,2024-06-10 00:20,
肃国公淋雨练剑的原因找到了,88450.0,2024-06-10 00:20,
黄油小熊也拥有了玲娜贝儿,83269.0,2024-06-10 00:20,
相亲对象对我隐瞒了学历,79218.0,2024-06-10 00:20,
熊猫背后的拉链要开了,74951.0,2024-06-10 00:20,
周深带全场毕业生说少管我,71246.0,2024-06-10 00:20,
郑州一小区发生火灾造成4人遇难,70181.0,2024-06-10 00:20,
极限挑战,66905.0,2024-06-10 00:20,
姿态冒充Uzi,66305.0,2024-06-10 00:20,
2024端午来啦,64857.0,2024-06-10 00:20,
紧急提醒这种粽子绳有毒,63600.0,2024-06-10 00:20,
