name,value,date,Unnamed: 3
教育局回应女老师打骂学生,561494.0,2024-02-29 01:05,
厅长退休后买13套房给子孙,465405.0,2024-02-29 01:05,
我国海上巨无霸已安装就位,53460.0,2024-02-29 01:05,
柳智敏李宰旭一见钟情瞬间,337584.0,2024-02-29 01:05,
官方通报广东一初中生跳楼自杀,314120.0,2024-02-29 01:05,
爱奇艺去年总营收319亿元,246408.0,2024-02-29 01:05,
迪丽热巴的天使蹲为什么劝你别学,228765.0,2024-02-29 01:05,
霍建华 要拍现在拍别跟着我,226403.0,2024-02-29 01:05,
艾滋病病毒无法在唾液中存活,224191.0,2024-02-29 01:05,
建议启动中小学教师在职学历提升计划,68467.0,2024-02-29 01:05,
我的性教育来自郭敬明的小说,735785.0,2024-02-29 01:05,
人流后支离破碎的子宫,258355.0,2024-02-29 01:05,
我国有近1亿人是慢阻肺人群,208521.0,2024-02-29 01:05,
比特币每枚突破6万美元,191530.0,2024-02-29 01:05,
挖呀挖黄老师家人回应被造黄谣,190466.0,2024-02-29 01:05,
蒲熠星 吃饭是我的人类学调查方式,167117.0,2024-02-29 01:05,
孙千陈靖可朋友圈签名,166051.0,2024-02-29 01:05,
舒畅红色马面裙,161218.0,2024-02-29 01:05,
被指吃绝户男子发声,120769.0,2024-02-29 01:05,
李洙赫 男狐狸,108096.0,2024-02-29 01:05,
舅舅让我帮他女儿付学费,145673.0,2024-02-29 01:05,
睡前吃夜宵和饿肚子睡觉哪个危害大,134997.0,2024-02-29 01:05,
恋爱冷淡期,110129.0,2024-02-29 01:05,
重庆姐弟坠亡案生母宣布将直播带货,103091.0,2024-02-29 01:05,
烟火人家 乳腺通了泪腺崩了,101442.0,2024-02-29 01:05,
檀健次演技,95917.0,2024-02-29 01:05,
女教师办公室殴打学生,94829.0,2024-02-29 01:05,
任嘉伦四年之约,91922.0,2024-02-29 01:05,
宗馥莉哽咽追忆父亲宗庆后,87764.0,2024-02-29 01:05,
日本已擅自排海超2.3万吨核污染水,41398.0,2024-02-29 01:05,
古希腊掌管teenager的神,102015.0,2024-02-29 01:05,
殴打学生女老师被停职,86694.0,2024-02-29 01:05,
贵州夫妻17年间生下9女1男,84848.0,2024-02-29 01:05,
网剧唐人街探案2定档,82951.0,2024-02-29 01:05,
张予曦cos杨玉环,80010.0,2024-02-29 01:05,
原来狗不嫌家贫是因为没富过,73668.0,2024-02-29 01:05,
亚洲首富之子18个月减重超200斤,72070.0,2024-02-29 01:05,
挖呀挖黄老师回应被造黄谣称已报警,71011.0,2024-02-29 01:05,
慢动作鲨鱼夹教程,70381.0,2024-02-29 01:05,
半熟恋人男嘉宾细致程度,69063.0,2024-02-29 01:05,
开始推理吧2,66565.0,2024-02-29 01:05,
王俊凯新加坡登上全球发音,64189.0,2024-02-29 01:05,
演员王迅游荆州怒批古城墙刻字行为,63582.0,2024-02-29 01:05,
上海一饭堂发生情杀案致2人死亡,63033.0,2024-02-29 01:05,
飞驰人生,61747.0,2024-02-29 01:05,
BTC,60640.0,2024-02-29 01:05,
见男朋友父母是需要考察一下的,59478.0,2024-02-29 01:05,
不要为轻松的日子感到愧疚,57608.0,2024-02-29 01:05,
陈赫晒妻子女儿背影照,56128.0,2024-02-29 01:05,
凤凰传奇演唱会预约人数,54413.0,2024-02-29 01:05,
