name,value,date,Unnamed: 3
姜萍,534675.0,2024-06-18 01:16,
北京男子或将错失10万元大奖,409743.0,2024-06-18 01:16,
教育部首次上线高考志愿信息系统,26305.0,2024-06-18 01:16,
林更新演技,381643.0,2024-06-18 01:16,
iPhone15多次降价重回销量榜第一,228254.0,2024-06-18 01:16,
订书钉才是上班摸鱼神器,173348.0,2024-06-18 01:16,
方协文 玫瑰换条裤子,255735.0,2024-06-18 01:16,
段嘉许回来了,240462.0,2024-06-18 01:16,
林更新怼黑粉 一战成名,310147.0,2024-06-18 01:16,
一份班主任准备了6年的礼物,16736.0,2024-06-18 01:16,
知情人称遇难8人非首次坐冷藏车,184907.0,2024-06-18 01:16,
比利时vs斯洛伐克,158715.0,2024-06-18 01:16,
陈哲远转发说他假唱微博,164300.0,2024-06-18 01:16,
烟草局回应凌晨上门伪造证据,155168.0,2024-06-18 01:16,
苏敏 离婚,154370.0,2024-06-18 01:16,
新加坡门将以为自己火不过两天,144528.0,2024-06-18 01:16,
玫瑰的故事 绝症哥,129224.0,2024-06-18 01:16,
医生提醒尽量不要生吃海鲜和肉,119468.0,2024-06-18 01:16,
方协文发疯请勿上升林更新,113291.0,2024-06-18 01:16,
火鸡面,100846.0,2024-06-18 01:16,
长寿的人多半有4慢3长特点,102601.0,2024-06-18 01:16,
玫瑰的故事朱珠精神灯塔,101675.0,2024-06-18 01:16,
鞠婧祎开心夜舞台,100858.0,2024-06-18 01:16,
玫瑰的故事告诉我们,95732.0,2024-06-18 01:16,
张真源到达匈牙利录制跑男,89654.0,2024-06-18 01:16,
罗马尼亚vs乌克兰,88125.0,2024-06-18 01:16,
广东梅州暴雨致5死15失联,88074.0,2024-06-18 01:16,
瘦了20斤才敢说的实话,78815.0,2024-06-18 01:16,
欧洲杯,73794.0,2024-06-18 01:16,
外国人被中国夜市硬控了,63749.0,2024-06-18 01:16,
四个男女主凑不出一副爹娘,63228.0,2024-06-18 01:16,
越来越多年轻人患上结婚羞耻症,60351.0,2024-06-18 01:16,
玫瑰的故事,58280.0,2024-06-18 01:16,
水象星座真的是恋爱脑吗,56639.0,2024-06-18 01:16,
city不city,54553.0,2024-06-18 01:16,
李耕耘陈少熙一起走红毯,54268.0,2024-06-18 01:16,
夏天怕热可以扎这四款发型,51631.0,2024-06-18 01:16,
谢霆锋怒火重案后消失三年原因,50411.0,2024-06-18 01:16,
关晓彤回应被推荐去歌手,49473.0,2024-06-18 01:16,
云南一女子吃野生菌看到机器人小偷,48974.0,2024-06-18 01:16,
乃万 从livehouse到体育馆,48319.0,2024-06-18 01:16,
Giselle中国首封,47775.0,2024-06-18 01:16,
单依纯唱王菲的天空,47620.0,2024-06-18 01:16,
庄国栋碎了,47053.0,2024-06-18 01:16,
于文文Amber刘忻 拽姐秀,46982.0,2024-06-18 01:16,
王星越吴谨言这大手这小腰,43801.0,2024-06-18 01:16,
丈夫替怀孕妻子辞职合理吗,43118.0,2024-06-18 01:16,
华晨宇声线有日出的温暖,42294.0,2024-06-18 01:16,
男子误机花6000从天津打车到西安,37012.0,2024-06-18 01:16,
数学专业就业后的收入,33107.0,2024-06-18 01:16,
