name,value,date,Unnamed: 3
今天明显对时间有了敬畏感,1449667,2024-07-01 10:23,
网友称张志杰未获及时救治,1673519,2024-07-01 10:23,
7月新规影响你我,97263,2024-07-01 10:23,
张志杰姐姐质疑抢救不及时,793297,2024-07-01 10:23,
张志杰去世,4217130,2024-07-01 10:23,
过早入睡也容易发生心脑血管疾病,561294,2024-07-01 10:23,
傅菁连唱29首歌没跳舞,544836,2024-07-01 10:23,
中国共产党103周年,504568,2024-07-01 10:23,
穿袜子睡觉可以提高睡眠质量,401508,2024-07-01 10:23,
下半年最想实现的心愿,116522,2024-07-01 10:23,
于正 连扑早被市场淘汰了,594404,2024-07-01 10:23,
小鱼海棠 小英,539292,2024-07-01 10:23,
巴菲特将1300亿美元留给儿女,441985,2024-07-01 10:23,
我妈看微信短视频花了六千多,439427,2024-07-01 10:23,
特斯拉 五年免息,397210,2024-07-01 10:23,
谢霆锋 开心我还辞什么职,356887,2024-07-01 10:23,
莎头 可口可乐,340969,2024-07-01 10:23,
张志杰曾表示想通过努力证明自己,322502,2024-07-01 10:23,
我国幽门螺杆菌的感染率高达59%,320202,2024-07-01 10:23,
张杰谢娜抢着拿包,255962,2024-07-01 10:23,
月薪八千房租1100会很贵吗,838615,2024-07-01 10:23,
微信收款码拍下来没法付款,528131,2024-07-01 10:23,
警方通报救护车副驾高速上直播飙车,249918,2024-07-01 10:23,
爷爷靠近一个月小宝结果醉酒了,239044,2024-07-01 10:23,
上午说了辞职晚上就后悔了,219210,2024-07-01 10:23,
这是今早的香港金紫荆广场,211049,2024-07-01 10:23,
黄旭东吐槽JackeyLove,200642,2024-07-01 10:23,
张杰重庆万人火锅点菜,195761,2024-07-01 10:23,
嗨放派直播,193350,2024-07-01 10:23,
缉毒卧底连续偶遇警察同事,186818,2024-07-01 10:23,
巴菲特去世后不再向盖茨基金会捐赠,195355,2024-07-01 10:23,
23岁找工作因年龄大被HR拒绝了,184845,2024-07-01 10:23,
业主砍断高空作业工人绳索,181360,2024-07-01 10:23,
王老师 花小龙,179861,2024-07-01 10:23,
微信恐惧综合症,174820,2024-07-01 10:23,
中国地铁站有厕所让老外破防,168480,2024-07-01 10:23,
离开张杰谁还把我当小孩,167899,2024-07-01 10:23,
坚持了二十天晚上十点半睡觉,167889,2024-07-01 10:23,
长期口臭可能是长了扁桃体结石,157450,2024-07-01 10:23,
于正再为吴谨言发声,155135,2024-07-01 10:23,
詹姆斯愿意降薪2000万,153887,2024-07-01 10:23,
当老师本质上是在当爱豆,152587,2024-07-01 10:23,
保罗签约马刺,150038,2024-07-01 10:23,
香港回归这一刻再看依旧激动人心,138356,2024-07-01 10:23,
妈妈是清华的儿子也是清华的,136141,2024-07-01 10:23,
发现谈恋爱其实就是找自己,124761,2024-07-01 10:23,
建党节,123488,2024-07-01 10:23,
直播间花499元抢了条假金链子,119189,2024-07-01 10:23,
现在连朋友圈自由都没有了,118634,2024-07-01 10:23,
周扬青走秀有戛纳那味儿了,116895,2024-07-01 10:23,
