name,value,date,Unnamed: 3
斩虎 巨婴,446743.0,2024-04-13 01:08,
伊朗,434597.0,2024-04-13 01:08,
秦朗丢寒假作业系摆拍博主被处罚,395599.0,2024-04-13 01:08,
杭州确诊一例狂犬病死亡几年前被狗咬,559200.0,2024-04-13 01:08,
百万网红杨立新遇害,303380.0,2024-04-13 01:08,
张予曦穿了贾静雯去年浪姐的衣服,286672.0,2024-04-13 01:08,
陈泽 红娘,243262.0,2024-04-13 01:08,
山西省考 出不出,231124.0,2024-04-13 01:08,
机智的医生生活第三季,228982.0,2024-04-13 01:08,
小学生多看两眼帮铲除339株罂粟,50940.0,2024-04-13 01:08,
网红猫一杯涉事公司监事回应处罚,675884.0,2024-04-13 01:08,
有没有性生活都一定要做4项妇科检查,380870.0,2024-04-13 01:08,
员工晒董宇辉白发越来越多,326675.0,2024-04-13 01:08,
林更新坦言二搭赵丽颖有压力,193883.0,2024-04-13 01:08,
封神剧组又重聚了,180933.0,2024-04-13 01:08,
我从211退学考上了另一所211,174468.0,2024-04-13 01:08,
郭文韬跳昆卡,158992.0,2024-04-13 01:08,
杨立新遇害21天前刚收嫌疑人为徒,154193.0,2024-04-13 01:08,
刘亦菲林更新玫瑰的故事剧照,140455.0,2024-04-13 01:08,
美情报显示伊朗将在24至48小时内动手,138362.0,2024-04-13 01:08,
黄子韬徐艺洋被说像兄妹,401007.0,2024-04-13 01:08,
网红猫一杯道歉,310551.0,2024-04-13 01:08,
本周做什么都顺的星座,161000.0,2024-04-13 01:08,
鹿晗黄子韬再合作,139635.0,2024-04-13 01:08,
周大福足金戒指不到2个月出现褪色,127970.0,2024-04-13 01:08,
花花被和叶推下水,121502.0,2024-04-13 01:08,
福宝和爷爷乘坐飞机的过程,108667.0,2024-04-13 01:08,
赵露思王安宇拥抱,106870.0,2024-04-13 01:08,
乐言喊zdz姐夫,103209.0,2024-04-13 01:08,
中国航天员拍的地球家园好震撼,40683.0,2024-04-13 01:08,
被广东同事的午饭吓晕,96168.0,2024-04-13 01:08,
乘风2024官宣,94904.0,2024-04-13 01:08,
承欢记收视率创新高,87061.0,2024-04-13 01:08,
朋友称网红杨立新遇害前吃了堕胎药,81683.0,2024-04-13 01:08,
王润泽靠墙蹲,79187.0,2024-04-13 01:08,
刘雅瑟的腰臀比,74878.0,2024-04-13 01:08,
李溪芮吊带银裙,70457.0,2024-04-13 01:08,
发疯文学算是被大学生玩明白了,66490.0,2024-04-13 01:08,
人近三十朋友圈迎来大面积关闭潮,62721.0,2024-04-13 01:08,
原神赛诺,51048.0,2024-04-13 01:08,
周也做猪鼻子,67613.0,2024-04-13 01:08,
宋雨琦戴唇环,67155.0,2024-04-13 01:08,
周扬青浪姐造型,65385.0,2024-04-13 01:08,
爱豆通过官宣知道自己行程,61654.0,2024-04-13 01:08,
刘浩存年度影响力青年演员,60662.0,2024-04-13 01:08,
专家称A股牛市正在孕育中,48332.0,2024-04-13 01:08,
董宇辉回应现在讲解质量差,45160.0,2024-04-13 01:08,
原神前瞻,44997.0,2024-04-13 01:08,
连花花都不认识你来看花花,44258.0,2024-04-13 01:08,
云南昆明发生森林火灾,36785.0,2024-04-13 01:08,
