name,value,date,Unnamed: 3
贵州文旅删除所有东方甄选相关视频,998146.0,2024-06-29 01:14,
那英 带状疱疹,825765.0,2024-06-29 01:14,
中国空间站舷窗大片上新,28571.0,2024-06-29 01:14,
85花 飞升失败,693255.0,2024-06-29 01:14,
杨紫遗憾没到白玉兰现场,606342.0,2024-06-29 01:14,
全球变暖致珠峰200多具遗体显露,333419.0,2024-06-29 01:14,
胡歌二封白玉兰视帝,441524.0,2024-06-29 01:14,
举报人回应被胖东来奖励10万,316902.0,2024-06-29 01:14,
男子清华毕业1年重新高考学中医,316453.0,2024-06-29 01:14,
浙江农村奶奶的打工状态属实羡慕了,16630.0,2024-06-29 01:14,
白玉兰获奖名单,417374.0,2024-06-29 01:14,
凡希亚吃了几个邓紫棋,409050.0,2024-06-29 01:14,
周迅二封白玉兰视后,351750.0,2024-06-29 01:14,
殷世航傲娇美官宣恋情,337131.0,2024-06-29 01:14,
广西一小区保安持刀杀害2人,160777.0,2024-06-29 01:14,
女子称亡夫13万存款消失账户被注销,143171.0,2024-06-29 01:14,
房东上门催租发现家里被卖空,114015.0,2024-06-29 01:14,
法院判定玖月晞小南风抄袭,101350.0,2024-06-29 01:14,
柬埔寨拥有千套房房东枪杀租客,100616.0,2024-06-29 01:14,
中国奥委会确认王楚钦樊振东单打资格,98549.0,2024-06-29 01:14,
谭维维给我听爽了,310272.0,2024-06-29 01:14,
歌手排名,305019.0,2024-06-29 01:14,
陈晓给刘亦菲提裙子,295755.0,2024-06-29 01:14,
尤长靖感谢那英,293698.0,2024-06-29 01:14,
你的屁股可能已经死掉了,161722.0,2024-06-29 01:14,
谭维维第一,248829.0,2024-06-29 01:14,
赵一博翻牌,153567.0,2024-06-29 01:14,
矿泉水湿敷半个月后,147126.0,2024-06-29 01:14,
歌手直播,133190.0,2024-06-29 01:14,
成绩上不了五院四系还报法学吗,73085.0,2024-06-29 01:14,
为什么空调开26度时有臭味,132903.0,2024-06-29 01:14,
一个久坐的屁股有多丑,107976.0,2024-06-29 01:14,
asen把diss删了,105613.0,2024-06-29 01:14,
花百万怒骂小炸串,101031.0,2024-06-29 01:14,
十个勤天演唱会,97314.0,2024-06-29 01:14,
seventeen舞台,95953.0,2024-06-29 01:14,
谭维维有以前歌手那味儿了,94425.0,2024-06-29 01:14,
王鹤棣工作室认不出王鹤棣,89038.0,2024-06-29 01:14,
中国大运河申遗成功10年了,78632.0,2024-06-29 01:14,
凹凸世界,70178.0,2024-06-29 01:14,
花儿与少年,85893.0,2024-06-29 01:14,
戚薇是真正的昆卡,74925.0,2024-06-29 01:14,
男子钓到1.45米水中老虎竟然放走,68741.0,2024-06-29 01:14,
李昊粉发,64871.0,2024-06-29 01:14,
带状疱疹,62834.0,2024-06-29 01:14,
高铁座被孕妇暂坐男子假装没看见,61913.0,2024-06-29 01:14,
你为什么会爱上同一类人,60687.0,2024-06-29 01:14,
infp每天典型的4种状态,57778.0,2024-06-29 01:14,
白敬亭的耳骨夹,57583.0,2024-06-29 01:14,
员工儿子高考718分公司奖10万,46232.0,2024-06-29 01:14,
