name,value,date,Unnamed: 3
金价持续暴涨建行紧急公告,356168.0,2024-03-08 01:09,
瓦利耶娃被俄国家队除名,292091.0,2024-03-08 01:09,
政府工作报告里的民生举措,22753.0,2024-03-08 01:09,
90后女硕士8年筛查出12000名艾滋患者,312208.0,2024-03-08 01:09,
建议加强对女性心血管疾病的筛查监测,25997.0,2024-03-08 01:09,
拿米哈游画师作品去米哈游投简历,190090.0,2024-03-08 01:09,
其实妈妈把你养得很好,118215.0,2024-03-08 01:09,
妇女节放假是法定的半天节假日,117215.0,2024-03-08 01:09,
电视剧暗河传,89958.0,2024-03-08 01:09,
政协委员谈国潮新中式成顶流,24309.0,2024-03-08 01:09,
生儿子才能分地是高彩礼的根源,874476.0,2024-03-08 01:09,
张元英为了保持清醒掐自己大腿,529715.0,2024-03-08 01:09,
男子上班浏览色情网站被开除辩称电脑中毒,434133.0,2024-03-08 01:09,
向佐评论李蠕蠕,409507.0,2024-03-08 01:09,
你又叫浣碧,307049.0,2024-03-08 01:09,
看见不认识的字不要随便拍照,202193.0,2024-03-08 01:09,
韩国一个苹果约15元,155498.0,2024-03-08 01:09,
大哥远 封了一天,117393.0,2024-03-08 01:09,
陈乔恩捐赠20吨狗粮,108780.0,2024-03-08 01:09,
别对我动心 哄不好了,102116.0,2024-03-08 01:09,
为啥体制内女性找对象越来越难,160313.0,2024-03-08 01:09,
研0喊了导师一晚上老鼠,134749.0,2024-03-08 01:09,
这个户型简直是我的理想型,95529.0,2024-03-08 01:09,
真的是要开始存钱了,90210.0,2024-03-08 01:09,
医生收到鲜花笔让全科室沸腾,80696.0,2024-03-08 01:09,
金牛座很有自己的主见,78681.0,2024-03-08 01:09,
现偶追妻癫公来了,75760.0,2024-03-08 01:09,
原来拉面不是统一只有三片肉,66929.0,2024-03-08 01:09,
迪丽热巴广州出发,64570.0,2024-03-08 01:09,
RitaCOS索拉卡,62868.0,2024-03-08 01:09,
唐探2这一集演的是萝莉岛吧,60885.0,2024-03-08 01:09,
回南天的布偶猫,59525.0,2024-03-08 01:09,
翟欣欣涉嫌敲诈勒索案已移送法院,59007.0,2024-03-08 01:09,
王鹤棣桃花坞前后变化,56508.0,2024-03-08 01:09,
檀健次模仿檀小呆檀力球表情包,56043.0,2024-03-08 01:09,
大理寺少卿游 他们本可以有更好的人生,55547.0,2024-03-08 01:09,
香奈儿内场座位图,53922.0,2024-03-08 01:09,
用壶铃一个月瘦了十斤,53866.0,2024-03-08 01:09,
黑执事 审美降级,53285.0,2024-03-08 01:09,
正确称体重的方法,53137.0,2024-03-08 01:09,
周琦 担架,51537.0,2024-03-08 01:09,
王一博回应回复字数,51503.0,2024-03-08 01:09,
间谍过家家 次子长大了,47594.0,2024-03-08 01:09,
山河四省高中生的十六岁,47187.0,2024-03-08 01:09,
王子文红玫瑰,42488.0,2024-03-08 01:09,
时代少年团接力女团舞,37535.0,2024-03-08 01:09,
白鹿直播,37049.0,2024-03-08 01:09,
孙千 容貌焦虑,36538.0,2024-03-08 01:09,
谁能看出来谢金燕50岁了,34079.0,2024-03-08 01:09,
唐斯半月板撕裂,33593.0,2024-03-08 01:09,
