name,value,date,Unnamed: 3
陈意涵 我来自中国台湾,545875.0,2024-07-18 01:01,
iPhone17不使用节省空间的主板材料,381735.0,2024-07-18 01:01,
小岗梦也是广大农民的梦,15814.0,2024-07-18 01:01,
四川一百货大楼起火已致6人遇难,239466.0,2024-07-18 01:01,
平台否认陆川被盗号,203844.0,2024-07-18 01:01,
普华永道将裁一半在华金融审计员工,105171.0,2024-07-18 01:01,
陆川发文删文手机设备一致,199496.0,2024-07-18 01:01,
赵露思新剧穿了高定,197246.0,2024-07-18 01:01,
建议列入北影教材,47133.0,2024-07-18 01:01,
中国汽车越卷越强越卷越好,13888.0,2024-07-18 01:01,
Kris离职,358536.0,2024-07-18 01:01,
孙颖莎离大满贯只差一枚奥运女单金牌,273639.0,2024-07-18 01:01,
白鹿直播状态,184424.0,2024-07-18 01:01,
美国男子将2岁女儿扔车内晒死,258397.0,2024-07-18 01:01,
巴西网红逼迫20多名粉丝卖淫获刑8年,209216.0,2024-07-18 01:01,
杨紫知道白玉兰提名的反应,200269.0,2024-07-18 01:01,
涂山璟我是你全家的仆人,172164.0,2024-07-18 01:01,
Kris 王多多,167018.0,2024-07-18 01:01,
薛之谦演唱会嘉宾是大鹏,145867.0,2024-07-18 01:01,
赤辰道歉,118374.0,2024-07-18 01:01,
建议大家下班回家立刻洗漱,137193.0,2024-07-18 01:01,
错位大结局,97161.0,2024-07-18 01:01,
员工一年内因考勤被扣工资20.9万,95718.0,2024-07-18 01:01,
爱奇艺2024大剧片单,83979.0,2024-07-18 01:01,
抓娃娃进入2024年内地票房榜前十,71874.0,2024-07-18 01:01,
十年前14000买的钻戒如今不值200块,64519.0,2024-07-18 01:01,
薛之谦戒指,63650.0,2024-07-18 01:01,
浙江一家8口确诊同种病一人患癌,63184.0,2024-07-18 01:01,
鞠婧祎纯欲穿搭,62158.0,2024-07-18 01:01,
消防员一次次潜入洪水开锁救人,20888.0,2024-07-18 01:01,
林一 不想做人很久了,61136.0,2024-07-18 01:01,
戒指哥 我破防了,62539.0,2024-07-18 01:01,
官方通报自贡九鼎购物广场火灾,59700.0,2024-07-18 01:01,
王星越定风波海报,59399.0,2024-07-18 01:01,
Tian 该祝69生日快乐了,59021.0,2024-07-18 01:01,
宋亚轩刘耀文同款T恤,57432.0,2024-07-18 01:01,
苏醒为薛之谦庆生,59579.0,2024-07-18 01:01,
发了个妈味十足的朋友圈,56807.0,2024-07-18 01:01,
格局被禁赛两场,54324.0,2024-07-18 01:01,
长相思2西陵玖瑶名场面来了,53808.0,2024-07-18 01:01,
四川自贡一百货大楼起火,53464.0,2024-07-18 01:01,
双鱼座是反骨的典型代表,48845.0,2024-07-18 01:01,
文韬好会撒娇啊,48309.0,2024-07-18 01:01,
多家汽车品牌退出价格战,48208.0,2024-07-18 01:01,
时代峰峻北京的新公司,47708.0,2024-07-18 01:01,
中山大学9位哲学硕博生卖烤肠走红,46303.0,2024-07-18 01:01,
涂山璟明天别去清水镇,45794.0,2024-07-18 01:01,
莫德里奇与皇马续约至2025年,44594.0,2024-07-18 01:01,
肖战得闲谨制通勤套装,41211.0,2024-07-18 01:01,
陶喆 一念之间,38709.0,2024-07-18 01:01,
