name,value,date,Unnamed: 3
王珂出道吧,940208.0,2024-04-07 01:01,
成都迪士尼被限流,672107.0,2024-04-07 01:01,
一起打卡春天里的中国,28482.0,2024-04-07 01:01,
长期戴耳塞睡觉的人最后怎么样了,651179.0,2024-04-07 01:01,
爱奇艺2024首部破万剧,576135.0,2024-04-07 01:01,
赵奕欢被李菲儿逼哭,336462.0,2024-04-07 01:01,
林狗你是真的火了,319776.0,2024-04-07 01:01,
某幻不直播,303189.0,2024-04-07 01:01,
花莲地震已致12人死亡1123人受伤,189839.0,2024-04-07 01:01,
上海饮料分级,96423.0,2024-04-07 01:01,
日本天皇独生女成为月薪7千的打工人,420684.0,2024-04-07 01:01,
男子上厕所隐私部位被割伤缝20多针,394094.0,2024-04-07 01:01,
创造营亚洲,315746.0,2024-04-07 01:01,
爷爷上坟比年轻人走的快,270376.0,2024-04-07 01:01,
林更新回应和赵丽颖三搭,246819.0,2024-04-07 01:01,
眼泪女王男二,229061.0,2024-04-07 01:01,
吴镇宇说张睿就一辈子演古装了,224135.0,2024-04-07 01:01,
沈璃在爱里生出了神性,218753.0,2024-04-07 01:01,
千万不要买樱花味食物,127216.0,2024-04-07 01:01,
福宝,67426.0,2024-04-07 01:01,
为什么现在退房都不检查了,242628.0,2024-04-07 01:01,
字字不提钱句句都是钱,217313.0,2024-04-07 01:01,
陈奕迅南京场观众,195312.0,2024-04-07 01:01,
将门毒后请肖战迪丽热巴会爆吗,188809.0,2024-04-07 01:01,
体制内开会为什么不能喝奶茶,135515.0,2024-04-07 01:01,
BOA锁定第三轮A组,116428.0,2024-04-07 01:01,
淄博小哥让人心疼价目表让人心动,22953.0,2024-04-07 01:01,
于正说赵晴替他一雪前耻,183110.0,2024-04-07 01:01,
谢帝 诺米,157355.0,2024-04-07 01:01,
这4种食物是尿毒症的加速器,90417.0,2024-04-07 01:01,
林更新周冬雨军服旧照,151611.0,2024-04-07 01:01,
林彦俊出道六周年应援,150990.0,2024-04-07 01:01,
眼泪女王,133944.0,2024-04-07 01:01,
小鬼朱正廷王子异直播,115899.0,2024-04-07 01:01,
54岁老板当主播日进百万,52401.0,2024-04-07 01:01,
清明出游西安热度霸榜全国前10,22511.0,2024-04-07 01:01,
你敢不敢去摸一下那只两脚兽,114871.0,2024-04-07 01:01,
陈楚生演唱会含哥量,114053.0,2024-04-07 01:01,
放假三天躺了三天,78350.0,2024-04-07 01:01,
坂田银时又是第一,68660.0,2024-04-07 01:01,
李沁写给沈近真的第九封信,101311.0,2024-04-07 01:01,
王一博出来跳舞,96397.0,2024-04-07 01:01,
陈楚生儿子巡演返场嘉宾,98087.0,2024-04-07 01:01,
阿信回应五月天越来越商业化,86420.0,2024-04-07 01:01,
锦超演的傅卫军,82799.0,2024-04-07 01:01,
海登海姆vs拜仁,45185.0,2024-04-07 01:01,
兰大回应虐猫考生进调剂名单,67095.0,2024-04-07 01:01,
Doinb回应复播,65818.0,2024-04-07 01:01,
成都迪士尼,62985.0,2024-04-07 01:01,
男孩做阑尾切除术5年后阑尾还在,40216.0,2024-04-07 01:01,
