name,value,date,Unnamed: 3
王力宏 歌手,874641.0,2024-05-16 01:14,
官方通报60余名幼儿群体性流血不实,214283.0,2024-05-16 01:14,
2024年全球贸易投资促进峰会,12865.0,2024-05-16 01:14,
韩佩泉报名歌手成功,318222.0,2024-05-16 01:14,
暖阳女友发博回应,123012.0,2024-05-16 01:14,
斯洛伐克总理遭枪击,231455.0,2024-05-16 01:14,
尼格买提 莫奈花园,304742.0,2024-05-16 01:14,
费可死了,296807.0,2024-05-16 01:14,
未婚女性不能使用精子库供精去父留子,189749.0,2024-05-16 01:14,
全局BP,98422.0,2024-05-16 01:14,
李溪芮张腾与代驾发生冲突全过程,250598.0,2024-05-16 01:14,
歌手2024揭榜歌手歌单,236501.0,2024-05-16 01:14,
原来张杰也会泰勒公式,193105.0,2024-05-16 01:14,
佟丽娅长发新中式,169298.0,2024-05-16 01:14,
华为MatePad,95509.0,2024-05-16 01:14,
95后小伙毕业后回乡当村医,11607.0,2024-05-16 01:14,
江西丰城一船舶4人窒息死亡,91559.0,2024-05-16 01:14,
教育部拟同意设24所本科高校,76684.0,2024-05-16 01:14,
日本制铁公司熔钢锅内发现人骨,68541.0,2024-05-16 01:14,
Uzi不和G2打训练赛,66593.0,2024-05-16 01:14,
16岁女孩洗澡时浴屏爆裂缝合20多针,421635.0,2024-05-16 01:14,
开心消消乐,321262.0,2024-05-16 01:14,
美国18岁女罪犯因颜值超高爆红,190135.0,2024-05-16 01:14,
李雪琴 小树不长歪长点枝丫没问题,162227.0,2024-05-16 01:14,
十个勤天去年底音乐节秀费超200万元,144506.0,2024-05-16 01:14,
1岁女婴被大伯母投毒致四肢瘫痪,137408.0,2024-05-16 01:14,
张静初回应凹学霸人设,117512.0,2024-05-16 01:14,
新生 烂尾,107340.0,2024-05-16 01:14,
庆余年第二季开播倒计时1天,90671.0,2024-05-16 01:14,
店家打烊遇拾荒老人果断开店送吃的,11602.0,2024-05-16 01:14,
鹿晗长沙,78601.0,2024-05-16 01:14,
庆余年2先导plus预告,74332.0,2024-05-16 01:14,
王一博跳街舞,71493.0,2024-05-16 01:14,
用利息生活是可行还是离谱,71018.0,2024-05-16 01:14,
小学六年级的李惠仁,68975.0,2024-05-16 01:14,
发现和没上过班的人很难交流,67017.0,2024-05-16 01:14,
新生 强行上价值,66221.0,2024-05-16 01:14,
新华社专访普京,54508.0,2024-05-16 01:14,
新生,54966.0,2024-05-16 01:14,
专家称过度防晒或导致缺钙闷痘,52201.0,2024-05-16 01:14,
咬伤3岁男童恶犬已被打死,51944.0,2024-05-16 01:14,
新生彩蛋,51784.0,2024-05-16 01:14,
关晓彤鞠婧祎早期合照,50898.0,2024-05-16 01:14,
坚持跑步1个月身体将怎样变化,50359.0,2024-05-16 01:14,
唐嫣璀璨亮片长裙,46583.0,2024-05-16 01:14,
上海一餐厅特设肖战墙景位预约爆满,45481.0,2024-05-16 01:14,
真正的大女主都是水泥封心,42750.0,2024-05-16 01:14,
经常吃海带还需吃碘盐补碘吗,42095.0,2024-05-16 01:14,
中国海警喊话警告非法侵闯黄岩岛船只,40423.0,2024-05-16 01:14,
高血压孕妇拒用药产后确诊子痫,38834.0,2024-05-16 01:14,
