name,value,date,Unnamed: 3
140万买的230平房子,81246.0,2024-03-06 05:10,
建议彩票个人单项奖金最高额度不超过500万,31000.0,2024-03-06 05:10,
2024全国两会新词热词,9297.0,2024-03-06 05:10,
最新研究找到熬夜致癌原因,79456.0,2024-03-06 05:10,
凯特王妃,57388.0,2024-03-06 05:10,
代表建议毕业生不要只把眼光放在一线城市,22065.0,2024-03-06 05:10,
皇家社会vs巴黎圣日耳曼,19742.0,2024-03-06 05:10,
建议消除简历第一学历概念,19277.0,2024-03-06 05:10,
射雕英雄传侠之大者计划全球发行,16349.0,2024-03-06 05:10,
建议中小学生每天都有一节体育课,12798.0,2024-03-06 05:10,
这哪是回南天这是回南天门了吧,71702.0,2024-03-06 05:10,
遭多人强暴的西班牙网红收到印度政府赔偿,47592.0,2024-03-06 05:10,
白敬亭退出乐本文化,38643.0,2024-03-06 05:10,
浪姐颜值,32425.0,2024-03-06 05:10,
张铭恩一种隐约的狠辣,30015.0,2024-03-06 05:10,
已经生娃可能还会检测出已怀孕,28351.0,2024-03-06 05:10,
朱丹听到sorry变脸,27896.0,2024-03-06 05:10,
周处除三害 抄袭,27206.0,2024-03-06 05:10,
粉丝抵制黄牛炒作300元生菜,25907.0,2024-03-06 05:10,
分手后最体面的星座,24770.0,2024-03-06 05:10,
阿姨被辞退后发信息轰炸我,29691.0,2024-03-06 05:10,
我在银行买金镯子又大又便宜,24314.0,2024-03-06 05:10,
继承者们 抄袭,23382.0,2024-03-06 05:10,
王一博白色运动服造型,22064.0,2024-03-06 05:10,
Jennie仪态,21586.0,2024-03-06 05:10,
拜仁慕尼黑vs拉齐奥,21559.0,2024-03-06 05:10,
越来越多年轻人确诊淡淡综合症,21176.0,2024-03-06 05:10,
相亲当晚女生发来开销账单,20781.0,2024-03-06 05:10,
真没必要为三五年后的前途担忧,17742.0,2024-03-06 05:10,
身体出现3个异常警惕癌症信号,17737.0,2024-03-06 05:10,
腰腹赘肉算是踢到铁板了,16895.0,2024-03-06 05:10,
易梦玲宋智雅合照,16341.0,2024-03-06 05:10,
男朋友谈过一段很长的恋爱,16087.0,2024-03-06 05:10,
蔚来现金储备达573亿元,14570.0,2024-03-06 05:10,
陈桂林原型,14378.0,2024-03-06 05:10,
别再让黄金店割智商税了,13993.0,2024-03-06 05:10,
宋茜谈年龄焦虑,13949.0,2024-03-06 05:10,
杨幂谈私服风格,12669.0,2024-03-06 05:10,
不平凡的她,12255.0,2024-03-06 05:10,
汪苏泷 感情中切忌自我感动,11838.0,2024-03-06 05:10,
邓为工作室的审美,11830.0,2024-03-06 05:10,
金价,11785.0,2024-03-06 05:10,
哈兰德认为梅西是历史最佳球员,11546.0,2024-03-06 05:10,
Tarzan去哪儿,11362.0,2024-03-06 05:10,
果然男生对电子产品没抵抗力,11312.0,2024-03-06 05:10,
这只猫真的非养不可吗,11205.0,2024-03-06 05:10,
王一博世趋排名,10550.0,2024-03-06 05:10,
老公出差抓人老婆在家救人,10504.0,2024-03-06 05:10,
豪士面包 种地吧,10441.0,2024-03-06 05:10,
MiuMiu大秀,10068.0,2024-03-06 05:10,
