name,value,date,Unnamed: 3
日全食,93996.0,2024-04-09 05:13,
朱婷官宣回归中国女排,72640.0,2024-04-09 05:13,
我国首口超5000米深层地热科学探井,13203.0,2024-04-09 05:13,
我们家 没这个条件,70414.0,2024-04-09 05:13,
王一博托姐公开秀恩爱,68468.0,2024-04-09 05:13,
赵丽颖曾推荐刘宇宁演与凤行,57814.0,2024-04-09 05:13,
官方通报女子半截身子卷入扶梯,56642.0,2024-04-09 05:13,
赵露思安妮海瑟薇穿同款皮裙,49256.0,2024-04-09 05:13,
感动中国2023年度人物,19203.0,2024-04-09 05:13,
凌晨4点在深圳海边看银河,40231.0,2024-04-09 05:13,
虐猫考生未被兰州大学录取,101654.0,2024-04-09 05:13,
江西师大男学生虐猫,56240.0,2024-04-09 05:13,
周雨彤 一次醉酒换来一生内向,46392.0,2024-04-09 05:13,
孙坚吐槽奢侈品包质量问题,45913.0,2024-04-09 05:13,
中医建议大家不要盲目的防晒,43453.0,2024-04-09 05:13,
欧阳娜娜奖学金,39654.0,2024-04-09 05:13,
关于女性生殖系统的一些知识,36087.0,2024-04-09 05:13,
俄罗斯远东一地发现放射源,33105.0,2024-04-09 05:13,
庆余年2,31382.0,2024-04-09 05:13,
河南姑娘在四季青做穿版模特月入两万,31103.0,2024-04-09 05:13,
原来林更新粉丝吃这么好,26078.0,2024-04-09 05:13,
cube男经纪人骚扰minnie后续,25655.0,2024-04-09 05:13,
鞠婧祎演技,25057.0,2024-04-09 05:13,
考上研本科延毕了,22718.0,2024-04-09 05:13,
00后开始青睐三无婚礼,22453.0,2024-04-09 05:13,
虐猫考生,22406.0,2024-04-09 05:13,
有苹果15要不要申请贫困生,21789.0,2024-04-09 05:13,
孙亚龙确诊中风,18822.0,2024-04-09 05:13,
王一博演唱会,18805.0,2024-04-09 05:13,
在欧美访了个寂寞中国工程师决定自己搞,15033.0,2024-04-09 05:13,
奥运会资格系列赛开票,18471.0,2024-04-09 05:13,
辞职旅行半年后我的生活翻天覆地,17849.0,2024-04-09 05:13,
王红权星说红了之后被排斥,17519.0,2024-04-09 05:13,
意外吃到了去世10年爷爷种的韭菜,17261.0,2024-04-09 05:13,
杨幂 谍战剧,16735.0,2024-04-09 05:13,
金智媛生图,16638.0,2024-04-09 05:13,
王鹤棣 人夫感,16578.0,2024-04-09 05:13,
外国人可用中国五星卡实名认证游戏,16397.0,2024-04-09 05:13,
金价暴涨房价下跌说明了什么,16311.0,2024-04-09 05:13,
iPhone闹钟正确设置方法,15699.0,2024-04-09 05:13,
时代少年团演唱会快官宣,15239.0,2024-04-09 05:13,
王晰怎么了,15170.0,2024-04-09 05:13,
金莎孙丞潇去韩国了,14011.0,2024-04-09 05:13,
追星也会影响颜值,13988.0,2024-04-09 05:13,
吴磊 文艺片票房,13882.0,2024-04-09 05:13,
为什么抠脚后总是想要闻一下手,13417.0,2024-04-09 05:13,
刘亦菲高定粉裙,13406.0,2024-04-09 05:13,
白羊座新月许愿,13295.0,2024-04-09 05:13,
剑网3,12718.0,2024-04-09 05:13,
不愧是最美的人间四月天,11690.0,2024-04-09 05:13,
