name,value,date,Unnamed: 3
日本地震,56379.0,2024-04-25 05:00,
男孩骑车失误刹车把手插进大腿里,50939.0,2024-04-25 05:00,
万千气象看山西,1810.0,2024-04-25 05:00,
花少第一站破碎的是张翰,46883.0,2024-04-25 05:00,
大麦网已退票退款,38696.0,2024-04-25 05:00,
章子怡 我的职业生涯不必在意,36712.0,2024-04-25 05:00,
这些人工合成水果又出来骗人了,33196.0,2024-04-25 05:00,
以色列,32941.0,2024-04-25 05:00,
金价下跌有人卖了一百多万金条,26425.0,2024-04-25 05:00,
唐家三少宣布停更,32496.0,2024-04-25 05:00,
狗头萝莉自曝找到员工了,57113.0,2024-04-25 05:00,
丁俊晖连续4年世锦赛首轮出局,46413.0,2024-04-25 05:00,
Angelababy狼尾超短发,32818.0,2024-04-25 05:00,
拼多多涉不正当竞争被判赔500万,30385.0,2024-04-25 05:00,
菠菜一定焯水后吃否则或引发肾损伤,28083.0,2024-04-25 05:00,
2000元人参泡酒15年后发芽了,26981.0,2024-04-25 05:00,
深圳现暴雨天给绿植浇水引质疑,24829.0,2024-04-25 05:00,
买长乘短是一种不折不扣的双输,23098.0,2024-04-25 05:00,
秦海璐霸总小说书单,22599.0,2024-04-25 05:00,
春色寄情人,16544.0,2024-04-25 05:00,
男子多次性侵前女友11岁女儿获刑16年,78513.0,2024-04-25 05:00,
田馥甄发微博,58540.0,2024-04-25 05:00,
微信区分单删互删,31624.0,2024-04-25 05:00,
每天1杯柠檬水身体会有何变化,22550.0,2024-04-25 05:00,
男明星的二手东西到底谁在买,22471.0,2024-04-25 05:00,
养7年狗被偷找到时只剩20斤残肢,21216.0,2024-04-25 05:00,
身份证号码中包含X该如何买票,19686.0,2024-04-25 05:00,
身体哪个部位最难瘦下来,19590.0,2024-04-25 05:00,
玲花 维权是你们的权利,16350.0,2024-04-25 05:00,
读研就是在筛选过于较真的人,16298.0,2024-04-25 05:00,
破镜重圆文,16239.0,2024-04-25 05:00,
诛仙陆雪琪鬼厉拔刀相向,15128.0,2024-04-25 05:00,
承欢记大结局,14986.0,2024-04-25 05:00,
生气时身体器官变化全过程,14896.0,2024-04-25 05:00,
被评最美公务员干部被曝曾殴打残疾人,14752.0,2024-04-25 05:00,
周鸿祎问贾跃亭啥时候回国,14528.0,2024-04-25 05:00,
福宝已开始在外场采食,13994.0,2024-04-25 05:00,
深圳暴雨,13861.0,2024-04-25 05:00,
22岁的我不舍得吃20块的外卖,13798.0,2024-04-25 05:00,
摩羯座最需要是自我认可,13627.0,2024-04-25 05:00,
小米回应SU7翼子板脱落原因,13406.0,2024-04-25 05:00,
花芷分手数钱,13075.0,2024-04-25 05:00,
老舅是张若昀的开关,13013.0,2024-04-25 05:00,
秦海璐刘涛 我带你梦想成真,12451.0,2024-04-25 05:00,
用过才知道国货美妆才是细糠,12313.0,2024-04-25 05:00,
赵丽颖林更新缘分开始的地方,12140.0,2024-04-25 05:00,
玲花 换位思考,12073.0,2024-04-25 05:00,
卢昱晓冷艳千金妆,11827.0,2024-04-25 05:00,
花少好友记冷场,11562.0,2024-04-25 05:00,
神超直播,11549.0,2024-04-25 05:00,
