name,value,date,Unnamed: 3
Asen新专辑,111948.0,2024-06-28 05:11,
长期轻断食对身体有什么影响,41738.0,2024-06-28 05:11,
科学报国正当时,5139.0,2024-06-28 05:11,
黄子韬谈经纪人被抓,108094.0,2024-06-28 05:11,
实验犬中98%犬只都是比格犬,38332.0,2024-06-28 05:11,
美国外交官被发现死于基辅一酒店,34592.0,2024-06-28 05:11,
几兄弟能把asen气死,68828.0,2024-06-28 05:11,
杨和苏diss,55282.0,2024-06-28 05:11,
有人领胖东来补偿倒贴300元原地消费,30287.0,2024-06-28 05:11,
女生用16天救被困10米深井小猫,1949.0,2024-06-28 05:11,
2岁女童因尿裤子被打店员大喊报警,65723.0,2024-06-28 05:11,
李尚福被开除党籍,41829.0,2024-06-28 05:11,
大奉打更人,41797.0,2024-06-28 05:11,
哈圈乱成一锅粥了 快趁热喝了,40256.0,2024-06-28 05:11,
徐正溪退圈后状态,37446.0,2024-06-28 05:11,
龚琳娜回应法老diss,34641.0,2024-06-28 05:11,
李尚福涉嫌犯罪问题移送军事检察机关,30521.0,2024-06-28 05:11,
洞鞋的苹果被两个阿姨抓了,29727.0,2024-06-28 05:11,
魏凤和被开除党籍,25208.0,2024-06-28 05:11,
不必要的女士优先到此为止吧,25173.0,2024-06-28 05:11,
于正说王楚然是上戏表演系本科,50970.0,2024-06-28 05:11,
歌手迎首位国际冲榜歌手,32193.0,2024-06-28 05:11,
女生多吃这种水果可以瘦肚子,25708.0,2024-06-28 05:11,
乘风,24977.0,2024-06-28 05:11,
digi大战活死人,21344.0,2024-06-28 05:11,
土狗,20888.0,2024-06-28 05:11,
女孩高考查分前车祸至今昏迷不醒,20864.0,2024-06-28 05:11,
儿子查分被爸爸一句谢谢我媳妇整破防,20273.0,2024-06-28 05:11,
拼团买猫粮还没收到平台已确认收货,20009.0,2024-06-28 05:11,
玲子怀孕,19950.0,2024-06-28 05:11,
肖战陈情令在日本有多火,19501.0,2024-06-28 05:11,
饭后出现4个症状可能是胆囊炎,19073.0,2024-06-28 05:11,
张小斐方便脱个外套吗,18176.0,2024-06-28 05:11,
中国女子日本街头骑电动行李箱被罚,18138.0,2024-06-28 05:11,
约会后像被遗弃的感觉,17860.0,2024-06-28 05:11,
京城大师赛,16884.0,2024-06-28 05:11,
为什么有些人坚持健身反而更显老,16500.0,2024-06-28 05:11,
没有一个秀人能活着走出这段,16268.0,2024-06-28 05:11,
李飞说TFBOYS有运气成分在,16157.0,2024-06-28 05:11,
歌手 想一出是一出,16090.0,2024-06-28 05:11,
中国共产党的政治智慧,16031.0,2024-06-28 05:11,
为什么通勤时间全都是算个人的,15877.0,2024-06-28 05:11,
墨雨云间导演三次婉拒王星越吻戏,15471.0,2024-06-28 05:11,
女子裸辞35万年薪工作回村专职带娃,14926.0,2024-06-28 05:11,
李海仁发声,14282.0,2024-06-28 05:11,
张婧仪皱眉也好漂亮,13587.0,2024-06-28 05:11,
7折保时捷5折BBA,13569.0,2024-06-28 05:11,
新秀diss已写好,13515.0,2024-06-28 05:11,
梅雨季一次性内裤成了南方人刚需,13330.0,2024-06-28 05:11,
汛期科学避险自救指南,13127.0,2024-06-28 05:11,
