name,value,date,Unnamed: 3
成都迪士尼被限流,79430.0,2024-04-07 05:14,
爱奇艺2024首部破万剧,53109.0,2024-04-07 05:14,
一起打卡春天里的中国,9852.0,2024-04-07 05:14,
赵奕欢被李菲儿逼哭,43937.0,2024-04-07 05:14,
某幻不直播,40808.0,2024-04-07 05:14,
淄博小哥让人心疼价目表让人心动,38314.0,2024-04-07 05:14,
王珂出道吧,37604.0,2024-04-07 05:14,
林更新回应和赵丽颖三搭,37597.0,2024-04-07 05:14,
福宝,21084.0,2024-04-07 05:14,
长期戴耳塞睡觉的人最后怎么样了,33968.0,2024-04-07 05:14,
日本天皇独生女成为月薪7千的打工人,80826.0,2024-04-07 05:14,
男子上厕所隐私部位被割伤缝20多针,57639.0,2024-04-07 05:14,
王铮亮录制6期被抓5次,57359.0,2024-04-07 05:14,
你敢不敢去摸一下那只两脚兽,34578.0,2024-04-07 05:14,
字字不提钱句句都是钱,33922.0,2024-04-07 05:14,
林狗你是真的火了,33140.0,2024-04-07 05:14,
三代日本皇室女性都曾患上心理疾病,32808.0,2024-04-07 05:14,
丁程鑫泼水误伤了何炅,28705.0,2024-04-07 05:14,
吴镇宇说张睿就一辈子演古装了,28195.0,2024-04-07 05:14,
成都迪士尼,21511.0,2024-04-07 05:14,
为什么现在退房都不检查了,47867.0,2024-04-07 05:14,
林更新周冬雨军服旧照,25062.0,2024-04-07 05:14,
体制内开会为什么不能喝奶茶,24454.0,2024-04-07 05:14,
谢帝 诺米,23256.0,2024-04-07 05:14,
这4种食物是尿毒症的加速器,21365.0,2024-04-07 05:14,
吵了一辈子的爸妈在晚年爱上彼此,20479.0,2024-04-07 05:14,
沈璃在爱里生出了神性,20344.0,2024-04-07 05:14,
新疆17岁小伙要追赶苏炳添,19773.0,2024-04-07 05:14,
于正说赵晴替他一雪前耻,19572.0,2024-04-07 05:14,
将门毒后请肖战迪丽热巴会爆吗,19385.0,2024-04-07 05:14,
松本润近照,18718.0,2024-04-07 05:14,
李沁写给沈近真的第九封信,17904.0,2024-04-07 05:14,
周杰伦长沙演唱会将实名入场,17093.0,2024-04-07 05:14,
兰大回应虐猫考生进调剂名单,16506.0,2024-04-07 05:14,
爷爷上坟比年轻人走的快,16166.0,2024-04-07 05:14,
陈奕迅南京场观众,17037.0,2024-04-07 05:14,
创造营亚洲,16903.0,2024-04-07 05:14,
Doinb回应复播,15765.0,2024-04-07 05:14,
花莲地震已致12人死亡1123人受伤,14568.0,2024-04-07 05:14,
上海饮料分级,13906.0,2024-04-07 05:14,
锦超演的傅卫军,16561.0,2024-04-07 05:14,
十个勤天上hi6,16248.0,2024-04-07 05:14,
电视剧品质盛典,14644.0,2024-04-07 05:14,
薛之谦天外来物巡回演唱会,14583.0,2024-04-07 05:14,
千万不要买樱花味食物,14467.0,2024-04-07 05:14,
眼泪女王男二,14332.0,2024-04-07 05:14,
小鬼朱正廷王子异直播,14329.0,2024-04-07 05:14,
BOA锁定第三轮A组,14053.0,2024-04-07 05:14,
男孩做阑尾切除术5年后阑尾还在,12234.0,2024-04-07 05:14,
海登海姆vs拜仁,10815.0,2024-04-07 05:14,
