name,value,date,Unnamed: 3
00后新警认出嫌疑人后嘴角上扬,85860.0,2024-03-04 05:07,
亚洲首富之子减肥108公斤后又胖回来了,56312.0,2024-03-04 05:07,
两会你我他,8549.0,2024-03-04 05:07,
姜爷爷宋爷爷哭成泪人,45275.0,2024-03-04 05:07,
十年前种下的种子真的能开出花,43419.0,2024-03-04 05:07,
向佐曾闭关练功七年不看手机,42704.0,2024-03-04 05:07,
当年爱情公寓第二季的官方设定,34113.0,2024-03-04 05:07,
怀疑对方AI换脸可以让对方摁鼻子,31105.0,2024-03-04 05:07,
怪不得没见过云南籍清冷学霸,25565.0,2024-03-04 05:07,
台湾海巡艇被目击与大陆海警船并行,18821.0,2024-03-04 05:07,
西班牙女演员在印度遭7人施暴,59068.0,2024-03-04 05:07,
秦昊帮伊能静拿到了霉霉演唱会门票,49297.0,2024-03-04 05:07,
硕士学历二胎宝妈投84份简历面试为0,34226.0,2024-03-04 05:07,
王楚钦橱窗,29431.0,2024-03-04 05:07,
女子买茅台验真伪被死亡威胁,27670.0,2024-03-04 05:07,
DYG教练 跑路,26091.0,2024-03-04 05:07,
顾寻 我是校草,23290.0,2024-03-04 05:07,
多少好友用过HIV预防阻断2小时达,19530.0,2024-03-04 05:07,
孙千和PP合照,16177.0,2024-03-04 05:07,
曼城vs曼联,15730.0,2024-03-04 05:07,
经常午睡比从来不午睡更健康吗,32865.0,2024-03-04 05:07,
包包被外国友人扔出地铁全车人欢呼,21595.0,2024-03-04 05:07,
唐探2 那可是杨谨华诶,15521.0,2024-03-04 05:07,
发现耳朵边上有个小孔,15477.0,2024-03-04 05:07,
这一抱硬控我10秒,14358.0,2024-03-04 05:07,
成毅白发造型,14013.0,2024-03-04 05:07,
王鹤棣出发录桃花坞4,13464.0,2024-03-04 05:07,
吴艳妮2024首秀8秒12,13051.0,2024-03-04 05:07,
尹子维新片尺度,13046.0,2024-03-04 05:07,
航拍广西海底第一眼以为是龙鳞,12361.0,2024-03-04 05:07,
代表建议将个税起征点提至1万元,14680.0,2024-03-04 05:07,
当地产大亨的土耳其外公有了中国小外孙,13361.0,2024-03-04 05:07,
别对我动心,12763.0,2024-03-04 05:07,
台湾著名的回春汤,12532.0,2024-03-04 05:07,
周处除三害,12322.0,2024-03-04 05:07,
当上菜的速度赶不上吃饭的速度时,12012.0,2024-03-04 05:07,
女儿第一次来例假妈妈哭了,11792.0,2024-03-04 05:07,
王鹤棣勇闯说唱圈,11720.0,2024-03-04 05:07,
汤唯去看了IU演唱会,11612.0,2024-03-04 05:07,
周笔畅巴黎时装周造型,11440.0,2024-03-04 05:07,
陈卓璇的古装,11114.0,2024-03-04 05:07,
南京鸡鸣寺的樱花消息树开了,10991.0,2024-03-04 05:07,
绿色穿搭真的让人眼前一亮,10883.0,2024-03-04 05:07,
阮经天40岁状态,10769.0,2024-03-04 05:07,
那不勒斯vs尤文图斯,10253.0,2024-03-04 05:07,
沈星回 你教教我,9971.0,2024-03-04 05:07,
周也嘴巴哭成typec,9913.0,2024-03-04 05:07,
和不内耗的朋友出去玩,9769.0,2024-03-04 05:07,
胡先煦背影,9395.0,2024-03-04 05:07,
提笔忘字开口忘词其实是一种脑病,9291.0,2024-03-04 05:07,
