name,value,date,Unnamed: 3
孩子玩手机把导航从回江西换到福建,90679.0,2024-02-05 05:05,
合肥南站D4832列车晚点744分钟,70363.0,2024-02-05 05:05,
真实暧昧又尴尬,63276.0,2024-02-05 05:05,
吃完头孢7天内不能喝酒,61731.0,2024-02-05 05:05,
为什么只有中国医生擅长取鱼刺,59103.0,2024-02-05 05:05,
湖北暴雪,56868.0,2024-02-05 05:05,
女子买刮刮乐兑奖却被撕彩票,56554.0,2024-02-05 05:05,
五十度暴雪,43200.0,2024-02-05 05:05,
91岁奶奶找回了失散55年的心肝宝贝,39050.0,2024-02-05 05:05,
香港特区政府回应梅西缺战,36780.0,2024-02-05 05:05,
王海测评希望董宇辉弯腰道歉,36879.0,2024-02-05 05:05,
睡觉吧 你俩过几天就成了,36207.0,2024-02-05 05:05,
蓝盈莹否认整容,35682.0,2024-02-05 05:05,
福建高速发生交通事故7人死亡,33603.0,2024-02-05 05:05,
辛芷蕾就想吃颗毛豆她有什么错,33375.0,2024-02-05 05:05,
十个勤天用的什么散粉,27874.0,2024-02-05 05:05,
恋与深空,24957.0,2024-02-05 05:05,
安琪拉大招 水龙头,24817.0,2024-02-05 05:05,
本周狗屎运最旺的星座,23391.0,2024-02-05 05:05,
格莱美,22817.0,2024-02-05 05:05,
看小说时真的会有生理反应,37837.0,2024-02-05 05:05,
初代网红奶茶倒闭潮,34269.0,2024-02-05 05:05,
元气森林创始人称要向华为学习,24884.0,2024-02-05 05:05,
已读不回就是绝杀,23911.0,2024-02-05 05:05,
iPhone年收入首次占智能手机市场50%,22886.0,2024-02-05 05:05,
港府称对梅西没出场比赛极度失望,21813.0,2024-02-05 05:05,
小狗金子,20922.0,2024-02-05 05:05,
一吃火锅就拉肚子正常吗,19963.0,2024-02-05 05:05,
人真的会一夜白头,19544.0,2024-02-05 05:05,
武汉高铁,19151.0,2024-02-05 05:05,
杨波朋友圈,56262.0,2024-02-05 05:05,
因暴雪滞留高速亲历者发声,30422.0,2024-02-05 05:05,
杨千嬅快把冷门歌唱热了,19114.0,2024-02-05 05:05,
杨波报平安,29670.0,2024-02-05 05:05,
刘亦菲初中时期旧照,18918.0,2024-02-05 05:05,
深圳一工人清洗外墙掉下8楼,17816.0,2024-02-05 05:05,
网友自曝被举报作弊取消考研政治成绩,17663.0,2024-02-05 05:05,
王者荣耀龙限皮肤,17293.0,2024-02-05 05:05,
打扫卫生翻到了老公私房钱该怎么处理,16797.0,2024-02-05 05:05,
官方通报体彩店员撕毁中奖彩票,16648.0,2024-02-05 05:05,
美国驻华大使打卡冰雪大世界,15150.0,2024-02-05 05:05,
杨鸣 辽宁男篮,15071.0,2024-02-05 05:05,
李雪琴质疑苏醒理解苏醒超越苏醒,14888.0,2024-02-05 05:05,
方媛工作变多的原因,14593.0,2024-02-05 05:05,
画卧蚕无法修饰长中庭,14163.0,2024-02-05 05:05,
南航,13799.0,2024-02-05 05:05,
狗剩快跑,13444.0,2024-02-05 05:05,
李亚鹏和妻女同框拍短片,13427.0,2024-02-05 05:05,
山下智久龟梨和也双人直播,13358.0,2024-02-05 05:05,
Xiaohu偷家RNG,12938.0,2024-02-05 05:05,
