name,value,date,Unnamed: 3
年轻人凌晨三点在迪士尼排长队,131005.0,2024-07-04 05:17,
野孩子 撤档,101570.0,2024-07-04 05:17,
哈萨克斯坦小女孩和康辉聊天好丝滑,1531.0,2024-07-04 05:17,
杜海涛曾为保护素人叫停节目,48104.0,2024-07-04 05:17,
中金称网传员工跳楼系谣言,38727.0,2024-07-04 05:17,
日本男子新加坡性侵女学生被判鞭刑,30528.0,2024-07-04 05:17,
后来赵霁活成了宛瑜的样子,33072.0,2024-07-04 05:17,
野孩子声明,31780.0,2024-07-04 05:17,
女子吃1斤见手青后看见一屋人,29830.0,2024-07-04 05:17,
神十八乘组第2次出舱圆满完成,21435.0,2024-07-04 05:17,
杜海涛 沈梦辰,74391.0,2024-07-04 05:17,
医院通报医生传播患者麻醉裸照,69751.0,2024-07-04 05:17,
北大博导否认地铁收徒看书小孩哥,55938.0,2024-07-04 05:17,
西宁通报2名15岁学生先后因病离世,50867.0,2024-07-04 05:17,
李泽锋站姐拍出了阿如那的善良,42839.0,2024-07-04 05:17,
日本一百余人骨坑被指与731部队有关,28446.0,2024-07-04 05:17,
宁静 花少,26749.0,2024-07-04 05:17,
小鬼工作室维权声明,24949.0,2024-07-04 05:17,
银河证券回应员工跳楼传闻,23745.0,2024-07-04 05:17,
合肥之心城,20885.0,2024-07-04 05:17,
坚持裸睡1年身体会有什么变化,51526.0,2024-07-04 05:17,
失眠是因为身体缺少维生素,47814.0,2024-07-04 05:17,
西交大回应校领导与学生不正当关系,38132.0,2024-07-04 05:17,
印度男女偷情被当众处私刑,26503.0,2024-07-04 05:17,
网友偶遇张亮儿子张天天,21708.0,2024-07-04 05:17,
谢霆锋听到粉丝说王菲的反应,20531.0,2024-07-04 05:17,
子女的心寒是父母站在对立面,20358.0,2024-07-04 05:17,
原来点外卖看太多次地图骑手知道的,19074.0,2024-07-04 05:17,
气血不足的人夏天是真难受,18858.0,2024-07-04 05:17,
不要让服务员用你手机写评价,18765.0,2024-07-04 05:17,
突然发现了我妈是先天留子圣体,19370.0,2024-07-04 05:17,
断崖式离职比断崖式分手还可怕,18125.0,2024-07-04 05:17,
含牛奶的茶饮竟然是C级,17978.0,2024-07-04 05:17,
于正回应赵晴AI换脸,17325.0,2024-07-04 05:17,
张志杰之殇折射羽毛球赛程过密,16465.0,2024-07-04 05:17,
肾虚不虚看这5个地方就知道,16278.0,2024-07-04 05:17,
外国女子突发疾病还好遇上中国医生,1536.0,2024-07-04 05:17,
郑州文旅回应涉林俊杰演唱会争议内容,16240.0,2024-07-04 05:17,
网曝一公司用关小黑屋方式劝退员工,16190.0,2024-07-04 05:17,
边伯贤solo出道五周年,16128.0,2024-07-04 05:17,
不建议大家离职的几个月份,15294.0,2024-07-04 05:17,
唐尚珺今年高考志愿全部服从调剂,14837.0,2024-07-04 05:17,
中餐厅8合伙人阵容官宣,14687.0,2024-07-04 05:17,
李沁深V高定,14492.0,2024-07-04 05:17,
原神KFC联动偷跑,14447.0,2024-07-04 05:17,
在毕业典礼上被求婚了,14318.0,2024-07-04 05:17,
这竟然是刘昊然,13463.0,2024-07-04 05:17,
林俊杰演唱会,13393.0,2024-07-04 05:17,
李雪琴 游泳证,13382.0,2024-07-04 05:17,
Uzi谈自己名人堂皮肤,13306.0,2024-07-04 05:17,
