name,value,date,Unnamed: 3
14岁男孩当伴郎遇班主任伴娘,58579.0,2024-05-05 05:08,
用户借胖猫事件煽动性别对立等被处置,55475.0,2024-05-05 05:08,
文化中国行我写家乡,2128.0,2024-05-05 05:08,
90后自媒体创业2天入账74万,54597.0,2024-05-05 05:08,
广东139个暴雨预警生效中,48558.0,2024-05-05 05:08,
为什么日本人门前爱放整排矿泉水瓶,44073.0,2024-05-05 05:08,
华晨宇唱15分钟把太阳唱出来,39857.0,2024-05-05 05:08,
雷军回应不建议给年轻人太多建议,33717.0,2024-05-05 05:08,
卵巢过快衰老的几个信号,32637.0,2024-05-05 05:08,
薛之谦一眼认出演果果的小女孩,32113.0,2024-05-05 05:08,
香飘飘回应讽日事件,80169.0,2024-05-05 05:08,
香飘飘,48519.0,2024-05-05 05:08,
潘玮柏演唱会大屏上的一家三口,37187.0,2024-05-05 05:08,
网友曾在泰妍家住宿,34166.0,2024-05-05 05:08,
乃万橘发,30491.0,2024-05-05 05:08,
国铁集团回应高铁票价将上涨,29927.0,2024-05-05 05:08,
歌手2024,26285.0,2024-05-05 05:08,
陕西一男子花62元买彩票中1.48亿元,25847.0,2024-05-05 05:08,
纪凌尘换发型了,25266.0,2024-05-05 05:08,
金价,22653.0,2024-05-05 05:08,
加拿大一家3男捐精捐出超600个娃,83934.0,2024-05-05 05:08,
张碧晨演我不愿意早起,36662.0,2024-05-05 05:08,
晚上比早晨重3斤是减重失败了吗,36662.0,2024-05-05 05:08,
你那坨肉根本就不是副乳,31036.0,2024-05-05 05:08,
俄媒称俄内务部决定通缉泽连斯基,22482.0,2024-05-05 05:08,
8岁女孩从300度近视变成400度远视,22186.0,2024-05-05 05:08,
向佐怎么瘦成这样了,20669.0,2024-05-05 05:08,
林俊杰唱了一生的爱,20239.0,2024-05-05 05:08,
邓超问孙俪能回家了吗,20013.0,2024-05-05 05:08,
施一公谈大学生用ChatGPT,17135.0,2024-05-05 05:08,
金价跌至近一个月低点,20004.0,2024-05-05 05:08,
男朋友想一个人去旅游该阻止吗,19021.0,2024-05-05 05:08,
男朋友开车来接我说要我平摊油费,18959.0,2024-05-05 05:08,
第五人格发布会,18423.0,2024-05-05 05:08,
布拉德皮特60岁状态,17656.0,2024-05-05 05:08,
从鹈鹕嘴里掏出被吞的鸭子同事,17623.0,2024-05-05 05:08,
李帝努脱了,17283.0,2024-05-05 05:08,
95后小伙洗鞋月入4万,16691.0,2024-05-05 05:08,
张杰青年节唱少年中国说,15560.0,2024-05-05 05:08,
眼泪女王特辑,15473.0,2024-05-05 05:08,
张真源绿海,15222.0,2024-05-05 05:08,
凤凰传奇 开蹦,15137.0,2024-05-05 05:08,
孙千央视五四晚会造型,14646.0,2024-05-05 05:08,
五月天香港,14256.0,2024-05-05 05:08,
逐花归海首秀首胜,13878.0,2024-05-05 05:08,
金希澈韩庚合照,13503.0,2024-05-05 05:08,
时代少年团演唱会直播,13424.0,2024-05-05 05:08,
十个勤天五四晚会舞台,13163.0,2024-05-05 05:08,
云南凤凰花盛放似热情火焰,12619.0,2024-05-05 05:08,
蔡依林泉州演唱会,12596.0,2024-05-05 05:08,
