name,value,date,Unnamed: 3
警方通报胖猫与谭某经济往来情况,246619.0,2024-05-20 05:00,
载有伊朗总统的直升机硬着陆,170470.0,2024-05-20 05:00,
行走美丽中国,1853.0,2024-05-20 05:00,
胖猫通报里的三个关键点,185171.0,2024-05-20 05:00,
庆余年2第九集封神,49102.0,2024-05-20 05:00,
突然发现六月只要上19天班,46801.0,2024-05-20 05:00,
黄家驹墓碑被毁歌迷扫墓痛哭,40830.0,2024-05-20 05:00,
外媒评关晓彤戛纳最佳造型,39383.0,2024-05-20 05:00,
狐妖小红娘月红篇,32419.0,2024-05-20 05:00,
父亲怕41岁女儿迷路手绘回家地图,7011.0,2024-05-20 05:00,
胖猫姐姐刘某操控舆论,171909.0,2024-05-20 05:00,
日本女子挺9个月孕肚为老公准备30天量晚饭,49844.0,2024-05-20 05:00,
戴珍珠耳环的少女 意外的颜料,44500.0,2024-05-20 05:00,
GEN夺冠,29703.0,2024-05-20 05:00,
王俊凯蔡依林五年后再唱心引力,27214.0,2024-05-20 05:00,
本周狗屎运最旺的星座,26131.0,2024-05-20 05:00,
张艺兴亮相戛纳红毯,26105.0,2024-05-20 05:00,
曼城夺得英超冠军,25879.0,2024-05-20 05:00,
曼城英超四连冠,22880.0,2024-05-20 05:00,
王俊凯蔡依林同台,24943.0,2024-05-20 05:00,
警方通报胖猫事件,95595.0,2024-05-20 05:00,
谭某未以恋爱为名骗取胖猫财物,83175.0,2024-05-20 05:00,
比流量更重要的是真相,50352.0,2024-05-20 05:00,
庆余年2,22599.0,2024-05-20 05:00,
频繁聊天真的会产生爱的错觉吗,21319.0,2024-05-20 05:00,
网红130万整形嘴弯眼斜,21266.0,2024-05-20 05:00,
龚俊首次执导女主是麦迪娜,20075.0,2024-05-20 05:00,
减肥期间正确称体重的方法,19957.0,2024-05-20 05:00,
连云港鬼秤事件5人被行拘,19153.0,2024-05-20 05:00,
许凯 金刚芭比,18411.0,2024-05-20 05:00,
朴志效说队内都是商业关系,17788.0,2024-05-20 05:00,
考研失败却过上更好的生活,17410.0,2024-05-20 05:00,
英超,17228.0,2024-05-20 05:00,
小狗偷吃被流浪猫追着打,17073.0,2024-05-20 05:00,
阿森纳vs埃弗顿,16911.0,2024-05-20 05:00,
邓子越演得真好,16530.0,2024-05-20 05:00,
seventeen演唱会,16425.0,2024-05-20 05:00,
曼城vs西汉姆联,16264.0,2024-05-20 05:00,
奔跑吧全员现身周深演唱会,16194.0,2024-05-20 05:00,
蔡依林问王俊凯的理想型,15677.0,2024-05-20 05:00,
从今以后我就是你的靠山,15445.0,2024-05-20 05:00,
蒲熠星南大,15423.0,2024-05-20 05:00,
五年了 还得是张若昀,15166.0,2024-05-20 05:00,
英雄联盟名人堂,15082.0,2024-05-20 05:00,
利物浦vs狼队,14664.0,2024-05-20 05:00,
GEN对战BLG,14553.0,2024-05-20 05:00,
陈丽君急性肠胃炎晕倒,14355.0,2024-05-20 05:00,
减肥必备的万能减脂餐,13634.0,2024-05-20 05:00,
Bin说MSI不是结尾,12938.0,2024-05-20 05:00,
BLG可惜,12630.0,2024-05-20 05:00,
