name,value,date,Unnamed: 3
男子试驾劳斯莱斯获销售鼓励打动网友,70639.0,2024-04-08 05:04,
第一批去埃及旅行的人快被骗到裸奔了,50404.0,2024-04-08 05:04,
文旅消费如何从开门红走向长红,10237.0,2024-04-08 05:04,
个人房贷规模大幅缩水,44660.0,2024-04-08 05:04,
河南某高校副科长被举报聚众淫乱,41778.0,2024-04-08 05:04,
租房吃过最大的苦是跟情侣合租,40352.0,2024-04-08 05:04,
追她呀 她旺你,36267.0,2024-04-08 05:04,
女性的小肚子是为了保护子宫卵巢,34721.0,2024-04-08 05:04,
大哥远 停播,34282.0,2024-04-08 05:04,
9.9元咖啡为何会消失,34192.0,2024-04-08 05:04,
陈学冬 不会退圈死心吧,38242.0,2024-04-08 05:04,
与凤行结局吻戏是加的,28548.0,2024-04-08 05:04,
应采儿说Jasper是脏儿子,28016.0,2024-04-08 05:04,
肖战早期与素人合照,25088.0,2024-04-08 05:04,
小米定金事件暴露了成年人的耍赖心态,23579.0,2024-04-08 05:04,
女生考研被拟录取室友偷偷送惊喜,21634.0,2024-04-08 05:04,
TES零封JDG,20868.0,2024-04-08 05:04,
眼泪女王,20840.0,2024-04-08 05:04,
沈图南入党,19957.0,2024-04-08 05:04,
以色列大规模撤军,19375.0,2024-04-08 05:04,
我倒要看看25年元旦会怎么调休,50408.0,2024-04-08 05:04,
这样睡觉大大增加糖尿病风险,30244.0,2024-04-08 05:04,
90后准新娘婚前立遗嘱遗产归父母,26383.0,2024-04-08 05:04,
与父母同居20天他们终于不再催婚,26370.0,2024-04-08 05:04,
佟丽娅带儿子在阿那亚度假,23241.0,2024-04-08 05:04,
中医建议女生春天多披头散发,19376.0,2024-04-08 05:04,
你睡得最晚的一次是在干什么,19096.0,2024-04-08 05:04,
钻戒市场开始背叛爱情了,17815.0,2024-04-08 05:04,
追风者 十送红军,17379.0,2024-04-08 05:04,
代号鸢,16778.0,2024-04-08 05:04,
仝卓,116015.0,2024-04-08 05:04,
曼联vs利物浦,16612.0,2024-04-08 05:04,
被路人狂撸的小狗狗,15954.0,2024-04-08 05:04,
去世的妈坐牢的爸破碎的他,15821.0,2024-04-08 05:04,
那些熬过的夜再也补不回来了,15730.0,2024-04-08 05:04,
仝卓工作室公开讨债,31053.0,2024-04-08 05:04,
沈璃有魑魅印记,15700.0,2024-04-08 05:04,
you know m3,15090.0,2024-04-08 05:04,
林更新谭松韵请叫我总监旧照,15004.0,2024-04-08 05:04,
王阳 叔圈天菜,14972.0,2024-04-08 05:04,
23岁没谈过恋爱正常吗,14783.0,2024-04-08 05:04,
金价还在涨超市上架金条遭疯抢,14717.0,2024-04-08 05:04,
赵露思厚刘海旧照,14556.0,2024-04-08 05:04,
眼泪女王第十集,14367.0,2024-04-08 05:04,
下班以后最轻松的副业,14311.0,2024-04-08 05:04,
今年唯一一次日全食即将上演,14197.0,2024-04-08 05:04,
谢帝,13243.0,2024-04-08 05:04,
苹果下月或推出新款iPadPro,13233.0,2024-04-08 05:04,
追风者,12278.0,2024-04-08 05:04,
卖菜嬢嬢怕弄脏地铁专门准备新背篓,11700.0,2024-04-08 05:04,
