name,value,date,Unnamed: 3
金价持续暴涨建行紧急公告,1565593.0,2024-03-07 23:07,
妇女节放假是法定的半天节假日,596695.0,2024-03-07 23:07,
10个关键字看2024政府工作任务,46924.0,2024-03-07 23:07,
轻舟已过万重山,514363.0,2024-03-07 23:07,
建议加强对女性心血管疾病的筛查监测,61110.0,2024-03-07 23:07,
其实妈妈把你养得很好,374197.0,2024-03-07 23:07,
正确称体重的方法,320517.0,2024-03-07 23:07,
唐探2这一集演的是萝莉岛吧,263184.0,2024-03-07 23:07,
胡先煦晒花少团打call视频,245526.0,2024-03-07 23:07,
政协委员谈国潮新中式成顶流,42026.0,2024-03-07 23:07,
向佐评论李蠕蠕,1212870.0,2024-03-07 23:07,
男子上班浏览色情网站被开除辩称电脑中毒,1032076.0,2024-03-07 23:07,
看见不认识的字不要随便拍照,601210.0,2024-03-07 23:07,
韩国一个苹果约15元,500670.0,2024-03-07 23:07,
陈乔恩捐赠20吨狗粮,337991.0,2024-03-07 23:07,
姚安娜新片路透,288700.0,2024-03-07 23:07,
香奈儿内场座位图,272204.0,2024-03-07 23:07,
唐斯半月板撕裂,258339.0,2024-03-07 23:07,
山河四省高中生的十六岁,245106.0,2024-03-07 23:07,
拿米哈游画师作品去米哈游投简历,216295.0,2024-03-07 23:07,
研0喊了导师一晚上老鼠,655168.0,2024-03-07 23:07,
为啥体制内女性找对象越来越难,623165.0,2024-03-07 23:07,
真的是要开始存钱了,219979.0,2024-03-07 23:07,
翟欣欣涉嫌敲诈勒索案已移送法院,212570.0,2024-03-07 23:07,
金牛座很有自己的主见,199795.0,2024-03-07 23:07,
白鹿直播,181793.0,2024-03-07 23:07,
王一博造型亮点贝雷帽,179518.0,2024-03-07 23:07,
周也晒美甲,175846.0,2024-03-07 23:07,
双色球,170294.0,2024-03-07 23:07,
永安梦 高门贵女和寒门学子,166931.0,2024-03-07 23:07,
这个户型简直是我的理想型,272070.0,2024-03-07 23:07,
周琦 担架,172252.0,2024-03-07 23:07,
网剧别对我动心,166537.0,2024-03-07 23:07,
大哥远 封了一天,161453.0,2024-03-07 23:07,
黑执事 审美降级,159571.0,2024-03-07 23:07,
孩子一年级被劝退该怎么办,153655.0,2024-03-07 23:07,
小S因公公去世停工一周,486053.0,2024-03-07 23:07,
时代少年团接力女团舞,146799.0,2024-03-07 23:07,
用壶铃一个月瘦了十斤,146140.0,2024-03-07 23:07,
WBG赢了,143886.0,2024-03-07 23:07,
春天防晒是智商税吗,143777.0,2024-03-07 23:07,
需要什么病例才能和你一起玩,139649.0,2024-03-07 23:07,
白鹿柔美月光妆,137494.0,2024-03-07 23:07,
回南天的布偶猫,136706.0,2024-03-07 23:07,
小小年纪就成了养殖大户,127806.0,2024-03-07 23:07,
孙千 容貌焦虑,123049.0,2024-03-07 23:07,
王一博回应回复字数,122581.0,2024-03-07 23:07,
RitaCOS索拉卡,117966.0,2024-03-07 23:07,
檀健次回应格子哥称号,117879.0,2024-03-07 23:07,
人生只有一次所以我们要享受现在,116857.0,2024-03-07 23:07,
