name,value,date,Unnamed: 3
尚雯婕冠军,1506448.0,2024-06-24 23:17,
韩方通报遇难中国公民增至19人,940234.0,2024-06-24 23:17,
收下这份暴雨天避险自救指南,63013.0,2024-06-24 23:17,
杜江霍思燕收养实验犬,1952974.0,2024-06-24 23:17,
唐尚珺高考成绩,878854.0,2024-06-24 23:17,
到底啥是city不city啊,753002.0,2024-06-24 23:17,
韩雪 难听,669068.0,2024-06-24 23:17,
靳梦佳救场,532013.0,2024-06-24 23:17,
韩方向中方表示哀悼,457807.0,2024-06-24 23:17,
浙江女孩锁定巴黎奥运会霹雳舞资格,22217.0,2024-06-24 23:17,
女子与男友发生关系后诬告对方强奸,1033089.0,2024-06-24 23:17,
林一回应和刘亦菲合作,452189.0,2024-06-24 23:17,
江苏高考689分及以上107人,428917.0,2024-06-24 23:17,
酒桌上发出5.2万红包后悔了能要回吗,402719.0,2024-06-24 23:17,
刘震云微观说河南人,13684.0,2024-06-24 23:17,
长沙1小时下了54个西湖,371994.0,2024-06-24 23:17,
A股大跌,353550.0,2024-06-24 23:17,
终于有了一部全女主的剧,352208.0,2024-06-24 23:17,
陈昊宇发言,349044.0,2024-06-24 23:17,
中方对波兰公民实施15日单方面免签,203183.0,2024-06-24 23:17,
榴莲的叶酸含量是苹果的30倍,458956.0,2024-06-24 23:17,
轻断食五天瘦了11斤,417445.0,2024-06-24 23:17,
月薪四千开始从孩子身上降本增效,301989.0,2024-06-24 23:17,
金智秀巴黎大秀造型,289849.0,2024-06-24 23:17,
唐治平疑似精神失常,270773.0,2024-06-24 23:17,
都投了尚雯婕,236329.0,2024-06-24 23:17,
刘烨主持,220456.0,2024-06-24 23:17,
EXO成员去了张艺兴演唱会,219945.0,2024-06-24 23:17,
长相思2定档,219158.0,2024-06-24 23:17,
网传荣梓杉高考成绩417分,196997.0,2024-06-24 23:17,
陈丽君 投票,196908.0,2024-06-24 23:17,
刘亦菲喝了黄玫瑰拿铁,192860.0,2024-06-24 23:17,
白夜追凶2过审了,190493.0,2024-06-24 23:17,
保时捷降价了,174534.0,2024-06-24 23:17,
女性一生中月经的次数变化,166691.0,2024-06-24 23:17,
大奉打更人,188007.0,2024-06-24 23:17,
李晋晔哽咽回应歌手争议,176076.0,2024-06-24 23:17,
橘子洲被淹一半是假的,152730.0,2024-06-24 23:17,
大四女生退学后复读5个月考641分,151611.0,2024-06-24 23:17,
痛经越来越疼要小心巧克力囊肿,150080.0,2024-06-24 23:17,
王星越一把抱起了前夫哥,174827.0,2024-06-24 23:17,
某韩国男星性侵18岁女学生,169163.0,2024-06-24 23:17,
李梦衣品,150238.0,2024-06-24 23:17,
林一沈月出电梯偷感很重,147806.0,2024-06-24 23:17,
萨顶顶回应去歌手,144955.0,2024-06-24 23:17,
辉子失误,143755.0,2024-06-24 23:17,
隔夜西瓜吃前需切掉1厘米,142287.0,2024-06-24 23:17,
桐岛爱,116041.0,2024-06-24 23:17,
为何前列腺癌一发现就是晚期,114977.0,2024-06-24 23:17,
江苏2024年高考一分一段表,105842.0,2024-06-24 23:17,
