name,value,date,Unnamed: 3
满屏都是唐艺昕,1093162.0,2024-05-28 23:13,
官方回应福宝颈部断毛,785095.0,2024-05-28 23:13,
浩瀚太空再一次留下中国足迹,79570.0,2024-05-28 23:13,
前员工称王妈塌房是意料之中,825812.0,2024-05-28 23:13,
以色列拟认定联合国机构为恐怖组织,606976.0,2024-05-28 23:13,
比亚迪,518645.0,2024-05-28 23:13,
鹿晗小英打牛,480587.0,2024-05-28 23:13,
长公主二皇子顶疯相见,456527.0,2024-05-28 23:13,
上海离婚预约爆满与楼市新政无关,422058.0,2024-05-28 23:13,
老师替你尝了树上樱桃不好吃,66531.0,2024-05-28 23:13,
第一批丁克开始操心养老,1942562.0,2024-05-28 23:13,
李沁的头冠是3D打印的,451394.0,2024-05-28 23:13,
一猩60万,379649.0,2024-05-28 23:13,
邱贻可邮票,355290.0,2024-05-28 23:13,
陈晓光头走红毯,353800.0,2024-05-28 23:13,
喜提范婉大婚伴手礼,69663.0,2024-05-28 23:13,
背着善宰跑大结局,333944.0,2024-05-28 23:13,
黑神话登上腾讯游戏发布会,281501.0,2024-05-28 23:13,
官员称还有2个月退休不该过多去问,232475.0,2024-05-28 23:13,
比亚迪海豹06油耗都2字头了,67261.0,2024-05-28 23:13,
比亚迪海豹06秦L9.98万元起售,177522.0,2024-05-28 23:13,
印度男子剖妻孕肚查胎儿性别,499389.0,2024-05-28 23:13,
人在猝死前会有什么预兆,432915.0,2024-05-28 23:13,
iPhone16Pro显示屏边框或变窄,361636.0,2024-05-28 23:13,
第一次见地铁户型的房子,217650.0,2024-05-28 23:13,
歌手 双补位,279729.0,2024-05-28 23:13,
李沁是唐艺昕的伴娘,267679.0,2024-05-28 23:13,
翟潇闻直播黑牙了,236821.0,2024-05-28 23:13,
王传福给老车主的子女交车,71875.0,2024-05-28 23:13,
福宝,222499.0,2024-05-28 23:13,
未婚在意外怀孕上要零容错,220662.0,2024-05-28 23:13,
善宰小率婚礼,208167.0,2024-05-28 23:13,
newjeans新MV引争议,192476.0,2024-05-28 23:13,
IVE 划水,190065.0,2024-05-28 23:13,
丈夫婆婆用被单给怀孕妻子荡秋千,175202.0,2024-05-28 23:13,
阿沁为詹雯婷陈建宁官司作证,173914.0,2024-05-28 23:13,
王传福致敬钱学森,40556.0,2024-05-28 23:13,
歌手第四期歌单,168647.0,2024-05-28 23:13,
李沁晒喜,163955.0,2024-05-28 23:13,
多家银行开启沉睡账户唤醒,162411.0,2024-05-28 23:13,
福宝啥时候上下班全看自己的心情,157825.0,2024-05-28 23:13,
一个动作缓解脊柱僵硬,156889.0,2024-05-28 23:13,
内娱智性恋天花板,152802.0,2024-05-28 23:13,
徐冬冬尹子维已经可以坦然聊分过手了,150313.0,2024-05-28 23:13,
深圳首套房首付最低20%,145197.0,2024-05-28 23:13,
胡先煦喝醉,131128.0,2024-05-28 23:13,
波尔在中国的最后一次冒险,127140.0,2024-05-28 23:13,
网红王妈签约公司致歉,125973.0,2024-05-28 23:13,
林婉儿人设 单薄,125495.0,2024-05-28 23:13,
撞脸情侣亲缘鉴定结果出来了,110484.0,2024-05-28 23:13,
