name,value,date,Unnamed: 3
蒋敦豪发长文回应,9899072.0,2024-07-22 23:09,
北京警方通报导师被学生举报情况,3986415.0,2024-07-22 23:09,
万千气象看青海,107168.0,2024-07-22 23:09,
人大女博士回应举报导师处理结果,2598460.0,2024-07-22 23:09,
奶茶30元时代已成过去,686795.0,2024-07-22 23:09,
种地吧成员支持蒋敦豪,2849004.0,2024-07-22 23:09,
相柳战死,650097.0,2024-07-22 23:09,
人大王某某被解聘,633318.0,2024-07-22 23:09,
田曦薇财阀千金,569439.0,2024-07-22 23:09,
郑州暴雨,384908.0,2024-07-22 23:09,
人大通报王某某性骚扰,6292290.0,2024-07-22 23:09,
老年男明星 性侵女服务员,2657450.0,2024-07-22 23:09,
90后男女都65岁以后退休系网民推估,850186.0,2024-07-22 23:09,
宗馥莉决定继续在娃哈哈履职,655470.0,2024-07-22 23:09,
女子称因学历低被判去高危妊娠门诊,632771.0,2024-07-22 23:09,
李昊 十个勤天永远是十个勤天,537420.0,2024-07-22 23:09,
秦岚 我不会和前任做朋友,427730.0,2024-07-22 23:09,
电影学院到底有谁在啊,409498.0,2024-07-22 23:09,
退休时间,373150.0,2024-07-22 23:09,
清华教授解读自愿弹性延迟退休原则,334530.0,2024-07-22 23:09,
游泳时千万别穿白色泳衣,394215.0,2024-07-22 23:09,
长相思尖叫之夜,371205.0,2024-07-22 23:09,
肖战工作室要维权了,355970.0,2024-07-22 23:09,
鹭卓 我们的心一定会一直在一起,330139.0,2024-07-22 23:09,
十个勤天新人是公司员工不是新成员,311481.0,2024-07-22 23:09,
原来慈禧太后的卧室长这样,309665.0,2024-07-22 23:09,
gidle方道歉,306696.0,2024-07-22 23:09,
肖战陈情令人物曲上线五周年,290912.0,2024-07-22 23:09,
人大王某某被开除党籍,284361.0,2024-07-22 23:09,
宁艺卓说第一次在中国签售,263082.0,2024-07-22 23:09,
张杰帮唱凡希亚,260796.0,2024-07-22 23:09,
毛球,259246.0,2024-07-22 23:09,
中国人民大学声明,256610.0,2024-07-22 23:09,
金智媛化妆师秒删ins,250863.0,2024-07-22 23:09,
人民网评人大清理害群之马,237951.0,2024-07-22 23:09,
女子折叠凳掉福宝场地被终身禁入,237004.0,2024-07-22 23:09,
空空日记掉粉超100万,227777.0,2024-07-22 23:09,
新华社好会拍,221808.0,2024-07-22 23:09,
邓为涂山璟婚服,219475.0,2024-07-22 23:09,
婚礼上被喷酒新娘霸气眼神杀,216632.0,2024-07-22 23:09,
男子猥亵被拘13天父亲向受害者求情,206634.0,2024-07-22 23:09,
时代少年团演唱会,200650.0,2024-07-22 23:09,
人大女博士举报情况属实,193997.0,2024-07-22 23:09,
洁癖严重到无法出门是种什么感觉,191267.0,2024-07-22 23:09,
小猫以为自己生了小狗,190174.0,2024-07-22 23:09,
统一了中西方审美的国风美学,186722.0,2024-07-22 23:09,
相柳是笑着死的,174230.0,2024-07-22 23:09,
夭柳彻底be,169485.0,2024-07-22 23:09,
想贾玲了,161223.0,2024-07-22 23:09,
成毅赴山海被绑路透,156861.0,2024-07-22 23:09,
