name,value,date,Unnamed: 3
苏苏结过婚,1376154.0,2024-06-19 23:01,
克罗地亚vs阿尔巴尼亚,876530.0,2024-06-19 23:01,
中国式现代化的万千气象,36787.0,2024-06-19 23:01,
2024高考成绩公布时间汇总,746136.0,2024-06-19 23:01,
玫瑰的故事最炸裂的台词出现了,705487.0,2024-06-19 23:01,
真的建议报考上海交通大学,390620.0,2024-06-19 23:01,
黄亦玫的离婚诉讼书是自己写的,415885.0,2024-06-19 23:01,
莫德里奇老了,354406.0,2024-06-19 23:01,
初级会计成绩,347758.0,2024-06-19 23:01,
白衣小伙教科书式救助误入高架老人,31612.0,2024-06-19 23:01,
一家7口套现20亿,686058.0,2024-06-19 23:01,
外交部回应中国游泳运动员兴奋剂阳性,427580.0,2024-06-19 23:01,
将门毒后,340421.0,2024-06-19 23:01,
黄亦玫离婚,335165.0,2024-06-19 23:01,
赵露思把耳机挂腰上,332421.0,2024-06-19 23:01,
天蝎座突然冷淡的原因,308070.0,2024-06-19 23:01,
韩国宣布进入人口危机紧急状态,295068.0,2024-06-19 23:01,
住持和女主播发生关系被敲诈案宣判,276442.0,2024-06-19 23:01,
霍建华出场,235050.0,2024-06-19 23:01,
陈泽直播,214065.0,2024-06-19 23:01,
胖哪都不要胖肚子,271411.0,2024-06-19 23:01,
有车有房存款30万适合回县城吗,249143.0,2024-06-19 23:01,
短发的田曦薇,210518.0,2024-06-19 23:01,
小伙刮到第13张喜中100万大奖,209387.0,2024-06-19 23:01,
SM英国男团颜值,206395.0,2024-06-19 23:01,
被嫌弃的黄牙多数是正常牙齿颜色,205150.0,2024-06-19 23:01,
墨雨云间34集预告,198278.0,2024-06-19 23:01,
欧洲杯,193297.0,2024-06-19 23:01,
素媛案罪犯赵斗淳再出狱,186528.0,2024-06-19 23:01,
阿尔巴尼亚 防线,169691.0,2024-06-19 23:01,
孩子吃华莱士汉堡吃出生肉,179317.0,2024-06-19 23:01,
余华当了高考反面教材二十年,158443.0,2024-06-19 23:01,
奇葩说辩手罗淼发长文力挺姜萍,144471.0,2024-06-19 23:01,
戚薇月光白裙,141117.0,2024-06-19 23:01,
潜意识爱上一个人的表现,136574.0,2024-06-19 23:01,
张远唱什么,131882.0,2024-06-19 23:01,
复旦打老师男生被警方带走,1563751.0,2024-06-19 23:01,
吴谨言王星越 芭莎,131139.0,2024-06-19 23:01,
这10件心脏最怕的事可能你每天在做,130565.0,2024-06-19 23:01,
长公主初代爱疯,127817.0,2024-06-19 23:01,
黑帮的我成了高中生,127295.0,2024-06-19 23:01,
编剧回应庄国栋黄亦玫吻戏多,126061.0,2024-06-19 23:01,
周深布达佩斯跑男录制,123484.0,2024-06-19 23:01,
军人归队在安检口向妻女敬礼,66226.0,2024-06-19 23:01,
2024暑期档的第一部电影,122459.0,2024-06-19 23:01,
厦大毕业生都去哪了,121726.0,2024-06-19 23:01,
鞠婧祎小号发博,119434.0,2024-06-19 23:01,
退钱哥吐槽欧洲杯上厕所1欧元,116662.0,2024-06-19 23:01,
萌探4官宣周柯宇,113509.0,2024-06-19 23:01,
克罗地亚半场0比1阿尔巴尼亚,105623.0,2024-06-19 23:01,
