name,value,date,Unnamed: 3
14岁被亲妈带去整容15年砸400万,878095.0,2024-04-24 07:09,
女子反映天然气费用突增老公被公司约谈,452907.0,2024-04-24 07:09,
9图了解无障碍阅读,21397.0,2024-04-24 07:09,
一条小团团单月礼物收入曾高达500万,370133.0,2024-04-24 07:09,
阿沁喊话陈建宁詹雯婷不要吵了,345560.0,2024-04-24 07:09,
金价,265791.0,2024-04-24 07:09,
蔡磊病情加重舌头下嘴唇已萎缩,243294.0,2024-04-24 07:09,
重庆动物园就熊猫扑倒保育员报平安,235371.0,2024-04-24 07:09,
周星驰要上综艺了,219144.0,2024-04-24 07:09,
孙女回家找不到奶奶崩溃大哭,153681.0,2024-04-24 07:09,
五一不调休就会是这种结果,722335.0,2024-04-24 07:09,
9岁坠楼男孩生前最后5分钟发呆徘徊,269948.0,2024-04-24 07:09,
昆凌迪士尼走出来的公主,208860.0,2024-04-24 07:09,
苹果发布会,189818.0,2024-04-24 07:09,
张颂文新剧官宣文案没跟上队形,167676.0,2024-04-24 07:09,
周雨彤现偶史上最e女主,145473.0,2024-04-24 07:09,
西湖也是要洗湖的,123383.0,2024-04-24 07:09,
眼泪女王大结局提前播出,121419.0,2024-04-24 07:09,
阿森纳5比0切尔西,114124.0,2024-04-24 07:09,
辛芷蕾 抱歉杨洋我听错了,101813.0,2024-04-24 07:09,
恋综史上最激烈的深吻,151272.0,2024-04-24 07:09,
孩子刚休学老师就把我微信删了,142893.0,2024-04-24 07:09,
女子孕期突然耳洞疤痕增生,116939.0,2024-04-24 07:09,
当地回应4岁男童被三小孩倒酒精烧死,108783.0,2024-04-24 07:09,
陈震称小米SU7背离自己预期,102424.0,2024-04-24 07:09,
轻断食吃了11根玉米,96327.0,2024-04-24 07:09,
乳腺癌来临的4个预兆,87856.0,2024-04-24 07:09,
黄景瑜体格怎么这么大,85941.0,2024-04-24 07:09,
张云龙上午古偶下午悬疑,80291.0,2024-04-24 07:09,
潘展乐100米自冠军,20439.0,2024-04-24 07:09,
田馥甄 音乐节,101242.0,2024-04-24 07:09,
红山动物园推草小猩猩疑似抑郁,79301.0,2024-04-24 07:09,
东方红一号发射54周年,76796.0,2024-04-24 07:09,
拿了驾照却不会开车了,71163.0,2024-04-24 07:09,
承欢记上门女婿,64786.0,2024-04-24 07:09,
住酒店睡过头被扣了押金,59880.0,2024-04-24 07:09,
阿森纳vs切尔西,59288.0,2024-04-24 07:09,
林俊杰为了防黄牛好拼,58052.0,2024-04-24 07:09,
泰版步步惊心,54144.0,2024-04-24 07:09,
张翰沧桑了,49452.0,2024-04-24 07:09,
娜扎粉色短裙,47274.0,2024-04-24 07:09,
双子座的分享欲不是喜欢,45893.0,2024-04-24 07:09,
王瀚哲恋爱,44284.0,2024-04-24 07:09,
北电规定艺考考生不得透露真实姓名,43682.0,2024-04-24 07:09,
刘涛还留着花少1的导游包,39077.0,2024-04-24 07:09,
陈震直播回应小米SU7争议,37412.0,2024-04-24 07:09,
辛芷蕾 差点打败周杰伦,38476.0,2024-04-24 07:09,
周琦被驱逐,36626.0,2024-04-24 07:09,
周深演唱会抢票,35892.0,2024-04-24 07:09,
春色寄情人 不够看,25087.0,2024-04-24 07:09,
