name,value,date,Unnamed: 3
西班牙夺得欧洲杯冠军,1098026.0,2024-07-15 07:01,
这3个体检项目其实是浪费钱,494868.0,2024-07-15 07:01,
行进的中国如此蓬勃,22866.0,2024-07-15 07:01,
迪士尼西班牙区发了刘亦菲花木兰,309758.0,2024-07-15 07:01,
亚马尔领奖还是没经验,269268.0,2024-07-15 07:01,
王楚钦孙颖莎巴黎如愿,224130.0,2024-07-15 07:01,
凯特王妃为阿尔卡拉斯颁奖,223802.0,2024-07-15 07:01,
好像所有人都确认了相柳的结局,208086.0,2024-07-15 07:01,
西班牙vs英格兰,162949.0,2024-07-15 07:01,
欧洲杯决赛,144106.0,2024-07-15 07:01,
枪击特朗普枪手行凶衣着引关注,582292.0,2024-07-15 07:01,
巴黎街头偶遇王一博散步,236051.0,2024-07-15 07:01,
黄子韬徐艺洋官宣,231322.0,2024-07-15 07:01,
特朗普或因侧头看图表救回一命,218662.0,2024-07-15 07:01,
女爱豆宣誓绝对不找丑人谈恋爱,199502.0,2024-07-15 07:01,
刘亦菲成了林一炫耀的资本,125284.0,2024-07-15 07:01,
特朗普遇刺6小时后首次露面,112771.0,2024-07-15 07:01,
特朗普称右耳被子弹击穿,101715.0,2024-07-15 07:01,
凯特王妃亮相温网,82551.0,2024-07-15 07:01,
邹市明吐槽3儿子没一个子承父业,81303.0,2024-07-15 07:01,
李闽轩 中戏录取,169305.0,2024-07-15 07:01,
月经快要离开时身体会给出4个提示,157314.0,2024-07-15 07:01,
预测特朗普胜选率上升至70%,86608.0,2024-07-15 07:01,
防风意映这一刻好漂亮,77293.0,2024-07-15 07:01,
西班牙全胜夺冠,71461.0,2024-07-15 07:01,
容祖儿 感谢我的爱人,70687.0,2024-07-15 07:01,
梅西首发出战美洲杯决赛,69308.0,2024-07-15 07:01,
凯恩再次有金靴无冠军,63480.0,2024-07-15 07:01,
希林娜依高 破音,61579.0,2024-07-15 07:01,
一夜之后韩总夫人跑了,61185.0,2024-07-15 07:01,
6人共享2024欧洲杯金靴,60779.0,2024-07-15 07:01,
枪击特朗普的枪手车内有爆炸装置,58651.0,2024-07-15 07:01,
欧洲杯,57756.0,2024-07-15 07:01,
阿根廷vs哥伦比亚首发,56149.0,2024-07-15 07:01,
凯恩冠军荒,53574.0,2024-07-15 07:01,
亚马尔获欧洲杯最佳年轻球员,53089.0,2024-07-15 07:01,
罗德里当选本届欧洲杯最佳球员,48573.0,2024-07-15 07:01,
国乒出发奔赴巴黎,47032.0,2024-07-15 07:01,
心疼凯恩,43698.0,2024-07-15 07:01,
想象到孙丞潇的二胎生活了,43373.0,2024-07-15 07:01,
中华田园犬不愧是祖宗严选,40133.0,2024-07-15 07:01,
温网男单决赛,39055.0,2024-07-15 07:01,
帕尔默世界波,38474.0,2024-07-15 07:01,
温网,38174.0,2024-07-15 07:01,
威廉姆斯使用内马尔庆祝动作,37245.0,2024-07-15 07:01,
西班牙2比1英格兰,33803.0,2024-07-15 07:01,
阿尔卡拉斯夺大满贯第四冠,33684.0,2024-07-15 07:01,
西班牙半场0比0英格兰,33406.0,2024-07-15 07:01,
亚马尔17岁的第一天,31672.0,2024-07-15 07:01,
奥亚萨瓦尔绝杀,31642.0,2024-07-15 07:01,
