name,value,date,Unnamed: 3
姆巴佩,477623.0,2024-06-04 07:00,
吴谨言演技,187588.0,2024-06-04 07:00,
中国探月工程不断刷新月球探测纪录,20536.0,2024-06-04 07:00,
数只美股疑似出现行情异常,129571.0,2024-06-04 07:00,
我国取消无偿赠送大熊猫已40多年,127899.0,2024-06-04 07:00,
王楚钦 脚踝,102856.0,2024-06-04 07:00,
秦岚觉得结了婚就不要离婚,94013.0,2024-06-04 07:00,
巴菲特,86021.0,2024-06-04 07:00,
王星越好帅,77638.0,2024-06-04 07:00,
义乌老奶奶闲不下来在家做手工活,10332.0,2024-06-04 07:00,
北京8兄妹因搬迁争夺宅基地,280085.0,2024-06-04 07:00,
浙江两驴友被溪流冲走当地商户发声,232188.0,2024-06-04 07:00,
丁真自曝刚上岛跟不上节奏,188442.0,2024-06-04 07:00,
海清曝温峥嵘把大学宿舍烧了,122891.0,2024-06-04 07:00,
东方甄选主号掉粉,104819.0,2024-06-04 07:00,
印度高温 恒河洗澡,92232.0,2024-06-04 07:00,
爱奇艺给杨幂开了专栏,70532.0,2024-06-04 07:00,
樊振东男单冠军,70046.0,2024-06-04 07:00,
早睡真能解决生活中大部分的问题,66722.0,2024-06-04 07:00,
才知道微信可以锁屏录音,61637.0,2024-06-04 07:00,
首饰金价重回5字头,59921.0,2024-06-04 07:00,
为什么收拾房间有助于攒钱,56641.0,2024-06-04 07:00,
张雪峰称多占用员工1天都双倍奉还,56389.0,2024-06-04 07:00,
樊振东4比3战胜王楚钦,53272.0,2024-06-04 07:00,
伯克希尔哈撒韦暴跌99.97%,53224.0,2024-06-04 07:00,
三家日本车企高管开记者会道歉,52367.0,2024-06-04 07:00,
袁娅维 双截棍,52265.0,2024-06-04 07:00,
戚薇录乘风十天没理李承铉,51457.0,2024-06-04 07:00,
毒液3直到死亡将他们分开,49010.0,2024-06-04 07:00,
叶轻眉 大女主,47255.0,2024-06-04 07:00,
夏天手上长巨痒小水泡怎么办,113077.0,2024-06-04 07:00,
这个家没有王栎鑫得散,64405.0,2024-06-04 07:00,
宝宝眼球被蜇进1根刺1个月才发现,51268.0,2024-06-04 07:00,
姆巴佩未入选奥运名单,42954.0,2024-06-04 07:00,
孙颖莎赛后发文,42550.0,2024-06-04 07:00,
半夜被手麻醒怎么回事,39469.0,2024-06-04 07:00,
18岁长女高考后妈生3胎弟弟,37963.0,2024-06-04 07:00,
王楚钦vs樊振东,37828.0,2024-06-04 07:00,
高考前看到妈妈的手机破防了,37659.0,2024-06-04 07:00,
樊振东说更在意王楚钦伤势,35573.0,2024-06-04 07:00,
孙颖莎4比3王曼昱,35294.0,2024-06-04 07:00,
知道为什么洪世贤认不出品如了,34808.0,2024-06-04 07:00,
婚房装成这样结婚更难了,33717.0,2024-06-04 07:00,
孙颖莎女单夺冠,33341.0,2024-06-04 07:00,
胖莎,32185.0,2024-06-04 07:00,
猫 忘了我也会,31034.0,2024-06-04 07:00,
以为爸妈只给妹妹买了新玩具车,30169.0,2024-06-04 07:00,
记忆里的明星批量翻红,29746.0,2024-06-04 07:00,
乘风之夜组队选曲征集,27224.0,2024-06-04 07:00,
伯克希尔哈撒韦,20815.0,2024-06-04 07:00,
