name,value,date,Unnamed: 3
网曝吉林银行取款需派出所同意,575844.0,2024-06-13 07:06,
南京咖啡阿姨说天下没有不散的筵席,471929.0,2024-06-13 07:06,
高考报志愿要了解的16个关键词,4461.0,2024-06-13 07:06,
黄景瑜中国人民警察大学招生简章,326471.0,2024-06-13 07:06,
刘亦菲一部剧带火了5个人,317580.0,2024-06-13 07:06,
东北孩子噩梦马上就来了,248288.0,2024-06-13 07:06,
专家说杨梅是减肥人士的福音,203131.0,2024-06-13 07:06,
彭冠英发文吐槽庄国栋,138073.0,2024-06-13 07:06,
女儿长成这样可以当童模吗,129314.0,2024-06-13 07:06,
验瓜师每天拍上万个西瓜收入千元,7337.0,2024-06-13 07:06,
女子出借20万元讨不回丈夫自杀,177289.0,2024-06-13 07:06,
杰里韦斯特去世,128769.0,2024-06-13 07:06,
肃国公的鸳鸯肚兜挂在令妃娘娘身上,123887.0,2024-06-13 07:06,
刘亦菲霍建华香港文艺片氛围感,110563.0,2024-06-13 07:06,
鞠婧祎 眉弓,97957.0,2024-06-13 07:06,
韩国没有了五花肉自由,97053.0,2024-06-13 07:06,
马斯克被曝与SpaceX多名员工有染,89840.0,2024-06-13 07:06,
桑尼食品摊被中国人买空,85011.0,2024-06-13 07:06,
北京偶遇刘亦菲逛街,95425.0,2024-06-13 07:06,
网红胡涵溪93岁姥姥去世,82728.0,2024-06-13 07:06,
家门口遭捅死女孩曾被保送北外,98131.0,2024-06-13 07:06,
脚露在外面睡觉有什么好处,83434.0,2024-06-13 07:06,
怀疑张若昀工作室有我们自己人,79022.0,2024-06-13 07:06,
原来天和空是有区别的,63110.0,2024-06-13 07:06,
女儿刚高考完就支出了3万,62314.0,2024-06-13 07:06,
坚持运动和从不运动的人差别在哪,61089.0,2024-06-13 07:06,
黄亦玫方协文闪婚,59936.0,2024-06-13 07:06,
印度贫民窟上百人共用一个厕所,59401.0,2024-06-13 07:06,
你喜欢的人突然有对象是什么感觉,56372.0,2024-06-13 07:06,
赵露思金牌女主播许妍上线,53183.0,2024-06-13 07:06,
黄亦玫徐海乔cp 玫进海选,56794.0,2024-06-13 07:06,
怦然心动20岁 be,52198.0,2024-06-13 07:06,
林更新上线霍建华也不远了,46492.0,2024-06-13 07:06,
Angelababy线下生图状态,46323.0,2024-06-13 07:06,
乐华否认程潇吴宣仪耍大牌,42427.0,2024-06-13 07:06,
某明星 坐电梯耍大牌,41288.0,2024-06-13 07:06,
吉林银行回应储户取款需派出所同意,40528.0,2024-06-13 07:06,
吴谨言回复罗伯特,40420.0,2024-06-13 07:06,
欧洲杯赛程,38995.0,2024-06-13 07:06,
毛不易现场,38601.0,2024-06-13 07:06,
上戏回应林更新考博成功,38578.0,2024-06-13 07:06,
四川瓦屋山景区落石有游客被砸伤,37287.0,2024-06-13 07:06,
福宝爱吃的都在蛋糕里,36177.0,2024-06-13 07:06,
女子炫了一斤杨梅被送进ICU,35090.0,2024-06-13 07:06,
YG糟糕的公关,33305.0,2024-06-13 07:06,
拍到地球自转是什么体验,32259.0,2024-06-13 07:06,
新疆为什么像四个省份,32253.0,2024-06-13 07:06,
抬头看的是天还是空,30777.0,2024-06-13 07:06,
墨雨云间,25074.0,2024-06-13 07:06,
建议快递包装都换成这种,22689.0,2024-06-13 07:06,
