name,value,date,Unnamed: 3
冯琳入职东方卫视,374251.0,2024-07-07 07:15,
印度一地一天内19人被雷击身亡,313807.0,2024-07-07 07:15,
中国友谊勋章如何颁授,21832.0,2024-07-07 07:15,
日本2男子将50岁同事放洗衣机,271638.0,2024-07-07 07:15,
洞庭湖226米决口已封堵66米,220738.0,2024-07-07 07:15,
易猝死的人往往有这4个共同点,185953.0,2024-07-07 07:15,
刘亦菲许红豆限时回归,172722.0,2024-07-07 07:15,
裴文宣死得很惨但想得很美,144576.0,2024-07-07 07:15,
TES对战G2,134165.0,2024-07-07 07:15,
神仙邻居带动社区200多人暑假晨跑,22839.0,2024-07-07 07:15,
警方通报川藏线孕妇插队事件,123011.0,2024-07-07 07:15,
单依纯想整容被医生拒绝,121829.0,2024-07-07 07:15,
丁程鑫真的泼了王俊凯,116263.0,2024-07-07 07:15,
韩廷 孟宴臣,115180.0,2024-07-07 07:15,
林俊杰,111970.0,2024-07-07 07:15,
荷兰vs土耳其,98982.0,2024-07-07 07:15,
英格兰瑞士点球大战,97167.0,2024-07-07 07:15,
T1晋级电竞世界杯决赛,94896.0,2024-07-07 07:15,
七七事变八十七周年,88892.0,2024-07-07 07:15,
英格兰vs瑞士,81814.0,2024-07-07 07:15,
奉劝晚婚的人不要随份子钱,102655.0,2024-07-07 07:15,
天水麻辣烫仍然在批量倒闭,89717.0,2024-07-07 07:15,
去已婚姐姐家过暑假要给生活费吗,86155.0,2024-07-07 07:15,
在小县城用联名公交卡被骂了,77512.0,2024-07-07 07:15,
55岁的妈妈拒绝学习任何新事物,76230.0,2024-07-07 07:15,
上厕所途中冲水小心病菌感染,73268.0,2024-07-07 07:15,
荷兰晋级欧洲杯4强,71210.0,2024-07-07 07:15,
何捷叫张馨予胖子,68523.0,2024-07-07 07:15,
TES晋级电竞世界杯决赛,64978.0,2024-07-07 07:15,
5.56万吨块石运往洞庭湖决口,57884.0,2024-07-07 07:15,
钓鱼网红周翠翠夫妇去世,298408.0,2024-07-07 07:15,
坚持运动40年的身材,63239.0,2024-07-07 07:15,
马思纯暴汗自拍,60508.0,2024-07-07 07:15,
英格兰6比4瑞士,56774.0,2024-07-07 07:15,
离职8年后因前老板涉黑获刑,56117.0,2024-07-07 07:15,
1937年7月7日永不能忘,55398.0,2024-07-07 07:15,
英格兰五罚全中,55251.0,2024-07-07 07:15,
摆拍生吃见手青网红已被禁言,53204.0,2024-07-07 07:15,
体脂率是衡量胖瘦的金标准,51254.0,2024-07-07 07:15,
存款多少才敢辞职,48942.0,2024-07-07 07:15,
TES零封G2,44990.0,2024-07-07 07:15,
进不了12强就得回去上班,44585.0,2024-07-07 07:15,
秦彻cv,43601.0,2024-07-07 07:15,
你在奥运会上的对手刚刚小学毕业,43180.0,2024-07-07 07:15,
荷兰2比1土耳其,42720.0,2024-07-07 07:15,
非升即走已从讲师延伸至副教授,42661.0,2024-07-07 07:15,
扬州地震,36561.0,2024-07-07 07:15,
卢沟桥事变亲历者郑福来老人去世,36082.0,2024-07-07 07:15,
温网2024,35026.0,2024-07-07 07:15,
汪苏泷连夜追加八百万,34759.0,2024-07-07 07:15,
