name,value,date,Unnamed: 3
韩国警告俄罗斯,483072.0,2024-06-24 07:12,
海蓝之谜柜姐被顾客泼水羞辱,451842.0,2024-06-24 07:12,
为什么说宁夏是一个宝藏,34693.0,2024-06-24 07:12,
首个高考成绩被屏蔽的人出现了,428058.0,2024-06-24 07:12,
黄晓明拿奖激动到手抖,314258.0,2024-06-24 07:12,
高考弟弟考了588分想复读,295117.0,2024-06-24 07:12,
于正说以后他所有的剧全部明确HE,221200.0,2024-06-24 07:12,
李一桐 将门毒后,177014.0,2024-06-24 07:12,
iPhone16全系尺寸曝光,175390.0,2024-06-24 07:12,
四喜丸子围坐狂炫生日餐仪式感满满,21099.0,2024-06-24 07:12,
韩国的白菜是从山东引进的,285291.0,2024-06-24 07:12,
林允发际线,168181.0,2024-06-24 07:12,
央视曝光农村生活污水治理假工程,130396.0,2024-06-24 07:12,
杭州灵隐寺发大水,129653.0,2024-06-24 07:12,
瑞士vs德国,96895.0,2024-06-24 07:12,
菲律宾蓄意闹海,94511.0,2024-06-24 07:12,
白日提灯 平番,91323.0,2024-06-24 07:12,
魏无羡 AG,90262.0,2024-06-24 07:12,
将门毒后 男主,86136.0,2024-06-24 07:12,
张艺兴朴灿烈合照,85538.0,2024-06-24 07:12,
梁实第28次高考成绩出炉,354024.0,2024-06-24 07:12,
男子带96岁母亲酒店养老遭集体拉黑,247922.0,2024-06-24 07:12,
夫妻自驾运毒34.8公斤被抓,166825.0,2024-06-24 07:12,
女子等红绿灯被撞飞后遭碾压当场身亡,153595.0,2024-06-24 07:12,
猪身上这三个部位很脏尽量少吃,128603.0,2024-06-24 07:12,
男生查分被屏蔽淡定向家人报喜,116387.0,2024-06-24 07:12,
2点睡觉10点起床算熬夜吗,88335.0,2024-06-24 07:12,
年轻人为什么爱上德训鞋,71217.0,2024-06-24 07:12,
女儿零点查分竟和妈妈梦的一模一样,65115.0,2024-06-24 07:12,
49岁的林志玲状态,69043.0,2024-06-24 07:12,
妈妈有钱和爸爸有钱的区别,66199.0,2024-06-24 07:12,
这3类首饰暗藏健康风险别再戴了,66094.0,2024-06-24 07:12,
高考成绩被屏蔽为什么,65152.0,2024-06-24 07:12,
高考成绩被亲戚擅自发到家人群,62853.0,2024-06-24 07:12,
霍建华朱珠演情侣,62339.0,2024-06-24 07:12,
Wei不打了,58203.0,2024-06-24 07:12,
陈瑶白晓荷有姐感了,55753.0,2024-06-24 07:12,
德国1比1瑞士,55081.0,2024-06-24 07:12,
一份没有985211的宝藏大学名单,53110.0,2024-06-24 07:12,
陈都灵买过刘诗诗步步惊心周边,51836.0,2024-06-24 07:12,
能驯服巨蟹的星座都有谁,48035.0,2024-06-24 07:12,
匈牙利绝杀苏格兰,46550.0,2024-06-24 07:12,
涵艺爆料WBG更换辅助,44323.0,2024-06-24 07:12,
青岛大学 奢香夫人,42573.0,2024-06-24 07:12,
王源听到结婚的反应,42362.0,2024-06-24 07:12,
高考成绩,40866.0,2024-06-24 07:12,
火锅界开始卷酸的赛道了,41963.0,2024-06-24 07:12,
汪苏泷回应上歌手碎了,38213.0,2024-06-24 07:12,
日本人冒充中国人在巴基斯坦骗吃骗喝,37704.0,2024-06-24 07:12,
不翻车的小短甲,36973.0,2024-06-24 07:12,
