name,value,date,Unnamed: 3
刘美含否认再次落选浪姐,235920.0,2024-03-10 07:09,
日行一万步或可降低久坐危害,153917.0,2024-03-10 07:09,
新质生产力如何改变生活,19189.0,2024-03-10 07:09,
孟羽童回应简介是前500强董事长秘书,148553.0,2024-03-10 07:09,
热辣滚烫海外成绩,144470.0,2024-03-10 07:09,
这居然是张栋梁,79098.0,2024-03-10 07:09,
艾滋病感染者抗病毒治疗成功率已超95%,75920.0,2024-03-10 07:09,
浪姐5一公歌单,71458.0,2024-03-10 07:09,
微信能不能改成部分人三天可见,63812.0,2024-03-10 07:09,
中国2024年国防费预算增长7.2%,28254.0,2024-03-10 07:09,
女子染发10余年致头皮胎记癌变,263266.0,2024-03-10 07:09,
学生睡不醒班主任背到医院,248367.0,2024-03-10 07:09,
演员尚梦初逝世,64971.0,2024-03-10 07:09,
朱梓骁被纪凌尘气炸了,220519.0,2024-03-10 07:09,
杨天真回应不减肥原因,211556.0,2024-03-10 07:09,
苹果和安卓的天气预报不一样,204896.0,2024-03-10 07:09,
赵安吉车祸身亡细节,204411.0,2024-03-10 07:09,
美国女子拍下老公用枪打死自己视频,173880.0,2024-03-10 07:09,
1人带316个LV包入境被查,130160.0,2024-03-10 07:09,
月入过万你还会考研考公吗,54533.0,2024-03-10 07:09,
杭州万象城,113138.0,2024-03-10 07:09,
普通家庭这样的生活算穷吗,100894.0,2024-03-10 07:09,
现在的朋友圈越来越低调了,71904.0,2024-03-10 07:09,
为何年轻人不愿意进工厂了,63623.0,2024-03-10 07:09,
杨紫提醒主持人牙齿上有口红,61520.0,2024-03-10 07:09,
泪失禁体质可能是大脑太发达,50320.0,2024-03-10 07:09,
李权哲第二名出道,45654.0,2024-03-10 07:09,
孟羽童回应收入,45045.0,2024-03-10 07:09,
李菲儿作品曾入围戛纳电影节,44375.0,2024-03-10 07:09,
南大一48岁博士生8年未毕业被劝退,42169.0,2024-03-10 07:09,
王梓薇感谢赵丽颖推荐客串与凤行,41412.0,2024-03-10 07:09,
终于知道电视里为啥喜欢买芹菜,41013.0,2024-03-10 07:09,
为什么感冒咳嗽一到晚上就更严重,39658.0,2024-03-10 07:09,
妈妈炸的花生米被同学嫌弃了,38453.0,2024-03-10 07:09,
杭州太子湾引进灰紫色浴缸郁金香,37908.0,2024-03-10 07:09,
男子流浪25年被侄子爆改接回家,37348.0,2024-03-10 07:09,
减脂期最怕的凉拌菜,35089.0,2024-03-10 07:09,
霍启刚建议实现大湾区体育教练资格互认,37254.0,2024-03-10 07:09,
奶奶珍藏十多年的塑料手链,36672.0,2024-03-10 07:09,
章若楠好港,34508.0,2024-03-10 07:09,
宁静打了焉栩嘉一耳光,32517.0,2024-03-10 07:09,
王锵徐若晗还原东宫名场面,31808.0,2024-03-10 07:09,
杨紫古韵旗袍,30879.0,2024-03-10 07:09,
瘦腰瘦得特别快的运动,29831.0,2024-03-10 07:09,
被我弄丢的你结局细思极恐,28598.0,2024-03-10 07:09,2024-1-26:7:23:49
奥利C位出道,28228.0,2024-03-10 07:09,2024-1-26:7:23:49
优酷回复赵丽颖片单,28029.0,2024-03-10 07:09,2024-1-26:7:23:49
这个理由她已经用了半年了,28030.0,2024-03-10 07:09,2024-1-26:7:23:49
沙丘2,27682.0,2024-03-10 07:09,2024-1-26:7:23:49
靳东再谈假靳东事件,26851.0,2024-03-10 07:09,2024-1-26:7:23:49
