name,value,date,Unnamed: 3
cp粉悬着的心终于死了,463497.0,2024-04-12 07:09,
卖房让娃退学环游世界的家庭怎么样了,359967.0,2024-04-12 07:09,
广西三月三到底有多好玩,48193.0,2024-04-12 07:09,
辛普森去世,989716.0,2024-04-12 07:09,
为什么英国人下雨很少打伞,356664.0,2024-04-12 07:09,
与凤行是宣璐和徐海乔第3次合作,265156.0,2024-04-12 07:09,
才知道医学生不用学毕业论文,264967.0,2024-04-12 07:09,
与凤行低了,205171.0,2024-04-12 07:09,
微信打电话和直接打电话的区别,203190.0,2024-04-12 07:09,
男生逆袭考研上岸还减肥100斤,145091.0,2024-04-12 07:09,
官方回应甘肃一男教师侵犯初三男生,303993.0,2024-04-12 07:09,
淄博烧烤赵大爷被叫去开会了,217098.0,2024-04-12 07:09,
甘肃一男教师被指侵犯初三男生,178813.0,2024-04-12 07:09,
赵丽颖2020年就确认出演与凤行了,170392.0,2024-04-12 07:09,
常吃这种食物更易性早熟,167995.0,2024-04-12 07:09,
赵露思在阿那亚,158274.0,2024-04-12 07:09,
章子怡酱园弄戛纳就穿这套吧,149208.0,2024-04-12 07:09,
仝卓工作室说很多艺人不敬业,135150.0,2024-04-12 07:09,
林更新说与赵丽颖搭档是荣幸,138610.0,2024-04-12 07:09,
蒋依依说今年不扯裙子了,120832.0,2024-04-12 07:09,
换儿子血的亿万富翁展示3年抗衰成果,295916.0,2024-04-12 07:09,
孙俪想知道邓超在证明啥,216184.0,2024-04-12 07:09,
越南女首富张美兰被判处死刑,117423.0,2024-04-12 07:09,
林更新称呼赵丽颖赵老师,127462.0,2024-04-12 07:09,
纪凌尘嗦冰棍,115444.0,2024-04-12 07:09,
以为猫咪生病了原来是猫盆漏电了,111415.0,2024-04-12 07:09,
士兵突击老班长在淄博被疯狂投喂,84681.0,2024-04-12 07:09,
高校回应女子一丝不挂大闹男生宿舍,84057.0,2024-04-12 07:09,
刘亦菲减肥法,75295.0,2024-04-12 07:09,
雷军问网友是否支持车上有原装手机支架,73214.0,2024-04-12 07:09,
大学生日薪三百做兼职竟成洗钱工具人,72473.0,2024-04-12 07:09,
少吃和运动哪个更容易瘦,71510.0,2024-04-12 07:09,
朴彩英双眼皮,71084.0,2024-04-12 07:09,
麦承欢分手了,69488.0,2024-04-12 07:09,
招商银行停发三年期五年期大额存单,68339.0,2024-04-12 07:09,
告诉辛家亮他爸出轨了,65574.0,2024-04-12 07:09,
张颂文第一反应竟是上手,64507.0,2024-04-12 07:09,
小米SU7断电后冰箱最长工作24小时,60777.0,2024-04-12 07:09,
巴黎奥运铁人三项或因塞纳河太脏改为两项,60142.0,2024-04-12 07:09,
手术直播间女主播被喷泉冲飞,56670.0,2024-04-12 07:09,
女子在老公帮助下减重60斤恢复自信,55963.0,2024-04-12 07:09,
久违了LAY,53149.0,2024-04-12 07:09,
雷军说余承东调侃小米手机支架没事,51492.0,2024-04-12 07:09,
朱一龙的生日蛋糕是朱1龙,49727.0,2024-04-12 07:09,
蓝盈莹也做了甘露寺美甲,48582.0,2024-04-12 07:09,2024-1-26:7:23:49
雅诗兰黛 IU,46501.0,2024-04-12 07:09,2024-1-26:7:23:49
大侦探就这样拍到一百季吧,46103.0,2024-04-12 07:09,2024-1-26:7:23:49
易烊千玺粉色小包,44413.0,2024-04-12 07:09,2024-1-26:7:23:49
Uzi谈RNG欠钱,41038.0,2024-04-12 07:09,2024-1-26:7:23:49
TES被偷家,39546.0,2024-04-12 07:09,2024-1-26:7:23:49
