name,value,date,Unnamed: 3
民宿涨价1500后被退单平台只赔230,595734.0,2024-04-29 07:09,
宋雨琦 反正他们听不懂,382898.0,2024-04-29 07:09,
中国航天员完成在轨交接,16233.0,2024-04-29 07:09,
张颂文回应砍价被吐槽穷酸,343326.0,2024-04-29 07:09,
张雨绮是怎么发现这个赛道的,331147.0,2024-04-29 07:09,
官方通报广州一女子商场跳楼砸中人,299654.0,2024-04-29 07:09,
四种素菜小心越吃越胖,266653.0,2024-04-29 07:09,
韩雪练舞前后对比,236116.0,2024-04-29 07:09,
海仁活到了84岁,205166.0,2024-04-29 07:09,
男子曾获老师无偿资助回母校捐款50万,90518.0,2024-04-29 07:09,
居然还有女用避孕套,370792.0,2024-04-29 07:09,
蔡磊妻子说天天愁有什么用,219688.0,2024-04-29 07:09,
粉圈乱象影响观剧体验,190210.0,2024-04-29 07:09,
国外一位妻子给老公打包午餐,159874.0,2024-04-29 07:09,
贾乃亮谎报年龄被黄景瑜踹,115825.0,2024-04-29 07:09,
快船2比2独行侠,114966.0,2024-04-29 07:09,
TT公布调查结果,107323.0,2024-04-29 07:09,
哈登33分,106739.0,2024-04-29 07:09,
眼泪女王大结局,104916.0,2024-04-29 07:09,
佩佩姐每条艾特刘涛都回复了,101110.0,2024-04-29 07:09,
史上最忙五一为何机票价格跳水,202863.0,2024-04-29 07:09,
会长是女仆大人 碓冰拓海,98650.0,2024-04-29 07:09,
从胃病到胃癌的报警症状,198098.0,2024-04-29 07:09,
雷军回应给武大捐款13亿,89890.0,2024-04-29 07:09,
五一1500元机票跳水至400,168062.0,2024-04-29 07:09,
长期吃榴莲身体会发生什么变化,164192.0,2024-04-29 07:09,
郑佩佩 我想她了,141816.0,2024-04-29 07:09,
9.9的风终于还是卷到了星巴克,95734.0,2024-04-29 07:09,
专家谈问界M7碰撞后疑车门无法打开,74219.0,2024-04-29 07:09,
时代少年团女主 贺美琦,66560.0,2024-04-29 07:09,
当洗澡后穿上你给的短裤,83623.0,2024-04-29 07:09,
周杰伦二开,65042.0,2024-04-29 07:09,
眼泪女王收视率,65031.0,2024-04-29 07:09,
雷军拿奖学金时发誓要1万倍奉还,62000.0,2024-04-29 07:09,
邓超 亚比囧囧囧,60088.0,2024-04-29 07:09,
特斯拉通过国家汽车数据安全4项全部要求,58242.0,2024-04-29 07:09,
问界,57816.0,2024-04-29 07:09,
32岁男子酒后泡澡脑血管破裂进了ICU,56831.0,2024-04-29 07:09,
雷军称小米造车投入了半个家底,54825.0,2024-04-29 07:09,
短短三句话却是一辈子的遗憾,51646.0,2024-04-29 07:09,
香蕉加一把糯米粉就是一道美食,48056.0,2024-04-29 07:09,
异地小情侣约好在同一天拔智齿,47222.0,2024-04-29 07:09,
Yaoyao发文道歉,46162.0,2024-04-29 07:09,
买家称周鸿祎的车不卖,42852.0,2024-04-29 07:09,
原来空间站钥匙长这样,41643.0,2024-04-29 07:09,2024-1-26:7:23:49
眼泪女王杀青宴好像婚闹现场,41261.0,2024-04-29 07:09,2024-1-26:7:23:49
新郎一家开荒给新娘办向日葵婚礼,40390.0,2024-04-29 07:09,2024-1-26:7:23:49
青环5 朴彩英,40168.0,2024-04-29 07:09,2024-1-26:7:23:49
眼泪女王,39627.0,2024-04-29 07:09,2024-1-26:7:23:49
邓超陈赫能玩到一起的原因,37148.0,2024-04-29 07:09,2024-1-26:7:23:49
