name,value,date,Unnamed: 3
取消公办中小学教师编制可不可行,1202864.0,2024-05-07 07:12,
缅甸,656885.0,2024-05-07 07:12,
数据盘点五一假期,50357.0,2024-05-07 07:12,
三只羊参与举办电音节被指宰客,593565.0,2024-05-07 07:12,
男子确诊胃癌提前一年为自己安排身后事,397696.0,2024-05-07 07:12,
人民文娱评华晨宇日出演唱会,384869.0,2024-05-07 07:12,
张翰一次开朗换来终生内向,344265.0,2024-05-07 07:12,
上海现付费马桶圈充1000可用13.8万次,338298.0,2024-05-07 07:12,
抑郁女儿叫朋友来家里吃饭了,335137.0,2024-05-07 07:12,
黄金狂飙后钻石崩了,269709.0,2024-05-07 07:12,
豪宅小区被外卖员吐槽赔钱也不送,259101.0,2024-05-07 07:12,
蔡少芬陶昕然体型差,231884.0,2024-05-07 07:12,
邓超你关注下陶白白吧,216443.0,2024-05-07 07:12,
男子打球被球友看出面相不对救了一命,194403.0,2024-05-07 07:12,
张若昀切范闲大号上线了,129304.0,2024-05-07 07:12,
句句说分开 句句都是爱,129169.0,2024-05-07 07:12,
张杰谢娜拍立得,126123.0,2024-05-07 07:12,
女子为被性侵的母亲奔波后丢了工作,116182.0,2024-05-07 07:12,
腰臀比小的人更长寿,106659.0,2024-05-07 07:12,
马龙止步大满贯32强,94771.0,2024-05-07 07:12,
经常口臭的人一般都逃不过这几个原因,756651.0,2024-05-07 07:12,
熬夜疲劳可能会让你变臭,184980.0,2024-05-07 07:12,
二十多岁已经厌烦上班到极致,102533.0,2024-05-07 07:12,
陈梦压力,88156.0,2024-05-07 07:12,
原来减肥更重要的是塑型,85064.0,2024-05-07 07:12,
MetGala红毯,82641.0,2024-05-07 07:12,
杨幂曾问邓超亚比是什么,82097.0,2024-05-07 07:12,
92名在缅北跨境电诈嫌犯被移交我方,78824.0,2024-05-07 07:12,
他新婚盛装她真刀真枪,74776.0,2024-05-07 07:12,
找份工作养活自己为什么这么难,72814.0,2024-05-07 07:12,
存款十几万在小县城什么水平,71103.0,2024-05-07 07:12,
范闲暴揍范思辙,68527.0,2024-05-07 07:12,
徐园男友称其系自杀,68239.0,2024-05-07 07:12,
有一种惨叫广东荔枝不挂果,67939.0,2024-05-07 07:12,
庆余年3还能集齐原班人马吗,67408.0,2024-05-07 07:12,
淘宝免单,62740.0,2024-05-07 07:12,
医学生有自己杀菠萝方式,60206.0,2024-05-07 07:12,
无名痒是身体发出的信号,59491.0,2024-05-07 07:12,
吴磊 你好不好,51904.0,2024-05-07 07:12,
原来这些行为是良性自虐,50565.0,2024-05-07 07:12,
想念郭艾伦,49609.0,2024-05-07 07:12,
原来高铁上是有15元的盒饭的,48083.0,2024-05-07 07:12,
杨鸣贴脸暴怒,44713.0,2024-05-07 07:12,
南部战区海军海空立体联合搜救演练,44234.0,2024-05-07 07:12,
刘亦菲海南plog,43810.0,2024-05-07 07:12,
内娱直播考研上岸第一人,43689.0,2024-05-07 07:12,
和动画简直一模一样,42747.0,2024-05-07 07:12,
给列车员送酸奶被回请全车最贵零食,41074.0,2024-05-07 07:12,
广州暴雨,39731.0,2024-05-07 07:12,
徐园男友有3次暴力前科,37516.0,2024-05-07 07:12,
