name,value,date,Unnamed: 3
董宇辉称非常反感被叫网红,365141.0,2024-06-10 07:00,
刘亦菲头像,225748.0,2024-06-10 07:00,
一批诋毁企业形象账号被处置,37974.0,2024-06-10 07:00,
女子注射400支玻尿酸丰臀致臀部感染,344970.0,2024-06-10 07:00,
彭冠英嘻嘻徐海乔不嘻嘻,126490.0,2024-06-10 07:00,
不接陌生电话但是要去微信搜,125093.0,2024-06-10 07:00,
潮牌Champion为什么不火了,98387.0,2024-06-10 07:00,
刘亦菲5集换了32套造型,95499.0,2024-06-10 07:00,
陈雨浓孙程潇吵架,81033.0,2024-06-10 07:00,
2024端午来啦,63205.0,2024-06-10 07:00,
女子厕所装百叶窗走光3年浑然不知,278165.0,2024-06-10 07:00,
殷罡逝世,164136.0,2024-06-10 07:00,
新女团成员上节目被开黄腔,97072.0,2024-06-10 07:00,
早田希娜女单冠军,71448.0,2024-06-10 07:00,
我爸以为有教资就能去学校当老师,67290.0,2024-06-10 07:00,
刘亦菲彭冠英踮脚吻,66042.0,2024-06-10 07:00,
原伟东称曾遭牙签扎指甲逼供,63199.0,2024-06-10 07:00,
孟庭苇叫赵丽颖颖宝,63181.0,2024-06-10 07:00,
法网,54945.0,2024-06-10 07:00,
用李现照片当成相亲对象发给老爸,53979.0,2024-06-10 07:00,
经常吃水煮蛋是养肝还是伤肝,121890.0,2024-06-10 07:00,
老破小二手房突然火了,105788.0,2024-06-10 07:00,
高铁上拒绝了宝妈的换座要求,92769.0,2024-06-10 07:00,
3个洗碗坏习惯或增加患癌风险,61804.0,2024-06-10 07:00,
紧急提醒这种粽子绳有毒,56718.0,2024-06-10 07:00,
金价大跌消费者还想再等等,55690.0,2024-06-10 07:00,
张翰当伴郎,54785.0,2024-06-10 07:00,
宋丹丹问董璇谈恋爱了不,43582.0,2024-06-10 07:00,
窝囊废赛道挤满了男明星,42822.0,2024-06-10 07:00,
高考再见,32995.0,2024-06-10 07:00,
黄晓明的眼神比大学生都清澈,42714.0,2024-06-10 07:00,
高考下一章 墨雨云间,41242.0,2024-06-10 07:00,
相亲对象对我隐瞒了学历,40480.0,2024-06-10 07:00,
玫瑰的故事,39312.0,2024-06-10 07:00,
请问你俩不亲是谁的问题,37889.0,2024-06-10 07:00,
你常做的7件小事正在偷走骨头里的钙,34915.0,2024-06-10 07:00,
小警犬因太友好而被开除,34510.0,2024-06-10 07:00,
他做饭他被骂他委屈巴巴,33461.0,2024-06-10 07:00,
为什么离职的都去新疆了,32073.0,2024-06-10 07:00,
廊坊灭门案再开庭,31617.0,2024-06-10 07:00,
以色列,31013.0,2024-06-10 07:00,
白桃星座,30746.0,2024-06-10 07:00,
于正审美,30331.0,2024-06-10 07:00,
老师最不看好你 可你偏偏最争气,30325.0,2024-06-10 07:00,
中国零食饮料逐渐征服外国人,29034.0,2024-06-10 07:00,
真的和纸片人结婚了,28122.0,2024-06-10 07:00,
荣梓杉是今年中戏北电双第一,26821.0,2024-06-10 07:00,
大唐不夜城粽子人偶为游客送祝福,23040.0,2024-06-10 07:00,
墨雨云间,21695.0,2024-06-10 07:00,
姿态冒充Uzi,18524.0,2024-06-10 07:00,
