name,value,date,Unnamed: 3
拜登退选,2785661.0,2024-07-22 07:01,
特朗普回应拜登退选,984429.0,2024-07-22 07:01,
打卡课本里的大美中国,40491.0,2024-07-22 07:01,
见证历史,1413414.0,2024-07-22 07:01,
为什么现在很少看到灾难片了,441416.0,2024-07-22 07:01,
男子称给霸王茶姬差评后被找上门,323649.0,2024-07-22 07:01,
虎门一公职人员贩毒被执行死刑,244513.0,2024-07-22 07:01,
做过近视眼手术的人嘴都这么严吗,127440.0,2024-07-22 07:01,
张元英踩到安宥真的裙子,96860.0,2024-07-22 07:01,
博物馆的千年文物开花了,21135.0,2024-07-22 07:01,
五一广场车祸,455199.0,2024-07-22 07:01,
男女店内亲热被店家请离后给差评,351691.0,2024-07-22 07:01,
延迟退休,220672.0,2024-07-22 07:01,
胎儿检出超雄孕妇完成终止妊娠手术,179100.0,2024-07-22 07:01,
宝马回应临时加价4S店才交车,162647.0,2024-07-22 07:01,
黄子韬徐艺洋公开后秀恩爱,150997.0,2024-07-22 07:01,
特朗普称哈里斯更容易被击败,125162.0,2024-07-22 07:01,
长沙交警通报,118075.0,2024-07-22 07:01,
拜登,105404.0,2024-07-22 07:01,
拜登支持哈里斯竞选,101869.0,2024-07-22 07:01,
睡觉盖肚脐真的有必要吗,115058.0,2024-07-22 07:01,
男婴出生2天腿部青紫查出罕见病,107670.0,2024-07-22 07:01,
熬过4个易发胖时刻变瘦就容易了,100250.0,2024-07-22 07:01,
阳虚还是阴虚看出汗就能知道,95551.0,2024-07-22 07:01,
相柳小夭见的最后一面,88710.0,2024-07-22 07:01,
盗墓团伙要价1.8亿的文物被追回,81863.0,2024-07-22 07:01,
泰国队员想来中国队宿舍凉快,76442.0,2024-07-22 07:01,
业主群爱心红包被秒抢引公愤,75385.0,2024-07-22 07:01,
为啥鸡的身体零件比整只鸡贵,64030.0,2024-07-22 07:01,
悉尼一父亲救滚入轨道的婴儿车不幸死亡,62654.0,2024-07-22 07:01,
吃饭偶遇张婧仪做服务员,62274.0,2024-07-22 07:01,
王源回重庆不回家住的原因,58272.0,2024-07-22 07:01,
陕西塌桥一落水者因打开车窗获救,57820.0,2024-07-22 07:01,
中国奥数竞赛五连冠被美国队终结,56115.0,2024-07-22 07:01,
预制菜已经发展到这个地步了,55361.0,2024-07-22 07:01,
宋丹丹张新成演恋人,53365.0,2024-07-22 07:01,
TFBOYS发文支持王源,55842.0,2024-07-22 07:01,
赵露思直播怼脸镜头,54371.0,2024-07-22 07:01,
薛之谦压轴,47566.0,2024-07-22 07:01,
种地吧回应加人,44755.0,2024-07-22 07:01,
你为什么不买优衣库了,42914.0,2024-07-22 07:01,
宋茜回应花少6官宣,42535.0,2024-07-22 07:01,
出汗并不能帮身体排毒,39739.0,2024-07-22 07:01,
三中全会决定60条,39713.0,2024-07-22 07:01,
王俊凯电竞男主,38185.0,2024-07-22 07:01,
被奶奶的手机壳震惊到了,34936.0,2024-07-22 07:01,
高会,32422.0,2024-07-22 07:01,
南京大屠杀幸存者周智林老人去世,29524.0,2024-07-22 07:01,
陕西桥梁垮塌事故已致15人遇难,27921.0,2024-07-22 07:01,
张信哲演唱会,24648.0,2024-07-22 07:01,
