name,value,date,Unnamed: 3
平江特大暴雨,549798.0,2024-07-02 07:00,
拜登,362779.0,2024-07-02 07:00,
我们向前中国向上,26339.0,2024-07-02 07:00,
女子穿JK遭2男生偷拍嘲讽还直播,325651.0,2024-07-02 07:00,
第一次见男二不爱女主爱发疯的,171397.0,2024-07-02 07:00,
法国vs比利时,166763.0,2024-07-02 07:00,
马斯克回应中国小女孩报bug,147400.0,2024-07-02 07:00,
韩国第二大城市釜山进入消失阶段,109616.0,2024-07-02 07:00,
朋友圈先仅自己可见三天后再公开,89406.0,2024-07-02 07:00,
刘亦菲唐嫣合照,84891.0,2024-07-02 07:00,
李敏镐肿了,478745.0,2024-07-02 07:00,
医院认定死亡后中国羽协仍尝试转院,270336.0,2024-07-02 07:00,
官方回应吃播卤羊头内吃出草,226295.0,2024-07-02 07:00,
欧阳龙嘴对嘴亲欧阳妮妮,188247.0,2024-07-02 07:00,
中羽协将为张志杰家人提供帮助,160479.0,2024-07-02 07:00,
陈乔恩教于正葡萄柚减肥法,86200.0,2024-07-02 07:00,
人教版大熊猫vs妈教版大熊猫,71825.0,2024-07-02 07:00,
张志杰比赛中猝死谁之过,61153.0,2024-07-02 07:00,
张杰这次像牵女儿了,61039.0,2024-07-02 07:00,
韩庚谈和粉丝20年之约,52743.0,2024-07-02 07:00,
林生斌,227582.0,2024-07-02 07:00,
长期熬夜会增加身体核心器官负担,221837.0,2024-07-02 07:00,
空调长期不洗男子肺部感染险丧命,178277.0,2024-07-02 07:00,
林生斌与亡妻关联公司均经营异常,117477.0,2024-07-02 07:00,
Angelababy庆祝香港回归27周年,82880.0,2024-07-02 07:00,
洗脸巾就是免费的冰箱除味剂,80884.0,2024-07-02 07:00,
情侣同居不同房是怎样的,74336.0,2024-07-02 07:00,
年轻护士在三甲医院6年后裸辞逃离,73228.0,2024-07-02 07:00,
中企人员在菲被绑架付300万后仍遇害,60965.0,2024-07-02 07:00,
唐艺昕带娃外出,48956.0,2024-07-02 07:00,
孙颖莎想和埃菲尔铁塔合影,48890.0,2024-07-02 07:00,
檀健次真的是天选相柳,46461.0,2024-07-02 07:00,
心脏骤停黄金抢救时间是4分钟,44218.0,2024-07-02 07:00,
先别管猫了快去救车厘子,43755.0,2024-07-02 07:00,
入住酒店千万要小心,43599.0,2024-07-02 07:00,
3类运动容易引发运动性猝死,43045.0,2024-07-02 07:00,
专家称心肺复苏任重道远,39721.0,2024-07-02 07:00,
外交部回应张志杰离世,38174.0,2024-07-02 07:00,
黄景瑜有疯批男主那味儿了,37960.0,2024-07-02 07:00,
黄子韬曾说30岁会考虑成家,37039.0,2024-07-02 07:00,
恋爱脑的本质是注意力的失控,35832.0,2024-07-02 07:00,
半夜点吃的外卖小哥会不高兴吗,35120.0,2024-07-02 07:00,
菲律宾绑架,34689.0,2024-07-02 07:00,
平江,34238.0,2024-07-02 07:00,
崔泰俊ZICO聊天内容,33286.0,2024-07-02 07:00,
西安西二环路面塌陷,33143.0,2024-07-02 07:00,
张子墨 自摸哥,31764.0,2024-07-02 07:00,
湖南平江发布抗击特大洪水通告,30975.0,2024-07-02 07:00,
欧洲杯,28610.0,2024-07-02 07:00,
林志颖一家五口游迪士尼,28508.0,2024-07-02 07:00,
