name,value,date,Unnamed: 3
小米定金事件暴露了成年人的耍赖心态,1529922.0,2024-04-07 21:16,
我倒要看看25年元旦会怎么调休,1162656.0,2024-04-07 21:16,
海南首个卫星超级工厂项目加快推动,60367.0,2024-04-07 21:16,
谢帝,1130894.0,2024-04-07 21:16,
追她呀 她旺你,1004026.0,2024-04-07 21:16,
TES零封JDG,678468.0,2024-04-07 21:16,
差点忘了林更新跟胡歌刘诗诗是同一批的,651357.0,2024-04-07 21:16,
以色列大规模撤军,380994.0,2024-04-07 21:16,
1L康师傅冰红茶涨到5元,558145.0,2024-04-07 21:16,
河南省考成绩出之前我的心情belike,165873.0,2024-04-07 21:16,
下班以后最轻松的副业,552573.0,2024-04-07 21:16,
眼泪女王,540867.0,2024-04-07 21:16,
陈学冬 不会退圈死心吧,487183.0,2024-04-07 21:16,
去世的妈坐牢的爸破碎的他,484038.0,2024-04-07 21:16,
TES对战JDG,431320.0,2024-04-07 21:16,
追风者结局,430116.0,2024-04-07 21:16,
女性的小肚子是为了保护子宫卵巢,379753.0,2024-04-07 21:16,
赵丽颖戴在人间口罩,356374.0,2024-04-07 21:16,
第一批去埃及旅行的人快被骗到裸奔了,350347.0,2024-04-07 21:16,
想当行长继承家产男孩父亲确为行长,226592.0,2024-04-07 21:16,
23岁没谈过恋爱正常吗,564331.0,2024-04-07 21:16,
中医建议女生春天多披头散发,329920.0,2024-04-07 21:16,
肖战长发侧颜库存,315241.0,2024-04-07 21:16,
宫崎骏 再见了我的朋友,297167.0,2024-04-07 21:16,
赵丽颖360度无死角,292408.0,2024-04-07 21:16,
王一博粉丝 不愿意就算了,288446.0,2024-04-07 21:16,
订婚时三金里面的手镯被偷了,268470.0,2024-04-07 21:16,
成都文旅还没反应过来 迪士尼建好了,228388.0,2024-04-07 21:16,
日本名将说和国乒技术差距没那么大,182334.0,2024-04-07 21:16,
教授建议小学低年级免去考试和成绩,145255.0,2024-04-07 21:16,
赵丽颖工作室玩梗沈璃,291727.0,2024-04-07 21:16,
林更新 我一人可抵千军万马,225620.0,2024-04-07 21:16,
眼泪女王 超前点播,222436.0,2024-04-07 21:16,
追风者黄秘书下线,214698.0,2024-04-07 21:16,
高铁会惩罚每个苹果用户,207790.0,2024-04-07 21:16,
成龙称心里会惊讶已经70岁,195174.0,2024-04-07 21:16,
我打宿傩,190481.0,2024-04-07 21:16,
午睡超1小时死亡风险增加30%,190064.0,2024-04-07 21:16,
手术直播间 咖啡过量小心肾衰竭,188982.0,2024-04-07 21:16,
江苏致4死火灾事故宣判4人被追刑责,115566.0,2024-04-07 21:16,
5天年假折现了6千多,178622.0,2024-04-07 21:16,
确认关系前要跟对方说清楚的话,176519.0,2024-04-07 21:16,
干眼症原来缺的是油不是水,174731.0,2024-04-07 21:16,
小萌兰帮奶爸收猫全过程,174286.0,2024-04-07 21:16,
网恋男约我出去旅游说订双床房,169212.0,2024-04-07 21:16,
李莲花 月影皓白,167771.0,2024-04-07 21:16,
追风者,167666.0,2024-04-07 21:16,
关于被选中做刘亦菲替身这件事,160488.0,2024-04-07 21:16,
关于民法典婚姻家庭编公开征求意见,90551.0,2024-04-07 21:16,
新疆拜城5.4级地震,81236.0,2024-04-07 21:16,
