name,value,date,Unnamed: 3
李承铉给离婚的爸妈订同一间房,972149.0,2024-06-10 21:02,
黑神话,585820.0,2024-06-10 21:02,
被中国皮影戏的灵动征服了,56879.0,2024-06-10 21:02,
彭冠英下线林更新上线,787514.0,2024-06-10 21:02,
韩国罕见展出500年前王室印玺,513238.0,2024-06-10 21:02,
发现一直玩手机真的很恐怖,510399.0,2024-06-10 21:02,
庄国栋有未婚妻,736514.0,2024-06-10 21:02,
墨雨云间这段刘亦菲10年前就意识到了,624659.0,2024-06-10 21:02,
高考47年来裸分最高的考生是谁,277422.0,2024-06-10 21:02,
大三女生捐造血干细胞说没啥可犹豫的,26986.0,2024-06-10 21:02,
96年28岁其实挺小的,1122083.0,2024-06-10 21:02,
双方都对这个吻感到恶心,575696.0,2024-06-10 21:02,
张艺兴一口气发了12首新歌试听,565887.0,2024-06-10 21:02,
刘亦菲新剧口碑逆跌,554555.0,2024-06-10 21:02,
墨雨云间硬控台湾网友,450876.0,2024-06-10 21:02,
OMG,259912.0,2024-06-10 21:02,
黑神话悟空,248032.0,2024-06-10 21:02,
BLG,245926.0,2024-06-10 21:02,
因为是牛马所以换公司叫跳槽,228724.0,2024-06-10 21:02,
法国总统宣布解散国民议会,206030.0,2024-06-10 21:02,
分手一年多了前任一直在用亲情卡,445387.0,2024-06-10 21:02,
Angelababy汉服少女,433339.0,2024-06-10 21:02,
边杰没死,398575.0,2024-06-10 21:02,
肖战放饭,351467.0,2024-06-10 21:02,
SM将追究EXOCBX法律责任,340588.0,2024-06-10 21:02,
在爸爸去世后我发现了收养证明,340449.0,2024-06-10 21:02,
杨紫李现国色芳华没有停拍,278114.0,2024-06-10 21:02,
黄亦玫苏苏这门亲事我同意,236180.0,2024-06-10 21:02,
你的考公对手可能是你老师,192804.0,2024-06-10 21:02,
欧洲股市狂跌,165809.0,2024-06-10 21:02,
林更新丁宁互关了,287502.0,2024-06-10 21:02,
黄日莹回应脸部受伤,218295.0,2024-06-10 21:02,
林一因为刘亦菲住在评论区了,202736.0,2024-06-10 21:02,
你俩都到互穿里衣的程度了,198726.0,2024-06-10 21:02,
BTS成员为迎接金硕珍退伍申请休假,189485.0,2024-06-10 21:02,
黄亦玫遭男友冷暴力,184708.0,2024-06-10 21:02,
李晨身体年龄只有三十岁左右,183442.0,2024-06-10 21:02,
卖不完的粽子去哪儿了,146294.0,2024-06-10 21:02,
国足,141838.0,2024-06-10 21:02,
月薪三千五一顿饭不超过五块,139662.0,2024-06-10 21:02,
赵丽颖端午放饭了,173206.0,2024-06-10 21:02,
Cube回应解约,154429.0,2024-06-10 21:02,
魏晨坦言不喜欢自己,149681.0,2024-06-10 21:02,
易烊千玺演过少年屈原,144574.0,2024-06-10 21:02,
南京公安龙舟队3个项目均未进决赛,134896.0,2024-06-10 21:02,
阿狸啊阿狸别看玫瑰了,131994.0,2024-06-10 21:02,
这样睡10分钟可抵2小时,125982.0,2024-06-10 21:02,
孙兴慜说对阵国足会全力争胜,116369.0,2024-06-10 21:02,
公司端午节就发了一个咸鸭蛋,113030.0,2024-06-10 21:02,
端午假期国内出游1.1亿人次,95837.0,2024-06-10 21:02,
