name,value,date,Unnamed: 3
瑞幸回应喝西梅美式腹泻,950403.0,2024-06-18 21:01,
科大讯飞内部通报员工去世,849424.0,2024-06-18 21:01,
治沙尖子生的解题新思路,34110.0,2024-06-18 21:01,
张杰谢娜临时公开恋情的原因,1146527.0,2024-06-18 21:01,
林更新微博评论,689119.0,2024-06-18 21:01,
宝鸡地震,311843.0,2024-06-18 21:01,
霍建华 偷偷哭,500839.0,2024-06-18 21:01,
徐娇回应不敢搂刘诗诗,475558.0,2024-06-18 21:01,
看中医 不要化妆,301963.0,2024-06-18 21:01,
税务部门没有倒查20年30年的安排,295526.0,2024-06-18 21:01,
鞠婧祎 到期不续,1781991.0,2024-06-18 21:01,
中餐厅 虞书欣,418039.0,2024-06-18 21:01,
黄亦玫生孩子婆婆不让打无痛,369629.0,2024-06-18 21:01,
两架波音747飞机将被打折拍卖,243242.0,2024-06-18 21:01,
还好不是刘亦菲,223008.0,2024-06-18 21:01,
男子为快速入睡吃了40多片安眠药,200877.0,2024-06-18 21:01,
考公斯坦福博士本科为中科大,135073.0,2024-06-18 21:01,
618挑战100元能买多少好东西,70025.0,2024-06-18 21:01,
土耳其 格鲁吉亚,190134.0,2024-06-18 21:01,
好看的裙子 无袖,187508.0,2024-06-18 21:01,
存了8万后变成了病态省钱,684952.0,2024-06-18 21:01,
彭昱畅想考驾照的心达到了顶峰,25178.0,2024-06-18 21:01,
张新成做了近视眼手术,350255.0,2024-06-18 21:01,
鞠婧祎工作室回复粉丝,202394.0,2024-06-18 21:01,
于正 我承认我错了,198503.0,2024-06-18 21:01,
严浩翔几乎成名,188898.0,2024-06-18 21:01,
张云龙曾舜晞曾拒演墨雨云间,173242.0,2024-06-18 21:01,
500万彩票大奖无人领,160518.0,2024-06-18 21:01,
如何看待餐厅公开产品身份证,157103.0,2024-06-18 21:01,
中国跳水队游泳队巴黎奥运名单公示,63021.0,2024-06-18 21:01,
养了6年的兔子给我做了个窝,176568.0,2024-06-18 21:01,
十个勤天帆布包,153277.0,2024-06-18 21:01,
方协文当着黄亦玫的面和妈妈说方言,152522.0,2024-06-18 21:01,
周深曾说等了张杰8年,148227.0,2024-06-18 21:01,
王星越他超爱,148082.0,2024-06-18 21:01,
奔跑吧下期最强社团争霸赛,142358.0,2024-06-18 21:01,
京东618最后4小时,27951.0,2024-06-18 21:01,
华为考虑在鸿蒙应用商店收取20%佣金,137058.0,2024-06-18 21:01,
梅州一干部疏散转移群众中因公殉职,134862.0,2024-06-18 21:01,
玫瑰的故事25,128160.0,2024-06-18 21:01,
鞠婧祎的时间参照物是什么,125432.0,2024-06-18 21:01,
晨尿发黄是肾有问题吗,124926.0,2024-06-18 21:01,
原来不用剧烈运动也能瘦,121723.0,2024-06-18 21:01,
高铁晚点 补偿,120269.0,2024-06-18 21:01,
日本食人菌大爆发感染超千例,118199.0,2024-06-18 21:01,
一汽丰田卡罗拉已不到8万,113836.0,2024-06-18 21:01,
林更新戏里偏执狂戏外柠檬精,112986.0,2024-06-18 21:01,
中餐厅,105994.0,2024-06-18 21:01,
丝芭传媒,104645.0,2024-06-18 21:01,
彭冠英的身材比例,103799.0,2024-06-18 21:01,
