name,value,date,Unnamed: 3
以色列,1176938.0,2024-06-09 21:17,
我爸以为有教资就能去学校当老师,1464094.0,2024-06-09 21:17,
铃声响起少年们告别了难忘的三年,115145.0,2024-06-09 21:17,
不接陌生电话但是要去微信搜,1073977.0,2024-06-09 21:17,
老师最不看好你 可你偏偏最争气,796803.0,2024-06-09 21:17,
真的和纸片人结婚了,692357.0,2024-06-09 21:17,
荣梓杉是今年中戏北电双第一,606056.0,2024-06-09 21:17,
郑州一小区发生火灾造成4人遇难,467572.0,2024-06-09 21:17,
玫瑰的故事,449547.0,2024-06-09 21:17,
乘警10秒救起掉站台缝隙女孩,38867.0,2024-06-09 21:17,
高考再见,443374.0,2024-06-09 21:17,
王传君拿错手机把志胜活儿拒了,366471.0,2024-06-09 21:17,
刘亦菲没待播剧了,329623.0,2024-06-09 21:17,
曾舜晞16岁放弃offer进入娱乐圈,322015.0,2024-06-09 21:17,
日本出现巨型章鱼,321659.0,2024-06-09 21:17,
高考刚结束男孩喜提新手机,312865.0,2024-06-09 21:17,
于正审美,310478.0,2024-06-09 21:17,
刘亦菲这段台词好适合准大学生,272951.0,2024-06-09 21:17,
中信集团副总经理徐佐被查,222562.0,2024-06-09 21:17,
主播多次违规直播福宝被终身禁入,212862.0,2024-06-09 21:17,
高铁上拒绝了宝妈的换座要求,588527.0,2024-06-09 21:17,
相亲对象对我隐瞒了学历,504344.0,2024-06-09 21:17,
墨雨云间,246231.0,2024-06-09 21:17,
刘亦菲5集换了32套造型,217491.0,2024-06-09 21:17,
边伯贤 不喜欢我就不要买我的票,201229.0,2024-06-09 21:17,
请问你俩不亲是谁的问题,195268.0,2024-06-09 21:17,
走走停停,194592.0,2024-06-09 21:17,
GenG冠军,191844.0,2024-06-09 21:17,
金价大跌消费者还想再等等,191019.0,2024-06-09 21:17,
墨雨云间让大学生神金合理了,188348.0,2024-06-09 21:17,
九尾双开门队服,203158.0,2024-06-09 21:17,
法网,177574.0,2024-06-09 21:17,
阿Sa徐明浩胃病,172542.0,2024-06-09 21:17,
黄亦玫的衣柜,165084.0,2024-06-09 21:17,
詹翌平接陈逸轩下考,154753.0,2024-06-09 21:17,
潮牌Champion为什么不火了,145730.0,2024-06-09 21:17,
Karina开球,137841.0,2024-06-09 21:17,
猫表达爱的方式,135895.0,2024-06-09 21:17,
女子误将墓园认景区花1万拍婚纱,131077.0,2024-06-09 21:17,
李白发博轻舟已过万重山,123718.0,2024-06-09 21:17,
十个勤天演唱会抢票,121263.0,2024-06-09 21:17,
把单位发的粽香红茶当粽子煮了,119669.0,2024-06-09 21:17,
魏大勋石家庄活动,115677.0,2024-06-09 21:17,
陈都灵张凌赫狐妖封面,105445.0,2024-06-09 21:17,
我知道你是一只小狸猫,105042.0,2024-06-09 21:17,
妈妈考场外用一排爱豆照片迎接女儿,104630.0,2024-06-09 21:17,
清华博主称今年高分段会非常聚集,104146.0,2024-06-09 21:17,
毕业歌会,103919.0,2024-06-09 21:17,
蔡徐坤顺毛侧颜,101549.0,2024-06-09 21:17,
墨雨云间18集预告,97087.0,2024-06-09 21:17,
