name,value,date,Unnamed: 3
大麦网已退票退款,1402321.0,2024-04-24 21:01,
玲花 维权是你们的权利,1171269.0,2024-04-24 21:01,
万千气象看上海,5421.0,2024-04-24 21:01,
五月天假唱风波调查近5个月没结果,1032279.0,2024-04-24 21:01,
福宝已开始在外场采食,897142.0,2024-04-24 21:01,
金价下跌有人卖了一百多万金条,587602.0,2024-04-24 21:01,
日本地震,551613.0,2024-04-24 21:01,
周琦,500606.0,2024-04-24 21:01,
陶昕然妈妈每天要吃够25种颜色,474582.0,2024-04-24 21:01,
手机里存了3个月的照片终于删了,268916.0,2024-04-24 21:01,
被评最美公务员干部被曝曾殴打残疾人,750266.0,2024-04-24 21:01,
秦海璐霸总小说书单,465518.0,2024-04-24 21:01,
承欢记大结局,444204.0,2024-04-24 21:01,
Angelababy狼尾超短发,432470.0,2024-04-24 21:01,
长期吃铝包子或引发肝肾损伤,406479.0,2024-04-24 21:01,
iPhone15频降价引吐槽,333079.0,2024-04-24 21:01,
周琦停赛2场罚款10万,297948.0,2024-04-24 21:01,
张予曦三公造型曝光,297731.0,2024-04-24 21:01,
五月天官宣鸟巢开十场,288252.0,2024-04-24 21:01,
杨幂原声台词有无字幕对比,270688.0,2024-04-24 21:01,
这些人工合成水果又出来骗人了,278158.0,2024-04-24 21:01,
实习生紧急撤回一个微笑,262450.0,2024-04-24 21:01,
赵丽颖林更新缘分开始的地方,258078.0,2024-04-24 21:01,
贾斯汀比伯为好友遭遇抢劫中枪身亡发声,248522.0,2024-04-24 21:01,
22岁的我不舍得吃20块的外卖,246188.0,2024-04-24 21:01,
田馥甄天津泡泡岛音乐节,240316.0,2024-04-24 21:01,
浪3 白月光,209892.0,2024-04-24 21:01,
陶喆青岛,193521.0,2024-04-24 21:01,
乳腺疾病真的是被气出来的吗,184366.0,2024-04-24 21:01,
沈阳发生持刀伤人嫌犯被抓,111837.0,2024-04-24 21:01,
姚志明父亲车祸去世,186627.0,2024-04-24 21:01,
买凤凰传奇柱子票获鸟巢票粉丝发声,182563.0,2024-04-24 21:01,
东亚小孩其实很容易原谅父母,174338.0,2024-04-24 21:01,
这些退货理由是要把人笑死吗,157359.0,2024-04-24 21:01,
丁俊晖 世锦赛,155797.0,2024-04-24 21:01,
高君雨全网账号被禁,152530.0,2024-04-24 21:01,
华为Pura70已修复AI消除衣服bug,152409.0,2024-04-24 21:01,
福宝,150585.0,2024-04-24 21:01,
孔刘宋慧乔或合作新剧,150032.0,2024-04-24 21:01,
女校长诈骗学生家长5000万后自杀身亡,144449.0,2024-04-24 21:01,
布林肯抵达上海,141470.0,2024-04-24 21:01,
陈都灵回复饶雪漫,140018.0,2024-04-24 21:01,
玲花给买到柱子票的粉丝留了鸟巢的票,138769.0,2024-04-24 21:01,
朱梓骁把流星雨的戏服卖了,138629.0,2024-04-24 21:01,
狗头萝莉公开煎饼摊收支结余,122099.0,2024-04-24 21:01,
赵睿复出,117473.0,2024-04-24 21:01,
花少中热巴的美妆好物,115308.0,2024-04-24 21:01,
承欢记,109608.0,2024-04-24 21:01,
Z9原来是贼久的意思,39681.0,2024-04-24 21:01,
花少好友记冷场,104370.0,2024-04-24 21:01,
