name,value,date,Unnamed: 3
东航就林生斌隐私权案提起上诉,1324974.0,2024-07-01 18:15,
女子错转226万元陌生阿姨全退回,905176.0,2024-07-01 18:15,
铸牢共同体中华一家亲,34998.0,2024-07-01 18:15,
有班味这么重的皇后进入国产剧,690058.0,2024-07-01 18:15,
朋友圈先仅自己可见三天后再公开,646164.0,2024-07-01 18:15,
外交部回应张志杰离世,1608050.0,2024-07-01 18:15,
林丹曾吐槽国际羽联,784020.0,2024-07-01 18:15,
韩国一女职员因涉厌男手势被停职,555699.0,2024-07-01 18:15,
小酥肉为何成了火锅店必点菜,528844.0,2024-07-01 18:15,
民警说在南京夫子庙小孩肯定丢不了,88772.0,2024-07-01 18:15,
张志杰去世,567902.0,2024-07-01 18:15,
汪苏泷说歌手是一场舆论的狂欢,502948.0,2024-07-01 18:15,
50枚蛇蛋及眼镜王蛇成功搬家,451750.0,2024-07-01 18:15,
2名中国企业管理人员菲律宾遇害,319474.0,2024-07-01 18:15,
JackeyLove 自费升舱,318835.0,2024-07-01 18:15,
长相思涂山璟红色婚服,301684.0,2024-07-01 18:15,
蒋敦豪官宣巡演,299224.0,2024-07-01 18:15,
王星越17年采访说自己17岁,291347.0,2024-07-01 18:15,
中方回应美称NASA未被邀请研究月壤,288289.0,2024-07-01 18:15,
林生斌与亡妻关联公司均经营异常,287104.0,2024-07-01 18:15,
爸爸考研成绩出来我焦虑了,494951.0,2024-07-01 18:15,
小酥肉一年卖出100亿,289072.0,2024-07-01 18:15,
徐志胜被孟子义整破防了,275244.0,2024-07-01 18:15,
林生斌,265497.0,2024-07-01 18:15,
KPL夏季赛第二轮赛程,238983.0,2024-07-01 18:15,
吴谨言曾给假粉签了五百张签名照,209605.0,2024-07-01 18:15,
李川 姐控,203386.0,2024-07-01 18:15,
张译在政法系统里走不出了,203061.0,2024-07-01 18:15,
B太称新疆行回程给司机大姐买机票,195493.0,2024-07-01 18:15,
李东海李赫宰担任TF三代导师,194012.0,2024-07-01 18:15,
一天熬过这2个发胖时段就能瘦,185908.0,2024-07-01 18:15,
于正曾想签下赵丽颖,180985.0,2024-07-01 18:15,
叶十七涂山璟上线,175520.0,2024-07-01 18:15,
猫咪陪男生全程读研后老师为它拨穗,159245.0,2024-07-01 18:15,
因为接受offer去工作被爸爸骂白养了,155847.0,2024-07-01 18:15,
林一晒白玉兰后台合照,151948.0,2024-07-01 18:15,
月入过万你还会考公考研吗,149227.0,2024-07-01 18:15,
菲律宾,146823.0,2024-07-01 18:15,
中国留学生在新西兰遭袭面部严重损伤,143467.0,2024-07-01 18:15,
董宇辉公司获广电节目制作许可,141557.0,2024-07-01 18:15,
在菲律宾遇害中企管理人员家属发声,136963.0,2024-07-01 18:15,
医生称张志杰恶性心律失常可能性很大,134684.0,2024-07-01 18:15,
俄媒称西方制裁反让俄赚至少2875亿美元,133308.0,2024-07-01 18:15,
三喜 改名,126460.0,2024-07-01 18:15,
美方似乎忘了沃尔夫条款存在,124949.0,2024-07-01 18:15,
赵丽颖胎毛刘海,124562.0,2024-07-01 18:15,
王星越方辟谣,122639.0,2024-07-01 18:15,
薛之谦什么时候再唱迟迟,120721.0,2024-07-01 18:15,
保罗乔治加盟76人,116465.0,2024-07-01 18:15,
女子在亲子更衣室淋浴后发现摄像头,113854.0,2024-07-01 18:15,
