name,value,date,Unnamed: 3
专家称调休时很多人在假装上班,943483.0,2024-02-04 18:15,
村民翻山越岭给滞留司机免费送吃喝,163177.0,2024-02-04 18:15,
让一切美好从立春开始,35641.0,2024-02-04 18:15,
杨波报平安,3675142.0,2024-02-04 18:15,
男子车祸昏迷护士雪地抢救半小时,128023.0,2024-02-04 18:15,
印度女星为假死道歉,677130.0,2024-02-04 18:15,
女孩雨雪天用手为女警暖耳朵,102748.0,2024-02-04 18:15,
杨波朋友圈,2952779.0,2024-02-04 18:15,
宝妈进群刷单5天被骗580万,503687.0,2024-02-04 18:15,
佟梦实是五竹叔,496697.0,2024-02-04 18:15,
睡觉吧 你俩过几天就成了,452694.0,2024-02-04 18:15,
美邦创始人回应女儿7年亏损32亿,341399.0,2024-02-04 18:15,
小义隐身,337380.0,2024-02-04 18:15,
奔驰男砸车前被白车顶了一下,325968.0,2024-02-04 18:15,
女子离婚冷静期间被丈夫杀害,317923.0,2024-02-04 18:15,
GOODBAI致歉,315644.0,2024-02-04 18:15,
美甲 约不上,306265.0,2024-02-04 18:15,
贾静雯女儿梧桐妹戴唇环舌环,267369.0,2024-02-04 18:15,
韩籍博士称中国电子支付需改进,265265.0,2024-02-04 18:15,
李庚希张婧仪 对眼睛好,259990.0,2024-02-04 18:15,
无畏辅助,253918.0,2024-02-04 18:15,
梅西替补,247463.0,2024-02-04 18:15,
王者荣耀孙尚香新皮肤,220162.0,2024-02-04 18:15,
麻辣烫为什么越来越高级了,210731.0,2024-02-04 18:15,
iPhone工作日闹钟今天没响,210123.0,2024-02-04 18:15,
周深又穿了半永久春晚羽绒服,206102.0,2024-02-04 18:15,
王睡睡新恋综,205640.0,2024-02-04 18:15,
邓紫棋与贝克汉姆合影,202766.0,2024-02-04 18:15,
大乔乘龙忆丹青新皮肤,202279.0,2024-02-04 18:15,
被困高速十几小时车主发声,122585.0,2024-02-04 18:15,
奔驰加塞事件正面7分钟监控曝光,195744.0,2024-02-04 18:15,
白鹿调休受害人,194321.0,2024-02-04 18:15,
南京Hero 幽默,189758.0,2024-02-04 18:15,
世界之外新卡池,187737.0,2024-02-04 18:15,
韩网评张佳宁穿朝鲜族服饰,187421.0,2024-02-04 18:15,
朱正廷问李权哲丢不丢人,175321.0,2024-02-04 18:15,
JDG对战LNG,162430.0,2024-02-04 18:15,
Hero对战VG,157429.0,2024-02-04 18:15,
林亦扬殷果冰箱吻,154057.0,2024-02-04 18:15,
小狗自己困了还要哄小熊睡觉,142746.0,2024-02-04 18:15,
甲辰年,137273.0,2024-02-04 18:15,
多地中小学教师被要求寒假期间值班,134004.0,2024-02-04 18:15,
如果侦探小说的主角是真正的凶手,130808.0,2024-02-04 18:15,
仙剑三龙年春晚重聚,129316.0,2024-02-04 18:15,
武大性骚扰事件男方首度发声,126713.0,2024-02-04 18:15,
hero抢龙要靠辅助,125577.0,2024-02-04 18:15,
迪丽热巴官宣百花迎春晚会,123214.0,2024-02-04 18:15,
明明有精神病但能表现得像正常人,119558.0,2024-02-04 18:15,
2月4日16时27分迎立春,118631.0,2024-02-04 18:15,
专家建议尽快推出平准基金,113931.0,2024-02-04 18:15,
