name,value,date,Unnamed: 3
周杰伦一审败诉网易,838605.0,2024-03-19 18:08,
张家界山上长满韩国人,656318.0,2024-03-19 18:08,
钢铁丝路好风光,27033.0,2024-03-19 18:08,
中国拥有亿元资产的家庭达13.3万户,1118842.0,2024-03-19 18:08,
除了医院谁还会这么算年龄,564945.0,2024-03-19 18:08,
海底捞玥,525423.0,2024-03-19 18:08,
为什么洗完头后容易炸毛,395303.0,2024-03-19 18:08,
庆余年,366732.0,2024-03-19 18:08,
蔡元培周末参加北大复试,277180.0,2024-03-19 18:08,
接下来杭州是这样的,84627.0,2024-03-19 18:08,
03年孩子爹出轨80年的女人,990489.0,2024-03-19 18:08,
当你早睡一次 你的器官,909590.0,2024-03-19 18:08,
安崎,634980.0,2024-03-19 18:08,
未满14岁男孩性侵女童为何不追究刑责,355530.0,2024-03-19 18:08,
赵丽颖回复李浩菲,353641.0,2024-03-19 18:08,
这真的是快50岁的何老师吗,351901.0,2024-03-19 18:08,
王一博工作室换头像背景,315451.0,2024-03-19 18:08,
洛杉矶偶遇贾玲,238772.0,2024-03-19 18:08,
李辉粲方回应涉嫌强制猥亵,223337.0,2024-03-19 18:08,
北大回应考生与前校长蔡元培同名,191990.0,2024-03-19 18:08,
洗头后最忌讳搓头发,292387.0,2024-03-19 18:08,
山东一学校惊现4层楼高视力表,41761.0,2024-03-19 18:08,
王鸥右手中指戴戒指,277458.0,2024-03-19 18:08,
陶昕然妈妈承认自己打孩子是虚荣,270549.0,2024-03-19 18:08,
萨巴伦卡男友去世,187598.0,2024-03-19 18:08,
金晨露腿,251647.0,2024-03-19 18:08,
安崎工作室辟谣霸凌,220552.0,2024-03-19 18:08,
赵丽颖神图的诞生,218152.0,2024-03-19 18:08,
我好像没有和男生当普通朋友的能力,211805.0,2024-03-19 18:08,
渤海发现1.04亿吨油田,45149.0,2024-03-19 18:08,
小米2023年营收2709.7亿,204124.0,2024-03-19 18:08,
Tabe回归加入AL,202690.0,2024-03-19 18:08,
你知道选择性缄默症吗,192071.0,2024-03-19 18:08,
下一个会消失的电子产品,191431.0,2024-03-19 18:08,
警方回应河北初中生被3名同学围殴,175213.0,2024-03-19 18:08,
Tods集团去年净利翻番,163480.0,2024-03-19 18:08,
牛仔裤外套屁帘到底谁在穿,162122.0,2024-03-19 18:08,
李辉粲涉嫌强制猥亵,161722.0,2024-03-19 18:08,
半熟恋人3 喜欢和不喜欢好明显,157545.0,2024-03-19 18:08,
内江地震,147081.0,2024-03-19 18:08,
大学生的点餐群真的别太好笑,151851.0,2024-03-19 18:08,
男孩学校遭霸凌父母讨说法被踢出群,309284.0,2024-03-19 18:08,
95后女生靠气球年营收上百万,136364.0,2024-03-19 18:08,
13岁男孩性侵8岁女童后已返校上课,1871189.0,2024-03-19 18:08,
王梓薇晒与赵丽颖合照,145747.0,2024-03-19 18:08,
王树国不再担任西安交通大学校长,144973.0,2024-03-19 18:08,
13岁男孩性侵8岁女童警方不予立案,1838151.0,2024-03-19 18:08,
爸爸接女儿放学用斗舞对暗号,32741.0,2024-03-19 18:08,
当代人APP使用现状,144536.0,2024-03-19 18:08,
玉兰花开,143864.0,2024-03-19 18:08,
