name,value,date,Unnamed: 3
董宇辉称非常反感被叫网红,168708.0,2024-06-10 04:16,
刘亦菲头像,71214.0,2024-06-10 04:16,
一批诋毁企业形象账号被处置,16781.0,2024-06-10 04:16,
女子注射400支玻尿酸丰臀致臀部感染,97100.0,2024-06-10 04:16,
陈雨浓孙程潇吵架,65242.0,2024-06-10 04:16,
不接陌生电话但是要去微信搜,62305.0,2024-06-10 04:16,
潮牌Champion为什么不火了,37699.0,2024-06-10 04:16,
刘亦菲5集换了32套造型,37613.0,2024-06-10 04:16,
法网,29053.0,2024-06-10 04:16,
苏炳添回应帅气高考生喊话,6416.0,2024-06-10 04:16,
殷罡逝世,166123.0,2024-06-10 04:16,
女子厕所装百叶窗走光3年浑然不知,87784.0,2024-06-10 04:16,
新女团成员上节目被开黄腔,63445.0,2024-06-10 04:16,
玫瑰的故事,34109.0,2024-06-10 04:16,
墨雨云间,33145.0,2024-06-10 04:16,
彭冠英嘻嘻徐海乔不嘻嘻,33026.0,2024-06-10 04:16,
真的和纸片人结婚了,30985.0,2024-06-10 04:16,
我爸以为有教资就能去学校当老师,28787.0,2024-06-10 04:16,
以色列,25266.0,2024-06-10 04:16,
原伟东称曾遭牙签扎指甲逼供,24298.0,2024-06-10 04:16,
高铁上拒绝了宝妈的换座要求,41223.0,2024-06-10 04:16,
3个洗碗坏习惯或增加患癌风险,27320.0,2024-06-10 04:16,
经常吃水煮蛋是养肝还是伤肝,26523.0,2024-06-10 04:16,
老破小二手房突然火了,26173.0,2024-06-10 04:16,
高考下一章 墨雨云间,25474.0,2024-06-10 04:16,
小警犬因太友好而被开除,25455.0,2024-06-10 04:16,
黄晓明的眼神比大学生都清澈,24756.0,2024-06-10 04:16,
紧急提醒这种粽子绳有毒,23314.0,2024-06-10 04:16,
张翰当伴郎,23034.0,2024-06-10 04:16,
高考再见,19907.0,2024-06-10 04:16,
于正审美,22625.0,2024-06-10 04:16,
早田希娜女单冠军,22381.0,2024-06-10 04:16,
窝囊废赛道挤满了男明星,20385.0,2024-06-10 04:16,
他做饭他被骂他委屈巴巴,20140.0,2024-06-10 04:16,
刘亦菲彭冠英踮脚吻,19597.0,2024-06-10 04:16,
金价大跌消费者还想再等等,18931.0,2024-06-10 04:16,
廊坊灭门案再开庭,18798.0,2024-06-10 04:16,
为什么离职的都去新疆了,18493.0,2024-06-10 04:16,
用李现照片当成相亲对象发给老爸,18272.0,2024-06-10 04:16,
荣梓杉是今年中戏北电双第一,17202.0,2024-06-10 04:16,
中国零食饮料逐渐征服外国人,17024.0,2024-06-10 04:16,
老师最不看好你 可你偏偏最争气,16883.0,2024-06-10 04:16,
宋丹丹问董璇谈恋爱了不,16670.0,2024-06-10 04:16,
相亲对象对我隐瞒了学历,16429.0,2024-06-10 04:16,
植物大战僵尸杂交版,16065.0,2024-06-10 04:16,
请问你俩不亲是谁的问题,15328.0,2024-06-10 04:16,
姿态冒充Uzi,15269.0,2024-06-10 04:16,
白桃星座,14967.0,2024-06-10 04:16,
00后的毕业照好有宿命感,14889.0,2024-06-10 04:16,
胡夏把清华电视踢翻了,14163.0,2024-06-10 04:16,
