name,value,date,Unnamed: 3
日本地震,76425.0,2024-04-25 04:03,
男孩骑车失误刹车把手插进大腿里,65248.0,2024-04-25 04:03,
万千气象看山西,1950.0,2024-04-25 04:03,
花少第一站破碎的是张翰,48401.0,2024-04-25 04:03,
大麦网已退票退款,45485.0,2024-04-25 04:03,
章子怡 我的职业生涯不必在意,44754.0,2024-04-25 04:03,
唐家三少宣布停更,36679.0,2024-04-25 04:03,
以色列,35493.0,2024-04-25 04:03,
金价下跌有人卖了一百多万金条,31090.0,2024-04-25 04:03,
破镜重圆文,27144.0,2024-04-25 04:03,
狗头萝莉自曝找到员工了,77773.0,2024-04-25 04:03,
丁俊晖连续4年世锦赛首轮出局,55716.0,2024-04-25 04:03,
拼多多涉不正当竞争被判赔500万,38560.0,2024-04-25 04:03,
Angelababy狼尾超短发,31418.0,2024-04-25 04:03,
2000元人参泡酒15年后发芽了,31409.0,2024-04-25 04:03,
秦海璐霸总小说书单,28317.0,2024-04-25 04:03,
买长乘短是一种不折不扣的双输,25505.0,2024-04-25 04:03,
菠菜一定焯水后吃否则或引发肾损伤,23237.0,2024-04-25 04:03,
摩羯座最需要是自我认可,22121.0,2024-04-25 04:03,
春色寄情人,21766.0,2024-04-25 04:03,
男子多次性侵前女友11岁女儿获刑16年,77640.0,2024-04-25 04:03,
田馥甄发微博,67389.0,2024-04-25 04:03,
微信区分单删互删,39527.0,2024-04-25 04:03,
养7年狗被偷找到时只剩20斤残肢,26231.0,2024-04-25 04:03,
每天1杯柠檬水身体会有何变化,24291.0,2024-04-25 04:03,
身份证号码中包含X该如何买票,20831.0,2024-04-25 04:03,
承欢记大结局,18742.0,2024-04-25 04:03,
这些人工合成水果又出来骗人了,18450.0,2024-04-25 04:03,
玲花 维权是你们的权利,18158.0,2024-04-25 04:03,
卢昱晓冷艳千金妆,17330.0,2024-04-25 04:03,
深圳现暴雨天给绿植浇水引质疑,19775.0,2024-04-25 04:03,
读研就是在筛选过于较真的人,17232.0,2024-04-25 04:03,
ive预告,16764.0,2024-04-25 04:03,
22岁的我不舍得吃20块的外卖,16730.0,2024-04-25 04:03,
生气时身体器官变化全过程,16447.0,2024-04-25 04:03,
被评最美公务员干部被曝曾殴打残疾人,15423.0,2024-04-25 04:03,
深圳暴雨,14555.0,2024-04-25 04:03,
小米回应SU7翼子板脱落原因,14506.0,2024-04-25 04:03,
大熊猫北辰随机迷晕一位姨姨,10615.0,2024-04-25 04:03,
周鸿祎问贾跃亭啥时候回国,14382.0,2024-04-25 04:03,
赵丽颖林更新缘分开始的地方,13775.0,2024-04-25 04:03,
神超直播,13656.0,2024-04-25 04:03,
老舅是张若昀的开关,13563.0,2024-04-25 04:03,
玲花 换位思考,13172.0,2024-04-25 04:03,
秦海璐刘涛 我带你梦想成真,12873.0,2024-04-25 04:03,
花少好友记冷场,12842.0,2024-04-25 04:03,
福宝已开始在外场采食,12724.0,2024-04-25 04:03,
手机里存了3个月的照片终于删了,12191.0,2024-04-25 04:03,
花芷分手数钱,11700.0,2024-04-25 04:03,
可以这样亲我吗李现,11274.0,2024-04-25 04:03,
