name,value,date,Unnamed: 3
拜登退选,687089.0,2024-07-22 04:18,
特朗普回应拜登退选,430825.0,2024-07-22 04:18,
打卡课本里的大美中国,15940.0,2024-07-22 04:18,
见证历史,450614.0,2024-07-22 04:18,
男子称给霸王茶姬差评后被找上门,109255.0,2024-07-22 04:18,
为什么现在很少看到灾难片了,89379.0,2024-07-22 04:18,
虎门一公职人员贩毒被执行死刑,51740.0,2024-07-22 04:18,
张元英踩到安宥真的裙子,39578.0,2024-07-22 04:18,
做过近视眼手术的人嘴都这么严吗,37607.0,2024-07-22 04:18,
陕西桥梁垮塌事故已致15人遇难,13243.0,2024-07-22 04:18,
五一广场车祸,148006.0,2024-07-22 04:18,
特朗普称哈里斯更容易被击败,85771.0,2024-07-22 04:18,
男女店内亲热被店家请离后给差评,76642.0,2024-07-22 04:18,
拜登支持哈里斯竞选,73836.0,2024-07-22 04:18,
拜登,62608.0,2024-07-22 04:18,
胎儿检出超雄孕妇完成终止妊娠手术,58192.0,2024-07-22 04:18,
黄子韬徐艺洋公开后秀恩爱,57584.0,2024-07-22 04:18,
长沙交警通报,54665.0,2024-07-22 04:18,
延迟退休,34619.0,2024-07-22 04:18,
宝马回应临时加价4S店才交车,31593.0,2024-07-22 04:18,
被奶奶的手机壳震惊到了,43119.0,2024-07-22 04:18,
睡觉盖肚脐真的有必要吗,36722.0,2024-07-22 04:18,
熬过4个易发胖时刻变瘦就容易了,32269.0,2024-07-22 04:18,
男婴出生2天腿部青紫查出罕见病,27947.0,2024-07-22 04:18,
TFBOYS发文支持王源,27912.0,2024-07-22 04:18,
阳虚还是阴虚看出汗就能知道,27442.0,2024-07-22 04:18,
为啥鸡的身体零件比整只鸡贵,26452.0,2024-07-22 04:18,
宋丹丹张新成演恋人,26442.0,2024-07-22 04:18,
悉尼一父亲救滚入轨道的婴儿车不幸死亡,26215.0,2024-07-22 04:18,
盗墓团伙要价1.8亿的文物被追回,25311.0,2024-07-22 04:18,
泰国队员想来中国队宿舍凉快,25733.0,2024-07-22 04:18,
陕西塌桥一落水者因打开车窗获救,24607.0,2024-07-22 04:18,
预制菜已经发展到这个地步了,23430.0,2024-07-22 04:18,
吃饭偶遇张婧仪做服务员,23288.0,2024-07-22 04:18,
种地吧回应加人,23012.0,2024-07-22 04:18,
王俊凯电竞男主,22639.0,2024-07-22 04:18,
薛之谦压轴,21998.0,2024-07-22 04:18,
南京大屠杀幸存者周智林老人去世,21451.0,2024-07-22 04:18,
宋茜回应花少6官宣,20815.0,2024-07-22 04:18,
三中全会决定60条,20054.0,2024-07-22 04:18,
赵露思直播怼脸镜头,19292.0,2024-07-22 04:18,
相柳小夭见的最后一面,18520.0,2024-07-22 04:18,
你为什么不买优衣库了,18118.0,2024-07-22 04:18,
王源回重庆不回家住的原因,17832.0,2024-07-22 04:18,
少年白马醉春风,16881.0,2024-07-22 04:18,
英雄联盟手游取消赵露思置顶,17843.0,2024-07-22 04:18,
高会,16013.0,2024-07-22 04:18,
中国奥数竞赛五连冠被美国队终结,15702.0,2024-07-22 04:18,
单依纯都搞唱跳了,15524.0,2024-07-22 04:18,
长沙,15443.0,2024-07-22 04:18,
