name,value,date,Unnamed: 3
养了6年的巨骨舌鱼把自己摔死了,101650.0,2024-06-06 04:19,
爱奇艺 线下免费线上收费,70945.0,2024-06-06 04:19,
我在五千年前等你,2381.0,2024-06-06 04:19,
官方回应B太长沙夜市打假,54072.0,2024-06-06 04:19,
高考很大可能是考得最好的一次,44113.0,2024-06-06 04:19,
李宇春 小宇,36157.0,2024-06-06 04:19,
斗鱼退缴主播非法收益超1亿,35761.0,2024-06-06 04:19,
王星越好帅,30735.0,2024-06-06 04:19,
2024高考,30266.0,2024-06-06 04:19,
都江堰已持续运行2280年,7053.0,2024-06-06 04:19,
王阳发文,58999.0,2024-06-06 04:19,
医院开展男性根浴服务被处罚,46087.0,2024-06-06 04:19,
朋友圈背景图,42467.0,2024-06-06 04:19,
蒋依依 远景,27439.0,2024-06-06 04:19,
刘恋和陈昊宇十年前就认识了,24398.0,2024-06-06 04:19,
5岁女童练舞站下腰摔倒致高位截瘫,22869.0,2024-06-06 04:19,
恢复一代,21434.0,2024-06-06 04:19,
印度总理莫迪提交辞呈,20694.0,2024-06-06 04:19,
王鹤棣继西瓜皮后又有神图,19923.0,2024-06-06 04:19,
老人被发现与小38岁保姆结婚后续,18768.0,2024-06-06 04:19,
亲姐姐总暗示我给外甥买东西,34697.0,2024-06-06 04:19,
没想到朋友圈置顶还能这么玩,29324.0,2024-06-06 04:19,
建议最近不要轻易离职,24782.0,2024-06-06 04:19,
为啥天天刷牙还有口臭,19820.0,2024-06-06 04:19,
终于知道饭店为什么要加葱香菜,18600.0,2024-06-06 04:19,
建议高考可以用大学作为考场,18004.0,2024-06-06 04:19,
B太 水果礼盒触碰了商家的逆鳞,17682.0,2024-06-06 04:19,
考王梁实称或是最后一次参加高考,17443.0,2024-06-06 04:19,
3类癌症不致命无需过度治疗,17395.0,2024-06-06 04:19,
你身上的狗味比我的还重,16816.0,2024-06-06 04:19,
公办中小学招聘不进编教师引关注,16689.0,2024-06-06 04:19,
王者貂蝉秒杀皮肤,16627.0,2024-06-06 04:19,
皮肤变好带给我的变化有多大,15897.0,2024-06-06 04:19,
摄影师拍陶昕然母女穿帮了,15407.0,2024-06-06 04:19,
情绪稳定的本质,15385.0,2024-06-06 04:19,
游客吐槽阿勒泰旅游太贵了,15381.0,2024-06-06 04:19,
斗鱼一季度亏损8800万元,15320.0,2024-06-06 04:19,
读研后对研究生祛魅了,15131.0,2024-06-06 04:19,
月经变少是卵巢衰老的信号吗,14604.0,2024-06-06 04:19,
重庆文旅发了肖战,14404.0,2024-06-06 04:19,
一不小心又被爸妈幽默到了,14261.0,2024-06-06 04:19,
yes24网站,13950.0,2024-06-06 04:19,
99年高三老师哭的比学生还伤心,13308.0,2024-06-06 04:19,
刘亦菲19岁时的采访,13196.0,2024-06-06 04:19,
歌手2024揭榜串讲人,13053.0,2024-06-06 04:19,
EXO和成员朋友见面必须通过允许,12709.0,2024-06-06 04:19,
leave闪现接箭,12291.0,2024-06-06 04:19,
邓为翻牌,12051.0,2024-06-06 04:19,
周大福有员工称收到N+3赔偿,12030.0,2024-06-06 04:19,
更好发挥住房公积金保障作用,11984.0,2024-06-06 04:19,
