name,value,date,Unnamed: 3
浙大百万网红陈娴已有多家公司,117103.0,2024-06-25 04:08,
尚雯婕冠军,74048.0,2024-06-25 04:08,
高铁火箭飞机的发展都与这门专业相关,13481.0,2024-06-25 04:08,
杜江霍思燕收养实验犬,99716.0,2024-06-25 04:08,
到底啥是city不city啊,57561.0,2024-06-25 04:08,
克罗地亚vs意大利,44606.0,2024-06-25 04:08,
辉子失误,62773.0,2024-06-25 04:08,
欧洲杯,34697.0,2024-06-25 04:08,
新说唱,45247.0,2024-06-25 04:08,
女生复读1年高考涨133分激动爆哭,11100.0,2024-06-25 04:08,
女子与男友发生关系后诬告对方强奸,84124.0,2024-06-25 04:08,
韩方通报遇难中国公民增至19人,64310.0,2024-06-25 04:08,
刘亦菲喝了黄玫瑰拿铁,42657.0,2024-06-25 04:08,
我不是小太阳啊,41063.0,2024-06-25 04:08,
某韩国男星性侵18岁女学生,36761.0,2024-06-25 04:08,
韩雪 难听,34444.0,2024-06-25 04:08,
桐岛爱,31931.0,2024-06-25 04:08,
酒桌上发出5.2万红包后悔了能要回吗,29398.0,2024-06-25 04:08,
韩方向中方表示哀悼,25991.0,2024-06-25 04:08,
唐尚珺高考成绩,25010.0,2024-06-25 04:08,
易猝死的人有4个共同点,47813.0,2024-06-25 04:08,
发现导师朋友圈只屏蔽了我,38694.0,2024-06-25 04:08,
方可给迪丽热巴做的盘发,26705.0,2024-06-25 04:08,
陈丽君 投票,25588.0,2024-06-25 04:08,
大碗宽面组团魂4年后居然还在,25034.0,2024-06-25 04:08,
终于有了一部全女主的剧,24764.0,2024-06-25 04:08,
EXO成员去了张艺兴演唱会,23377.0,2024-06-25 04:08,
唐治平疑似精神失常,22595.0,2024-06-25 04:08,
向佐发16个问号问黄子韬,22349.0,2024-06-25 04:08,
长沙1小时下了54个西湖,17926.0,2024-06-25 04:08,
外国博主打卡北京带火city不city,27611.0,2024-06-25 04:08,
月薪四千开始从孩子身上降本增效,22190.0,2024-06-25 04:08,
轻断食五天瘦了11斤,22078.0,2024-06-25 04:08,
山东卫视发了肖战,21299.0,2024-06-25 04:08,
韩国起火电池厂员工多来自东北朝鲜族,21083.0,2024-06-25 04:08,
toyoki的diss,19947.0,2024-06-25 04:08,
A股大跌,19150.0,2024-06-25 04:08,
女性一生中月经的次数变化,18830.0,2024-06-25 04:08,
网传荣梓杉高考成绩417分,18740.0,2024-06-25 04:08,
靳梦佳救场,18603.0,2024-06-25 04:08,
狗狗临走前被摸后果断离去,17426.0,2024-06-25 04:08,
榴莲的叶酸含量是苹果的30倍,17329.0,2024-06-25 04:08,
林一回应和刘亦菲合作,17197.0,2024-06-25 04:08,
王星越一把抱起了前夫哥,16810.0,2024-06-25 04:08,
李晋晔哽咽回应歌手争议,16430.0,2024-06-25 04:08,
江苏高考689分及以上107人,15913.0,2024-06-25 04:08,
快速对一个人祛魅的方式,15761.0,2024-06-25 04:08,
AI陶喆 泪桥,15039.0,2024-06-25 04:08,
长相思2定档,14977.0,2024-06-25 04:08,
长相思男团穿西装不告诉邓为,14657.0,2024-06-25 04:08,
