name,value,date,Unnamed: 3
刘亦菲回复林一,100812.0,2024-06-26 04:00,
男生查分后默默去做饭妈妈秒懂,82194.0,2024-06-26 04:00,
嫦娥六号返回器安全着陆,10931.0,2024-06-26 04:00,
清华告诉你北京到底有谁在,45626.0,2024-06-26 04:00,
MTJJ 弃养,40946.0,2024-06-26 04:00,
刘亦菲发文感谢所有人,44105.0,2024-06-26 04:00,
腾讯四连爆,43710.0,2024-06-26 04:00,
我考了696分我同桌考了703分,40712.0,2024-06-26 04:00,
那英 我根本记不住歌词,35473.0,2024-06-26 04:00,
发条微博缅怀邓稼先,10815.0,2024-06-26 04:00,
林一晒与刘亦菲合照,36260.0,2024-06-26 04:00,
裘德 歌手,34365.0,2024-06-26 04:00,
金靖刘胜瑛真的一起怀孕,32323.0,2024-06-26 04:00,
法国vs波兰,31691.0,2024-06-26 04:00,
罗小黑原型,31290.0,2024-06-26 04:00,
喜茶新品名小奶栀被指擦边,30843.0,2024-06-26 04:00,
男子用麻精药品迷奸多名女性被判无期,29685.0,2024-06-26 04:00,
喜茶 小奶栀,26347.0,2024-06-26 04:00,
只有川渝人才知道他演的有多像,24037.0,2024-06-26 04:00,
梁永棋抱着喝醉的王星越,21635.0,2024-06-26 04:00,
晚上睡不着和熬夜的区别有多大,91436.0,2024-06-26 04:00,
i人甚至都不敢看完,23650.0,2024-06-26 04:00,
不想腹部长赘肉8种食物少吃,22460.0,2024-06-26 04:00,
朋友圈可以屏蔽一个群的人,22074.0,2024-06-26 04:00,
凡尔赛男孩称考得不好全省排名一千多,20814.0,2024-06-26 04:00,
迪丽热巴这发际线,20263.0,2024-06-26 04:00,
被境外毒枭悬赏人头的缉毒警有话要说,19941.0,2024-06-26 04:00,
北京警方通报65岁男子捂女孩嘴,19367.0,2024-06-26 04:00,
韩国流行的半扎发方法,19285.0,2024-06-26 04:00,
赵露思旗袍,19141.0,2024-06-26 04:00,
别成为那个不愿被让座的人,18335.0,2024-06-26 04:00,
万茜怎么把编织袋穿身上了,18314.0,2024-06-26 04:00,
孙阳和网友吵起来了,18233.0,2024-06-26 04:00,
古茗logo,18167.0,2024-06-26 04:00,
长期不爱说话或说话少的后果,18129.0,2024-06-26 04:00,
周杰伦 DIOR活动,17898.0,2024-06-26 04:00,
吴奇隆晒照,17787.0,2024-06-26 04:00,
美术馆就玫瑰的故事丢失作品致歉,17447.0,2024-06-26 04:00,
黑龙江高考分数线,16759.0,2024-06-26 04:00,
宝石老舅已老实求放过,15788.0,2024-06-26 04:00,
双鱼座讨厌一个人全写在脸上,15677.0,2024-06-26 04:00,
金智媛台北活动,15418.0,2024-06-26 04:00,
丁当 揭榜,15279.0,2024-06-26 04:00,
涂山璟还是熟悉的那味儿,14999.0,2024-06-26 04:00,
正确改善驼背,14816.0,2024-06-26 04:00,
庄国栋等了黄亦玫20年,14674.0,2024-06-26 04:00,
日本卖的西瓜皮是谁啃的,14652.0,2024-06-26 04:00,
WBG更换首发辅助,14409.0,2024-06-26 04:00,
江西卫视发了王一博哭戏,14349.0,2024-06-26 04:00,
杜海涛想要个女儿,13609.0,2024-06-26 04:00,
