name,value,date,Unnamed: 3
建议取消高中学业水平考试科目,82546.0,2024-03-05 04:07,
女子刮彩票中一辆车没发现扭头就走,48525.0,2024-03-05 04:07,
100秒说两会,8934.0,2024-03-05 04:07,
他才4岁已经懂得了分别的滋味,59221.0,2024-03-05 04:07,
父亲心疼女儿被撞伤将床头柱锯掉,43557.0,2024-03-05 04:07,
海底捞宣布将推加盟特许经营模式,42431.0,2024-03-05 04:07,
委员建议放宽35岁就业年龄限制,34470.0,2024-03-05 04:07,
建议增加年轻人年假天数,26194.0,2024-03-05 04:07,
建议整治校园形式主义,25227.0,2024-03-05 04:07,
2024乘风破浪,22836.0,2024-03-05 04:07,
浪五开场 主播癫狂带货感,79023.0,2024-03-05 04:07,
蕾丝裙帘成年轻人新潮流,48696.0,2024-03-05 04:07,
9万粉丝英语博主因四级没过停更,34207.0,2024-03-05 04:07,
王鹤棣爆改王大锤,31761.0,2024-03-05 04:07,
炎亚纶成江宏杰许孟哲老板,30943.0,2024-03-05 04:07,
天蚕土豆直播码字一周胖三斤,29732.0,2024-03-05 04:07,
韩素希模特时期旧照,27730.0,2024-03-05 04:07,
28岁找工作被嫌弃年龄大,22818.0,2024-03-05 04:07,
iPad什么时候出,22221.0,2024-03-05 04:07,
苹果推M3芯片版MacBookAir,18996.0,2024-03-05 04:07,
睡前长期玩手机可能让你变丑,32711.0,2024-03-05 04:07,
杭州姑娘翻出60克金饰卖了3万元,27494.0,2024-03-05 04:07,
李一桐民国护士形象,18036.0,2024-03-05 04:07,
明星主播带不动货了,16852.0,2024-03-05 04:07,
全国政协委员建议取消入住酒店必须刷脸规定,16810.0,2024-03-05 04:07,
三月将要播的电视剧,16778.0,2024-03-05 04:07,
热辣滚烫延长上映,16267.0,2024-03-05 04:07,
体脂率下降的小习惯,16199.0,2024-03-05 04:07,
JackeyLove赛后发博,16133.0,2024-03-05 04:07,
全国两会五大看点,15210.0,2024-03-05 04:07,
现在年轻人婚前普遍都有存款吗,14856.0,2024-03-05 04:07,
练背把减肥的含金量拉满了,13773.0,2024-03-05 04:07,
金价又上涨了,13736.0,2024-03-05 04:07,
为何说今年是十四五的关键一年,13734.0,2024-03-05 04:07,
女孩公交卡掉进夹缝里司机掏出10块钱,13443.0,2024-03-05 04:07,
鞍山地震,13419.0,2024-03-05 04:07,
明道回应跟阮经天相像,13289.0,2024-03-05 04:07,
已婚女生找工作有多难,13167.0,2024-03-05 04:07,
睡前玩8分钟手机身体兴奋1小时,12658.0,2024-03-05 04:07,
真正还原美貌的化妆,12441.0,2024-03-05 04:07,
吴镇宇真是小嘴抹了鹤顶红,11533.0,2024-03-05 04:07,
网球王子 迹部景吾绝美,11393.0,2024-03-05 04:07,
及时止损 做回自己,11128.0,2024-03-05 04:07,
难哄路透,10605.0,2024-03-05 04:07,
牛顿我真的爱上你了,10284.0,2024-03-05 04:07,
全智贤仪态,10255.0,2024-03-05 04:07,
林允普拉提,9959.0,2024-03-05 04:07,
陈丽君浪姐路透,9541.0,2024-03-05 04:07,
贵女男主,9278.0,2024-03-05 04:07,
世界之外,9201.0,2024-03-05 04:07,
