name,value,date,Unnamed: 3
凯特,172007.0,2024-03-21 04:00,
天水麻辣烫成都分烫火到闭店,78290.0,2024-03-21 04:00,
这个春天祝你春风得意向阳花开,10929.0,2024-03-21 04:00,
素媛案罪犯赵斗淳又被判了,61136.0,2024-03-21 04:00,
花间令开始吓人了,50732.0,2024-03-21 04:00,
女子怀孕7个月刚独自待5分钟就倒地,49978.0,2024-03-21 04:00,
男生美国卖三蹦子首日进账1万美金,48718.0,2024-03-21 04:00,
关晓彤短发,48584.0,2024-03-21 04:00,
日媒称一中国富豪借给福原爱3亿日元,45354.0,2024-03-21 04:00,
鹿晗给自己整不好意思了,43035.0,2024-03-21 04:00,
东航致132人遇难事故调查进展发布,72735.0,2024-03-21 04:00,
为什么牙不好疾病满身跑,33751.0,2024-03-21 04:00,
2月龄男婴接种疫苗14天后死亡,31047.0,2024-03-21 04:00,
周杰伦方回应败诉,30870.0,2024-03-21 04:00,
最擅于隐藏情绪的星座,30833.0,2024-03-21 04:00,
刘学义光头造型,29083.0,2024-03-21 04:00,
金高银撑住了贴头皮造型,27665.0,2024-03-21 04:00,
汪东城你年龄是满40减20吗,26412.0,2024-03-21 04:00,
边伯贤 香港,25745.0,2024-03-21 04:00,
腾讯8款游戏年收入超40亿,25510.0,2024-03-21 04:00,
河北邯郸一高中生被同学打伤睾丸,36539.0,2024-03-21 04:00,
早上该先刷牙还是先吃早饭,26323.0,2024-03-21 04:00,
刘学义配角演了8年,24095.0,2024-03-21 04:00,
打工人开始尝试用刮刮乐打上班卡,24074.0,2024-03-21 04:00,
行云念了沈璃一辈子,23924.0,2024-03-21 04:00,
揭秘凯特王妃背后宫斗内幕,21973.0,2024-03-21 04:00,
越共中央批准越南国家主席武文赏辞职,21877.0,2024-03-21 04:00,
沪上阿姨紧急补货,20278.0,2024-03-21 04:00,
想瘦脸少不了练背,19351.0,2024-03-21 04:00,
自己买的房最不该考虑的就是客人,19253.0,2024-03-21 04:00,
冯小刚辟谣病危移民传言,28967.0,2024-03-21 04:00,
东航,19040.0,2024-03-21 04:00,
拼多多涨逾15%,19029.0,2024-03-21 04:00,
春分,17666.0,2024-03-21 04:00,
刘亦菲又在撕嘴皮,17329.0,2024-03-21 04:00,
戚薇的包是个方向盘,16935.0,2024-03-21 04:00,
iPhone16系列或实现更大显示屏,15765.0,2024-03-21 04:00,
沈璃红衣,15456.0,2024-03-21 04:00,
哪个价位的手机最值得买,15278.0,2024-03-21 04:00,
Uzi被提名LOL历史第二人,15154.0,2024-03-21 04:00,
肖战藏海传官服造型,14296.0,2024-03-21 04:00,
恋爱兄妹,14023.0,2024-03-21 04:00,
承欢记要来了,13723.0,2024-03-21 04:00,
出差时公司给定的儿童房,13488.0,2024-03-21 04:00,
杜海涛演戏,13138.0,2024-03-21 04:00,
龚俊邓为撞衫,13130.0,2024-03-21 04:00,
藏海传,13044.0,2024-03-21 04:00,
BLG四人亮天使致敬angel,12772.0,2024-03-21 04:00,
第一次知道刷牙后不用漱口,12679.0,2024-03-21 04:00,
林依晨 你,12141.0,2024-03-21 04:00,
