name,value,date,Unnamed: 3
央视网评秦朗丢寒假作业事件,173912.0,2024-02-21 04:00,
许凯报警,117215.0,2024-02-21 04:00,
航天员拍摄的蔚蓝地球,15123.0,2024-02-21 04:00,
肖战 请不要再蹲守了,137083.0,2024-02-21 04:00,
金晨 不存在白敬亭放鸽子,100895.0,2024-02-21 04:00,
cos赵世子男网红道歉,90358.0,2024-02-21 04:00,
目前票房前6都是跨界导演,78928.0,2024-02-21 04:00,
专家称现在不买房五年又白忙,64968.0,2024-02-21 04:00,
柳鑫宇发声,64029.0,2024-02-21 04:00,
乐华为王一博报警,57337.0,2024-02-21 04:00,
柳鑫宇自曝事件,56430.0,2024-02-21 04:00,
贾玲第一次正视自己的才华,54675.0,2024-02-21 04:00,
背薄真的显年轻,53362.0,2024-02-21 04:00,
刘涛演妈祖 掷圣杯,44297.0,2024-02-21 04:00,
中国女游客泰国搭摩托车险遭司机强暴,43440.0,2024-02-21 04:00,
当哈尔滨收起来玩具后的本地人,43000.0,2024-02-21 04:00,
冻雨,38204.0,2024-02-21 04:00,
曼谷偶遇刘恋庄达菲,35958.0,2024-02-21 04:00,
梅西AI,33108.0,2024-02-21 04:00,
后车想破头也不知道堵车原因是800只鹅,29870.0,2024-02-21 04:00,
毕业工作四年只存了4w块钱,37994.0,2024-02-21 04:00,
贾玲有七部待播作品,31093.0,2024-02-21 04:00,
虞书欣兔塑,28097.0,2024-02-21 04:00,
四六级成绩倒计时,27325.0,2024-02-21 04:00,
韩素希腰部纹身含义,26938.0,2024-02-21 04:00,
妈妈让我工作后每月给家里转三千,23456.0,2024-02-21 04:00,
多部门已介入核查柳鑫宇自曝事件,23232.0,2024-02-21 04:00,
贵州山火,22042.0,2024-02-21 04:00,
我好像连一万块都很难存下来,21741.0,2024-02-21 04:00,
钱学森写在香烟纸上的求救信,19860.0,2024-02-21 04:00,
工位越乱的员工稳定性越好,20579.0,2024-02-21 04:00,
百元之恋导演编剧祝贺贾玲,20285.0,2024-02-21 04:00,
肖战工作室倡议书,19716.0,2024-02-21 04:00,
男子游神现场cos赵世子被马夫鞭打,18932.0,2024-02-21 04:00,
十年前抽过的烟至今还在伤害免疫系统,17135.0,2024-02-21 04:00,
张佳宁点不掉的痣,16506.0,2024-02-21 04:00,
喜剧演员是对他最大的误解,16346.0,2024-02-21 04:00,
时代少年团开通B站账号,16193.0,2024-02-21 04:00,
贵州普安山火已致2人遇难,16191.0,2024-02-21 04:00,
江西菜是预制菜鄙视链的顶端,16151.0,2024-02-21 04:00,
不化妆素颜出门怎么变好看,16045.0,2024-02-21 04:00,
原来孙艺洲这么会开车,16010.0,2024-02-21 04:00,
乐莹跳楼戏拍了72遍用了第72条,15355.0,2024-02-21 04:00,
胖东来回应看完电影不满意可退半价,15022.0,2024-02-21 04:00,
考研成绩,14816.0,2024-02-21 04:00,
知道许昕家缺什么了缺观众席,14503.0,2024-02-21 04:00,
狗狗的耳朵一只站岗一只稍息,14166.0,2024-02-21 04:00,
授她以柄,13292.0,2024-02-21 04:00,
努力凑够400万可怜可怜他,13076.0,2024-02-21 04:00,
白鹿白月梵星婚服路透,11652.0,2024-02-21 04:00,
