name,value,date,Unnamed: 3
新疆惊现巨大哈密瓜为模型,755917.0,2024-07-16 20:18,
李东受贿1.08亿余元被判无期,307075.0,2024-07-16 20:18,
全面深化改革进行时,16618.0,2024-07-16 20:18,
秦彻 抄袭,1852389.0,2024-07-16 20:18,
女生剃光头蓄发5个月炸毛似海胆,615803.0,2024-07-16 20:18,
曝CUBE贷款续约gidle,409063.0,2024-07-16 20:18,
男子婚后每天6小时162公里跨城上班,342694.0,2024-07-16 20:18,
你多胖可能在妈妈肚子里就决定了,313980.0,2024-07-16 20:18,
FNC被曝让中国练习生陪酒,261751.0,2024-07-16 20:18,
一文梳理巴黎奥运中国队各项目看点,14884.0,2024-07-16 20:18,
梁博更新,464990.0,2024-07-16 20:18,
金在中姐姐为隐瞒领养不过生日,427903.0,2024-07-16 20:18,
在日本海上漂流36小时中国女生自述,365028.0,2024-07-16 20:18,
邓为钻石脸链,362939.0,2024-07-16 20:18,
中方回应万斯称中国是美国最大威胁,357078.0,2024-07-16 20:18,
苏醒薛之谦为梅西发声,309691.0,2024-07-16 20:18,
鞠婧祎官方对接,307922.0,2024-07-16 20:18,
鹿晗帮路人搬杠铃片,271414.0,2024-07-16 20:18,
上岸后发现教师这碗饭我真吃不了,238220.0,2024-07-16 20:18,
一时分不清是哪朵梨花香,198465.0,2024-07-16 20:18,
朋友圈真的不要留太多电子宠物,284406.0,2024-07-16 20:18,
薛之谦新歌预告怪诞童话,226062.0,2024-07-16 20:18,
王俊凯合照站成人形立牌,218933.0,2024-07-16 20:18,
朱旺旺边哭边拽假睫毛,217455.0,2024-07-16 20:18,
赤水丰隆才是玱玹的王后吧,209523.0,2024-07-16 20:18,
法国阿姨找王一博要签名,195058.0,2024-07-16 20:18,
邓超儿子好像段奕宏,187263.0,2024-07-16 20:18,
赵丽颖夏天穿好多,167974.0,2024-07-16 20:18,
买金条遭遇不发货不退款,165221.0,2024-07-16 20:18,
TF家族三代登陆日杀青,155233.0,2024-07-16 20:18,
陶喆 讨厌红楼梦,1006548.0,2024-07-16 20:18,
王嘉尔自曝很少有真心朋友,199522.0,2024-07-16 20:18,
广州地铁上有人开始卖黄皮了,154789.0,2024-07-16 20:18,
以前谈恋爱是要交换QQ密码的,153420.0,2024-07-16 20:18,
姆巴佩与皇马正式签约,145348.0,2024-07-16 20:18,
张纪中 很难杀的一位中国男人,145547.0,2024-07-16 20:18,
少年打球后心脏骤停一群医生冲了上去,144720.0,2024-07-16 20:18,
75岁独居老人1个月狂买38个快递,143852.0,2024-07-16 20:18,
吴昕不知道蒲熠星公开了女朋友,140833.0,2024-07-16 20:18,
特朗普右耳包扎绷带露面,124859.0,2024-07-16 20:18,
蒋敦豪 有e吗,133746.0,2024-07-16 20:18,
为什么年轻人越来越喜欢旅游,122866.0,2024-07-16 20:18,
抓娃娃票房破6亿,117164.0,2024-07-16 20:18,
拜登称同意9月与特朗普再次辩论,110694.0,2024-07-16 20:18,
TF家族2024夏日运动会先导片,108348.0,2024-07-16 20:18,
肖战YSL广告大片,105164.0,2024-07-16 20:18,
奇迹相柳,98406.0,2024-07-16 20:18,
中国茶饮登上国际媒体,96041.0,2024-07-16 20:18,
终于知道年轻人为啥爱养宠物了,95381.0,2024-07-16 20:18,
姆巴佩皇马亮相仪式,94657.0,2024-07-16 20:18,
上岸后发现教师这碗饭我真吃不了,888102.0,2024-07-16 20:45,
新疆惊现巨大哈密瓜为模型,556167.0,2024-07-16 20:45,
全面深化改革进行时,17414.0,2024-07-16 20:45,
秦彻 抄袭,1673764.0,2024-07-16 20:45,
在日本海上漂流36小时中国女生自述,473288.0,2024-07-16 20:45,
一文梳理巴黎奥运中国队各项目看点,29708.0,2024-07-16 20:45,
赤水丰隆才是玱玹的王后吧,469471.0,2024-07-16 20:45,
女生剃光头蓄发5个月炸毛似海胆,359836.0,2024-07-16 20:45,
曝CUBE贷款续约gidle,353671.0,2024-07-16 20:45,
暑期档电影票房破45亿,22076.0,2024-07-16 20:45,
金在中姐姐为隐瞒领养不过生日,597200.0,2024-07-16 20:45,
中方回应万斯称中国是美国最大威胁,437635.0,2024-07-16 20:45,
梁博更新,382405.0,2024-07-16 20:45,
苏醒薛之谦为梅西发声,287724.0,2024-07-16 20:45,
男子婚后每天6小时162公里跨城上班,287339.0,2024-07-16 20:45,
王者荣耀梦之队,275606.0,2024-07-16 20:45,
你多胖可能在妈妈肚子里就决定了,273031.0,2024-07-16 20:45,
75岁独居老人1个月狂买38个快递,259478.0,2024-07-16 20:45,
邓为钻石脸链,248266.0,2024-07-16 20:45,
鞠婧祎官方对接,246862.0,2024-07-16 20:45,
朋友圈真的不要留太多电子宠物,295264.0,2024-07-16 20:45,
苹果回应iPhone鬼手现象,242168.0,2024-07-16 20:45,
刘耀文得知翔霖一队后的反应,227035.0,2024-07-16 20:45,
一桌烧烤三个冠军一个徐志胜,205798.0,2024-07-16 20:45,
鹿晗帮路人搬杠铃片,201074.0,2024-07-16 20:45,
李东受贿1.08亿余元被判无期,192691.0,2024-07-16 20:45,
薛之谦新歌预告怪诞童话,183492.0,2024-07-16 20:45,
以前谈恋爱是要交换QQ密码的,181533.0,2024-07-16 20:45,
法国阿姨找王一博要签名,177131.0,2024-07-16 20:45,
邓超儿子好像段奕宏,176609.0,2024-07-16 20:45,
陶喆 讨厌红楼梦,796232.0,2024-07-16 20:45,
泰国被害女子姐姐发声,174024.0,2024-07-16 20:45,
朱旺旺边哭边拽假睫毛,170372.0,2024-07-16 20:45,
林青霞自曝因安眠药意外跌倒,169875.0,2024-07-16 20:45,
货车深夜侧翻他们选择停车上前,81374.0,2024-07-16 20:45,
看卢昱晓正骨默默放下二郎腿,162453.0,2024-07-16 20:45,
为什么年轻人越来越喜欢旅游,158595.0,2024-07-16 20:45,
FNC被曝让中国练习生陪酒,156984.0,2024-07-16 20:45,
老师最不看好你 你却偏偏最争气,155108.0,2024-07-16 20:45,
王俊凯合照站成人形立牌,152289.0,2024-07-16 20:45,
TF家族三代登陆日杀青,140090.0,2024-07-16 20:45,
买金条遭遇不发货不退款,137910.0,2024-07-16 20:45,
赵丽颖夏天穿好多,136584.0,2024-07-16 20:45,
蒋敦豪 有e吗,131833.0,2024-07-16 20:45,
编剧看了多少烂剧才写出的台词,127299.0,2024-07-16 20:45,
广州地铁上有人开始卖黄皮了,118125.0,2024-07-16 20:45,
百岁山符合国标和欧盟标准,33455.0,2024-07-16 20:45,
姆巴佩亮相伯纳乌,110059.0,2024-07-16 20:45,
姆巴佩与皇马正式签约,99514.0,2024-07-16 20:45,
一时分不清是哪朵梨花香,93861.0,2024-07-16 20:45,
