name,value,date,Unnamed: 3
艾滋病病毒无法在唾液中存活,1543757.0,2024-02-28 20:15,
贵州夫妻17年间生下9女1男,779934.0,2024-02-28 20:15,
e法e同行 京彩新征程,14839.0,2024-02-28 20:15,
重庆姐弟坠亡案生母宣布将直播带货,1330911.0,2024-02-28 20:15,
亚洲首富之子18个月减重超200斤,646435.0,2024-02-28 20:15,
泰国版张雨绮,594020.0,2024-02-28 20:15,
孙千陈靖可朋友圈签名,581899.0,2024-02-28 20:15,
陈赫晒妻子女儿背影照,511356.0,2024-02-28 20:15,
热心市民魏大勋,477638.0,2024-02-28 20:15,
外交部回应日本启动第四批核污染水排海,329778.0,2024-02-28 20:15,
凤凰传奇演唱会预约人数,468407.0,2024-02-28 20:15,
为什么汉堡王没火起来,442462.0,2024-02-28 20:15,
被时代淘汰的水果,411306.0,2024-02-28 20:15,
上海一饭堂发生情杀案致2人死亡,381677.0,2024-02-28 20:15,
钟睒睒向宗庆后敬送花圈,376083.0,2024-02-28 20:15,
老公姐 人夫哥,370769.0,2024-02-28 20:15,
找工作,319669.0,2024-02-28 20:15,
黄嘉千称夏天被夏克立家暴,313943.0,2024-02-28 20:15,
肠癌来临时上厕所会出现4个异常,310290.0,2024-02-28 20:15,
烟火人家 乳腺通了泪腺崩了,278380.0,2024-02-28 20:15,
猫 我基本没差评的啊,281631.0,2024-02-28 20:15,
RNG中单,270856.0,2024-02-28 20:15,
没发过朋友圈的都叫新衣服,265212.0,2024-02-28 20:15,
爷爷 他甚至边玩手机边下,263639.0,2024-02-28 20:15,
雷军称苹果用户买小米汽车是最好选择,233748.0,2024-02-28 20:15,
建议启动中小学教师在职学历提升计划,228966.0,2024-02-28 20:15,
张杰武汉演唱会又取消了,215028.0,2024-02-28 20:15,
日本队发布会成了孙颖莎表彰大会,212911.0,2024-02-28 20:15,
贡菜就是晒干的莴笋,209323.0,2024-02-28 20:15,
杭州下沙花圈材料已卖断货,190304.0,2024-02-28 20:15,
长期吃这些东西可缓解肥胖,189020.0,2024-02-28 20:15,
娃哈哈感谢信,176428.0,2024-02-28 20:15,
魏大勋 看熟人演戏的尴尬,175059.0,2024-02-28 20:15,
韩素希露腰毛衣,173221.0,2024-02-28 20:15,
阚清子长发羊毛卷,158930.0,2024-02-28 20:15,
猫 妈妈那么做肯定有她的道理,156296.0,2024-02-28 20:15,
林一周也 北体北电颜值高山,155942.0,2024-02-28 20:15,
相亲第三天就领证了,152981.0,2024-02-28 20:15,
常华森杀青照,149181.0,2024-02-28 20:15,
国产剧洗澡戏越来越见外了,148153.0,2024-02-28 20:15,
鲁班元芳战令新皮肤,147710.0,2024-02-28 20:15,
李耕耘 幸福是什么,147440.0,2024-02-28 20:15,
女教师办公室殴打学生,138566.0,2024-02-28 20:15,
陈靖可回应面试封神,134649.0,2024-02-28 20:15,
周芯竹巴黎看秀造型,122903.0,2024-02-28 20:15,
冷暴力中长大的孩子,118503.0,2024-02-28 20:15,
大学生真的好整齐,115478.0,2024-02-28 20:15,
这完全是大侦探的经典味道,111699.0,2024-02-28 20:15,
甜馨cos初音未来,111477.0,2024-02-28 20:15,
男子赤膊跳4米深冰水救出落水母女,110573.0,2024-02-28 20:15,
