name,value,date,Unnamed: 3
张韶涵回应那英需要你,1116416.0,2024-05-18 20:00,
女子试戴金戒不慎摔落被索赔1250,869993.0,2024-05-18 20:00,
文化中国行看博物馆之宝,8803.0,2024-05-18 20:00,
她的小梨涡,666197.0,2024-05-18 20:00,
泰国预计榴莲减产40%至60%,563607.0,2024-05-18 20:00,
2岁宝宝疑因奶奶嚼碎喂食感染梅毒,338096.0,2024-05-18 20:00,
赴山海阵容官宣,361686.0,2024-05-18 20:00,
AG对战狼队,328876.0,2024-05-18 20:00,
每一次挥棒都是对极限的挑战,57363.0,2024-05-18 20:00,
女生挑战中式元素变装惊艳了,59310.0,2024-05-18 20:00,
华东理工大学回应男生向12岁女孩要裸照,901546.0,2024-05-18 20:00,
AG剧透,322947.0,2024-05-18 20:00,
普京拍拍肚子说烤鸭太香了再吃一块,315024.0,2024-05-18 20:00,
陈赫录节目血栓甲状腺全通了,288074.0,2024-05-18 20:00,
十个勤天在天猫618卖断货,29770.0,2024-05-18 20:00,
赵露思英文采访,266184.0,2024-05-18 20:00,
时代少年团优酸乳直播,261676.0,2024-05-18 20:00,
狼队藏东西了,250539.0,2024-05-18 20:00,
关晓彤陈赫 破碎的妹无助的哥,251281.0,2024-05-18 20:00,
广东人将挑战暴雨上班30天,229352.0,2024-05-18 20:00,
瘦30斤五官的变化,725210.0,2024-05-18 20:00,
男子嫖娼被抓妻子选择原谅回家养牛,457846.0,2024-05-18 20:00,
突然发现今年520好有意义,344200.0,2024-05-18 20:00,
不要低估了小孩子的聪明程度,334534.0,2024-05-18 20:00,
赵露思火炬手造型,249470.0,2024-05-18 20:00,
T1对战BLG,239885.0,2024-05-18 20:00,
沈梦辰情商,221933.0,2024-05-18 20:00,
庆余年2或在本月收官,201283.0,2024-05-18 20:00,
林孝埈说用行动打造冰雪新未来,152116.0,2024-05-18 20:00,
筷子出现前古人用啥吃饭,127498.0,2024-05-18 20:00,
沈腾没入围,199320.0,2024-05-18 20:00,
汪苏泷 还不如让我走了呢,197180.0,2024-05-18 20:00,
赵丽颖帮朱梓骁追星,196634.0,2024-05-18 20:00,
十个勤天的店也太难抢了,180376.0,2024-05-18 20:00,
五月天鸟巢演唱会,178014.0,2024-05-18 20:00,
AG状态,173178.0,2024-05-18 20:00,
88岁医生成为大体老师重回母校,55293.0,2024-05-18 20:00,
范闲骂得声音好大好超前,169215.0,2024-05-18 20:00,
十个勤天小卖铺,165314.0,2024-05-18 20:00,
济南打雷,124837.0,2024-05-18 20:00,
蔡徐坤小香风,153623.0,2024-05-18 20:00,
巴顿 好听,152700.0,2024-05-18 20:00,
易烊千玺入围百花奖最佳男主角初评,150159.0,2024-05-18 20:00,
廖骏雄去世,142710.0,2024-05-18 20:00,
许嵩演唱会,142168.0,2024-05-18 20:00,
十个勤天上错链接,140735.0,2024-05-18 20:00,
第一次见这么聪明的猴,139088.0,2024-05-18 20:00,
王俊凯入围百花奖最佳男主角初评,131302.0,2024-05-18 20:00,
老板怒斥员工朝9晚6按时上下班,110886.0,2024-05-18 20:00,
泽连斯基拒绝奥运会期间休战,109150.0,2024-05-18 20:00,
