name,value,date,Unnamed: 3
1997年7月1日0时0分0秒,1294314.0,2024-06-30 20:00,
吴艳妮女子100米栏冠军,894631.0,2024-06-30 20:00,
龙腾湾区桥见未来,48674.0,2024-06-30 20:00,
彩虹,845508.0,2024-06-30 20:00,
河南官方回应火箭起火坠落,625350.0,2024-06-30 20:00,
陈志朋53岁再签新公司,424864.0,2024-06-30 20:00,
天兵科技回应火箭起火爆炸,398482.0,2024-06-30 20:00,
猎罪图鉴3恶魔监狱,424186.0,2024-06-30 20:00,
知情人称坠落火箭系天龙三号,395921.0,2024-06-30 20:00,
18岁少年回应三进火场勇救老人,21918.0,2024-06-30 20:00,
于正说不明白吴谨言受了啥委屈,840844.0,2024-06-30 20:00,
你觉得女子怀孕应该是谁来照顾,572226.0,2024-06-30 20:00,
王星越说买断是有点买不过来了,478995.0,2024-06-30 20:00,
家长去武校看儿子其正被按地上抽,377055.0,2024-06-30 20:00,
伊拉克男子妻儿丧生后性侵同船少女,350831.0,2024-06-30 20:00,
婚恋中伴侣长嘴有多重要,331560.0,2024-06-30 20:00,
孙海洋回应孙卓高考成绩,330245.0,2024-06-30 20:00,
现在电视剧为何不爱叫XX传了,300872.0,2024-06-30 20:00,
多地挪用农村学生营养餐补助,297350.0,2024-06-30 20:00,
吴谨言王星越拍芭莎,289498.0,2024-06-30 20:00,
校长回答月薪1万2先深造还是先赚钱,497953.0,2024-06-30 20:00,
工作室发了王源转场顶胯视频,285191.0,2024-06-30 20:00,
黄子韬说没有鹿晗就不会签徐艺洋,265456.0,2024-06-30 20:00,
火箭,245488.0,2024-06-30 20:00,
赵今麦张凌赫双人大片,234592.0,2024-06-30 20:00,
女生花470元带1条鱼去医院看病,230699.0,2024-06-30 20:00,
李一桐发文回应蜈蚣,197570.0,2024-06-30 20:00,
吴彦祖又帅回来了,186231.0,2024-06-30 20:00,
Uzi谈停播原因,174411.0,2024-06-30 20:00,
仙逆,167267.0,2024-06-30 20:00,
坠落火箭系试飞暂无伤亡,146015.0,2024-06-30 20:00,
女孩差点被带走父亲查监控像人贩子,145336.0,2024-06-30 20:00,
毛晓彤 不觉得30岁是个坎,142551.0,2024-06-30 20:00,
微信朋友圈置顶新玩法,139084.0,2024-06-30 20:00,
王星越钓鱼,138288.0,2024-06-30 20:00,
马嘉祺给六斤配乐猪八戒背媳妇,131770.0,2024-06-30 20:00,
天龙三号运载火箭试车的情况说明,121436.0,2024-06-30 20:00,
刘畊宏纪凌尘腋下管理的极与极,116673.0,2024-06-30 20:00,
美国网红鼻祖自曝16岁起遭性虐待,115926.0,2024-06-30 20:00,
原来这种家庭是真的存在的,115280.0,2024-06-30 20:00,
金融消费者,112313.0,2024-06-30 20:00,
日本拉面店禁止食客用耳机,111374.0,2024-06-30 20:00,
山寨周杰伦全国巡演暂停,110674.0,2024-06-30 20:00,
黄子韬徐艺洋一路上都在拌嘴,105968.0,2024-06-30 20:00,
阴干的衣服为什么有股臭味,105339.0,2024-06-30 20:00,
蒲熠星黄子弘凡背着院人接新节目,105333.0,2024-06-30 20:00,
日本老教授被曝猥亵幼女,102243.0,2024-06-30 20:00,
j人和P人一起买东西流程,95462.0,2024-06-30 20:00,
娜扎y2K编发,93994.0,2024-06-30 20:00,
薛之谦 有温度的字有诚意的人,93935.0,2024-06-30 20:00,
