name,value,date,Unnamed: 3
大麦网已退票退款,1668008.0,2024-04-24 20:01,
玲花 维权是你们的权利,1351328.0,2024-04-24 20:01,
万千气象看上海,5971.0,2024-04-24 20:01,
五月天官宣鸟巢开十场,625523.0,2024-04-24 20:01,
金价下跌有人卖了一百多万金条,605157.0,2024-04-24 20:01,
iPhone15频降价引吐槽,516008.0,2024-04-24 20:01,
浪3 白月光,434339.0,2024-04-24 20:01,
长期吃铝包子或引发肝肾损伤,420464.0,2024-04-24 20:01,
他赌上3分之1人生建港珠澳大桥,110323.0,2024-04-24 20:01,
手机里存了3个月的照片终于删了,260577.0,2024-04-24 20:01,
被评最美公务员干部被曝曾殴打残疾人,1053550.0,2024-04-24 20:01,
布林肯抵达上海,262493.0,2024-04-24 20:01,
Angelababy狼尾超短发,439821.0,2024-04-24 20:01,
贾斯汀比伯为好友遭遇抢劫中枪身亡发声,366080.0,2024-04-24 20:01,
日本地震,274826.0,2024-04-24 20:01,
孔刘宋慧乔或合作新剧,335605.0,2024-04-24 20:01,
普拉多又来整治硬派越野市场了,24890.0,2024-04-24 20:01,
姚志明父亲车祸去世,303332.0,2024-04-24 20:01,
张予曦三公造型曝光,268204.0,2024-04-24 20:01,
女校长诈骗学生家长5000万后自杀身亡,217127.0,2024-04-24 20:01,
这些人工合成水果又出来骗人了,326304.0,2024-04-24 20:01,
发现石油,239378.0,2024-04-24 20:01,
杨幂原声台词有无字幕对比,227496.0,2024-04-24 20:01,
高君雨全网账号被禁,220373.0,2024-04-24 20:01,
花少中热巴的美妆好物,210542.0,2024-04-24 20:01,
福宝,192579.0,2024-04-24 20:01,
狗头萝莉公开煎饼摊收支结余,190173.0,2024-04-24 20:01,
乳腺疾病真的是被气出来的吗,183797.0,2024-04-24 20:01,
提醒布林肯别想带着筹码来访华,107935.0,2024-04-24 20:01,
岚图携手华为全新纯电SUV剧透,23826.0,2024-04-24 20:01,
朱梓骁把流星雨的戏服卖了,182554.0,2024-04-24 20:01,
秦海璐霸总小说书单,165974.0,2024-04-24 20:01,
宋雨琦张真源跳了freak,163992.0,2024-04-24 20:01,
黄子韬孙千互怼能看一百遍,160320.0,2024-04-24 20:01,
李现又要带火一小镇了,152297.0,2024-04-24 20:01,
买凤凰传奇柱子票获鸟巢票粉丝发声,150008.0,2024-04-24 20:01,
苹果定位 发现石油,149056.0,2024-04-24 20:01,
张颂文捡的流浪狗,146393.0,2024-04-24 20:01,
这些退货理由是要把人笑死吗,137802.0,2024-04-24 20:01,
玲花给买到柱子票的粉丝留了鸟巢的票,128827.0,2024-04-24 20:01,
梅耶马斯克在用什么底妆,24734.0,2024-04-24 20:01,
如何把双休变成三休,128131.0,2024-04-24 20:01,
耙耙柑是讨好型水果吧,127693.0,2024-04-24 20:01,
赵丽颖林更新缘分开始的地方,127280.0,2024-04-24 20:01,
官方通报自行车上路无牌被罚50元,127127.0,2024-04-24 20:01,
海贼王伏笔回收,121121.0,2024-04-24 20:01,
卢昱晓单肩黑裙,112091.0,2024-04-24 20:01,
邓为能不能拍部现偶,111822.0,2024-04-24 20:01,
丁俊晖 世锦赛,107452.0,2024-04-24 20:01,
illit疑似抄袭straykids手势,106179.0,2024-04-24 20:01,
