name,value,date,Unnamed: 3
福宝隔离检疫期一切平稳正常,1082894.0,2024-04-10 19:06,
王凯方回应被讨债,1002952.0,2024-04-10 19:06,
中国第40次南极考察队凯旋,13248.0,2024-04-10 19:06,
下岸,1131435.0,2024-04-10 19:06,
福建立法规定妻子可查询配偶财产,890191.0,2024-04-10 19:06,
吴镇宇回应后费曼删博,817308.0,2024-04-10 19:06,
韩民众请求政府续租福宝,774964.0,2024-04-10 19:06,
刘美含33岁状态,743284.0,2024-04-10 19:06,
老板1个月转账近5万给翘班员工,472991.0,2024-04-10 19:06,
福宝大口吃胡萝卜声音嘎嘣脆,550758.0,2024-04-10 19:06,
仝卓工作室回应王凯方,730097.0,2024-04-10 19:06,
李沁西装裙,434399.0,2024-04-10 19:06,
欧阳娜娜首次回应叫陈伟霆爸爸,404679.0,2024-04-10 19:06,
女子花椒呛喉推开家人海姆立克法自救,386213.0,2024-04-10 19:06,
易烊千玺闯美成功,360553.0,2024-04-10 19:06,
官方通报昆明多家医院现男性根浴,334913.0,2024-04-10 19:06,
气血不足很难瘦,302893.0,2024-04-10 19:06,
赵丽颖玉面判官,291539.0,2024-04-10 19:06,
任敏 有李现我是真服气,277179.0,2024-04-10 19:06,
韩国知名偶像组合成员被骗26亿韩元,269191.0,2024-04-10 19:06,
才知道51岁的妈妈没买社保,292897.0,2024-04-10 19:06,
被一碗25块钱的牛肉面惊呆了,264849.0,2024-04-10 19:06,
7天戒掉了熬夜让自己6点起床,264740.0,2024-04-10 19:06,
中式母爱做到了全国统一,255294.0,2024-04-10 19:06,
费曼新简介,221324.0,2024-04-10 19:06,
我爸不愿意被叫外公,215215.0,2024-04-10 19:06,
暴雪全家桶回归次序,178164.0,2024-04-10 19:06,
日晕,171478.0,2024-04-10 19:06,
耙耙柑的耙是四川耙耳朵的耙,163997.0,2024-04-10 19:06,
青3选手蒋智豪患肺癌,159270.0,2024-04-10 19:06,
癌症发生前身体的预警信号,340957.0,2024-04-10 19:06,
研究生最大的共性,177067.0,2024-04-10 19:06,
陈泽 没有,157540.0,2024-04-10 19:06,
两岸同胞同属中华民族,157253.0,2024-04-10 19:06,
帅是真的帅 刻薄也是真刻薄,154308.0,2024-04-10 19:06,
惜花芷 祖母,154058.0,2024-04-10 19:06,
清华大学所在国家学生,145166.0,2024-04-10 19:06,
鞠婧祎小道士盘发,143836.0,2024-04-10 19:06,
假如每个星期三都能休息一次,143606.0,2024-04-10 19:06,
鹿晗语言系统紊乱,138754.0,2024-04-10 19:06,
平野绫称婚前与丈夫交往0天,136744.0,2024-04-10 19:06,
为何女生比男生更喜欢用iPhone,135484.0,2024-04-10 19:06,
种地星球直播,130547.0,2024-04-10 19:06,
福宝回国后变着花样干饭,130251.0,2024-04-10 19:06,
过完清明假期办公室全体离职,128508.0,2024-04-10 19:06,
宋妍霏人鱼猫眼妆,124386.0,2024-04-10 19:06,
猫咪走丢一次后再也不肯出门,115378.0,2024-04-10 19:06,
何浩楠 无人机师傅撒药中,108305.0,2024-04-10 19:06,
杨紫台湾腔走戏,108064.0,2024-04-10 19:06,
怀孕期间什么能做什么不能做,104778.0,2024-04-10 19:06,
