name,value,date,Unnamed: 3
未来三天有可能爆发M级甚至X级以上耀斑,1755481.0,2024-05-05 19:13,
太疲惫身体会变臭,762655.0,2024-05-05 19:13,
文化中国行发现节气之美,43321.0,2024-05-05 19:13,
五一很短但六天很长,724069.0,2024-05-05 19:13,
女子买3叫花鸡回家发现2只仅有泥巴,479262.0,2024-05-05 19:13,
丈夫病危妻子请假照顾被开除,396405.0,2024-05-05 19:13,
我也退出五一档了,336837.0,2024-05-05 19:13,
夏威夷职业技术学院,304068.0,2024-05-05 19:13,
榴莲是典型的高糖高脂水果,179761.0,2024-05-05 19:13,
为什么女性一定要养好气血,187878.0,2024-05-05 19:13,
开封王婆怒怼亳州王婆,1251224.0,2024-05-05 19:13,
医院被举报代孕1小时后产妇出院被疑通风报信,820610.0,2024-05-05 19:13,
王耀庆连续煎了21天鸡蛋,292830.0,2024-05-05 19:13,
河大一研究生论文曾指出礼堂消防隐患,482017.0,2024-05-05 19:13,
石宇奇强得可怕,400068.0,2024-05-05 19:13,
泰国男子性侵邻居遭反杀家属不追究,318860.0,2024-05-05 19:13,
极限挑战看得我都酸了,272916.0,2024-05-05 19:13,
王力宏 山东省文旅厅,272472.0,2024-05-05 19:13,
女子称住酒店裸睡被人强行刷开房门,261686.0,2024-05-05 19:13,
周扬青 带经纪人录节目的一天,255901.0,2024-05-05 19:13,
黄子韬徐艺洋吵架受伤的是姜潮,626587.0,2024-05-05 19:13,
杨幂回应首次把真发染红,513853.0,2024-05-05 19:13,
张一山也是紫米,384501.0,2024-05-05 19:13,
爸爸才四十多岁就不工作了,368943.0,2024-05-05 19:13,
迪丽热巴旗袍,260686.0,2024-05-05 19:13,
叶祖新怎么越老越帅,242264.0,2024-05-05 19:13,
买榴莲要买像荔枝的,238896.0,2024-05-05 19:13,
魏大勋脚上的红绳被P掉了,213596.0,2024-05-05 19:13,
杨紫发文祝张一山生日快乐,210967.0,2024-05-05 19:13,
山东10个馄饨250克吃懵南方人,194280.0,2024-05-05 19:13,
苗苗自己给自己化妆,202530.0,2024-05-05 19:13,
丁程鑫 monster直拍,188489.0,2024-05-05 19:13,
王一博看一眼再看一眼,184401.0,2024-05-05 19:13,
金秀贤泡泡ins的差异,182538.0,2024-05-05 19:13,
五一 out,170877.0,2024-05-05 19:13,
新娘出嫁小狗用身体挡婚车不让走,170329.0,2024-05-05 19:13,
求回到五一教程,169417.0,2024-05-05 19:13,
性格内向是职场的隐形天花板吗,158857.0,2024-05-05 19:13,
女性生完孩子后子宫修复需要6周,149123.0,2024-05-05 19:13,
肖战地广有了新的打开方式,147010.0,2024-05-05 19:13,
童瑶听到八离世家的反应,139918.0,2024-05-05 19:13,
很烧钱却小众的爱好,133515.0,2024-05-05 19:13,
马来西亚女子称被生父强奸8年,128827.0,2024-05-05 19:13,
沈腾马丽炫彩小卡,125580.0,2024-05-05 19:13,
迪丽热巴露背灰裙,118747.0,2024-05-05 19:13,
陈赫妈妈是来录陈赫吐槽大会吗,117534.0,2024-05-05 19:13,
信一太帅了,116949.0,2024-05-05 19:13,
鹿晗五哈镜头,111367.0,2024-05-05 19:13,
亳州王婆说媒劝小伙牵手怀孕女孩,108680.0,2024-05-05 19:13,
出淤泥而挑染的萨摩耶,104682.0,2024-05-05 19:13,
