name,value,date,Unnamed: 3
东航致132人遇难事故调查进展发布,7537946.0,2024-03-20 19:10,
林依晨 你,1217031.0,2024-03-20 19:10,
播种春天播撒希望,9945.0,2024-03-20 19:10,
2024年全国高考时间确定,750288.0,2024-03-20 19:10,
东航,603531.0,2024-03-20 19:10,
主播靠辱骂母亲走红被批捕封号,554776.0,2024-03-20 19:10,
短剧把李沁证件照P成黑白,496272.0,2024-03-20 19:10,
龚俊邓为撞衫,470981.0,2024-03-20 19:10,
奔马不踏飞燕改行捣辣椒做麻辣烫了,108529.0,2024-03-20 19:10,
每天三五百个网红专往杭州这座山头跑,180751.0,2024-03-20 19:10,
此沙张婧仪周雨彤春分踏青,60421.0,2024-03-20 19:10,
认识你真好,14273.0,2024-03-20 19:10,
南宁一规培生在医院卫生间割颈死亡,1189544.0,2024-03-20 19:10,
微信及WeChat月活13.43亿,472220.0,2024-03-20 19:10,
淘宝红人人均身价超千万,35473.0,2024-03-20 19:10,
不要再为吃糖油混合物焦虑了,414670.0,2024-03-20 19:10,
Uzi被提名LOL历史第二人,414372.0,2024-03-20 19:10,
李沁方回应被短剧P黑白照,392179.0,2024-03-20 19:10,
恶作剧之吻,387844.0,2024-03-20 19:10,
iPhone16系列或实现更大显示屏,383911.0,2024-03-20 19:10,
aespa舞台,348058.0,2024-03-20 19:10,
沪上阿姨崩了,324919.0,2024-03-20 19:10,
第一次知道刷牙后不用漱口,309210.0,2024-03-20 19:10,
你愿意为了调休连上7天班吗,299861.0,2024-03-20 19:10,
英国王室发查尔斯三世最新画面,274673.0,2024-03-20 19:10,
肖战镜头下的横店,268641.0,2024-03-20 19:10,
八旬奶奶得知李政去世消息落泪,259577.0,2024-03-20 19:10,
精简后的低成本防晒,242246.0,2024-03-20 19:10,
赵丽颖方辟谣推荐知否屠二爷,230020.0,2024-03-20 19:10,
电影版红楼梦 贾吞林财,219741.0,2024-03-20 19:10,
腾讯宣布2024年回购不少于1000亿港元,217398.0,2024-03-20 19:10,
四川麻辣烫申请出战被本地人驳回,197046.0,2024-03-20 19:10,
KPL,195821.0,2024-03-20 19:10,
朱劲草血脉压制朱大力,195252.0,2024-03-20 19:10,
早安婚礼现场,194553.0,2024-03-20 19:10,
沪上阿姨紧急补货,188325.0,2024-03-20 19:10,
我只是敢花钱不代表我真有钱,186719.0,2024-03-20 19:10,
张杰新专辑要得,182141.0,2024-03-20 19:10,
C罗中国行机酒退款到账,179075.0,2024-03-20 19:10,
太空育种鲜花大规模上市,92005.0,2024-03-20 19:10,
闪耀暖暖魔仙咒语,177128.0,2024-03-20 19:10,
杨洋拄拐现身医院,171791.0,2024-03-20 19:10,
LNG对战AL,170491.0,2024-03-20 19:10,
央视网评校园霸凌新特征,169052.0,2024-03-20 19:10,
随机吓到一名师范生,164212.0,2024-03-20 19:10,
民航局通报东航MU5735航空器飞行事故调查进展,163114.0,2024-03-20 19:10,
库克郑恺外滩偶遇,161253.0,2024-03-20 19:10,
52岁男子爱吃生腌感染3种寄生虫,155803.0,2024-03-20 19:10,
春分,152399.0,2024-03-20 19:10,
杨幂张小斐挽手聚餐,147543.0,2024-03-20 19:10,
