name,value,date,Unnamed: 3
梅州高速塌方,1346997.0,2024-05-01 10:20,
间谍窃取我国杂交水稻亲本种子,985972.0,2024-05-01 10:20,
我的五一游记,55193.0,2024-05-01 10:20,
沙溢回应退出奔跑吧,844873.0,2024-05-01 10:20,
日本或将进入单身税时代,822405.0,2024-05-01 10:20,
低估了五一堵车的程度,507400.0,2024-05-01 10:20,
男子称两年前被上门采集核酸时的照片泄露,391186.0,2024-05-01 10:20,
丁真上岛了,361396.0,2024-05-01 10:20,
养猫的和不养猫的都沉默了,315293.0,2024-05-01 10:20,
第一批游客已冒雨抵达长沙,207269.0,2024-05-01 10:20,
戚薇 我从不掩饰对女生的喜爱,694758.0,2024-05-01 10:20,
江南造船厂,503427.0,2024-05-01 10:20,
肖战对接辟谣包场王一博电影,427187.0,2024-05-01 10:20,
王者荣耀,311399.0,2024-05-01 10:20,
小米SU7上市首月交付7058辆,281665.0,2024-05-01 10:20,
五一到底哪里没人啊,269586.0,2024-05-01 10:20,
梅州高速塌方有车辆人员被困,256539.0,2024-05-01 10:20,
张韶涵工作室报平安,256212.0,2024-05-01 10:20,
苹果正在修复iPhone闹钟不响问题,254983.0,2024-05-01 10:20,
迪丽热巴工作室包场杨幂新电影,220563.0,2024-05-01 10:20,
南雅被当众扒衣服,309384.0,2024-05-01 10:20,
耳鸣是身体在发出警告,266341.0,2024-05-01 10:20,
喝完水多久排尿才正常,227139.0,2024-05-01 10:20,
问界M7事故砸窗救援者在现场大哭,203840.0,2024-05-01 10:20,
孩子住院家长请假遭开除获赔22万,201808.0,2024-05-01 10:20,
维和防暴队,195946.0,2024-05-01 10:20,
成毅两大平台同时官宣,189367.0,2024-05-01 10:20,
福建舰海试,182123.0,2024-05-01 10:20,
马克西绝平三分,181961.0,2024-05-01 10:20,
真的别再打孩子了,173995.0,2024-05-01 10:20,
原来跑男早就预言了退出的人,173750.0,2024-05-01 10:20,
五一劳动节,170920.0,2024-05-01 10:20,
电影维和防暴队今日上映,170047.0,2024-05-01 10:20,
我国第三艘航母解缆启航,169843.0,2024-05-01 10:20,
长期吃榴莲身体会发生什么变化,163244.0,2024-05-01 10:20,
元气森林音乐节,160582.0,2024-05-01 10:20,
美国流浪汉当街啃人脸吃眼球和耳朵,154943.0,2024-05-01 10:20,
交警回应梅州高速塌方,152463.0,2024-05-01 10:20,
刚出生四天的小柴犬宝宝,149768.0,2024-05-01 10:20,
五一文案,141495.0,2024-05-01 10:20,
女生自驾去广东一路暴雨带闪电,136407.0,2024-05-01 10:20,
洁丽雅董事长谈儿子拍短剧出圈,135992.0,2024-05-01 10:20,
newjeans飞天小女警MV预告,135617.0,2024-05-01 10:20,
突然感觉朋友圈发什么都很幼稚了,132003.0,2024-05-01 10:20,
苹果称5月7日发布会将不同寻常,130270.0,2024-05-01 10:20,
芍药这么美还是中药换谁不迷糊,120900.0,2024-05-01 10:20,
iOS18将为Safari浏览器带来大更新,118824.0,2024-05-01 10:20,
余承东职位调整为正常管理任命,117362.0,2024-05-01 10:20,
青旅众人凌晨急救癫痫男子,114491.0,2024-05-01 10:20,
54岁快递员手机备注上千收件人奇葩花名,111623.0,2024-05-01 10:20,
