name,value,date,Unnamed: 3
王力宏 歌手,330701.0,2024-05-16 02:19,
中国海警喊话警告非法侵闯黄岩岛船只,116695.0,2024-05-16 02:19,
2024年全球贸易投资促进峰会,9737.0,2024-05-16 02:19,
韩佩泉报名歌手成功,136914.0,2024-05-16 02:19,
官方通报60余名幼儿群体性流血不实,68844.0,2024-05-16 02:19,
未婚女性不能使用精子库供精去父留子,102194.0,2024-05-16 02:19,
李溪芮张腾与代驾发生冲突全过程,136694.0,2024-05-16 02:19,
费可死了,135756.0,2024-05-16 02:19,
歌手2024揭榜歌手歌单,121354.0,2024-05-16 02:19,
店家打烊遇拾荒老人果断开店送吃的,8868.0,2024-05-16 02:19,
佟丽娅长发新中式,100182.0,2024-05-16 02:19,
斯洛伐克总理遭枪击,99938.0,2024-05-16 02:19,
尼格买提 莫奈花园,87999.0,2024-05-16 02:19,
李雪琴 小树不长歪长点枝丫没问题,87531.0,2024-05-16 02:19,
暖阳女友发博回应,63497.0,2024-05-16 02:19,
全局BP,43694.0,2024-05-16 02:19,
江西丰城一船舶4人窒息死亡,43458.0,2024-05-16 02:19,
新华社专访普京,39876.0,2024-05-16 02:19,
华为MatePad,37290.0,2024-05-16 02:19,
日本制铁公司熔钢锅内发现人骨,34606.0,2024-05-16 02:19,
16岁女孩洗澡时浴屏爆裂缝合20多针,174951.0,2024-05-16 02:19,
开心消消乐,115475.0,2024-05-16 02:19,
美国18岁女罪犯因颜值超高爆红,92507.0,2024-05-16 02:19,
原来张杰也会泰勒公式,82207.0,2024-05-16 02:19,
十个勤天去年底音乐节秀费超200万元,69230.0,2024-05-16 02:19,
前夫出轨拒赔偿女子每年起诉要钱,61868.0,2024-05-16 02:19,
1岁女婴被大伯母投毒致四肢瘫痪,61640.0,2024-05-16 02:19,
新生 烂尾,52598.0,2024-05-16 02:19,
鹿晗长沙,51549.0,2024-05-16 02:19,
张静初回应凹学霸人设,47602.0,2024-05-16 02:19,
庆余年第二季开播倒计时1天,41684.0,2024-05-16 02:19,
发现和没上过班的人很难交流,41669.0,2024-05-16 02:19,
王一博跳街舞,39313.0,2024-05-16 02:19,
庆余年2先导plus预告,38872.0,2024-05-16 02:19,
新生 强行上价值,37651.0,2024-05-16 02:19,
教育部拟同意设24所本科高校,31564.0,2024-05-16 02:19,
新生,31162.0,2024-05-16 02:19,
Uzi不和G2打训练赛,30527.0,2024-05-16 02:19,
小学六年级的李惠仁,29926.0,2024-05-16 02:19,
新生彩蛋,29910.0,2024-05-16 02:19,
坚持跑步1个月身体将怎样变化,28461.0,2024-05-16 02:19,
唐嫣璀璨亮片长裙,28329.0,2024-05-16 02:19,
咬伤3岁男童恶犬已被打死,28034.0,2024-05-16 02:19,
关晓彤鞠婧祎早期合照,27764.0,2024-05-16 02:19,
上海一餐厅特设肖战墙景位预约爆满,24538.0,2024-05-16 02:19,
一起看2024巴黎奥运会,23734.0,2024-05-16 02:19,
用利息生活是可行还是离谱,23157.0,2024-05-16 02:19,
奥运资格赛王一博观赛,23022.0,2024-05-16 02:19,
真正的大女主都是水泥封心,22821.0,2024-05-16 02:19,
给免胶假睫毛泼盆凉水,22009.0,2024-05-16 02:19,
