name,value,date,Unnamed: 3
庆余年 剧王,460252.0,2024-05-17 02:09,
男童狂犬病病毒免疫失败一串问号需要解答,200229.0,2024-05-17 02:09,
中国有约,15871.0,2024-05-17 02:09,
周杰伦哭了,368844.0,2024-05-17 02:09,
大凉山血色彩礼30多万元涉两条人命,187833.0,2024-05-17 02:09,
菲律宾船只受中方震慑已驶离,97067.0,2024-05-17 02:09,
王楚然演技 尴尬,334778.0,2024-05-17 02:09,
中国科协辟谣阿波罗登月造假,71631.0,2024-05-17 02:09,
普京向人民英雄纪念碑敬献花圈,69940.0,2024-05-17 02:09,
庆余年2的观后感,285387.0,2024-05-17 02:09,
坐火车40小时没及时换卫生巾感染送医,177210.0,2024-05-17 02:09,
从西安买7斤普罗旺斯西红柿回广州,86808.0,2024-05-17 02:09,
腾讯视频会员,159038.0,2024-05-17 02:09,
高速上逼停小车的2民警被停职,61968.0,2024-05-17 02:09,
他把家改造成山里娃的24小时书屋,20516.0,2024-05-17 02:09,
庆余年2老金头下线,132019.0,2024-05-17 02:09,
医生建议榴莲1天最多吃1瓣,46453.0,2024-05-17 02:09,
Bin哥辛苦了,42520.0,2024-05-17 02:09,
三皇子 甲方,123375.0,2024-05-17 02:09,
无畏回应转会,38913.0,2024-05-17 02:09,
黄子韬只承认鹿晗比自己帅,105642.0,2024-05-17 02:09,
喜欢睡前玩手机的人警惕5个毛病找上门,248429.0,2024-05-17 02:09,
李佳琦称今年618大促是难的,156837.0,2024-05-17 02:09,
范思辙胖了,107339.0,2024-05-17 02:09,
花少北 p聊天记录,82203.0,2024-05-17 02:09,
谁能认得出这是小鬼,67369.0,2024-05-17 02:09,
庆余年收视率,95322.0,2024-05-17 02:09,
你脸上的痘痘可能是吃出来的,45642.0,2024-05-17 02:09,
民警高速亮证查车疑穿4400元T恤,39916.0,2024-05-17 02:09,
博主想用叶子换饭听障摊主写下我请你,19438.0,2024-05-17 02:09,
杨幂包场庆余年,94390.0,2024-05-17 02:09,
女子100多元买到报仇榴莲,39079.0,2024-05-17 02:09,
富士新品,37236.0,2024-05-17 02:09,
王楚然 假笑,85653.0,2024-05-17 02:09,
BLG不敌GEN1比3落败,37001.0,2024-05-17 02:09,
吴镇宇说丞磊这样子拍不了武侠,46168.0,2024-05-17 02:09,
二皇子范闲 嗑了,72595.0,2024-05-17 02:09,
相似度高的人更容易成为伴侣,36366.0,2024-05-17 02:09,
警方通报残疾女子街头直播遭拍臀,31345.0,2024-05-17 02:09,
范闲一死叔圈大乱,64497.0,2024-05-17 02:09,
陆虎在机场捡了个活儿,45378.0,2024-05-17 02:09,
蒲熠星眼睛,38170.0,2024-05-17 02:09,
李沁看得出是公主,60983.0,2024-05-17 02:09,
武艺 综艺感的神,34505.0,2024-05-17 02:09,
周杰伦福州演唱会,31734.0,2024-05-17 02:09,
言冰云,56892.0,2024-05-17 02:09,
专家称只有房价不跌老百姓才会回归购房市场,30679.0,2024-05-17 02:09,
花少北承认煎蛋恋情,30327.0,2024-05-17 02:09,
庆余年2,56649.0,2024-05-17 02:09,
那英说文俊辉太能撒谎了,29995.0,2024-05-17 02:09,
