name,value,date,Unnamed: 3
拜登,499415.0,2024-07-22 02:16,
男子称给霸王茶姬差评后被找上门,467942.0,2024-07-22 02:16,
打卡课本里的大美中国,16519.0,2024-07-22 02:16,
为什么现在很少看到灾难片了,326298.0,2024-07-22 02:16,
拜登退选,173725.0,2024-07-22 02:16,
虎门一公职人员贩毒被执行死刑,132430.0,2024-07-22 02:16,
TFBOYS发文支持王源,132263.0,2024-07-22 02:16,
做过近视眼手术的人嘴都这么严吗,113679.0,2024-07-22 02:16,
张元英踩到安宥真的裙子,103105.0,2024-07-22 02:16,
陕西桥梁垮塌事故已致15人遇难,47366.0,2024-07-22 02:16,
五一广场车祸,488334.0,2024-07-22 02:16,
男女店内亲热被店家请离后给差评,196391.0,2024-07-22 02:16,
黄子韬徐艺洋公开后秀恩爱,168062.0,2024-07-22 02:16,
胎儿检出超雄孕妇完成终止妊娠手术,105633.0,2024-07-22 02:16,
延迟退休,103056.0,2024-07-22 02:16,
宝马回应临时加价4S店才交车,89135.0,2024-07-22 02:16,
盗墓团伙要价1.8亿的文物被追回,87382.0,2024-07-22 02:16,
吃饭偶遇张婧仪做服务员,77595.0,2024-07-22 02:16,
宋茜回应花少6官宣,77407.0,2024-07-22 02:16,
长沙,74191.0,2024-07-22 02:16,
睡觉盖肚脐真的有必要吗,76638.0,2024-07-22 02:16,
种地吧回应加人,71240.0,2024-07-22 02:16,
熬过4个易发胖时刻变瘦就容易了,61671.0,2024-07-22 02:16,
阳虚还是阴虚看出汗就能知道,60663.0,2024-07-22 02:16,
预制菜已经发展到这个地步了,59348.0,2024-07-22 02:16,
赵露思直播怼脸镜头,56394.0,2024-07-22 02:16,
单依纯都搞唱跳了,55250.0,2024-07-22 02:16,
相柳小夭见的最后一面,49358.0,2024-07-22 02:16,
薛之谦压轴,48935.0,2024-07-22 02:16,
泰国队员想来中国队宿舍凉快,48254.0,2024-07-22 02:16,
英雄联盟手游取消赵露思置顶,52105.0,2024-07-22 02:16,
悉尼一父亲救滚入轨道的婴儿车不幸死亡,47282.0,2024-07-22 02:16,
王源回重庆不回家住的原因,47206.0,2024-07-22 02:16,
男婴出生2天腿部青紫查出罕见病,45736.0,2024-07-22 02:16,
为啥鸡的身体零件比整只鸡贵,41306.0,2024-07-22 02:16,
赵露思ID耙耙柑儿,40905.0,2024-07-22 02:16,
时代峰峻否认张真源贺峻霖恋情,40058.0,2024-07-22 02:16,
陕西塌桥一落水者因打开车窗获救,38655.0,2024-07-22 02:16,
南京大屠杀幸存者周智林老人去世,37403.0,2024-07-22 02:16,
宋丹丹张新成演恋人,35934.0,2024-07-22 02:16,
杨幂画的手稿,34954.0,2024-07-22 02:16,
赵雅芝叶童重现打伞名场面,34896.0,2024-07-22 02:16,
蒲熠星JOJO私下关系,34630.0,2024-07-22 02:16,
唐诡2仵作之死最惨的是谁,34439.0,2024-07-22 02:16,
高会,34401.0,2024-07-22 02:16,
被奶奶的手机壳震惊到了,31406.0,2024-07-22 02:16,
周深年度最具影响力全能歌手,29269.0,2024-07-22 02:16,
张杰未live开往1982巡回演唱会,27411.0,2024-07-22 02:16,
三中全会决定60条,26543.0,2024-07-22 02:16,
少年白马醉春风,25995.0,2024-07-22 02:16,
