name,value,date,Unnamed: 3
女教师哺乳期被学校调岗为保洁,290185.0,2024-03-12 02:11,
假性亲密关系,158976.0,2024-03-12 02:11,
两会中国经济问答,14607.0,2024-03-12 02:11,
曾98万拍下摊位的大叔卖馍半月回本,130902.0,2024-03-12 02:11,
林一 男友101,117240.0,2024-03-12 02:11,
白鹿把领口缝起来了,112154.0,2024-03-12 02:11,
中科院院士不提倡健康人做癌症筛查,111719.0,2024-03-12 02:11,
王楚然双开门大衣,92026.0,2024-03-12 02:11,
石头姐 杨紫琼,66198.0,2024-03-12 02:11,
爸妈让6岁儿子晚上学一年到处旅游,65587.0,2024-03-12 02:11,
凯特王妃已有2个多月未出席活动,200890.0,2024-03-12 02:11,
凯特王妃就P图道歉,125498.0,2024-03-12 02:11,
小罗伯特唐尼被批无视关继威,106786.0,2024-03-12 02:11,
白鹿好性感,103592.0,2024-03-12 02:11,
港风是陈都灵的统治区,80312.0,2024-03-12 02:11,
李嘉琦与凤行妆造,75584.0,2024-03-12 02:11,
待在小县城为什么会有窒息感,73747.0,2024-03-12 02:11,
高君雨手术是毕业后做的,72437.0,2024-03-12 02:11,
丈夫看店铺监控发现妻子出轨,70974.0,2024-03-12 02:11,
倪妮的腿低调不了一点,69566.0,2024-03-12 02:11,
香港出租屋惊现两具男婴尸体浸泡玻璃罐,123629.0,2024-03-12 02:11,
沈腾马丽没坐一起,60851.0,2024-03-12 02:11,
为什么男生对女生是不是独生女这么看重,58573.0,2024-03-12 02:11,
对洗衣液用量毫无概念的大学生,58353.0,2024-03-12 02:11,
安徽发生瓦斯爆燃事故致7死2失联,58011.0,2024-03-12 02:11,
白敬亭章若楠难哄最新路透,50729.0,2024-03-12 02:11,
女孩第一次买刮刮乐就中了100万,48215.0,2024-03-12 02:11,
周翊然田曦薇热舞,37916.0,2024-03-12 02:11,
辞职考研的人越来越多了,35821.0,2024-03-12 02:11,
8个习惯正在毁掉你的胃,33472.0,2024-03-12 02:11,
一对夫妇做短剧每月进账4亿多,44904.0,2024-03-12 02:11,
许嵩演唱会抢票,37746.0,2024-03-12 02:11,
凯特王妃,35198.0,2024-03-12 02:11,
Uzi韩服账号改名JackeyLove,34403.0,2024-03-12 02:11,
高君雨妈妈发声,34181.0,2024-03-12 02:11,
耙耙柑不是粑粑柑,33644.0,2024-03-12 02:11,
多方回应网友质疑高君雨脑瘤手术视频,33520.0,2024-03-12 02:11,
与凤行变更为39集,33134.0,2024-03-12 02:11,
近10年考研国家线多在3月中旬公布,29316.0,2024-03-12 02:11,
教资考试知道成绩第一人,25072.0,2024-03-12 02:11,
RNG我哭死,31241.0,2024-03-12 02:11,
娃哈哈客服回应推出啤酒产品,28307.0,2024-03-12 02:11,
一直娱,27988.0,2024-03-12 02:11,
万茜穿平底鞋的身材比例,27959.0,2024-03-12 02:11,
涵艺爆料Milkyway到期召回,26350.0,2024-03-12 02:11,
吴镇宇表情,26231.0,2024-03-12 02:11,
高君雨妈妈称MCN运营出现严重问题,24117.0,2024-03-12 02:11,
Kanavi回应JDG输给FPX,23417.0,2024-03-12 02:11,
博主B太揭秘加油站鬼秤,19656.0,2024-03-12 02:11,
孙颖莎 好快的飞扑护台,16547.0,2024-03-12 02:11,
