name,value,date,Unnamed: 3
辅助生殖被纳入4省份医保,373821.0,2024-04-05 02:18,
这一互关就是一辈子,338553.0,2024-04-05 02:18,
清明版如愿致敬先辈,13911.0,2024-04-05 02:18,
最让人震惊的爆改出现了,274552.0,2024-04-05 02:18,
徐艺洋发了和黄子韬的合照,214384.0,2024-04-05 02:18,
十年后才知道朋友提前杀虫了,197442.0,2024-04-05 02:18,
餐馆老板让暑假工5元随便吃被欠五千餐费,145630.0,2024-04-05 02:18,
林更新喘息声,139035.0,2024-04-05 02:18,
比跷二郎腿伤害更大的坐姿,119887.0,2024-04-05 02:18,
福宝在家嘎嘎炫饭,53414.0,2024-04-05 02:18,
行止张嘴了,159445.0,2024-04-05 02:18,
恋爱让他谈 三界我来守,110360.0,2024-04-05 02:18,
终于在高铁上发疯了,99057.0,2024-04-05 02:18,
台湾4.6级地震,96979.0,2024-04-05 02:18,
林更新工作室,94950.0,2024-04-05 02:18,
沈璃行止圆房完整版,88748.0,2024-04-05 02:18,
果然上万年的童子身比较补,79119.0,2024-04-05 02:18,
台湾祭音乐节取消回春丹演出,77024.0,2024-04-05 02:18,
这次可让李沁演爽了,75501.0,2024-04-05 02:18,
岳父母要求继承女婿父母留下的房产,64406.0,2024-04-05 02:18,
四千的工资根本花不完甚至还能存点钱,84096.0,2024-04-05 02:18,
宫崎骏新作 完美的谢幕,68414.0,2024-04-05 02:18,
我和老公劝高三儿子放弃高考,66654.0,2024-04-05 02:18,
为什么鸟类大多是侧面照,65556.0,2024-04-05 02:18,
罪犯史泰龙被执行死刑,64113.0,2024-04-05 02:18,
小米SU7锁单前退定金即时到账,61327.0,2024-04-05 02:18,
18岁女生一天给男友打100多个电话,56115.0,2024-04-05 02:18,
与凤行热度,56086.0,2024-04-05 02:18,
瘦了24斤闺蜜说我像张元英,54508.0,2024-04-05 02:18,
姜爷爷回应母亲去世坚持送福宝,42667.0,2024-04-05 02:18,
黄旭熙solo,52629.0,2024-04-05 02:18,
为什么infp经常被误认为e人,46990.0,2024-04-05 02:18,
成毅前经纪公司发文,46539.0,2024-04-05 02:18,
小伞说Doinb能随时开播,44543.0,2024-04-05 02:18,
回春丹献唱穿过月亮的旅行,42840.0,2024-04-05 02:18,
Doinb被偶遇,42792.0,2024-04-05 02:18,
冷漠在男女关系里真的好用,41522.0,2024-04-05 02:18,
东宫绝世甜剧不是说说而已,40633.0,2024-04-05 02:18,
宜家怎么沦为了打工人食堂,39413.0,2024-04-05 02:18,
黄晓明自曝胖了30斤,38736.0,2024-04-05 02:18,
男朋友加了我妈微信,37391.0,2024-04-05 02:18,
马丽破产姐妹卡洛琳合作新片,36306.0,2024-04-05 02:18,
花楼花楼 我要迪斯尼,36011.0,2024-04-05 02:18,
张婧仪回复卢昱晓,35866.0,2024-04-05 02:18,
00后女生凭爱好考上大学,31331.0,2024-04-05 02:18,
辛芷蕾赵昭仪同框拍摄路透,30846.0,2024-04-05 02:18,
金靖cos西施,30617.0,2024-04-05 02:18,
郭艾伦秀张元英转圈过人,30375.0,2024-04-05 02:18,
卢昱晓 可塑性,34928.0,2024-04-05 02:18,
吴宣仪cover恶作剧,28708.0,2024-04-05 02:18,
