name,value,date,Unnamed: 3
三只羊参与举办电音节被指宰客,222703.0,2024-05-07 02:24,
抑郁女儿叫朋友来家里吃饭了,116488.0,2024-05-07 02:24,
数据盘点五一假期,16366.0,2024-05-07 02:24,
人民文娱评华晨宇日出演唱会,174412.0,2024-05-07 02:24,
男子确诊胃癌提前一年为自己安排身后事,106697.0,2024-05-07 02:24,
92名在缅北跨境电诈嫌犯被移交我方,73180.0,2024-05-07 02:24,
张翰一次开朗换来终生内向,113924.0,2024-05-07 02:24,
句句说分开 句句都是爱,99015.0,2024-05-07 02:24,
陈梦压力,54465.0,2024-05-07 02:24,
原来高铁上是有15元的盒饭的,66146.0,2024-05-07 02:24,
邓超你关注下陶白白吧,117030.0,2024-05-07 02:24,
女子为被性侵的母亲奔波后丢了工作,101328.0,2024-05-07 02:24,
张杰谢娜拍立得,69587.0,2024-05-07 02:24,
淘宝免单,68624.0,2024-05-07 02:24,
张若昀切范闲大号上线了,65809.0,2024-05-07 02:24,
杨幂曾问邓超亚比是什么,61327.0,2024-05-07 02:24,
上海现付费马桶圈充1000可用13.8万次,50725.0,2024-05-07 02:24,
腰臀比小的人更长寿,50074.0,2024-05-07 02:24,
WB 折磨,39188.0,2024-05-07 02:24,
想念郭艾伦,36729.0,2024-05-07 02:24,
经常口臭的人一般都逃不过这几个原因,257079.0,2024-05-07 02:24,
熬夜疲劳可能会让你变臭,193674.0,2024-05-07 02:24,
取消公办中小学教师编制可不可行,170939.0,2024-05-07 02:24,
徐园男友称其系自杀,138235.0,2024-05-07 02:24,
原来减肥更重要的是塑型,98685.0,2024-05-07 02:24,
缅甸,96246.0,2024-05-07 02:24,
豪宅小区被外卖员吐槽赔钱也不送,71208.0,2024-05-07 02:24,
无名痒是身体发出的信号,55965.0,2024-05-07 02:24,
二十多岁已经厌烦上班到极致,54823.0,2024-05-07 02:24,
吴磊 你好不好,42817.0,2024-05-07 02:24,
庆余年3还能集齐原班人马吗,42024.0,2024-05-07 02:24,
内娱直播考研上岸第一人,35859.0,2024-05-07 02:24,
刘亦菲海南plog,35604.0,2024-05-07 02:24,
杨鸣贴脸暴怒,34285.0,2024-05-07 02:24,
胡明轩巨星球,33796.0,2024-05-07 02:24,
想和吴磊谈,33225.0,2024-05-07 02:24,
黄金狂飙后钻石崩了,32758.0,2024-05-07 02:24,
有一种惨叫广东荔枝不挂果,30537.0,2024-05-07 02:24,
广州暴雨,29953.0,2024-05-07 02:24,
爸爸辅导作业崩溃用石榴砸破孩子脾脏,29538.0,2024-05-07 02:24,
邓紫棋上海五天连开将破纪录,29101.0,2024-05-07 02:24,
南部战区海军海空立体联合搜救演练,28802.0,2024-05-07 02:24,
存款十几万在小县城什么水平,28557.0,2024-05-07 02:24,
他新婚盛装她真刀真枪,28170.0,2024-05-07 02:24,
和动画简直一模一样,27404.0,2024-05-07 02:24,
纪凌尘回复宋威龙,25906.0,2024-05-07 02:24,
原来这些行为是良性自虐,25529.0,2024-05-07 02:24,
李沁拿鸡腿,25235.0,2024-05-07 02:24,
徐园男友有3次暴力前科,24975.0,2024-05-07 02:24,
Jennie和zicoMV花絮,23455.0,2024-05-07 02:24,
