name,value,date,Unnamed: 3
蒋敦豪发长文回应,841535.0,2024-07-23 02:21,
奶茶30元时代已成过去,188726.0,2024-07-23 02:21,
神十八乘组太空出差能有多充实,17795.0,2024-07-23 02:21,
苹果手表被曝运动记录无中生有,147287.0,2024-07-23 02:21,
从严从快处理师德失范行为,121812.0,2024-07-23 02:21,
种地吧成员支持蒋敦豪,405666.0,2024-07-23 02:21,
李梦 穿的不错下次别穿了,157142.0,2024-07-23 02:21,
gidle方道歉,124568.0,2024-07-23 02:21,
人大王某某被开除党籍,99389.0,2024-07-23 02:21,
你好易初女士,10171.0,2024-07-23 02:21,
老年男明星 性侵女服务员,513549.0,2024-07-23 02:21,
人大通报王某某性骚扰,370232.0,2024-07-23 02:21,
万千气象看青海,25051.0,2024-07-23 02:21,
空空日记人设,153584.0,2024-07-23 02:21,
女子称因学历低被判去高危妊娠门诊,122744.0,2024-07-23 02:21,
空空日记掉粉超100万,101802.0,2024-07-23 02:21,
相柳战死,99713.0,2024-07-23 02:21,
90后男女都65岁以后退休系网民推估,84040.0,2024-07-23 02:21,
清华教授解读自愿弹性延迟退休原则,83226.0,2024-07-23 02:21,
女子折叠凳掉福宝场地被终身禁入,81498.0,2024-07-23 02:21,
拜登退选至少有两重原因,78538.0,2024-07-23 02:21,
游泳时千万别穿白色泳衣,73831.0,2024-07-23 02:21,
田曦薇财阀千金,72710.0,2024-07-23 02:21,
中国人民大学声明,67314.0,2024-07-23 02:21,
秦岚 我不会和前任做朋友,65179.0,2024-07-23 02:21,
宁艺卓说第一次在中国签售,57936.0,2024-07-23 02:21,
男子猥亵被拘13天父亲向受害者求情,57154.0,2024-07-23 02:21,
娜然在内娱闯出妩魅系赛道,53611.0,2024-07-23 02:21,
相柳是笑着死的,53167.0,2024-07-23 02:21,
天秤座的情绪周期,51373.0,2024-07-23 02:21,
郑州暴雨,51057.0,2024-07-23 02:21,
金智媛化妆师秒删ins,50318.0,2024-07-23 02:21,
人民网评人大清理害群之马,48449.0,2024-07-23 02:21,
毛球,46812.0,2024-07-23 02:21,
中方决定取消对美国卫讯公司的反制措施,45589.0,2024-07-23 02:21,
原来慈禧太后的卧室长这样,45105.0,2024-07-23 02:21,
李昊 十个勤天永远是十个勤天,44677.0,2024-07-23 02:21,
杨紫长相思2最后一个镜头,43972.0,2024-07-23 02:21,
肖战陈情令人物曲上线五周年,40243.0,2024-07-23 02:21,
婚礼上被喷酒新娘霸气眼神杀,38601.0,2024-07-23 02:21,
优衣库和中国消费者都说对方变了,38176.0,2024-07-23 02:21,
一句警察叔叔我好饿小孩哥成功蹭到了,36205.0,2024-07-23 02:21,
人大女博士举报情况属实,35720.0,2024-07-23 02:21,
肖战宋威龙同款,36517.0,2024-07-23 02:21,
成毅赴山海被绑路透,35272.0,2024-07-23 02:21,
张杰帮唱凡希亚,33991.0,2024-07-23 02:21,
相柳下线了,33854.0,2024-07-23 02:21,
汪苏泷我想念一周年,33030.0,2024-07-23 02:21,
长相思尖叫之夜,33452.0,2024-07-23 02:21,
00后姑娘试用期被特批15天休假,31420.0,2024-07-23 02:21,
