name,value,date,Unnamed: 3
蔡徐坤范思哲全球品牌代言人,259082.0,2024-05-22 02:19,
夫妻俩因为同一个习惯双双确诊结直肠癌,226477.0,2024-05-22 02:19,
港珠澳大桥今年出入境客流破1000万人次,16450.0,2024-05-22 02:19,
中国终将实现完全统一,165324.0,2024-05-22 02:19,
中方要求以色列立即停止军事进攻拉法,160603.0,2024-05-22 02:19,
二皇子人设,145147.0,2024-05-22 02:19,
李佳琦回应参加披哥,142603.0,2024-05-22 02:19,
年轻人为什么喜欢养寄居蟹了,121177.0,2024-05-22 02:19,
海南海边发现骨架2米不明生物尸体,114701.0,2024-05-22 02:19,
单亲爸爸思念妻子泪如雨下,15009.0,2024-05-22 02:19,
迪丽热巴祝赵昭仪生日大快乐,114394.0,2024-05-22 02:19,
大麦回应出示死亡证明仍拒变更观演人,113372.0,2024-05-22 02:19,
为什么女生的身上莫名出现淤青,93582.0,2024-05-22 02:19,
蕾哈娜直播带货,86411.0,2024-05-22 02:19,
Jennie曾拒绝李胜利的邀请,77248.0,2024-05-22 02:19,
新航客机死亡上升至2人,71470.0,2024-05-22 02:19,
武功山失温遇难女孩同伴曾打电话求救,68671.0,2024-05-22 02:19,
外交部回应布林肯祝贺赖清德就职,68199.0,2024-05-22 02:19,
刘亦菲回复舒淇,67409.0,2024-05-22 02:19,
RNG 别虐泉,51637.0,2024-05-22 02:19,
森林北回应,236588.0,2024-05-22 02:19,
公职人员出轨不雅照被张贴车上,123528.0,2024-05-22 02:19,
付辛博演技,51965.0,2024-05-22 02:19,
五月天鸟巢演唱会,51685.0,2024-05-22 02:19,
建议大家工作后都准备两个微信,47054.0,2024-05-22 02:19,
哥哥想替过世妹妹见周杰伦遭大麦拒绝,47857.0,2024-05-22 02:19,
赵丽颖去了与凤行庆功宴,43454.0,2024-05-22 02:19,
又幸福了纯爱大皇子,49174.0,2024-05-22 02:19,
4小孩河边洗澡两人溺亡同行人获刑11年,41160.0,2024-05-22 02:19,
infp会喜欢什么样的人,40339.0,2024-05-22 02:19,
姚PD感谢苗苗救场跑男,41640.0,2024-05-22 02:19,
赵丽颖T恤印的是狗头,42337.0,2024-05-22 02:19,
王启年 在下邓子越,40171.0,2024-05-22 02:19,
李胜利百万欠款的来龙去脉,39743.0,2024-05-22 02:19,
王婆说媒相亲已婚男已离婚,38474.0,2024-05-22 02:19,
张艺兴晒了与林允儿合照,37864.0,2024-05-22 02:19,
背着善宰跑14集,35601.0,2024-05-22 02:19,
这5类人要少吃榴莲,34405.0,2024-05-22 02:19,
克罗斯宣布退役,33951.0,2024-05-22 02:19,
第一次意识到1万块这么有质感,33430.0,2024-05-22 02:19,
张若昀为什么不能改名叫张姐,34336.0,2024-05-22 02:19,
朱丹赛道被颖儿闯进去了,32778.0,2024-05-22 02:19,
广州到上海仅需3小时,32402.0,2024-05-22 02:19,
起猛了以为李峋回来了,30525.0,2024-05-22 02:19,
脑瘫小伙每天下班后做兼职努力赚钱,12848.0,2024-05-22 02:19,
在东京吃雪人儿肉,29259.0,2024-05-22 02:19,
袁爷爷吴爷爷我们好想你们,28536.0,2024-05-22 02:19,
张颂文说小白不好管了,27671.0,2024-05-22 02:19,
舒淇穿洞洞鞋,27586.0,2024-05-22 02:19,
请问这是男生女生拿命来吗,24970.0,2024-05-22 02:19,
