name,value,date,Unnamed: 3
729声明,231072.0,2024-07-10 02:23,
涂山璟 此身从此分明了,165580.0,2024-07-10 02:23,
伟大的历史变革,14889.0,2024-07-10 02:23,
为什么现在电视剧都是1女N男,153381.0,2024-07-10 02:23,
跌200万后女子要卖掉能看西湖的房子,140342.0,2024-07-10 02:23,
西班牙vs法国,96572.0,2024-07-10 02:23,
相柳 ooc,152044.0,2024-07-10 02:23,
Jennie方承认吸烟并道歉,151755.0,2024-07-10 02:23,
巴黎奥运会韩国代表团制服,89825.0,2024-07-10 02:23,
母亲背罕见病儿子14年累断足骨,12114.0,2024-07-10 02:23,
失踪22年美国登山者遗体被找到,171933.0,2024-07-10 02:23,
黄晓明再次感谢虞书欣,119077.0,2024-07-10 02:23,
清华大学博士情侣毕业奔赴祖国中部,88383.0,2024-07-10 02:23,
防风邶下线,74910.0,2024-07-10 02:23,
中国人民解放军92950部队记一等功,72656.0,2024-07-10 02:23,
长相思戏还没播完番外先出了,68773.0,2024-07-10 02:23,
欧洲杯半决赛,61541.0,2024-07-10 02:23,
iPhone16系列或将支持40W快充,59107.0,2024-07-10 02:23,
小夭的难堪众人的狂欢,55469.0,2024-07-10 02:23,
三只羊在开发自营梅菜扣肉,34754.0,2024-07-10 02:23,
不想结节癌变千万避开这3种蔬菜,76690.0,2024-07-10 02:23,
李善均案泄密警察记者被抓,54407.0,2024-07-10 02:23,
杜海涛在节目里又cue沈梦辰了,51866.0,2024-07-10 02:23,
体制内对怀孕女性的态度,44902.0,2024-07-10 02:23,
会吵架真的能省很多事,33973.0,2024-07-10 02:23,
才25岁就要被介绍40岁的男孩,43977.0,2024-07-10 02:23,
猫猫摸完后居然会按开心,41234.0,2024-07-10 02:23,
体制内到办公室的第一件事,39864.0,2024-07-10 02:23,
研究发现月经用品中含有毒金属,37165.0,2024-07-10 02:23,
孙莉晒三个孩子近况,35856.0,2024-07-10 02:23,
4个部位出汗多暗示身体有问题,35419.0,2024-07-10 02:23,
欧洲杯最壕的一场比赛来了,34390.0,2024-07-10 02:23,
人死之前为什么会回光返照,33187.0,2024-07-10 02:23,
荷兰男子捐精生下1000个娃,32104.0,2024-07-10 02:23,
AI生成插画制作流程视频,31935.0,2024-07-10 02:23,
朱一龙黄振开,31371.0,2024-07-10 02:23,
卢昱晓父母都是医生,30511.0,2024-07-10 02:23,
夏日整活日记,30498.0,2024-07-10 02:23,
金牛座为什么难以亲近,30127.0,2024-07-10 02:23,
张贤胜公开退团原因,29453.0,2024-07-10 02:23,
主动一点儿挺好的,28656.0,2024-07-10 02:23,
鹿晗工作室是在暗示四巡地点吗,27190.0,2024-07-10 02:23,
你好星期六评分,26748.0,2024-07-10 02:23,
白敬亭P了两个白敬亭,21614.0,2024-07-10 02:23,
重生之我是江浙沪独女,21485.0,2024-07-10 02:23,
BOYNEXTDOOR拍的队友,21331.0,2024-07-10 02:23,
华晨宇演唱会日出场航拍,20960.0,2024-07-10 02:23,
两个账号同一航班价格相差1300,20927.0,2024-07-10 02:23,
辛纳对战梅德维德夫,20914.0,2024-07-10 02:23,
billboard评选的最佳KPOP专辑,20547.0,2024-07-10 02:23,
