name,value,date,Unnamed: 3
3月1日起快递不得擅自放驿站,155447.0,2024-02-24 06:11,
肖战领口一年比一年低,118997.0,2024-02-24 06:11,
空间站里都有哪些科学装置,7031.0,2024-02-24 06:11,
广州断桥事件倒车拦车车主发声,93083.0,2024-02-24 06:11,
周一围对朱丹不理解但关心,85534.0,2024-02-24 06:11,
贾玲说如果重拍你好李焕英会更有电影感,73593.0,2024-02-24 06:11,
杭州98年姑娘自助买二手房省4万多中介费,60610.0,2024-02-24 06:11,
汪东城回应吴尊,53657.0,2024-02-24 06:11,
富家千金接班7年累计亏损近32亿,53004.0,2024-02-24 06:11,
曾黎也有撑伞神图了,45505.0,2024-02-24 06:11,
官方回应女浴室门口图片被吐槽变态,122935.0,2024-02-24 06:11,
凯特王妃疑患绿色癌症,78332.0,2024-02-24 06:11,
网红杨老二家属称劝酒观众无一人道歉,71940.0,2024-02-24 06:11,
胡先煦黑历史再加一,43167.0,2024-02-24 06:11,
93岁姥爷非要帮铲雪外孙女吓跪了,40198.0,2024-02-24 06:11,
迪士尼现在能带食物的原因,34583.0,2024-02-24 06:11,
大理寺少卿游 竹马天降,33290.0,2024-02-24 06:11,
影视剧只拍上半身的原因,30101.0,2024-02-24 06:11,
任正非曾公开支持姚安娜搞文艺,29348.0,2024-02-24 06:11,
新东方发布归巢计划,25726.0,2024-02-24 06:11,
容易长胖的人可能蛋白质没吃够,33276.0,2024-02-24 06:11,
好久没联系的同学一般只有三件事,27810.0,2024-02-24 06:11,
早上和老板说怀孕下午就被降薪,24421.0,2024-02-24 06:11,
28岁网红菲菲公主因癌症去世,23580.0,2024-02-24 06:11,
马面裙卖爆了,21393.0,2024-02-24 06:11,
肖战第二套看秀造型,20817.0,2024-02-24 06:11,
预示癌症的20个症状,20772.0,2024-02-24 06:11,
元宵节文案,20349.0,2024-02-24 06:11,
不会断句的网友把博物馆逼得改名,20124.0,2024-02-24 06:11,
元宵节有哪些民俗,16225.0,2024-02-24 06:11,
春楠 热辣滚烫最不值一提的是减重,19169.0,2024-02-24 06:11,
贾玲 你看到什么我就拍了什么,17902.0,2024-02-24 06:11,
吐槽如懿传视频被投诉下架,17714.0,2024-02-24 06:11,
经常内耗焦虑可能是你太认真了,17475.0,2024-02-24 06:11,
大王具足虫,17344.0,2024-02-24 06:11,
多地延迟开学90后父母忙成双面人,17309.0,2024-02-24 06:11,
佛山电翰又开始直播打螺丝了,17274.0,2024-02-24 06:11,
王者荣耀,15769.0,2024-02-24 06:11,
苏醒也知道很不体面,15288.0,2024-02-24 06:11,
Hanni米兰时装周,9872.0,2024-02-24 06:11,
虞书欣 橱窗娃娃,15071.0,2024-02-24 06:11,
徐璐直播,14754.0,2024-02-24 06:11,
母女是一种有痛感的关系,14545.0,2024-02-24 06:11,
唐九洲赵昭仪吓跪了,14293.0,2024-02-24 06:11,
鹿晗村超破门做C罗式庆祝,13689.0,2024-02-24 06:11,
蒲熠星给苏醒开了十年会员,14150.0,2024-02-24 06:11,
猎冰,13524.0,2024-02-24 06:11,
沥心沙大桥事故幸存者发声,12852.0,2024-02-24 06:11,
水哥出题算是踢到铁板了,11949.0,2024-02-24 06:11,
张艺兴全英文新歌,11925.0,2024-02-24 06:11,
