name,value,date,Unnamed: 3
董宇辉称非常反感被叫网红,198617.0,2024-06-10 06:13,
不接陌生电话但是要去微信搜,85504.0,2024-06-10 06:13,
一批诋毁企业形象账号被处置,23278.0,2024-06-10 06:13,
女子注射400支玻尿酸丰臀致臀部感染,181875.0,2024-06-10 06:13,
刘亦菲头像,71678.0,2024-06-10 06:13,
潮牌Champion为什么不火了,47858.0,2024-06-10 06:13,
彭冠英嘻嘻徐海乔不嘻嘻,63466.0,2024-06-10 06:13,
陈雨浓孙程潇吵架,55233.0,2024-06-10 06:13,
2024端午来啦,38972.0,2024-06-10 06:13,
苏炳添回应帅气高考生喊话,2784.0,2024-06-10 06:13,
女子厕所装百叶窗走光3年浑然不知,155313.0,2024-06-10 06:13,
殷罡逝世,115453.0,2024-06-10 06:13,
新女团成员上节目被开黄腔,58136.0,2024-06-10 06:13,
刘亦菲5集换了32套造型,47425.0,2024-06-10 06:13,
真的和纸片人结婚了,41015.0,2024-06-10 06:13,
早田希娜女单冠军,38568.0,2024-06-10 06:13,
法网,37645.0,2024-06-10 06:13,
我爸以为有教资就能去学校当老师,36656.0,2024-06-10 06:13,
原伟东称曾遭牙签扎指甲逼供,36051.0,2024-06-10 06:13,
高考下一章 墨雨云间,32667.0,2024-06-10 06:13,
经常吃水煮蛋是养肝还是伤肝,72123.0,2024-06-10 06:13,
高铁上拒绝了宝妈的换座要求,58676.0,2024-06-10 06:13,
老破小二手房突然火了,57077.0,2024-06-10 06:13,
小警犬因太友好而被开除,37320.0,2024-06-10 06:13,
玫瑰的故事,31010.0,2024-06-10 06:13,
3个洗碗坏习惯或增加患癌风险,36238.0,2024-06-10 06:13,
张翰当伴郎,32501.0,2024-06-10 06:13,
紧急提醒这种粽子绳有毒,32370.0,2024-06-10 06:13,
金价大跌消费者还想再等等,32159.0,2024-06-10 06:13,
高考再见,17057.0,2024-06-10 06:13,
刘亦菲彭冠英踮脚吻,30911.0,2024-06-10 06:13,
窝囊废赛道挤满了男明星,30428.0,2024-06-10 06:13,
黄晓明的眼神比大学生都清澈,26445.0,2024-06-10 06:13,
他做饭他被骂他委屈巴巴,26260.0,2024-06-10 06:13,
宋丹丹问董璇谈恋爱了不,25972.0,2024-06-10 06:13,
廊坊灭门案再开庭,25828.0,2024-06-10 06:13,
用李现照片当成相亲对象发给老爸,25069.0,2024-06-10 06:13,
于正审美,24297.0,2024-06-10 06:13,
墨雨云间,23347.0,2024-06-10 06:13,
荣梓杉是今年中戏北电双第一,22422.0,2024-06-10 06:13,
请问你俩不亲是谁的问题,22035.0,2024-06-10 06:13,
为什么离职的都去新疆了,21725.0,2024-06-10 06:13,
相亲对象对我隐瞒了学历,20790.0,2024-06-10 06:13,
你常做的7件小事正在偷走骨头里的钙,20489.0,2024-06-10 06:13,
老师最不看好你 可你偏偏最争气,19602.0,2024-06-10 06:13,
白桃星座,19448.0,2024-06-10 06:13,
以色列,19173.0,2024-06-10 06:13,
中国零食饮料逐渐征服外国人,17925.0,2024-06-10 06:13,
孟庭苇叫赵丽颖颖宝,17588.0,2024-06-10 06:13,
终于找到戴夫的家了,17065.0,2024-06-10 06:13,
