name,value,date,Unnamed: 3
上海暴雨,332912.0,2024-02-21 06:00,
央视网评秦朗丢寒假作业事件,161507.0,2024-02-21 06:00,
航天员拍摄的蔚蓝地球,14571.0,2024-02-21 06:00,
肖战 请不要再蹲守了,95214.0,2024-02-21 06:00,
许凯报警,87896.0,2024-02-21 06:00,
专家称现在不买房五年又白忙,80347.0,2024-02-21 06:00,
目前票房前6都是跨界导演,79857.0,2024-02-21 06:00,
金晨 不存在白敬亭放鸽子,76097.0,2024-02-21 06:00,
冻雨,50391.0,2024-02-21 06:00,
cos赵世子男网红道歉,45018.0,2024-02-21 06:00,
当哈尔滨收起来玩具后的本地人,66110.0,2024-02-21 06:00,
柳鑫宇自曝事件,58548.0,2024-02-21 06:00,
中国女游客泰国搭摩托车险遭司机强暴,54722.0,2024-02-21 06:00,
贾玲第一次正视自己的才华,47301.0,2024-02-21 06:00,
刘涛演妈祖 掷圣杯,43574.0,2024-02-21 06:00,
后车想破头也不知道堵车原因是800只鹅,40178.0,2024-02-21 06:00,
乐华为王一博报警,37378.0,2024-02-21 06:00,
曼谷偶遇刘恋庄达菲,33112.0,2024-02-21 06:00,
柳鑫宇发声,32124.0,2024-02-21 06:00,
背薄真的显年轻,28480.0,2024-02-21 06:00,
毕业工作四年只存了4w块钱,36798.0,2024-02-21 06:00,
贾玲有七部待播作品,28794.0,2024-02-21 06:00,
妈妈让我工作后每月给家里转三千,27227.0,2024-02-21 06:00,
十年前抽过的烟至今还在伤害免疫系统,24300.0,2024-02-21 06:00,
明星后援会是怎么运作的,23983.0,2024-02-21 06:00,
以为大家开玩笑的你家是真有,22854.0,2024-02-21 06:00,
多部门已介入核查柳鑫宇自曝事件,22311.0,2024-02-21 06:00,
工位越乱的员工稳定性越好,20443.0,2024-02-21 06:00,
钱学森写在香烟纸上的求救信,19206.0,2024-02-21 06:00,
四六级成绩倒计时,18965.0,2024-02-21 06:00,
喜剧演员是对他最大的误解,17567.0,2024-02-21 06:00,
贵州山火,17304.0,2024-02-21 06:00,
肖战工作室倡议书,17194.0,2024-02-21 06:00,
梅西AI,17096.0,2024-02-21 06:00,
男子游神现场cos赵世子被马夫鞭打,16380.0,2024-02-21 06:00,
生死面前什么是更好的抉择,15996.0,2024-02-21 06:00,
我好像连一万块都很难存下来,15923.0,2024-02-21 06:00,
不化妆素颜出门怎么变好看,15753.0,2024-02-21 06:00,
贵州普安山火已致2人遇难,15524.0,2024-02-21 06:00,
韩素希腰部纹身含义,15162.0,2024-02-21 06:00,
原来孙艺洲这么会开车,15083.0,2024-02-21 06:00,
胖东来回应看完电影不满意可退半价,14749.0,2024-02-21 06:00,
狗狗的耳朵一只站岗一只稍息,14303.0,2024-02-21 06:00,
张佳宁点不掉的痣,13802.0,2024-02-21 06:00,
江西菜是预制菜鄙视链的顶端,13674.0,2024-02-21 06:00,
努力凑够400万可怜可怜他,13390.0,2024-02-21 06:00,
周洁琼谈吴镇宇的教导,13297.0,2024-02-21 06:00,
时代少年团开通B站账号,12870.0,2024-02-21 06:00,
虞书欣兔塑,11391.0,2024-02-21 06:00,
百元之恋导演编剧祝贺贾玲,11195.0,2024-02-21 06:00,
