name,value,date,Unnamed: 3
广州遇难公交司机凌晨4点工作到晚7点,283312.0,2024-02-23 06:09,
一旦出现这个姿势要立即就医,131539.0,2024-02-23 06:09,
南腔北调见证冰雪运动热力十足,8737.0,2024-02-23 06:09,
断崖式衰老常发生在3个年龄,102415.0,2024-02-23 06:09,
青簪行 定档,77864.0,2024-02-23 06:09,
当一个江浙沪赘婿决定离婚,72243.0,2024-02-23 06:09,
网红杨老二去世,70888.0,2024-02-23 06:09,
2.2亿元彩票大奖得主无须缴纳个人所得税,56372.0,2024-02-23 06:09,
庄达菲海边大片竟是王安宇拍的,51529.0,2024-02-23 06:09,
宋小宝凭实力爆改自己,44542.0,2024-02-23 06:09,
我的妈妈是大明星,54305.0,2024-02-23 06:09,
法国观众说封神比漫威电影好看,43498.0,2024-02-23 06:09,
生理性喜欢,41592.0,2024-02-23 06:09,
人民网评网红扮演赵世子,40974.0,2024-02-23 06:09,
高合创始人承认翻身窗口期仅剩3个月,34093.0,2024-02-23 06:09,
张继科重回蝴蝶乒乓中国官网,32863.0,2024-02-23 06:09,
我和马丽只差一个王晶,29990.0,2024-02-23 06:09,
陈都灵早期模特照,28897.0,2024-02-23 06:09,
Redmi显示器,25420.0,2024-02-23 06:09,
迪丽热巴妈妈想再养育一遍她,25245.0,2024-02-23 06:09,
浙江一17岁学生确诊肠癌,39668.0,2024-02-23 06:09,
人生建议 永远别赚太辛苦的钱,37576.0,2024-02-23 06:09,
白天和晚上睡觉的区别,33246.0,2024-02-23 06:09,
整个三亚都在偶遇明星,29695.0,2024-02-23 06:09,
什么叫裁员裁到大动脉了,29019.0,2024-02-23 06:09,
Gucci和Tods接机肖战,24869.0,2024-02-23 06:09,
孙千吃醋了,23541.0,2024-02-23 06:09,
阿根廷友谊赛移至美国进行,21637.0,2024-02-23 06:09,
快30岁还觉得自己像小孩,19772.0,2024-02-23 06:09,
哥哥给妹妹化韩妆,19323.0,2024-02-23 06:09,
安徽冻雨,19225.0,2024-02-23 06:09,
肖战台版GQ封面大片,18609.0,2024-02-23 06:09,
上海和深圳的区别在哪,17991.0,2024-02-23 06:09,
甲沟炎患者不建议养猫,17548.0,2024-02-23 06:09,
柿柿如意汤圆火了,15903.0,2024-02-23 06:09,
断崖式衰老,15667.0,2024-02-23 06:09,
圆肩驼背可能会导致龅牙,15428.0,2024-02-23 06:09,
普通情侣一年的年收入,15416.0,2024-02-23 06:09,
把学历改成高中后终于找到工作,15402.0,2024-02-23 06:09,
外国人在用一种很新的搓澡巾,14628.0,2024-02-23 06:09,
一段关系结束的标志,14355.0,2024-02-23 06:09,
倪妮钻石背心,14180.0,2024-02-23 06:09,
青簪行 簪中录,13315.0,2024-02-23 06:09,
节后减脂餐好吃掉秤,12831.0,2024-02-23 06:09,
于正要拍仙侠剧,12670.0,2024-02-23 06:09,
迪丽热巴相信时间会给出答案,12583.0,2024-02-23 06:09,
网传浪姐2024名单,12440.0,2024-02-23 06:09,
白鹿敖瑞鹏回应吻戏,12427.0,2024-02-23 06:09,
农民修理工版李宗盛坐拥130万粉丝,12278.0,2024-02-23 06:09,
鹿晗张云龙问路路透,12195.0,2024-02-23 06:09,
