name,value,date,Unnamed: 3
芒果又押错宝了吗,241462.0,2024-04-27 06:17,
田馥甄回应参加天津音乐节,120119.0,2024-04-27 06:17,
全国网络普法行江苏站,1819.0,2024-04-27 06:17,
辅警杀害新婚妻子被判死缓,226071.0,2024-04-27 06:17,
抗癌东东去世,134255.0,2024-04-27 06:17,
刘琳演技 此处无声却震耳欲聋,116383.0,2024-04-27 06:17,
28岁女子经常饥一顿饱一顿确诊胃癌,108746.0,2024-04-27 06:17,
工作三年和读研三年到底哪个更值,105189.0,2024-04-27 06:17,
美国去死宣传册疯传美高校,98599.0,2024-04-27 06:17,
飞行员训练进化到让我震惊,17494.0,2024-04-27 06:17,
女生晒八年级妹妹价值888元点阵笔,188792.0,2024-04-27 06:17,
61岁老人接孙女放学掉进下水道被冲走,97152.0,2024-04-27 06:17,
发明邓超的人真是个天才,92737.0,2024-04-27 06:17,
奔跑吧P安全带,84568.0,2024-04-27 06:17,
韩国N号房事件再现,82821.0,2024-04-27 06:17,
为什么超市里的蓝莓多是125克一盒,81186.0,2024-04-27 06:17,
跑男收视率,69021.0,2024-04-27 06:17,
没有编制教师岗还有吸引力吗,63180.0,2024-04-27 06:17,
泽泽饭饭 断崖式分手,54479.0,2024-04-27 06:17,
爱情公寓 同一个人不同的角色,51309.0,2024-04-27 06:17,
为什么睡醒后总是疲惫,115421.0,2024-04-27 06:17,
70后女子坚持跑步9年重返20岁,52092.0,2024-04-27 06:17,
李庚希录节目进去23出来24,48826.0,2024-04-27 06:17,
癌症晚期倾家荡产吃药延长生命值得吗,41128.0,2024-04-27 06:17,
林更新 把你的恶心收一收,42684.0,2024-04-27 06:17,
哈尔滨一九四四 活到年底都算喜丧,38402.0,2024-04-27 06:17,
辛芷蕾拿了白玉兰戏剧奖,38394.0,2024-04-27 06:17,
睡不着就吃天然的褪黑素,37897.0,2024-04-27 06:17,
庞博10天瘦了7斤,37328.0,2024-04-27 06:17,
普京称计划5月访华,18075.0,2024-04-27 06:17,
范伟62岁再夺影帝,36844.0,2024-04-27 06:17,
走路时膝盖突然软一下咋回事,35061.0,2024-04-27 06:17,
南方媳妇到山东吃席400块17个菜,32854.0,2024-04-27 06:17,
为什么职场人喜欢戴智能手表,30052.0,2024-04-27 06:17,
台湾花莲附近发生4.6级左右地震,29267.0,2024-04-27 06:17,
韩国教师引诱121名未成年拍不雅视频,28685.0,2024-04-27 06:17,
徐冬冬尹子维影子吻,28636.0,2024-04-27 06:17,
强制自己早睡的方法找到了,25216.0,2024-04-27 06:17,
向太大腿骨断裂,24067.0,2024-04-27 06:17,
美国男子强奸14岁少女被判物理阉割,23489.0,2024-04-27 06:17,
多久不吃才算空腹,22935.0,2024-04-27 06:17,
美国各高校抗议以色列对加沙的战争,21643.0,2024-04-27 06:17,
张杰演唱会门口被陌生人送票,21579.0,2024-04-27 06:17,
邓超 亚比囧囧囧,21285.0,2024-04-27 06:17,
赵小童 三号房爬进一只小龙虾,21163.0,2024-04-27 06:17,
叫人搬家来了个六十多岁的大爷,20800.0,2024-04-27 06:17,
恋综 合约情侣,18675.0,2024-04-27 06:17,
偶像梦幻祭新团,17428.0,2024-04-27 06:17,
Jennie第一次cha,17255.0,2024-04-27 06:17,
HYBE否认不宣传newjeans,16683.0,2024-04-27 06:17,
