name,value,date,Unnamed: 3
迪丽热巴不喝冰川水的原因,90878.0,2024-07-16 06:10,
双高父母16岁儿子身高仅156竟因睡眠不足,46173.0,2024-07-16 06:10,
全面深化改革的实践续篇,10519.0,2024-07-16 06:10,
北京一幼儿园突遇搬迁遭家长集体反对,59325.0,2024-07-16 06:10,
本届欧洲杯到底有多难看,34177.0,2024-07-16 06:10,
爱奇艺回应基础会员不能跳片头广告,28324.0,2024-07-16 06:10,
3名中国火炬手巴黎传递奥运火炬,27256.0,2024-07-16 06:10,
韩总 夫人终于给你名分了,23399.0,2024-07-16 06:10,
上半年中国GDP同比增长5.0%,8236.0,2024-07-16 06:10,
三伏天反而要防寒,11459.0,2024-07-16 06:10,
劳斯莱斯传奇设计师被刺身亡,98739.0,2024-07-16 06:10,
日本17岁女孩误拍他人惨遭杀害,81816.0,2024-07-16 06:10,
旅行有一种没苦硬吃的感觉,58858.0,2024-07-16 06:10,
惠州4人潜水失联背后,38628.0,2024-07-16 06:10,
霸王茶姬就员工离职被公示致歉,28228.0,2024-07-16 06:10,
王子奇李耕耘争当爹,28043.0,2024-07-16 06:10,
孟子义原名孟子乂,27855.0,2024-07-16 06:10,
小夭给玱玹砸了一辈子,21538.0,2024-07-16 06:10,
九尾缺席沙特大名单,19870.0,2024-07-16 06:10,
ins爆火双麻花辫,18888.0,2024-07-16 06:10,
长期烧水喝和买桶装水喝哪个更健康,72966.0,2024-07-16 06:10,
失眠为什么建议把脚露外面,38914.0,2024-07-16 06:10,
韩国女性孕36周堕胎被警方调查,33259.0,2024-07-16 06:10,
三伏天谨记三忌三宜,26693.0,2024-07-16 06:10,
百岁奶奶为浇菜把粪桶放孙子屋,23104.0,2024-07-16 06:10,
最讨厌的小说女主名字,22749.0,2024-07-16 06:10,
网传花儿与少年6名单,22513.0,2024-07-16 06:10,
吴谨言王星越叼玫瑰花片段被删,20526.0,2024-07-16 06:10,
一家三口心眼子不齐是什么体验,20474.0,2024-07-16 06:10,
原来一个人就可以四世同堂了,19208.0,2024-07-16 06:10,
徐艺洋在SM时期的旧照,18982.0,2024-07-16 06:10,
当你的手办被妈妈碰过,18302.0,2024-07-16 06:10,
拍出了赵今麦竹的气质,18178.0,2024-07-16 06:10,
被拽走时依然保持明星姿态,17820.0,2024-07-16 06:10,
解决内耗最好的方法是学会翻篇,17402.0,2024-07-16 06:10,
猫 没事哒,17311.0,2024-07-16 06:10,
周雨彤 花少,17148.0,2024-07-16 06:10,
iPhone16值得等吗,16118.0,2024-07-16 06:10,
俩话痨在婚礼上也止不住唠嗑,15889.0,2024-07-16 06:10,
相柳九命九脸,15883.0,2024-07-16 06:10,
婆婆理解的皮蛋瘦肉粥,15527.0,2024-07-16 06:10,
邓为涂山璟人夫感,14832.0,2024-07-16 06:10,
07高中生的一天是什么样,14736.0,2024-07-16 06:10,
霸王茶姬被曝正在业内大量挖人,14322.0,2024-07-16 06:10,
秦彻 喵喵牌,14040.0,2024-07-16 06:10,
九尾Cat清清梦之队交流大使,14034.0,2024-07-16 06:10,
国家助学贷款在校期间本息都不用还,13977.0,2024-07-16 06:10,
文佳煐车银优合照,13652.0,2024-07-16 06:10,
被小女孩照顾长大的小象,13347.0,2024-07-16 06:10,
单依纯希望这辈子优质的活着,12705.0,2024-07-16 06:10,
