name,value,date,Unnamed: 3
三只羊参与举办电音节被指宰客,192441.0,2024-05-07 06:09,
缅甸,173714.0,2024-05-07 06:09,
数据盘点五一假期,18518.0,2024-05-07 06:09,
人民文娱评华晨宇日出演唱会,129871.0,2024-05-07 06:09,
男子确诊胃癌提前一年为自己安排身后事,120605.0,2024-05-07 06:09,
上海现付费马桶圈充1000可用13.8万次,110735.0,2024-05-07 06:09,
抑郁女儿叫朋友来家里吃饭了,105451.0,2024-05-07 06:09,
张翰一次开朗换来终生内向,102456.0,2024-05-07 06:09,
黄金狂飙后钻石崩了,80137.0,2024-05-07 06:09,
92名在缅北跨境电诈嫌犯被移交我方,45419.0,2024-05-07 06:09,
女子为被性侵的母亲奔波后丢了工作,71346.0,2024-05-07 06:09,
邓超你关注下陶白白吧,59007.0,2024-05-07 06:09,
男子打球被球友看出面相不对救了一命,45246.0,2024-05-07 06:09,
张若昀切范闲大号上线了,44447.0,2024-05-07 06:09,
句句说分开 句句都是爱,41414.0,2024-05-07 06:09,
他新婚盛装她真刀真枪,44435.0,2024-05-07 06:09,
张杰谢娜拍立得,42754.0,2024-05-07 06:09,
抗抑郁食物清单,38496.0,2024-05-07 06:09,
陈梦压力,34898.0,2024-05-07 06:09,
腰臀比小的人更长寿,34090.0,2024-05-07 06:09,
取消公办中小学教师编制可不可行,255663.0,2024-05-07 06:09,
经常口臭的人一般都逃不过这几个原因,239569.0,2024-05-07 06:09,
豪宅小区被外卖员吐槽赔钱也不送,74217.0,2024-05-07 06:09,
熬夜疲劳可能会让你变臭,59789.0,2024-05-07 06:09,
原来减肥更重要的是塑型,35258.0,2024-05-07 06:09,
有一种惨叫广东荔枝不挂果,32698.0,2024-05-07 06:09,
医学生有自己杀菠萝方式,31958.0,2024-05-07 06:09,
徐园男友称其系自杀,31026.0,2024-05-07 06:09,
无名痒是身体发出的信号,28276.0,2024-05-07 06:09,
杨鸣贴脸暴怒,27564.0,2024-05-07 06:09,
杨幂曾问邓超亚比是什么,27133.0,2024-05-07 06:09,
淘宝免单,26694.0,2024-05-07 06:09,
南部战区海军海空立体联合搜救演练,26368.0,2024-05-07 06:09,
WB 折磨,26289.0,2024-05-07 06:09,
范闲暴揍范思辙,25317.0,2024-05-07 06:09,
存款十几万在小县城什么水平,24769.0,2024-05-07 06:09,
内娱直播考研上岸第一人,23038.0,2024-05-07 06:09,
二十多岁已经厌烦上班到极致,22422.0,2024-05-07 06:09,
庆余年3还能集齐原班人马吗,22317.0,2024-05-07 06:09,
想念郭艾伦,21174.0,2024-05-07 06:09,
吴磊 你好不好,19678.0,2024-05-07 06:09,
原来这些行为是良性自虐,19406.0,2024-05-07 06:09,
纪凌尘回复宋威龙,18447.0,2024-05-07 06:09,
原来高铁上是有15元的盒饭的,18193.0,2024-05-07 06:09,
和动画简直一模一样,18178.0,2024-05-07 06:09,
刘亦菲海南plog,17827.0,2024-05-07 06:09,
广州暴雨,17461.0,2024-05-07 06:09,
TTG晋级败者组第三轮,15699.0,2024-05-07 06:09,
郭艾伦说很想和大家一起上,15374.0,2024-05-07 06:09,
徐园男友有3次暴力前科,15283.0,2024-05-07 06:09,
