name,value,date,Unnamed: 3
凯特,231648.0,2024-03-21 06:06,
天水麻辣烫成都分烫火到闭店,83261.0,2024-03-21 06:06,
这个春天祝你春风得意向阳花开,15428.0,2024-03-21 06:06,
女子怀孕7个月刚独自待5分钟就倒地,81383.0,2024-03-21 06:06,
男生美国卖三蹦子首日进账1万美金,77369.0,2024-03-21 06:06,
素媛案罪犯赵斗淳又被判了,64923.0,2024-03-21 06:06,
关晓彤短发,52541.0,2024-03-21 06:06,
花间令开始吓人了,51384.0,2024-03-21 06:06,
日媒称一中国富豪借给福原爱3亿日元,47918.0,2024-03-21 06:06,
2月龄男婴接种疫苗14天后死亡,43187.0,2024-03-21 06:06,
不吃早饭比不吃晚饭危害更大吗,170015.0,2024-03-21 06:06,
东航致132人遇难事故调查进展发布,96315.0,2024-03-21 06:06,
冯小刚辟谣病危移民传言,50640.0,2024-03-21 06:06,
揭秘凯特王妃背后宫斗内幕,41506.0,2024-03-21 06:06,
鹿晗给自己整不好意思了,39238.0,2024-03-21 06:06,
行云念了沈璃一辈子,38071.0,2024-03-21 06:06,
为什么牙不好疾病满身跑,32062.0,2024-03-21 06:06,
金高银撑住了贴头皮造型,31641.0,2024-03-21 06:06,
最擅于隐藏情绪的星座,31293.0,2024-03-21 06:06,
刘学义配角演了8年,29384.0,2024-03-21 06:06,
河北邯郸一高中生被同学打伤睾丸,87910.0,2024-03-21 06:06,
打工人开始尝试用刮刮乐打上班卡,33441.0,2024-03-21 06:06,
肖战藏海传官服造型,28820.0,2024-03-21 06:06,
周杰伦方回应败诉,28524.0,2024-03-21 06:06,
自己买的房最不该考虑的就是客人,27321.0,2024-03-21 06:06,
想减肥要多站立,27012.0,2024-03-21 06:06,
越共中央批准越南国家主席武文赏辞职,26744.0,2024-03-21 06:06,
想瘦脸少不了练背,26008.0,2024-03-21 06:06,
戚薇的包是个方向盘,24807.0,2024-03-21 06:06,
东航,24079.0,2024-03-21 06:06,
出差时公司给定的儿童房,43106.0,2024-03-21 06:06,
汪东城你年龄是满40减20吗,22629.0,2024-03-21 06:06,
藏海传,21826.0,2024-03-21 06:06,
边伯贤 香港,21658.0,2024-03-21 06:06,
早上该先刷牙还是先吃早饭,21638.0,2024-03-21 06:06,
承欢记要来了,20854.0,2024-03-21 06:06,
网飞三体,20166.0,2024-03-21 06:06,
刘学义光头造型,20154.0,2024-03-21 06:06,
拼多多涨逾15%,18931.0,2024-03-21 06:06,
新冠感染用药参考,18578.0,2024-03-21 06:06,
沈璃红衣,17459.0,2024-03-21 06:06,
刘亦菲又在撕嘴皮,17042.0,2024-03-21 06:06,
春分,16549.0,2024-03-21 06:06,
沪上阿姨紧急补货,16432.0,2024-03-21 06:06,
哪个价位的手机最值得买,16373.0,2024-03-21 06:06,
杜海涛演戏,15738.0,2024-03-21 06:06,
腾讯8款游戏年收入超40亿,15626.0,2024-03-21 06:06,
iPhone16系列或实现更大显示屏,15482.0,2024-03-21 06:06,
龚俊邓为撞衫,14686.0,2024-03-21 06:06,
恋爱兄妹,12966.0,2024-03-21 06:06,
