name,value,date,Unnamed: 3
养了6年的巨骨舌鱼把自己摔死了,235298.0,2024-06-06 06:00,
官方回应B太长沙夜市打假,104424.0,2024-06-06 06:00,
我在五千年前等你,2791.0,2024-06-06 06:00,
2024高考,77977.0,2024-06-06 06:00,
爱奇艺 线下免费线上收费,77835.0,2024-06-06 06:00,
李宇春 小宇,61488.0,2024-06-06 06:00,
高考很大可能是考得最好的一次,53844.0,2024-06-06 06:00,
公办中小学招聘不进编教师引关注,51386.0,2024-06-06 06:00,
TF三代出道战禁止线下应援,43292.0,2024-06-06 06:00,
都江堰已持续运行2280年,4419.0,2024-06-06 06:00,
老人被发现与小38岁保姆结婚后续,99457.0,2024-06-06 06:00,
医院开展男性根浴服务被处罚,72170.0,2024-06-06 06:00,
5岁女童练舞站下腰摔倒致高位截瘫,68320.0,2024-06-06 06:00,
王阳发文,66902.0,2024-06-06 06:00,
印度总理莫迪提交辞呈,60564.0,2024-06-06 06:00,
朋友圈背景图,43602.0,2024-06-06 06:00,
斗鱼退缴主播非法收益超1亿,34865.0,2024-06-06 06:00,
蒋依依 远景,30205.0,2024-06-06 06:00,
刘恋和陈昊宇十年前就认识了,27213.0,2024-06-06 06:00,
王星越好帅,26327.0,2024-06-06 06:00,
周大福有员工称收到N+3赔偿,68349.0,2024-06-06 06:00,
亲姐姐总暗示我给外甥买东西,57605.0,2024-06-06 06:00,
没想到朋友圈置顶还能这么玩,43442.0,2024-06-06 06:00,
建议最近不要轻易离职,41238.0,2024-06-06 06:00,
3类癌症不致命无需过度治疗,30025.0,2024-06-06 06:00,
B太 水果礼盒触碰了商家的逆鳞,26023.0,2024-06-06 06:00,
游客吐槽阿勒泰旅游太贵了,25854.0,2024-06-06 06:00,
王鹤棣继西瓜皮后又有神图,25401.0,2024-06-06 06:00,
建议高考可以用大学作为考场,25224.0,2024-06-06 06:00,
为啥天天刷牙还有口臭,25147.0,2024-06-06 06:00,
终于知道饭店为什么要加葱香菜,24937.0,2024-06-06 06:00,
邓为翻牌,23871.0,2024-06-06 06:00,
重庆文旅发了肖战,23500.0,2024-06-06 06:00,
月经变少是卵巢衰老的信号吗,23285.0,2024-06-06 06:00,
摄影师拍陶昕然母女穿帮了,22489.0,2024-06-06 06:00,
96版一帘幽梦女主近照,20897.0,2024-06-06 06:00,
皮肤变好带给我的变化有多大,20494.0,2024-06-06 06:00,
情绪稳定的本质,20194.0,2024-06-06 06:00,
你的高考幸运签已送达,20097.0,2024-06-06 06:00,
刘亦菲19岁时的采访,19338.0,2024-06-06 06:00,
斗鱼一季度亏损8800万元,18594.0,2024-06-06 06:00,
考王梁实称或是最后一次参加高考,18041.0,2024-06-06 06:00,
99年高三老师哭的比学生还伤心,17484.0,2024-06-06 06:00,
王者貂蝉秒杀皮肤,16830.0,2024-06-06 06:00,
读研后对研究生祛魅了,16633.0,2024-06-06 06:00,
歌手2024揭榜串讲人,15781.0,2024-06-06 06:00,
你身上的狗味比我的还重,15770.0,2024-06-06 06:00,
更好发挥住房公积金保障作用,15737.0,2024-06-06 06:00,
一不小心又被爸妈幽默到了,13361.0,2024-06-06 06:00,
恢复一代,13166.0,2024-06-06 06:00,
