name,value,date,Unnamed: 3
伊朗对美国发出警告,252179.0,2024-04-14 06:00,
伊朗,121966.0,2024-04-14 06:00,
春日限定励志文案,13090.0,2024-04-14 06:00,
纪凌尘祝阚清子幸福,104834.0,2024-04-14 06:00,
伊朗扣押一艘和以色列相关货船,89311.0,2024-04-14 06:00,
伊朗称美若干预伊以纷争将打击美军,85490.0,2024-04-14 06:00,
睡前1小时尽量别玩手机,79263.0,2024-04-14 06:00,
男童30万耳蜗丢失全城合力找回,46417.0,2024-04-14 06:00,
Thurman猫一杯视频号被封,45796.0,2024-04-14 06:00,
没想到这种国粹在韩综里出现了,44615.0,2024-04-14 06:00,
警方调查14岁女生被学校教练性侵,96760.0,2024-04-14 06:00,
猫一杯旗下品牌发货售后正常,46847.0,2024-04-14 06:00,
王祖蓝在香港被放假的广西人包围了,44586.0,2024-04-14 06:00,
金秀贤金智媛不再合体,42123.0,2024-04-14 06:00,
纪凌尘看宁静的眼神,43273.0,2024-04-14 06:00,
保时捷撞车后女子砸门被行政拘留,42582.0,2024-04-14 06:00,
秦皇岛一船只侧翻已致12死6失联,41625.0,2024-04-14 06:00,
伊朗扣押的船只上有17名印度人,35649.0,2024-04-14 06:00,
眼泪女王 不会要be吧,32463.0,2024-04-14 06:00,
纪凌尘说蹭阚清子热度是事实,37130.0,2024-04-14 06:00,
长期宅在家里能量是不流通的,40402.0,2024-04-14 06:00,
微信被拉黑删除和被屏蔽的区别,34014.0,2024-04-14 06:00,
38块钱居然能吃20个菜,32093.0,2024-04-14 06:00,
许嵩演唱会 没有嘉宾,30537.0,2024-04-14 06:00,
薛之谦发型一半清汤一半麻辣,29902.0,2024-04-14 06:00,
普通人的4次翻身机会,28981.0,2024-04-14 06:00,
彻底打消了去韩国旅游的念头,28725.0,2024-04-14 06:00,
李宇春无价之姐,27277.0,2024-04-14 06:00,
男子养了20年的海龟竟是国保玳瑁,26852.0,2024-04-14 06:00,
不要再把月经称为那个了,26695.0,2024-04-14 06:00,
孙怡玫瑰连衣裙,46281.0,2024-04-14 06:00,
荔枝和龙眼杂交出来的新水果,26079.0,2024-04-14 06:00,
焉栩嘉荧幕初吻,25392.0,2024-04-14 06:00,
5种素菜是热量炸弹,24416.0,2024-04-14 06:00,
林俊杰唱当你送给隔壁王心凌,24085.0,2024-04-14 06:00,
男子一个大意3万元一缸鱼快熟了,23921.0,2024-04-14 06:00,
睡前1分钟躺着就能瘦肚子,23051.0,2024-04-14 06:00,
一夜承明,22223.0,2024-04-14 06:00,
眼泪女王,20953.0,2024-04-14 06:00,
许凯身材好好,22111.0,2024-04-14 06:00,
AG 现场复盘,20648.0,2024-04-14 06:00,
许嵩唱了断桥残雪,19516.0,2024-04-14 06:00,
元与均棋,19263.0,2024-04-14 06:00,
种地吧母带,18665.0,2024-04-14 06:00,
每天做800个腹肌运动的AHyeon,18532.0,2024-04-14 06:00,
美股黄金白银大跳水,17422.0,2024-04-14 06:00,
苏打绿演唱会 盗摄,16918.0,2024-04-14 06:00,
主动让路人摸摸的耶耶,15903.0,2024-04-14 06:00,
张云雷酷狗唱玩会,15447.0,2024-04-14 06:00,
RNG直播需付费观看,15161.0,2024-04-14 06:00,
