name,value,date,Unnamed: 3
蒋敦豪发长文回应,263807.0,2024-07-23 06:15,
从严从快处理师德失范行为,170502.0,2024-07-23 06:15,
神十八乘组太空出差能有多充实,19248.0,2024-07-23 06:15,
拜登退选至少有两重原因,96695.0,2024-07-23 06:15,
中方决定取消对美国卫讯公司的反制措施,90630.0,2024-07-23 06:15,
种地吧成员支持蒋敦豪,116954.0,2024-07-23 06:15,
李梦 穿的不错下次别穿了,92182.0,2024-07-23 06:15,
相柳战死,71145.0,2024-07-23 06:15,
人大王某某被开除党籍,67800.0,2024-07-23 06:15,
拜登退选后的可能继任者,22347.0,2024-07-23 06:15,
老年男明星 性侵女服务员,389231.0,2024-07-23 06:15,
女子称因学历低被判去高危妊娠门诊,213056.0,2024-07-23 06:15,
人大通报王某某性骚扰,170413.0,2024-07-23 06:15,
清华教授解读自愿弹性延迟退休原则,113912.0,2024-07-23 06:15,
空空日记人设,87490.0,2024-07-23 06:15,
男子猥亵被拘13天父亲向受害者求情,69756.0,2024-07-23 06:15,
女子折叠凳掉福宝场地被终身禁入,56960.0,2024-07-23 06:15,
90后男女都65岁以后退休系网民推估,56329.0,2024-07-23 06:15,
空空日记掉粉超100万,54808.0,2024-07-23 06:15,
奶茶30元时代已成过去,45515.0,2024-07-23 06:15,
游泳时千万别穿白色泳衣,43808.0,2024-07-23 06:15,
宗馥莉已接手父亲名下多家公司,43562.0,2024-07-23 06:15,
郑州暴雨,42964.0,2024-07-23 06:15,
秦岚 我不会和前任做朋友,42483.0,2024-07-23 06:15,
一句警察叔叔我好饿小孩哥成功蹭到了,38703.0,2024-07-23 06:15,
田曦薇财阀千金,33690.0,2024-07-23 06:15,
原来慈禧太后的卧室长这样,33354.0,2024-07-23 06:15,
胡先煦曾参加过封神试镜,31500.0,2024-07-23 06:15,
中国人民大学声明,30765.0,2024-07-23 06:15,
人大女博士举报情况属实,30616.0,2024-07-23 06:15,
人民网评人大清理害群之马,30591.0,2024-07-23 06:15,
苹果手表被曝运动记录无中生有,30052.0,2024-07-23 06:15,
优衣库和中国消费者都说对方变了,29554.0,2024-07-23 06:15,
肖战宋威龙同款,29149.0,2024-07-23 06:15,
婚礼上被喷酒新娘霸气眼神杀,28143.0,2024-07-23 06:15,
杨紫长相思2最后一个镜头,28083.0,2024-07-23 06:15,
四川眉山千人共吃超大火锅,27082.0,2024-07-23 06:15,
郑州局部暴雨超100毫米,26883.0,2024-07-23 06:15,
gidle方道歉,26172.0,2024-07-23 06:15,
金智媛化妆师秒删ins,25577.0,2024-07-23 06:15,
肖战陈情令人物曲上线五周年,25238.0,2024-07-23 06:15,
用山东方言说唱呼叫山东舰,24850.0,2024-07-23 06:15,
BBA退出价格战涨了多少,23953.0,2024-07-23 06:15,
巴黎奥运吉祥物会按奖牌颜色颁发,20779.0,2024-07-23 06:15,
宁艺卓说第一次在中国签售,19136.0,2024-07-23 06:15,
坚持零容忍才能斩断高校性骚扰,18670.0,2024-07-23 06:15,
咒术回战 要不还是别画了,18517.0,2024-07-23 06:15,
李昊 十个勤天永远是十个勤天,18472.0,2024-07-23 06:15,
毛球,18440.0,2024-07-23 06:15,
遇到性骚扰请勇敢说不,17944.0,2024-07-23 06:15,
