name,value,date,Unnamed: 3
00后新警认出嫌疑人后嘴角上扬,165043.0,2024-03-04 06:11,
亚洲首富之子减肥108公斤后又胖回来了,131648.0,2024-03-04 06:11,
两会你我他,10566.0,2024-03-04 06:11,
姜爷爷宋爷爷哭成泪人,96124.0,2024-03-04 06:11,
怀疑对方AI换脸可以让对方摁鼻子,73286.0,2024-03-04 06:11,
向佐曾闭关练功七年不看手机,70764.0,2024-03-04 06:11,
十年前种下的种子真的能开出花,64755.0,2024-03-04 06:11,
怪不得没见过云南籍清冷学霸,45823.0,2024-03-04 06:11,
当年爱情公寓第二季的官方设定,41672.0,2024-03-04 06:11,
顾寻 我是校草,39991.0,2024-03-04 06:11,
西班牙女演员在印度遭7人施暴,107667.0,2024-03-04 06:11,
秦昊帮伊能静拿到了霉霉演唱会门票,71865.0,2024-03-04 06:11,
王楚钦橱窗,68623.0,2024-03-04 06:11,
硕士学历二胎宝妈投84份简历面试为0,62138.0,2024-03-04 06:11,
睡得好要看这4个指标,44929.0,2024-03-04 06:11,
女子买茅台验真伪被死亡威胁,40853.0,2024-03-04 06:11,
台湾海巡艇被目击与大陆海警船并行,30752.0,2024-03-04 06:11,
DYG教练 跑路,27013.0,2024-03-04 06:11,
孙千和PP合照,26275.0,2024-03-04 06:11,
唐探2 那可是杨谨华诶,25474.0,2024-03-04 06:11,
经常午睡比从来不午睡更健康吗,63341.0,2024-03-04 06:11,
包包被外国友人扔出地铁全车人欢呼,36443.0,2024-03-04 06:11,
多少好友用过HIV预防阻断2小时达,22353.0,2024-03-04 06:11,
尹子维新片尺度,22156.0,2024-03-04 06:11,
发现耳朵边上有个小孔,21251.0,2024-03-04 06:11,
曼城vs曼联,20416.0,2024-03-04 06:11,
这一抱硬控我10秒,19022.0,2024-03-04 06:11,
台湾著名的回春汤,17202.0,2024-03-04 06:11,
航拍广西海底第一眼以为是龙鳞,17161.0,2024-03-04 06:11,
王鹤棣出发录桃花坞4,17105.0,2024-03-04 06:11,
当地产大亨的土耳其外公有了中国小外孙,18309.0,2024-03-04 06:11,
南京鸡鸣寺的樱花消息树开了,16813.0,2024-03-04 06:11,
成毅白发造型,16206.0,2024-03-04 06:11,
吴艳妮2024首秀8秒12,15975.0,2024-03-04 06:11,
女儿第一次来例假妈妈哭了,15784.0,2024-03-04 06:11,
提笔忘字开口忘词其实是一种脑病,15294.0,2024-03-04 06:11,
绿色穿搭真的让人眼前一亮,14383.0,2024-03-04 06:11,
周处除三害,14210.0,2024-03-04 06:11,
代表建议将个税起征点提至1万元,13984.0,2024-03-04 06:11,
阮经天40岁状态,12940.0,2024-03-04 06:11,
王鹤棣勇闯说唱圈,12866.0,2024-03-04 06:11,
别对我动心,12677.0,2024-03-04 06:11,
陈卓璇的古装,12258.0,2024-03-04 06:11,
周笔畅巴黎时装周造型,12068.0,2024-03-04 06:11,
当上菜的速度赶不上吃饭的速度时,12043.0,2024-03-04 06:11,
那不勒斯vs尤文图斯,11580.0,2024-03-04 06:11,
有一种叫云南的生活,11415.0,2024-03-04 06:11,
胡先煦背影,11396.0,2024-03-04 06:11,
和不内耗的朋友出去玩,11365.0,2024-03-04 06:11,
周也嘴巴哭成typec,11350.0,2024-03-04 06:11,
