name,value,date,Unnamed: 3
持续黑一个历史人物十年,107383.0,2024-03-28 06:14,
冯提莫腰线,79292.0,2024-03-28 06:14,
我国网络视听用户规模达10.74亿人,17303.0,2024-03-28 06:14,
女子将儿媳打得满身疤痕惹众怒,108699.0,2024-03-28 06:14,
女子得知父亲去世高速上崩溃大哭,59015.0,2024-03-28 06:14,
南通,293047.0,2024-03-28 06:14,
何悯鸿向四美道歉,53562.0,2024-03-28 06:14,
大熊猫青糍死亡,53446.0,2024-03-28 06:14,
王嘉尔普吉岛,50546.0,2024-03-28 06:14,
8万的预算能在深圳玩三天吗,47545.0,2024-03-28 06:14,
金宝贝突然停业几天前还怂恿家长充值,92610.0,2024-03-28 06:14,
陈法拉生二胎后首露面,45963.0,2024-03-28 06:14,
刚出生就1米85的帅宝宝来了,44295.0,2024-03-28 06:14,
王诗龄晒与李湘在英国的日常,40177.0,2024-03-28 06:14,
孔雪儿演女二,39964.0,2024-03-28 06:14,
180斤山东女孩拍写真美哭网友,39115.0,2024-03-28 06:14,
魏大勋说不清了,37991.0,2024-03-28 06:14,
禁售殡葬用品后南通12345接大量电话,37075.0,2024-03-28 06:14,
北京沙尘暴,36147.0,2024-03-28 06:14,
一觉醒来夏东海和锅姨在一起了,31736.0,2024-03-28 06:14,
你愿意不交社保换更多工资吗,191334.0,2024-03-28 06:14,
幼儿园老师背名牌包被投诉,57991.0,2024-03-28 06:14,
经常喝牛奶或增加这两种癌症风险,56054.0,2024-03-28 06:14,
男方准备10万彩礼女方要30万,45013.0,2024-03-28 06:14,
知情人士回应腾讯大规模裁员,31453.0,2024-03-28 06:14,
韩国高中生向女老师保温杯注入精液,42696.0,2024-03-28 06:14,
春季最狠减肥法 轻断食,38045.0,2024-03-28 06:14,
为什么肚子上的肉这么难减,37819.0,2024-03-28 06:14,
尿毒症都是拖出来的吗,30664.0,2024-03-28 06:14,
王一博听到并立于雪山之巅笑了,28628.0,2024-03-28 06:14,
老邪吐槽追风者 翻车,27470.0,2024-03-28 06:14,
与凤行 送子婚姻,24867.0,2024-03-28 06:14,
小米SU7续航700公里起步,24507.0,2024-03-28 06:14,
广州10块一碗猪脚面,23880.0,2024-03-28 06:14,
张慧雯回应演何悯鸿后面相变了,23459.0,2024-03-28 06:14,
南通禁止制造销售封建迷信殡葬用品,22488.0,2024-03-28 06:14,
导致胃部癌变的6大因素,22142.0,2024-03-28 06:14,
王一博素颜,20918.0,2024-03-28 06:14,
金牛座的焦虑来自于匮乏感,20520.0,2024-03-28 06:14,
离异3年内不得京内购房被废止,18979.0,2024-03-28 06:14,
去喜欢一个对你有空的人,18310.0,2024-03-28 06:14,
终于学会删除空白页了,17416.0,2024-03-28 06:14,
NikeAirMax,8614.0,2024-03-28 06:14,
杨幂直发侧拍,17309.0,2024-03-28 06:14,
蔡文静什么都赖地磁暴,16849.0,2024-03-28 06:14,
极限挑战,16806.0,2024-03-28 06:14,
天价彩礼何时休,14895.0,2024-03-28 06:14,
白鹿一口气发了28张照片,14666.0,2024-03-28 06:14,
林俊杰生日照,14123.0,2024-03-28 06:14,
Scout说不会韩语,13712.0,2024-03-28 06:14,
