name,value,date,Unnamed: 3
姑娘翻出一堆施华洛世奇后悔没买黄金,230631.0,2024-05-19 06:13,
警方回应知名主持人被曝私生活混乱,176613.0,2024-05-19 06:13,
文化中国行看博物馆之宝,1851.0,2024-05-19 06:13,
纽约中央公园偶遇网红凤姐,121774.0,2024-05-19 06:13,
三胞胎兄弟居然有胎内记忆,102675.0,2024-05-19 06:13,
幼态审美盯上女生的牙齿,82985.0,2024-05-19 06:13,
田嘉瑞 我何德何能去救那姐,65144.0,2024-05-19 06:13,
95后亿万富豪被罚1.33亿元,63708.0,2024-05-19 06:13,
早就说了我邀请的是断眉亚当,54558.0,2024-05-19 06:13,
豹警官减肥2个月瘦不了一点,8158.0,2024-05-19 06:13,
AG,54162.0,2024-05-19 06:13,
向12岁女孩要裸照男大学生已被刑拘,51512.0,2024-05-19 06:13,
elk吐了,48350.0,2024-05-19 06:13,
三皇子 年轻人觉多,47748.0,2024-05-19 06:13,
李佳薇 煎熬,47675.0,2024-05-19 06:13,
陈丽君跳BangBang很适配,44371.0,2024-05-19 06:13,
毛晓彤庆余年2奶凶奶凶的,43988.0,2024-05-19 06:13,
李娟为什么是李娟,32604.0,2024-05-19 06:13,
狼队战胜AG,30611.0,2024-05-19 06:13,
勒沃库森德甲不败夺冠,30496.0,2024-05-19 06:13,
散步是一种最被低估的运动,97694.0,2024-05-19 06:13,
男子被蜱虫咬几天后做足疗时发现,60435.0,2024-05-19 06:13,
中年人的婚外情为何不会通往离婚,57715.0,2024-05-19 06:13,
周杰伦福州演唱会带来泼天富贵,35083.0,2024-05-19 06:13,
歌手2024鉴音团,34399.0,2024-05-19 06:13,
再见了爸爸今晚范思辙要远航,29945.0,2024-05-19 06:13,
鹿晗和张远两个人凑不出一个胆,28488.0,2024-05-19 06:13,
赵露思带粉丝China,28364.0,2024-05-19 06:13,
瘦30斤五官的变化,27737.0,2024-05-19 06:13,
女子试戴金戒不慎摔落被索赔1250,27593.0,2024-05-19 06:13,
郭有才被聘为菏泽文旅推荐官,26971.0,2024-05-19 06:13,
狼队十冠王,26542.0,2024-05-19 06:13,
黄俊捷工作室发声明,25505.0,2024-05-19 06:13,
理想汽车将裁员5600人,24391.0,2024-05-19 06:13,
郑合惠子抹胸粉裙,23834.0,2024-05-19 06:13,
种地吧,22618.0,2024-05-19 06:13,
庆余年太子给打工人一些震撼,22014.0,2024-05-19 06:13,
张韶涵回应那英需要你,21738.0,2024-05-19 06:13,
林更新与学妹合照,21476.0,2024-05-19 06:13,
汪苏泷机场状态,21427.0,2024-05-19 06:13,
BLG战胜T1,21277.0,2024-05-19 06:13,
亚当曾说想和蔡依林合作,21236.0,2024-05-19 06:13,
krd,20630.0,2024-05-19 06:13,
歌手第三期网传歌单,19822.0,2024-05-19 06:13,
一诺单杀小胖,19625.0,2024-05-19 06:13,
张若昀看到霸霸嘴角比AK还难压,18755.0,2024-05-19 06:13,
神bin天降,18694.0,2024-05-19 06:13,
G2问Bin收徒吗,17005.0,2024-05-19 06:13,
老林哭了,16858.0,2024-05-19 06:13,
许嵩演唱会,15811.0,2024-05-19 06:13,
