name,value,date,Unnamed: 3
平江特大暴雨,228401.0,2024-07-02 06:11,
法国vs比利时,86434.0,2024-07-02 06:11,
我们向前中国向上,13576.0,2024-07-02 06:11,
女子穿JK遭2男生偷拍嘲讽还直播,129944.0,2024-07-02 06:11,
拜登,78087.0,2024-07-02 06:11,
第一次见男二不爱女主爱发疯的,69820.0,2024-07-02 06:11,
朋友圈先仅自己可见三天后再公开,58694.0,2024-07-02 06:11,
韩国第二大城市釜山进入消失阶段,51123.0,2024-07-02 06:11,
刘亦菲唐嫣合照,41118.0,2024-07-02 06:11,
欧洲杯,33890.0,2024-07-02 06:11,
李敏镐肿了,192393.0,2024-07-02 06:11,
医院认定死亡后中国羽协仍尝试转院,112895.0,2024-07-02 06:11,
官方回应吃播卤羊头内吃出草,98578.0,2024-07-02 06:11,
中羽协将为张志杰家人提供帮助,75819.0,2024-07-02 06:11,
欧阳龙嘴对嘴亲欧阳妮妮,75667.0,2024-07-02 06:11,
马斯克回应中国小女孩报bug,74154.0,2024-07-02 06:11,
陈乔恩教于正葡萄柚减肥法,38929.0,2024-07-02 06:11,
张志杰比赛中猝死谁之过,33585.0,2024-07-02 06:11,
心脏骤停黄金抢救时间是4分钟,31965.0,2024-07-02 06:11,
黄景瑜有疯批男主那味儿了,30879.0,2024-07-02 06:11,
空调长期不洗男子肺部感染险丧命,121808.0,2024-07-02 06:11,
长期熬夜会增加身体核心器官负担,76498.0,2024-07-02 06:11,
林生斌,76085.0,2024-07-02 06:11,
林生斌与亡妻关联公司均经营异常,71402.0,2024-07-02 06:11,
年轻护士在三甲医院6年后裸辞逃离,38326.0,2024-07-02 06:11,
洗脸巾就是免费的冰箱除味剂,35503.0,2024-07-02 06:11,
中企人员在菲被绑架付300万后仍遇害,32875.0,2024-07-02 06:11,
情侣同居不同房是怎样的,32259.0,2024-07-02 06:11,
入住酒店千万要小心,30904.0,2024-07-02 06:11,
黄子韬曾说30岁会考虑成家,28827.0,2024-07-02 06:11,
人教版大熊猫vs妈教版大熊猫,28506.0,2024-07-02 06:11,
Angelababy庆祝香港回归27周年,27282.0,2024-07-02 06:11,
平江,26580.0,2024-07-02 06:11,
檀健次真的是天选相柳,25573.0,2024-07-02 06:11,
外交部回应张志杰离世,24475.0,2024-07-02 06:11,
林志颖一家五口游迪士尼,24386.0,2024-07-02 06:11,
湖南平江发布抗击特大洪水通告,23847.0,2024-07-02 06:11,
专家称心肺复苏任重道远,23607.0,2024-07-02 06:11,
先别管猫了快去救车厘子,23326.0,2024-07-02 06:11,
半夜点吃的外卖小哥会不高兴吗,22557.0,2024-07-02 06:11,
唐艺昕带娃外出,22523.0,2024-07-02 06:11,
张杰这次像牵女儿了,22497.0,2024-07-02 06:11,
3类运动容易引发运动性猝死,22104.0,2024-07-02 06:11,
张子墨 自摸哥,19932.0,2024-07-02 06:11,
恋爱脑的本质是注意力的失控,19640.0,2024-07-02 06:11,
菲律宾绑架,19211.0,2024-07-02 06:11,
西安西二环路面塌陷,19027.0,2024-07-02 06:11,
崔泰俊ZICO聊天内容,17031.0,2024-07-02 06:11,
孙颖莎想和埃菲尔铁塔合影,16135.0,2024-07-02 06:11,
祝福香港祝福祖国,15054.0,2024-07-02 06:11,
