name,value,date,Unnamed: 3
从脂肪肝到肝癌只需四步,209236.0,2024-02-06 06:16,
我被暴雪留在高速的第三天,177476.0,2024-02-06 06:16,
我的龙年仪式感,2545.0,2024-02-06 06:16,
日本小姐冠军承认当小三放弃桂冠,136492.0,2024-02-06 06:16,
梅西表演赛主办方撤回1600万港元资助申请,119434.0,2024-02-06 06:16,
梅西爽约突破商业底线,106530.0,2024-02-06 06:16,
梅西抵达日本,84511.0,2024-02-06 06:16,
张颂文 上你个头我要过年,80983.0,2024-02-06 06:16,
当一个行业开始赚钱女性就被迫离开,72597.0,2024-02-06 06:16,
爸妈吐槽大学生要提前吃光全家年货,63809.0,2024-02-06 06:16,
男子偷卖女朋友黄金用作恋爱开销,175940.0,2024-02-06 06:16,
男子花20万彩礼闪婚仅十多天就离婚,63398.0,2024-02-06 06:16,
借出房车卫生间当事女生发声,59874.0,2024-02-06 06:16,
林更新说楚乔传的遗憾会在与凤行补上,55816.0,2024-02-06 06:16,
被困湖北高速急哭的女车主获河南小伙救援,50066.0,2024-02-06 06:16,
王豆豆怀孕,49041.0,2024-02-06 06:16,
马思纯晒孙千醉酒照,41489.0,2024-02-06 06:16,
粉丝祝王星越新婚快乐,41274.0,2024-02-06 06:16,
车厘子价格跌至每斤20元,39500.0,2024-02-06 06:16,
李昇基李多寅官宣得女,36555.0,2024-02-06 06:16,
王一博与晗晗qvq网络纠纷案审理结果,30775.0,2024-02-06 06:16,
程潇 龙女,30291.0,2024-02-06 06:16,
张雨绮用蚌壳当手包,27731.0,2024-02-06 06:16,
专家建议给老百姓每人发1000元,27274.0,2024-02-06 06:16,
LOL开播十分钟观众破百万,26516.0,2024-02-06 06:16,
7个月宝宝吃猕猴桃经历断崖式衰老,25665.0,2024-02-06 06:16,
吴磊吃到赵今麦的头发,24738.0,2024-02-06 06:16,
这3处青筋异常凸起要留意,24532.0,2024-02-06 06:16,
请和我的老公结婚,23333.0,2024-02-06 06:16,
强制自己早睡的办法,22501.0,2024-02-06 06:16,
12306账号为何有陌生人信息,22233.0,2024-02-06 06:16,
瘦脸的最优解是练背,22097.0,2024-02-06 06:16,
在暴雪时分男三,20472.0,2024-02-06 06:16,
梅西方需要给个售后方案,20188.0,2024-02-06 06:16,
211高校毕业女生密室扮鬼,19668.0,2024-02-06 06:16,
春晚彩排,18647.0,2024-02-06 06:16,
哪些人不适合吃车厘子,18603.0,2024-02-06 06:16,
朱婷谈是否回归国家队,18133.0,2024-02-06 06:16,
林更新谈和赵丽颖刘亦菲合作,18080.0,2024-02-06 06:16,
霍启刚要求梅西与迈阿密道歉,16838.0,2024-02-06 06:16,
虞书欣工作室重组,16245.0,2024-02-06 06:16,
范丞丞科目一考了好几次,15958.0,2024-02-06 06:16,
唐鹤德晒与张国荣合照庆生,15934.0,2024-02-06 06:16,
卡琳娜cos祁煜,15147.0,2024-02-06 06:16,
刘亦菲刘诗诗合影旧照,14123.0,2024-02-06 06:16,
射手座认真才会犹豫,14104.0,2024-02-06 06:16,
有强迫症的人更易患这7种病,13621.0,2024-02-06 06:16,
香港文旅局称主办方确认梅西可以出场,13595.0,2024-02-06 06:16,
祝绪丹新剧妆造,12340.0,2024-02-06 06:16,
新年祝福接龙,12140.0,2024-02-06 06:16,
