name,value,date,Unnamed: 3
端午节放3天不调休,3760921.0,2024-04-15 10:52,
保时捷中国总裁回应米时捷,1449799.0,2024-04-15 10:52,
60秒了解总体国家安全观,34970.0,2024-04-15 10:52,
突然的恋情可能是间谍的圈套,1024130.0,2024-04-15 10:52,
黄岛地震,865785.0,2024-04-15 10:52,
奔跑吧12官宣定档,757789.0,2024-04-15 10:52,
华为P70 Pura,689268.0,2024-04-15 10:52,
IU香港,555190.0,2024-04-15 10:52,
张艺兴工作室发文向张艺兴道歉,529510.0,2024-04-15 10:52,
炸串奶奶摊前排起长队,193076.0,2024-04-15 10:52,
张杰把南昌说成了南京,485968.0,2024-04-15 10:52,
98年小伙因精神状态太美丽走红,453232.0,2024-04-15 10:52,
澳洲亿万富豪之女在悉尼袭击案中遇害,445538.0,2024-04-15 10:52,
A股,365287.0,2024-04-15 10:52,
王嘉尔空降科切拉,314584.0,2024-04-15 10:52,
孩子理发138元妈妈嫌太贵只愿付24,307783.0,2024-04-15 10:52,
第五人格,285556.0,2024-04-15 10:52,
日照震感,285032.0,2024-04-15 10:52,
剑网3,278115.0,2024-04-15 10:52,
薛之谦把重庆洪崖洞说成了成都洪崖洞,268544.0,2024-04-15 10:52,
第一批丁克夫妻现状曝光,1388681.0,2024-04-15 10:52,
中医劝患者想怀孕不要穿裙子,403099.0,2024-04-15 10:52,
很体面工资却不高的工作,279863.0,2024-04-15 10:52,
中国发布伏特台风黑客组织溯源报告,258013.0,2024-04-15 10:52,
芒果台的文案,260101.0,2024-04-15 10:52,
有大学生是内娱的福气,232972.0,2024-04-15 10:52,
种地吧直播,225843.0,2024-04-15 10:52,
难怪陈奕迅的演唱会不让带相机,221032.0,2024-04-15 10:52,
美国间谍梁成运出镜忏悔,211078.0,2024-04-15 10:52,
以色列宣布恢复全国教学活动,205928.0,2024-04-15 10:52,
美国女生带韩国男友回家,340382.0,2024-04-15 10:52,
沪指翻绿跌破3000点,204254.0,2024-04-15 10:52,
华为官宣P系列品牌升级为Pura,190565.0,2024-04-15 10:52,
悉尼袭击事件中死伤中国公民均为留学生,187116.0,2024-04-15 10:52,
TFBOYS415十周年,175282.0,2024-04-15 10:52,
普通家庭的悲哀是把日子过反了,171802.0,2024-04-15 10:52,
河南专科生上岸中科大,167682.0,2024-04-15 10:52,
原来吃榴莲还能缓解痛经,164439.0,2024-04-15 10:52,
本科的毕业设计真的一言难尽,163444.0,2024-04-15 10:52,
曾尖11比0申裕斌,153597.0,2024-04-15 10:52,
男子车祸后连拨14次120终自救,153353.0,2024-04-15 10:52,
梁朝伟拿影帝的最大受害者出现了,151103.0,2024-04-15 10:52,
李泰容入伍,147776.0,2024-04-15 10:52,
比蹦极更刺激的项目出现了,146347.0,2024-04-15 10:52,
他怎么又凶又奶的,142768.0,2024-04-15 10:52,
体重不降的十个原因,130991.0,2024-04-15 10:52,
内塔尼亚胡取消回击伊朗,122167.0,2024-04-15 10:52,
确诊小学生春游综合症,122101.0,2024-04-15 10:52,
悉尼,116069.0,2024-04-15 10:52,
步入中年的丁克女性,109919.0,2024-04-15 10:52,
