name,value,date,Unnamed: 3
丢寒假作业的秦朗家人回应,2240876.0,2024-02-18 16:11,
贾玲仪态,1261760.0,2024-02-18 16:11,
开年第一弹智造业强省,29501.0,2024-02-18 16:11,
高三班主任被曝办公室强吻女学生,1450160.0,2024-02-18 16:11,
马丽测评了14条光腿神器,831892.0,2024-02-18 16:11,
薛之谦 你们人类有两幅面孔,773083.0,2024-02-18 16:11,
谷爱凌夺冠后要去做作业,600489.0,2024-02-18 16:11,
内娱大冰,583206.0,2024-02-18 16:11,
两个贾玲对唱,521216.0,2024-02-18 16:11,
王鹤棣见到库里了,417855.0,2024-02-18 16:11,
白敬亭工作人员说魏大勋掉扇子,1633822.0,2024-02-18 16:11,
虞书欣父母退出涉诈骗公司,445022.0,2024-02-18 16:11,
李雪琴P图贾玲都等瘦了,389882.0,2024-02-18 16:11,
1家5口从三亚飞回新疆要花10万,376013.0,2024-02-18 16:11,
詹姆斯点赞女主播辣照,373501.0,2024-02-18 16:11,
把掰了四年的朋友微博看完了,370718.0,2024-02-18 16:11,
年轻人为什么开始爱买黄金,341102.0,2024-02-18 16:11,
朱婷未进集训名单,336372.0,2024-02-18 16:11,
考研成绩倒计时,293737.0,2024-02-18 16:11,
一切都来得及 记得爱自己,285415.0,2024-02-18 16:11,
瑞幸9.9元一杯活动缩水,531608.0,2024-02-18 16:11,
迪丽热巴狗耳朵开工照,409595.0,2024-02-18 16:11,
马丽以为mary饺是沈腾送的,282900.0,2024-02-18 16:11,
这个班真就非上不可吗,275945.0,2024-02-18 16:11,
亲爱的 还有另一半呢,273925.0,2024-02-18 16:11,
卜凡回应卜卦,270298.0,2024-02-18 16:11,
许光汉道枝骏佑新片剧照,263247.0,2024-02-18 16:11,
宝马确认发生数据泄露事件,261857.0,2024-02-18 16:11,
舅舅买试卷送丢寒假作业的秦朗,261366.0,2024-02-18 16:11,
1个八段锦动作改善节后疲乏,201562.0,2024-02-18 16:11,
贾玲马丽之间的惺惺相惜,376397.0,2024-02-18 16:11,
YouTube前CEO之子在校突然身亡,247891.0,2024-02-18 16:11,
贾玲大波浪晚礼服,241111.0,2024-02-18 16:11,
江苏海安一工厂发生爆炸有伤亡,230818.0,2024-02-18 16:11,
开工首日iPhone15降至4588元,209157.0,2024-02-18 16:11,
高叶演技,208757.0,2024-02-18 16:11,
2024春节档电影票房创纪录,51323.0,2024-02-18 16:11,
女儿舍不得父母返程时真情流泪,191485.0,2024-02-18 16:11,
秀智金宇彬新戏路透,187760.0,2024-02-18 16:11,
咏春拳的创始人是严咏春女士,184808.0,2024-02-18 16:11,
带娃和citywalk适配满分,57969.0,2024-02-18 16:11,
龙年开工一起振奋龙马精神,55816.0,2024-02-18 16:11,
财神爷摆件成了我开工搭子,183591.0,2024-02-18 16:11,
傲娇美 殷世航,176333.0,2024-02-18 16:11,
白敬亭泪痣,175217.0,2024-02-18 16:11,
因为高速太堵跟领导请假被拒了,174127.0,2024-02-18 16:11,
爱其实是很奢侈的东西,173001.0,2024-02-18 16:11,
千万别随便跟陌生人的车,159752.0,2024-02-18 16:11,
尔滨返程机票一票难求,153045.0,2024-02-18 16:11,
时代少年团被电子鞭炮吓到,145415.0,2024-02-18 16:11,
