name,value,date,Unnamed: 3
凡希亚吃了几个邓紫棋,6345619.0,2024-06-28 22:07,
胡歌二封白玉兰视帝,6081586.0,2024-06-28 22:07,
中国空间站舷窗大片上新,98327.0,2024-06-28 22:07,
周迅二封白玉兰视后,4164662.0,2024-06-28 22:07,
谭维维给我听爽了,3168731.0,2024-06-28 22:07,
中国奥委会确认王楚钦樊振东单打资格,662990.0,2024-06-28 22:07,
法院判定玖月晞小南风抄袭,441366.0,2024-06-28 22:07,
阿尔茨海默病特效药药店已上架,384970.0,2024-06-28 22:07,
员工儿子高考718分公司奖10万,307071.0,2024-06-28 22:07,
女生高考考出目标分震惊不敢信,76741.0,2024-06-28 22:07,
那英 带状疱疹,2909339.0,2024-06-28 22:07,
白玉兰内场,2366858.0,2024-06-28 22:07,
歌手直播,1375662.0,2024-06-28 22:07,
全球变暖致珠峰200多具遗体显露,474426.0,2024-06-28 22:07,
高铁座被孕妇暂坐男子假装没看见,263556.0,2024-06-28 22:07,
那英 好听,1332984.0,2024-06-28 22:07,
印尼逮捕103名台湾人,225354.0,2024-06-28 22:07,
绝区零开服送180抽,52638.0,2024-06-28 22:07,
房东上门催租发现家里被卖空,206690.0,2024-06-28 22:07,
中国奥委会确认孙颖莎陈梦单打资格,202407.0,2024-06-28 22:07,
万茜把发尾染绿了,1628728.0,2024-06-28 22:07,
孙楠破音,1168477.0,2024-06-28 22:07,
陈晓给刘亦菲提裙子,1088955.0,2024-06-28 22:07,
姜妍好美,1019043.0,2024-06-28 22:07,
你的屁股可能已经死掉了,388828.0,2024-06-28 22:07,
杨紫火炬手,783828.0,2024-06-28 22:07,
谭维维 民族的就是世界的,573256.0,2024-06-28 22:07,
汪苏泷 人美歌甜,963131.0,2024-06-28 22:07,
矿泉水湿敷半个月后,335725.0,2024-06-28 22:07,
一个久坐的屁股有多丑,239584.0,2024-06-28 22:07,
殷世航傲娇美官宣恋情,451923.0,2024-06-28 22:07,
想买MPV和SUV的人看完都沉默了,149225.0,2024-06-28 22:07,
王鹤棣工作室认不出王鹤棣,346996.0,2024-06-28 22:07,
来自天堂的魔鬼,310681.0,2024-06-28 22:07,
19年林更新在林允儿微博下留言,305393.0,2024-06-28 22:07,
白敬亭的耳骨夹,298800.0,2024-06-28 22:07,
人工智能或成最火爆专业,169272.0,2024-06-28 22:07,
男孩爱说脏话被妈妈一招治好,151086.0,2024-06-28 22:07,
6位北大录取生都有1个共同点,125729.0,2024-06-28 22:07,
不要刻意去迎合水瓶座,125016.0,2024-06-28 22:07,
十个勤天演唱会,271358.0,2024-06-28 22:07,
陈晓光头出席白玉兰,272144.0,2024-06-28 22:07,
张俪也去看歌手了,189424.0,2024-06-28 22:07,
小米澎湃OS更新,122772.0,2024-06-28 22:07,
花百万怒骂小炸串,163339.0,2024-06-28 22:07,
歌手排名,249926.0,2024-06-28 22:07,
熊祁 杀生丸cos,121296.0,2024-06-28 22:07,
歌手2024冲榜歌手露西娅,232683.0,2024-06-28 22:07,
7月十二星座注意事项,120629.0,2024-06-28 22:07,
谈恋爱中的三个月定律,110201.0,2024-06-28 22:07,
