name,value,date,Unnamed: 3
歌手2024揭榜歌手歌单,2194185.0,2024-05-15 22:16,
斯洛伐克总理遭枪击,1576694.0,2024-05-15 22:16,
2024年全球贸易投资促进峰会,31402.0,2024-05-15 22:16,
费可死了,1032875.0,2024-05-15 22:16,
教育部拟同意设24所本科高校,541980.0,2024-05-15 22:16,
未婚女性不能使用精子库供精去父留子,651562.0,2024-05-15 22:16,
新生 烂尾,874248.0,2024-05-15 22:16,
王一博跳街舞,663016.0,2024-05-15 22:16,
江西丰城一船舶4人窒息死亡,429616.0,2024-05-15 22:16,
书本里铁汉柔情有了现实画面,28015.0,2024-05-15 22:16,
张靓颖回应被网友喊话去歌手,502222.0,2024-05-15 22:16,
鹿晗长沙,429587.0,2024-05-15 22:16,
安徽一司机碾压小孩致身亡逃逸被抓,413763.0,2024-05-15 22:16,
庆余年第二季开播倒计时1天,385857.0,2024-05-15 22:16,
周也深V,377683.0,2024-05-15 22:16,
园方回应60余名幼儿在校群体性流血,347168.0,2024-05-15 22:16,
乐道L60百公里电耗低至12.1,35260.0,2024-05-15 22:16,
CBA总决赛,298244.0,2024-05-15 22:16,
日本制铁公司熔钢锅内发现人骨,250884.0,2024-05-15 22:16,
咬伤3岁男童恶犬已被打死,223105.0,2024-05-15 22:16,
1岁女婴被大伯母投毒致四肢瘫痪,867532.0,2024-05-15 22:16,
李溪芮拖鞋打伤代驾,711420.0,2024-05-15 22:16,
坚持跑步1个月身体将怎样变化,401332.0,2024-05-15 22:16,
发现和没上过班的人很难交流,376394.0,2024-05-15 22:16,
乐道L60超长续航,85114.0,2024-05-15 22:16,
彭于晏佟丽娅戛纳自拍,301458.0,2024-05-15 22:16,
关晓彤鞠婧祎早期合照,293581.0,2024-05-15 22:16,
张杰与TF家族合体过,279072.0,2024-05-15 22:16,
庆余年2先导plus预告,258671.0,2024-05-15 22:16,
上海一餐厅特设肖战墙景位预约爆满,238671.0,2024-05-15 22:16,
齐麟犯规,214671.0,2024-05-15 22:16,
美国18岁女罪犯因颜值超高爆红,233315.0,2024-05-15 22:16,
鱼缸成了树 树下埋着叔,188643.0,2024-05-15 22:16,
张若昀好痛一滴泪,187100.0,2024-05-15 22:16,
真正的大女主都是水泥封心,184751.0,2024-05-15 22:16,
张杰回复了摔倒小男孩的妈妈,169972.0,2024-05-15 22:16,
朱一龙OPPO新机海报,101749.0,2024-05-15 22:16,
华晨宇看白举纲直播,156893.0,2024-05-15 22:16,
有人管管南方的烧烤吗,153969.0,2024-05-15 22:16,
黄梦莹高干文女主脸,152962.0,2024-05-15 22:16,
双鱼座的合群都是装的,152857.0,2024-05-15 22:16,
姜珮瑶一句话打开林家川眼泪开关,150491.0,2024-05-15 22:16,
竹已三部曲都影视化了,147697.0,2024-05-15 22:16,
Uzi AL,146815.0,2024-05-15 22:16,
黄循财就任新加坡总理,139452.0,2024-05-15 22:16,
Tabe说可以帮Uzi点外卖了,138593.0,2024-05-15 22:16,
成毅首本五大女刊,127305.0,2024-05-15 22:16,
中国海警在黄岩岛海域常态开展维权执法活动,123251.0,2024-05-15 22:16,
鹿晗在路边吐了,120359.0,2024-05-15 22:16,
辽宁男篮总决赛开门红,115642.0,2024-05-15 22:16,
