name,value,date,Unnamed: 3
TFBOYS发文支持王源,2113682.0,2024-07-21 22:00,
悉尼一父亲救滚入轨道的婴儿车不幸死亡,811054.0,2024-07-21 22:00,
暴雨来袭不要这样做,54042.0,2024-07-21 22:00,
做过近视眼手术的人嘴都这么严吗,1026124.0,2024-07-21 22:00,
三中全会决定60条,481852.0,2024-07-21 22:00,
王源回重庆不回家住的原因,654294.0,2024-07-21 22:00,
花儿与少年直播,614540.0,2024-07-21 22:00,
宋丹丹张新成演恋人,534196.0,2024-07-21 22:00,
王楚钦早六晚十练了两年了,457678.0,2024-07-21 22:00,
陕西塌桥一落水者因打开车窗获救,124440.0,2024-07-21 22:00,
延迟退休,2486109.0,2024-07-21 22:00,
黄子韬徐艺洋公开后秀恩爱,1510293.0,2024-07-21 22:00,
泰国队员想来中国队宿舍凉快,1133913.0,2024-07-21 22:00,
胎儿检出超雄孕妇完成终止妊娠手术,1133426.0,2024-07-21 22:00,
时代峰峻声明,802865.0,2024-07-21 22:00,
预制菜已经发展到这个地步了,429984.0,2024-07-21 22:00,
薛之谦压轴,420879.0,2024-07-21 22:00,
唐诡2仵作之死最惨的是谁,354134.0,2024-07-21 22:00,
美国15岁华裔女孩骑行途中离奇消失,249586.0,2024-07-21 22:00,
退休阿姨5个好友4个骗子,245932.0,2024-07-21 22:00,
中医说三伏天得热着过,384112.0,2024-07-21 22:00,
男婴出生2天腿部青紫查出罕见病,356217.0,2024-07-21 22:00,
英雄联盟手游取消赵露思置顶,319264.0,2024-07-21 22:00,
怎么有反派30集才掉马的啊,305503.0,2024-07-21 22:00,
张杰即将13次打卡鸟巢,263870.0,2024-07-21 22:00,
阳虚还是阴虚看出汗就能知道,245298.0,2024-07-21 22:00,
王俊凯EZ反杀,238091.0,2024-07-21 22:00,
酱汁鑫鑫豆豆,234814.0,2024-07-21 22:00,
种地吧回应加人,224347.0,2024-07-21 22:00,
ive新闻图,209790.0,2024-07-21 22:00,
串串房引发身体不适搬走后又租别人,208306.0,2024-07-21 22:00,
时代峰峻否认张真源贺峻霖恋情,207847.0,2024-07-21 22:00,
周深已老实,205199.0,2024-07-21 22:00,
王冰冰和她家的猫撞脸,199415.0,2024-07-21 22:00,
二十届三中全会决定全文公布,178178.0,2024-07-21 22:00,
孟佳腰臀比,193113.0,2024-07-21 22:00,
NMIXX滑倒,192235.0,2024-07-21 22:00,
我们的歌,188861.0,2024-07-21 22:00,
按自愿弹性原则推进渐进式延迟退休改革,162043.0,2024-07-21 22:00,
开着空调在养生馆做艾灸三人中毒,144387.0,2024-07-21 22:00,
汪苏泷王心凌合唱大眠,188904.0,2024-07-21 22:00,
唐诡西行里的仵作精神,158598.0,2024-07-21 22:00,
孙一宁说流量对她来说是风险,155558.0,2024-07-21 22:00,
涂山璟角色热度破1亿,153105.0,2024-07-21 22:00,
TF三代reaction直播,152748.0,2024-07-21 22:00,
老两口常年吃剩菜先后确诊胃癌,143546.0,2024-07-21 22:00,
实拍陕西桥梁垮塌搜救现场,139104.0,2024-07-21 22:00,
内蒙奶酪已经nextlevel,137177.0,2024-07-21 22:00,
超雄综合征,135478.0,2024-07-21 22:00,
一诺经典一保四,134872.0,2024-07-21 22:00,
