name,value,date,Unnamed: 3
面包店的浪费现象有多严重,157991.0,2024-02-29 03:10,
教育局回应女老师打骂学生,137981.0,2024-02-29 03:10,
我国载人航天工程取得4000多项发明专利,8824.0,2024-02-29 03:10,
厅长退休后买13套房给子孙,93349.0,2024-02-29 03:10,
被指吃绝户男子发声,69352.0,2024-02-29 03:10,
艾滋病病毒无法在唾液中存活,67223.0,2024-02-29 03:10,
官方通报广东一初中生跳楼自杀,59999.0,2024-02-29 03:10,
柳智敏李宰旭一见钟情瞬间,59804.0,2024-02-29 03:10,
我国有近1亿人是慢阻肺人群,54625.0,2024-02-29 03:10,
霍建华 要拍现在拍别跟着我,53617.0,2024-02-29 03:10,
我的性教育来自郭敬明的小说,114474.0,2024-02-29 03:10,
赵昭仪与素人合照,65262.0,2024-02-29 03:10,
比特币每枚突破6万美元,58818.0,2024-02-29 03:10,
人流后支离破碎的子宫,47570.0,2024-02-29 03:10,
迪丽热巴的天使蹲为什么劝你别学,46491.0,2024-02-29 03:10,
重庆姐弟坠亡案生母宣布将直播带货,40593.0,2024-02-29 03:10,
祁煜 奇遇,40088.0,2024-02-29 03:10,
孙千陈靖可朋友圈签名,37886.0,2024-02-29 03:10,
挖呀挖黄老师家人回应被造黄谣,33374.0,2024-02-29 03:10,
BTC,31125.0,2024-02-29 03:10,
睡前吃夜宵和饿肚子睡觉哪个危害大,36494.0,2024-02-29 03:10,
舅舅让我帮他女儿付学费,32237.0,2024-02-29 03:10,
女教师办公室殴打学生,30325.0,2024-02-29 03:10,
男朋友寄来的一周年纪念礼物,30130.0,2024-02-29 03:10,
舒畅红色马面裙,29796.0,2024-02-29 03:10,
亚洲首富之子18个月减重超200斤,25376.0,2024-02-29 03:10,
小伙撸铁2小时横纹肌溶解了,24253.0,2024-02-29 03:10,
全球发音,24155.0,2024-02-29 03:10,
上海一饭堂发生情杀案致2人死亡,23559.0,2024-02-29 03:10,
建议启动中小学教师在职学历提升计划,12751.0,2024-02-29 03:10,
殴打学生女老师被停职,23317.0,2024-02-29 03:10,
古希腊掌管teenager的神,23096.0,2024-02-29 03:10,
贵州夫妻17年间生下9女1男,22520.0,2024-02-29 03:10,
宗馥莉哽咽追忆父亲宗庆后,22327.0,2024-02-29 03:10,
任嘉伦四年之约,22152.0,2024-02-29 03:10,
蒲熠星 吃饭是我的人类学调查方式,21542.0,2024-02-29 03:10,
爱奇艺去年总营收319亿元,21456.0,2024-02-29 03:10,
原来狗不嫌家贫是因为没富过,21289.0,2024-02-29 03:10,
慢动作鲨鱼夹教程,20985.0,2024-02-29 03:10,
恋爱冷淡期,20350.0,2024-02-29 03:10,
挖呀挖黄老师回应被造黄谣称已报警,20311.0,2024-02-29 03:10,
烟火人家 乳腺通了泪腺崩了,19521.0,2024-02-29 03:10,
张予曦cos杨玉环,19298.0,2024-02-29 03:10,
陈赫晒妻子女儿背影照,18264.0,2024-02-29 03:10,
演员王迅游荆州怒批古城墙刻字行为,17765.0,2024-02-29 03:10,
杨幂8年前就配过功夫熊猫,17659.0,2024-02-29 03:10,
李洙赫 男狐狸,17044.0,2024-02-29 03:10,
檀健次演技,16434.0,2024-02-29 03:10,
网剧唐人街探案2定档,14983.0,2024-02-29 03:10,
老公姐 人夫哥,14181.0,2024-02-29 03:10,
