name,value,date,Unnamed: 3
拜登退选,1917750.0,2024-07-22 03:09,
拜登,393683.0,2024-07-22 03:09,
打卡课本里的大美中国,19804.0,2024-07-22 03:09,
拜登支持哈里斯竞选,372437.0,2024-07-22 03:09,
男子称给霸王茶姬差评后被找上门,241891.0,2024-07-22 03:09,
为什么现在很少看到灾难片了,148517.0,2024-07-22 03:09,
虎门一公职人员贩毒被执行死刑,80942.0,2024-07-22 03:09,
做过近视眼手术的人嘴都这么严吗,63769.0,2024-07-22 03:09,
TFBOYS发文支持王源,63558.0,2024-07-22 03:09,
张元英踩到安宥真的裙子,60907.0,2024-07-22 03:09,
五一广场车祸,245686.0,2024-07-22 03:09,
黄子韬徐艺洋公开后秀恩爱,99954.0,2024-07-22 03:09,
男女店内亲热被店家请离后给差评,96023.0,2024-07-22 03:09,
胎儿检出超雄孕妇完成终止妊娠手术,83200.0,2024-07-22 03:09,
延迟退休,63208.0,2024-07-22 03:09,
盗墓团伙要价1.8亿的文物被追回,52599.0,2024-07-22 03:09,
博物馆的千年文物开花了,18904.0,2024-07-22 03:09,
宝马回应临时加价4S店才交车,42610.0,2024-07-22 03:09,
吃饭偶遇张婧仪做服务员,42286.0,2024-07-22 03:09,
赵露思直播怼脸镜头,41656.0,2024-07-22 03:09,
睡觉盖肚脐真的有必要吗,82259.0,2024-07-22 03:09,
被奶奶的手机壳震惊到了,55324.0,2024-07-22 03:09,
熬过4个易发胖时刻变瘦就容易了,39835.0,2024-07-22 03:09,
宋丹丹张新成演恋人,38486.0,2024-07-22 03:09,
种地吧回应加人,37296.0,2024-07-22 03:09,
王俊凯电竞男主,37206.0,2024-07-22 03:09,
薛之谦压轴,36763.0,2024-07-22 03:09,
阳虚还是阴虚看出汗就能知道,35563.0,2024-07-22 03:09,
泰国队员想来中国队宿舍凉快,35386.0,2024-07-22 03:09,
宋茜回应花少6官宣,35156.0,2024-07-22 03:09,
特朗普回应拜登退选,51769.0,2024-07-22 03:09,
男婴出生2天腿部青紫查出罕见病,35123.0,2024-07-22 03:09,
大熊猫北辰是实心的实锤了,10851.0,2024-07-22 03:09,
相柳小夭见的最后一面,34967.0,2024-07-22 03:09,
长沙,34754.0,2024-07-22 03:09,
为啥鸡的身体零件比整只鸡贵,31948.0,2024-07-22 03:09,
英雄联盟手游取消赵露思置顶,30616.0,2024-07-22 03:09,
王源回重庆不回家住的原因,30195.0,2024-07-22 03:09,
预制菜已经发展到这个地步了,29939.0,2024-07-22 03:09,
悉尼一父亲救滚入轨道的婴儿车不幸死亡,29441.0,2024-07-22 03:09,
长沙交警通报,29051.0,2024-07-22 03:09,
单依纯都搞唱跳了,28643.0,2024-07-22 03:09,
陕西塌桥一落水者因打开车窗获救,28416.0,2024-07-22 03:09,
时代峰峻否认张真源贺峻霖恋情,28006.0,2024-07-22 03:09,
陕西桥梁垮塌事故已致15人遇难,27447.0,2024-07-22 03:09,
赵露思ID耙耙柑儿,27002.0,2024-07-22 03:09,
中餐厅,26309.0,2024-07-22 03:09,
南京大屠杀幸存者周智林老人去世,26279.0,2024-07-22 03:09,
蒲熠星JOJO私下关系,24435.0,2024-07-22 03:09,
少年白马醉春风,23229.0,2024-07-22 03:09,
