name,value,date,Unnamed: 3
河南大学,681343.0,2024-05-03 03:07,
小众城市突然爆红,156966.0,2024-05-03 03:07,
数据见证五一假期出行热度,21046.0,2024-05-03 03:07,
华晨宇内娱首个凌晨三点开演唱会,381575.0,2024-05-03 03:07,
Tiffany被年轻人抛弃了吗,87929.0,2024-05-03 03:07,
韩国教授为IVE国风争议发声,87775.0,2024-05-03 03:07,
梅大高速塌方已致48人死亡,86419.0,2024-05-03 03:07,
我弟弟就是最好的旅游搭子,85702.0,2024-05-03 03:07,
观音桥网红天桥因人流火爆而限流,75635.0,2024-05-03 03:07,
102岁奶奶补办身份证女警手舞足蹈引导,27075.0,2024-05-03 03:07,
胖猫 谭竹,780034.0,2024-05-03 03:07,
胖猫,292919.0,2024-05-03 03:07,
朱珠方发文谴责倒卖门票商品行为,182747.0,2024-05-03 03:07,
郭晋安离婚,106527.0,2024-05-03 03:07,
罗西 临界十缨,94324.0,2024-05-03 03:07,
IVE能不能把中国结摘下来,64862.0,2024-05-03 03:07,
张杰在台上轻轻地碎了,55372.0,2024-05-03 03:07,
网友晒299元买朱珠价值5千二手包,91595.0,2024-05-03 03:07,
美国又一黑人男子遭警察跪压后身亡,49838.0,2024-05-03 03:07,
汪苏泷如果爱忘了,48778.0,2024-05-03 03:07,
老公一个月四千多养活我们一家三口,70208.0,2024-05-03 03:07,
女子吐槽夏季女装不适合普通人,43330.0,2024-05-03 03:07,
射手座容易给人制造恋爱假象,41892.0,2024-05-03 03:07,
成毅工作室放饭,39351.0,2024-05-03 03:07,
医生多看了一眼30秒救回窒息婴儿,38562.0,2024-05-03 03:07,
泫雅 回春,37171.0,2024-05-03 03:07,
张子枫哭出了漫画里才有的泪眼,36543.0,2024-05-03 03:07,
成龙回应满头白发,34307.0,2024-05-03 03:07,
发炎时要少吃4类食物,32806.0,2024-05-03 03:07,
拜登声称中俄印日经济停滞是因排外,31770.0,2024-05-03 03:07,
游客从橘子洲挤到五一广场,31669.0,2024-05-03 03:07,
时代少年团重庆,29900.0,2024-05-03 03:07,
华晨宇日出演唱会,29030.0,2024-05-03 03:07,
褚会长称990万已支付完成,28130.0,2024-05-03 03:07,
李健枣庄演唱会,27641.0,2024-05-03 03:07,
昆明蓝莓12元1盒震惊外地游客,27294.0,2024-05-03 03:07,
黄景瑜演技,27110.0,2024-05-03 03:07,
室友一年要五个生日礼物,26822.0,2024-05-03 03:07,
郭晋安欧倩怡 共用微博,25443.0,2024-05-03 03:07,
西湖醋鱼,25355.0,2024-05-03 03:07,
今年五一没人结婚吗,24812.0,2024-05-03 03:07,
杨谨华回应与萧亚轩友情,24722.0,2024-05-03 03:07,
切尔西vs热刺,24681.0,2024-05-03 03:07,
黄子韬抓住徐艺洋的手,24614.0,2024-05-03 03:07,
五一档新片票房破9亿,24211.0,2024-05-03 03:07,
甘肃一地连续拍到5只野生大熊猫,24026.0,2024-05-03 03:07,
公共场所有多脏,23404.0,2024-05-03 03:07,
爸爸妈妈好像把我当小猫养了,23239.0,2024-05-03 03:07,
迪丽热巴旗袍舞台直拍,23227.0,2024-05-03 03:07,
乐山大佛排队4小时才能看到佛脚,22410.0,2024-05-03 03:07,
