name,value,date,Unnamed: 3
140万买的230平房子,133060.0,2024-03-06 03:01,
建议彩票个人单项奖金最高额度不超过500万,48479.0,2024-03-06 03:01,
2024全国两会新词热词,11962.0,2024-03-06 03:01,
凯特王妃,222388.0,2024-03-06 03:01,
最新研究找到熬夜致癌原因,111668.0,2024-03-06 03:01,
建议消除简历第一学历概念,40442.0,2024-03-06 03:01,
射雕英雄传侠之大者计划全球发行,33567.0,2024-03-06 03:01,
代表建议毕业生不要只把眼光放在一线城市,32322.0,2024-03-06 03:01,
建议中小学生每天都有一节体育课,22448.0,2024-03-06 03:01,
朱一龙志愿军2将于国庆档上映,19165.0,2024-03-06 03:01,
遭多人强暴的西班牙网红收到印度政府赔偿,83350.0,2024-03-06 03:01,
白敬亭退出乐本文化,80829.0,2024-03-06 03:01,
Jennie仪态,76291.0,2024-03-06 03:01,
周处除三害 抄袭,72912.0,2024-03-06 03:01,
粉丝抵制黄牛炒作300元生菜,71209.0,2024-03-06 03:01,
朱丹听到sorry变脸,64456.0,2024-03-06 03:01,
分手后最体面的星座,57979.0,2024-03-06 03:01,
张铭恩一种隐约的狠辣,55079.0,2024-03-06 03:01,
张元英miumiu巴黎时装周,49359.0,2024-03-06 03:01,
易梦玲宋智雅合照,48738.0,2024-03-06 03:01,
阿姨被辞退后发信息轰炸我,43227.0,2024-03-06 03:01,
浪姐颜值,40540.0,2024-03-06 03:01,
宋茜谈年龄焦虑,39573.0,2024-03-06 03:01,
腰腹赘肉算是踢到铁板了,38281.0,2024-03-06 03:01,
越来越多年轻人确诊淡淡综合症,34238.0,2024-03-06 03:01,
继承者们 抄袭,33218.0,2024-03-06 03:01,
相亲当晚女生发来开销账单,31898.0,2024-03-06 03:01,
已经生娃可能还会检测出已怀孕,31879.0,2024-03-06 03:01,
我在银行买金镯子又大又便宜,31201.0,2024-03-06 03:01,
真没必要为三五年后的前途担忧,29536.0,2024-03-06 03:01,
金价,29111.0,2024-03-06 03:01,
男朋友谈过一段很长的恋爱,27367.0,2024-03-06 03:01,
身体出现3个异常警惕癌症信号,25816.0,2024-03-06 03:01,
王一博白色运动服造型,22578.0,2024-03-06 03:01,
杨幂谈私服风格,22431.0,2024-03-06 03:01,
蔚来现金储备达573亿元,22248.0,2024-03-06 03:01,
MiuMiu大秀,20614.0,2024-03-06 03:01,
豪士面包 种地吧,20265.0,2024-03-06 03:01,
别再让黄金店割智商税了,19902.0,2024-03-06 03:01,
哈兰德认为梅西是历史最佳球员,19633.0,2024-03-06 03:01,
周杰伦录制说唱梦工厂,19202.0,2024-03-06 03:01,
邓为工作室的审美,17134.0,2024-03-06 03:01,
许凯 别刷那个汉堡了,16010.0,2024-03-06 03:01,
这只猫真的非养不可吗,15556.0,2024-03-06 03:01,
00后都在做什么工作,14801.0,2024-03-06 03:01,
烟火人家孟菀青角色魅力,14527.0,2024-03-06 03:01,
苗苗浪姐上班路透,13782.0,2024-03-06 03:01,
IVE台北,13704.0,2024-03-06 03:01,
皇家社会vs巴黎圣日耳曼,12535.0,2024-03-06 03:01,
学雷锋文艺志愿服务,12329.0,2024-03-06 03:01,
