name,value,date,Unnamed: 3
刘美含否认再次落选浪姐,137566.0,2024-03-10 03:07,
热辣滚烫海外成绩,94446.0,2024-03-10 03:07,
新质生产力如何改变生活,13230.0,2024-03-10 03:07,
孟羽童回应简介是前500强董事长秘书,75664.0,2024-03-10 03:07,
宁静打了焉栩嘉一耳光,71150.0,2024-03-10 03:07,
微信能不能改成部分人三天可见,66194.0,2024-03-10 03:07,
李权哲第二名出道,63583.0,2024-03-10 03:07,
艾滋病感染者抗病毒治疗成功率已超95%,60627.0,2024-03-10 03:07,
月入过万你还会考研考公吗,49564.0,2024-03-10 03:07,
中国2024年国防费预算增长7.2%,21452.0,2024-03-10 03:07,
朱梓骁被纪凌尘气炸了,138896.0,2024-03-10 03:07,
赵安吉车祸身亡细节,138269.0,2024-03-10 03:07,
学生睡不醒班主任背到医院,124091.0,2024-03-10 03:07,
杭州万象城,103651.0,2024-03-10 03:07,
1人带316个LV包入境被查,102053.0,2024-03-10 03:07,
女子染发10余年致头皮胎记癌变,99325.0,2024-03-10 03:07,
苹果和安卓的天气预报不一样,80893.0,2024-03-10 03:07,
美国女子拍下老公用枪打死自己视频,73543.0,2024-03-10 03:07,
杨天真回应不减肥原因,71113.0,2024-03-10 03:07,
优酷回复赵丽颖片单,53118.0,2024-03-10 03:07,
现在的朋友圈越来越低调了,52501.0,2024-03-10 03:07,
奥利C位出道,40865.0,2024-03-10 03:07,
普通家庭这样的生活算穷吗,33567.0,2024-03-10 03:07,
杨紫提醒主持人牙齿上有口红,33337.0,2024-03-10 03:07,
沙丘2,32555.0,2024-03-10 03:07,
终于知道电视里为啥喜欢买芹菜,31752.0,2024-03-10 03:07,
王锵徐若晗还原东宫名场面,31560.0,2024-03-10 03:07,
演员尚梦初逝世,30700.0,2024-03-10 03:07,
男子流浪25年被侄子爆改接回家,24168.0,2024-03-10 03:07,
靳东谈短视频,12505.0,2024-03-10 03:07,
爱在黎明前降落,29876.0,2024-03-10 03:07,
妈妈炸的花生米被同学嫌弃了,29768.0,2024-03-10 03:07,
徐佳莹演唱会嘉宾是汪苏泷,29452.0,2024-03-10 03:07,
章若楠好港,28760.0,2024-03-10 03:07,
李宇春演唱会直播,27841.0,2024-03-10 03:07,
何洛洛演技,27810.0,2024-03-10 03:07,
被我弄丢的你结局细思极恐,27553.0,2024-03-10 03:07,
孟羽童回应收入,26821.0,2024-03-10 03:07,
彭奶奶,25712.0,2024-03-10 03:07,
奶奶珍藏十多年的塑料手链,25261.0,2024-03-10 03:07,
杭州太子湾引进灰紫色浴缸郁金香,24198.0,2024-03-10 03:07,
霍启刚建议实现大湾区体育教练资格互认,22140.0,2024-03-10 03:07,
JYP自己倒是闯中成功了,22115.0,2024-03-10 03:07,
南大一48岁博士生8年未毕业被劝退,21772.0,2024-03-10 03:07,
为何年轻人不愿意进工厂了,21269.0,2024-03-10 03:07,
王梓薇感谢赵丽颖推荐客串与凤行,19720.0,2024-03-10 03:07,
靳东再谈假靳东事件,19462.0,2024-03-10 03:07,
瘦腰瘦得特别快的运动,19133.0,2024-03-10 03:07,
张杰与80位歌迷对视流泪,19073.0,2024-03-10 03:07,
李菲儿作品曾入围戛纳电影节,18608.0,2024-03-10 03:07,
