name,value,date,Unnamed: 3
孩子理发138元妈妈嫌太贵只愿付24,285948,2024-04-15 06:15,
中医建议的最佳作息时间表,130937,2024-04-15 06:15,
60秒了解总体国家安全观,14153,2024-04-15 06:15,
以色列,118059,2024-04-15 06:15,
科研人员出卖核心机密被执行死刑,115201,2024-04-15 06:15,
女子丰胸检出骆驼等动物源性成分,103489,2024-04-15 06:15,
海仁和孩子的墓碑,102147,2024-04-15 06:15,
把肯德基1995年价格表挖出来了,88613,2024-04-15 06:15,
悉尼,64745,2024-04-15 06:15,
炸串奶奶摊前排起长队,45965,2024-04-15 06:15,
男子车祸后连拨14次120终自救,143305,2024-04-15 06:15,
Angelababy金像奖红毯,84135,2024-04-15 06:15,
曾志伟办71岁慈善生日宴,63251,2024-04-15 06:15,
左溢删博,58309,2024-04-15 06:15,
体重不降的十个原因,56328,2024-04-15 06:15,
梁朝伟金像奖影帝,55233,2024-04-15 06:15,
林保怡 可惜,53356,2024-04-15 06:15,
钟美美回应带家人出国计划,50090,2024-04-15 06:15,
伊以冲突,43098,2024-04-15 06:15,
姚志明的身世,35456,2024-04-15 06:15,
卫健委调查男子献血13次妻子用血却被拒,67687,2024-04-15 06:15,
很体面工资却不高的工作,61367,2024-04-15 06:15,
吃这3种水果或加重湿气,48197,2024-04-15 06:15,
国际金价疯涨金饰却遇冷,44084,2024-04-15 06:15,
为什么大家都装马桶不要蹲厕,43414,2024-04-15 06:15,
林更新爆改沈月微信头像,37684,2024-04-15 06:15,
为什么很多女生不愿意恋爱了,37426,2024-04-15 06:15,
张元英头巾,37061,2024-04-15 06:15,
伊朗再次警告美国勿插手伊以冲突,33106,2024-04-15 06:15,
杨紫承欢记吻戏reaction,32067,2024-04-15 06:15,
何超仪拄拐带老公亮相黄贯中画展,32074,2024-04-15 06:15,
Knight 十张身份证的决赛这次我会赢,31341,2024-04-15 06:15,
乘坐扶手电梯不要踩2号板,30873,2024-04-15 06:15,
如懿传 吐槽,30674,2024-04-15 06:15,
眼泪女王 爷爷死了,29184,2024-04-15 06:15,
金像奖红毯,27127,2024-04-15 06:15,
原来这些专业考不了公务员,26457,2024-04-15 06:15,
伊朗,25908,2024-04-15 06:15,
关于我室友装外国人催发货,24972,2024-04-15 06:15,
张杰3场就像我穿的衣服那么少,24380,2024-04-15 06:15,
杨紫许凯海报要横着看,24273,2024-04-15 06:15,
贤佑海仁复婚失败,23690,2024-04-15 06:15,
我们活在巨大的差距里,23054,2024-04-15 06:15,
白桃星座,22569,2024-04-15 06:15,
香港金像奖颁奖典礼,22363,2024-04-15 06:15,
心理医生应对内耗的5个建议,22246,2024-04-15 06:15,
金像奖 黄子华,20257,2024-04-15 06:15,
射手当joker也是三分钟热度,18903,2024-04-15 06:15,
JackeyLove时隔1820天再次确定进入MSI,18766,2024-04-15 06:15,
周也 汤姆猫女朋友,17760,2024-04-15 06:15,
孩子理发138元妈妈嫌太贵只愿付24,1422172,2024-04-15 07:39,
男子车祸后连拨14次120终自救,868021,2024-04-15 07:39,
60秒了解总体国家安全观,58953,2024-04-15 07:39,
中医建议的最佳作息时间表,593794,2024-04-15 07:39,
体重不降的十个原因,491628,2024-04-15 07:39,
科研人员出卖核心机密被执行死刑,441598,2024-04-15 07:39,
海仁和孩子的墓碑,441011,2024-04-15 07:39,
青海地震,421696,2024-04-15 07:39,
以色列,338728,2024-04-15 07:39,
炸串奶奶摊前排起长队,198611,2024-04-15 07:39,
何超仪拄拐带老公亮相黄贯中画展,344101,2024-04-15 07:39,
女子丰胸检出骆驼等动物源性成分,337250,2024-04-15 07:39,
林保怡 可惜,269102,2024-04-15 07:39,
钟美美回应带家人出国计划,241056,2024-04-15 07:39,
Angelababy金像奖红毯,252429,2024-04-15 07:39,
XG夺冠,212311,2024-04-15 07:39,
把肯德基1995年价格表挖出来了,210410,2024-04-15 07:39,
湖人战胜鹈鹕,169248,2024-04-15 07:39,
勒沃库森首夺德甲冠军,162695,2024-04-15 07:39,
梁朝伟金像奖影帝,162321,2024-04-15 07:39,
很体面工资却不高的工作,354729,2024-04-15 07:39,
卫健委调查男子献血13次妻子用血却被拒,237165,2024-04-15 07:39,
为什么大家都装马桶不要蹲厕,169420,2024-04-15 07:39,
阿森纳0比2阿斯顿维拉,154271,2024-04-15 07:39,
国际金价疯涨金饰却遇冷,148341,2024-04-15 07:39,
吃这3种水果或加重湿气,142300,2024-04-15 07:39,
辛芷蕾听劝,141820,2024-04-15 07:39,
张元英头巾,140208,2024-04-15 07:39,
眼泪女王 爷爷死了,135172,2024-04-15 07:39,
王一博早期与素人合照,133064,2024-04-15 07:39,
湖人锁定西部第八,119825,2024-04-15 07:39,
为什么很多女生不愿意恋爱了,118676,2024-04-15 07:39,
Knight 十张身份证的决赛这次我会赢,115478,2024-04-15 07:39,
左溢删博,107174,2024-04-15 07:39,
姚志明的身世,97710,2024-04-15 07:39,
TES门票,95879,2024-04-15 07:39,
原来这些专业考不了公务员,94997,2024-04-15 07:39,
浓眉 附加赛能打,92355,2024-04-15 07:39,
曾志伟办71岁慈善生日宴,88910,2024-04-15 07:39,
伊朗再次警告美国勿插手伊以冲突,86572,2024-04-15 07:39,
伊以冲突,84853,2024-04-15 07:39,
白桃星座,81552,2024-04-15 07:39,
伊朗,78961,2024-04-15 07:39,
周也 汤姆猫女朋友,77599,2024-04-15 07:39,
杨紫许凯海报要横着看,74712,2024-04-15 07:39,
乘坐扶手电梯不要踩2号板,72764,2024-04-15 07:39,
悉尼,71478,2024-04-15 07:39,
拜仁德甲11连冠遭终结,68362,2024-04-15 07:39,
林更新爆改沈月微信头像,67837,2024-04-15 07:39,
NBA常规赛收官日,67340,2024-04-15 07:39,
端午节放3天不调休,3760921,2024-04-15 10:52,
保时捷中国总裁回应米时捷,1449799,2024-04-15 10:52,
60秒了解总体国家安全观,34970,2024-04-15 10:52,
突然的恋情可能是间谍的圈套,1024130,2024-04-15 10:52,
黄岛地震,865785,2024-04-15 10:52,
奔跑吧12官宣定档,757789,2024-04-15 10:52,
华为P70 Pura,689268,2024-04-15 10:52,
IU香港,555190,2024-04-15 10:52,
张艺兴工作室发文向张艺兴道歉,529510,2024-04-15 10:52,
炸串奶奶摊前排起长队,193076,2024-04-15 10:52,
张杰把南昌说成了南京,485968,2024-04-15 10:52,
98年小伙因精神状态太美丽走红,453232,2024-04-15 10:52,
澳洲亿万富豪之女在悉尼袭击案中遇害,445538,2024-04-15 10:52,
A股,365287,2024-04-15 10:52,
王嘉尔空降科切拉,314584,2024-04-15 10:52,
孩子理发138元妈妈嫌太贵只愿付24,307783,2024-04-15 10:52,
第五人格,285556,2024-04-15 10:52,
日照震感,285032,2024-04-15 10:52,
剑网3,278115,2024-04-15 10:52,
薛之谦把重庆洪崖洞说成了成都洪崖洞,268544,2024-04-15 10:52,
第一批丁克夫妻现状曝光,1388681,2024-04-15 10:52,
中医劝患者想怀孕不要穿裙子,403099,2024-04-15 10:52,
很体面工资却不高的工作,279863,2024-04-15 10:52,
中国发布伏特台风黑客组织溯源报告,258013,2024-04-15 10:52,
芒果台的文案,260101,2024-04-15 10:52,
有大学生是内娱的福气,232972,2024-04-15 10:52,
种地吧直播,225843,2024-04-15 10:52,
难怪陈奕迅的演唱会不让带相机,221032,2024-04-15 10:52,
美国间谍梁成运出镜忏悔,211078,2024-04-15 10:52,
以色列宣布恢复全国教学活动,205928,2024-04-15 10:52,
美国女生带韩国男友回家,340382,2024-04-15 10:52,
沪指翻绿跌破3000点,204254,2024-04-15 10:52,
华为官宣P系列品牌升级为Pura,190565,2024-04-15 10:52,
悉尼袭击事件中死伤中国公民均为留学生,187116,2024-04-15 10:52,
TFBOYS415十周年,175282,2024-04-15 10:52,
普通家庭的悲哀是把日子过反了,171802,2024-04-15 10:52,
河南专科生上岸中科大,167682,2024-04-15 10:52,
原来吃榴莲还能缓解痛经,164439,2024-04-15 10:52,
本科的毕业设计真的一言难尽,163444,2024-04-15 10:52,
曾尖11比0申裕斌,153597,2024-04-15 10:52,
男子车祸后连拨14次120终自救,153353,2024-04-15 10:52,
梁朝伟拿影帝的最大受害者出现了,151103,2024-04-15 10:52,
李泰容入伍,147776,2024-04-15 10:52,
比蹦极更刺激的项目出现了,146347,2024-04-15 10:52,
他怎么又凶又奶的,142768,2024-04-15 10:52,
体重不降的十个原因,130991,2024-04-15 10:52,
内塔尼亚胡取消回击伊朗,122167,2024-04-15 10:52,
确诊小学生春游综合症,122101,2024-04-15 10:52,
悉尼,116069,2024-04-15 10:52,
步入中年的丁克女性,109919,2024-04-15 10:52,
端午节放3天不调休,2989036,2024-04-15 12:10,
章泽天家族病史,2220796,2024-04-15 12:10,
守护国家安全要做到8个不,64302,2024-04-15 12:10,
保时捷中国总裁回应米时捷,1007361,2024-04-15 12:10,
突然的恋情可能是间谍的圈套,781472,2024-04-15 12:10,
甄嬛传 团综,702876,2024-04-15 12:10,
美国女生带韩国男友回家,659702,2024-04-15 12:10,
华为P70 Pura,626840,2024-04-15 12:10,
他怎么又凶又奶的,606064,2024-04-15 12:10,
五一调休,567858,2024-04-15 12:10,
卡琳娜将出席间谍过家家首映礼,562168,2024-04-15 12:10,
拼多多上爱花钱的女人,464254,2024-04-15 12:10,
奔跑吧12官宣定档,460112,2024-04-15 12:10,
王晶称梁朝伟应宣布不再领奖,396148,2024-04-15 12:10,
张艺兴工作室发文向张艺兴道歉,393917,2024-04-15 12:10,
薛之谦把重庆洪崖洞说成了成都洪崖洞,331406,2024-04-15 12:10,
张杰把南昌说成了南京,309303,2024-04-15 12:10,
黄岛地震,285862,2024-04-15 12:10,
IU香港,284308,2024-04-15 12:10,
大侦探,259006,2024-04-15 12:10,
李亚鹏妻子称与李嫣是好姐妹,359465,2024-04-15 12:10,
第一批丁克夫妻现状曝光,903643,2024-04-15 12:10,
中医劝患者想怀孕不要穿裙子,724714,2024-04-15 12:10,
女性生孩子的理由只有一个,430513,2024-04-15 12:10,
开始推理吧2概念官宣,251776,2024-04-15 12:10,
华为P70三角形相机岛设计实锤,237019,2024-04-15 12:10,
上班后才知道读研有多苦,236187,2024-04-15 12:10,
深圳机场卫星厅高坠事故原因查明,231979,2024-04-15 12:10,
魏建军带头卷智驾直播,85922,2024-04-15 12:10,
养儿防老原来是儿媳妇养老,220833,2024-04-15 12:10,
汪苏泷到底是什么意思,204712,2024-04-15 12:10,
澳洲亿万富豪之女在悉尼袭击案中遇害,200902,2024-04-15 12:10,
很体面工资却不高的工作,197821,2024-04-15 12:10,
98年小伙因精神状态太美丽走红,192299,2024-04-15 12:10,
华为Pura怎么读,184341,2024-04-15 12:10,
AI医生会成为可能吗,174313,2024-04-15 12:10,
TFBOYS415十周年,169353,2024-04-15 12:10,
暴雪前总裁希望玩家给小费,164182,2024-04-15 12:10,
孩子理发138元妈妈嫌太贵只愿付24,161269,2024-04-15 12:10,
王嘉尔空降科切拉,155425,2024-04-15 12:10,
陈梦世界杯开门红,155078,2024-04-15 12:10,
律师谈猫一杯MCN机构责任,147320,2024-04-15 12:10,
肺结节离癌症有多远,146168,2024-04-15 12:10,
荠菜煮鸡蛋的威力,145367,2024-04-15 12:10,
刘雨昕把苗音带到科切拉,139575,2024-04-15 12:10,
长城智驾直播挑战闹市区,124433,2024-04-15 12:10,
难怪陈奕迅的演唱会不让带相机,139026,2024-04-15 12:10,
田曦薇配音宫崎骏女孩苏菲,138764,2024-04-15 12:10,
种地吧直播,136680,2024-04-15 12:10,
A股,119824,2024-04-15 12:10,
