name,value,date,Unnamed: 3
温州发现一例比熊猫血更稀有的恐龙血,102899.0,2024-06-07 03:15,
娜扎曾说没人能取代刘亦菲,82892.0,2024-06-07 03:15,
嫦娥六号祝福考生高中,1897.0,2024-06-07 03:15,
奶奶去世后第一次在她的屋子看电视,69275.0,2024-06-07 03:15,
国足1比1泰国,59537.0,2024-06-07 03:15,
苏醒 以为国足在踢皇马,49645.0,2024-06-07 03:15,
我们十个人的关系要你评价,43972.0,2024-06-07 03:15,
楚乔传2没有赵丽颖林更新,42533.0,2024-06-07 03:15,
浙江38岁教师去世用身体上最后一课,33312.0,2024-06-07 03:15,
高考前一夜你想对考生说什么,28614.0,2024-06-07 03:15,
中方回应是否考虑恢复日本海产品进口,94672.0,2024-06-07 03:15,
歌手总导演回应做直播,79248.0,2024-06-07 03:15,
00后女孩勇闯非洲2年攒50万,61551.0,2024-06-07 03:15,
种地吧,36357.0,2024-06-07 03:15,
王星越 眼线哥,36132.0,2024-06-07 03:15,
李昀锐 这不是我原本实力,31334.0,2024-06-07 03:15,
一眨眼就高考了,30680.0,2024-06-07 03:15,
水瓶座聊天都是选择性回复,30663.0,2024-06-07 03:15,
国足vs泰国,30009.0,2024-06-07 03:15,
国足扳平泰国,28075.0,2024-06-07 03:15,
徐璐下衣失踪,30226.0,2024-06-07 03:15,
建议大家不要在床上乱蹦,52173.0,2024-06-07 03:15,
徐娇五分钟两次五杀,33393.0,2024-06-07 03:15,
离职后把同事微信全删了,30778.0,2024-06-07 03:15,
说唱冠军三年归来仍是素人,28856.0,2024-06-07 03:15,
大胖媳妇爆改亚当,27625.0,2024-06-07 03:15,
韩国7比0新加坡,27162.0,2024-06-07 03:15,
汪顺送出高考祝福,11179.0,2024-06-07 03:15,
咒术回战作者生病,26483.0,2024-06-07 03:15,
孟美岐榜字写错,25449.0,2024-06-07 03:15,
尾号6666666手机号拍卖估值160多万元,24729.0,2024-06-07 03:15,
2024祝福高考学子,24453.0,2024-06-07 03:15,
李昊 磨洋工,24412.0,2024-06-07 03:15,
国足下场平韩国就能出线,24146.0,2024-06-07 03:15,
墨雨云间张雨绮出场,23927.0,2024-06-07 03:15,
肖战晒老家日常,22791.0,2024-06-07 03:15,
赵一博现场,22073.0,2024-06-07 03:15,
林更新又被夸出歪嘴笑,21990.0,2024-06-07 03:15,
各地全力以赴护航高考,6762.0,2024-06-07 03:15,
6成男性防晒衣被女性买走,21866.0,2024-06-07 03:15,
辛芷蕾说看娜扎那么瘦就生气,20776.0,2024-06-07 03:15,
孙千露背挂脖上衣,20193.0,2024-06-07 03:15,
捡废品考上清华的庞众望现状,19857.0,2024-06-07 03:15,
乘风之夜1V1跨队合作秀征集,19757.0,2024-06-07 03:15,
种地吧第二届感恩音乐会,19738.0,2024-06-07 03:15,
墨雨云间 好有张力的拉扯,19589.0,2024-06-07 03:15,
国足 点球不进,19033.0,2024-06-07 03:15,
这才是一次性手套该有的样子,18642.0,2024-06-07 03:15,
李玟遗作将公开,18504.0,2024-06-07 03:15,
年轻人过节开始走出家门进行短逃离,16494.0,2024-06-07 03:15,
